review_id,sentences_ids,sentences_texts,sentences_opinions
0,0,"Ones experience is truly dampened by having to trundle up lifts and escalators, further on arrival at the restaurant we found the actual dining room to be slightly sterile and lacking in atmosphere.",actual dining room negative <sep> atmosphere negative <sep> experience neutral
0,0,The atmosphere was really nice and inviting but our waiter was awful!,atmosphere positive <sep> waiter negative
0,0,"The Scene The bar's upbeat Latin music, colorful stools and cocktail napkins, and a fruity drink menu are the first confirmations that Agozar lives up to its translation: A good time.",Scene neutral <sep> bar neutral <sep> upbeat Latin music neutral <sep> stools positive <sep> cocktail napkins positive <sep> fruity drink menu positive
0,0,"The food is ok at best, but the service and the uncomfortable accomidations have such a negetive effect, that one can only wonder why they waited so long for so little.",food neutral <sep> service negative
0,0,"When I told the staff that I was displeased and wanted to write a letter to the owner, I was told the owner had no name and that I should just give the letter with no formal greeting (Dear Pick a Bagel Owner) to the cashier and that she would pass it along.",staff negative <sep> Bagel Owner neutral
0,0,"Nice decor and an extensive menu lured me in, but the horrible service and rude staff drove me out.",menu positive <sep> staff negative
0,0,"The fresh mozzerella appetizer had to be the runniest mozz I have ever had, and the accompanying tomato was so over-salted I could barely eat it.",mozzerella appetizer positive <sep> accompanying tomato negative
0,0,Yoguart/mint/jalipeno sauce for instance didn't work with asparagus.,Yoguart/mint/jalipeno sauce negative <sep> asparagus neutral
0,0,"One of the best things about this place are the appetizers, since they have so many unique things to choose from (I always get the clams and the zucchini!)",appetizers positive <sep> clams neutral <sep> zucchini neutral
0,0,"The service is a bit slow, but harkens back to my years growing up in Napoli, Italy where things are not rushed and when you sit down for dinner the table is yours all night.",service negative <sep> dinner neutral
0,0,"When I questioned the purpose of waiting on this line, I was asked to leave the bar.",waiting neutral <sep> bar negative
0,0,There are times when there is a long wait at lunch so be safe and make a reservation.,wait negative <sep> lunch neutral <sep> reservation neutral
0,0,"The menu includes the usual Chinese restaurant staples, but also includes a fairly diverse selection of other dishes not typically found in your average noodle house.",menu neutral <sep> dishes positive <sep> house neutral
0,0,The Scene This tiny jewel of a spot is simply decorated with white walls and plate glass.,Scene neutral <sep> spot positive <sep> glass neutral
0,0,I had a tasty Caesar salad for an appetizer and ordered the 10 oz Fillet Mignon medium rare.,Caesar salad positive <sep> appetizer neutral <sep> oz Fillet Mignon neutral
0,0,We would have to flag down the bored looking wait staff to refill our tea.,wait staff negative <sep> tea neutral
0,0,"Tip: go for lunch early, 12:00 say, when the place and street is quiet and enjoy the romantic and charming setting and delicious food.",lunch neutral <sep> setting positive <sep> food positive
0,0,"I still go often, but the prices went up a little and the service is even slower now that they're always full during dinner hours.",prices negative <sep> dinner neutral
0,0,"Lastly, after spending a little over an hour and most of that time waiting for our food to arrive the manager barked at us to leave to make room for another party that had been waiting for 25 minutes!",manager negative <sep> room neutral
0,0,"The service was not the greatest, but the place is huge and it has a nice setting.",service negative <sep> place positive <sep> setting positive
0,0,"The waiter was pretty anxious to get us in-and-out, although there were ample tables and my friend and I opted to sit at the bar.",waiter negative <sep> tables neutral <sep> bar neutral
0,0,The waiter never once came back to our table to ask how our meal was OR if we needed another drink.,waiter negative <sep> meal neutral
0,0,The menu is pricey and the food was not tasty - except for the tostones with garlic and oil.,menu negative <sep> tostones positive <sep> garlic neutral <sep> oil neutral
0,0,We picked on a bunch of different appetizers as dinner and everything was yummy.,appetizers positive <sep> dinner neutral
0,0,"Entrees are right around $10, with fried rice and noodles being a little cheaper.",Entrees neutral <sep> noodles positive
0,0,"The atmosphere was embracing and enticing and the costs of the meal, $45 to $55 in value.",atmosphere positive <sep> costs neutral
0,0,"Althought the menu is more expensive than your average Mexican restaurant, it is not more expensive than any other hip, increadibly well designed, bar scene and dining room in Manhattan -could be less in fact.",menu neutral <sep> scene positive <sep> dining room neutral
0,0,Our waiter didn't even bothered to ask for dessert.,waiter negative <sep> dessert neutral
0,0,"With some good sake, I tried the salmon, yellowtail, king crab, eel (thought this would turn my stomach), red white tuna.",sake positive <sep> salmon neutral
0,0,the waitress was slow and forgot our drinks about 3 times.,waitress negative <sep> drinks neutral
0,0,"While the bar is expansive, the ceilings are high, the tables are spacious and the plates are oversized, where is the food?",bar positive <sep> tables positive <sep> food neutral
0,0,"When we showed up at the restaurant, the manager claimed that I made reservation for TWO instead of TEN and flat out told us we don't seat that many and refused to even apologize for the miss communication.",manager negative <sep> reservation neutral <sep> communication negative
0,0,"The greens were ok, but probably were too salty for those who don't hail from the south (I do) or don't have access to authentic southern cooking.",greens neutral <sep> southern cooking positive
0,0,The duck burrito with mole sauce is out of this world and the prices are definitely affordable $12-16 for most entrees.,duck burrito with mole sauce positive <sep> prices positive <sep> entrees neutral
0,0,"For the money, it's a dependable and fun place to get sushi - bring friends and share the 2 for 1 rolls (they have to be 2 of the same.",money positive <sep> place positive <sep> sushi neutral <sep> rolls neutral
0,0,The food is not five star but the prices reflect that.,food negative <sep> prices positive
0,0,"Actually she want to eat sushi, but their staff reject to serve it.",sushi neutral <sep> staff negative
0,0,"Self-important people, please stay at home and cook and dump as much parmesan on as you like.",people negative <sep> parmesan positive
0,0,I think I'm going to start taking the food and coffee to go b/c everytime I go there (which is quite often) I get more frustrated with the service.,food neutral <sep> coffee neutral <sep> service negative
0,0,"Overall,it's a good place to have dinner and hang out if you do not mind waiting for food,weird music and rude manager.",dinner neutral <sep> waiting neutral <sep> music negative
0,0,Wine has had C-Tails at the bar(SUPRISE!!!),Wine positive <sep> bar neutral
0,0,"Even though it wasn't totally full, the waitress had to RUN around the restaurant, and the drinks and the food took a LONG time to arrive.",waitress negative <sep> drinks neutral
0,0,"The Scene There are two distinct personalities to the place: The loud, seemingly always-crowded bar with hanging paper decorations and dim lighting, and the two main dining areas, where the noise level and decor is notably more subdued.",bar negative <sep> two main dining neutral <sep> noise level negative
0,0,"You can undoubtedly get better food and service for the price at other places, but certainly not with those views!",food positive <sep> price neutral
0,0,"We were charged for the missing appetizer and when I complained to the manager, who never thought to apologize, he blamed the kitchen.",missing appetizer neutral <sep> manager negative <sep> kitchen neutral
0,0,"Few styles of cooking place such an importance on texture--baby eels in a sizzling slick of oil, for example, is nudged just a shade away from pasta by the crackle of tiny bones under your teeth.",texture positive <sep> oil neutral <sep> pasta neutral
0,0,"never had a bad pizza, the staff has always been friendly, if not overly solicitous, and the only downside is the occasional wait on line outside.",pizza positive <sep> staff positive <sep> wait negative
0,0,"Unfortunately, the food is awful, the staff really doesnt care about you, and the frozen hot chocolate is just a chocolate milkshake (it wasnt all that great) I went before lunch on a Thursday and it took me 2 hours to get in.",food negative <sep> staff negative <sep> frozen hot chocolate negative <sep> chocolate milkshake negative <sep> lunch neutral
0,0,We placed a delivery order - 2 pastas and a caprese and they took and 1 1/2 to get here and the food was inedible when we received it.,delivery neutral <sep> food negative
0,0,The service was spotty as a couple of drink orders were forgotten and the waiter didn't really come to check on us.,service negative <sep> drink neutral <sep> waiter negative
0,0,"A few years ago I would have rated it much higher, but now - with other better choices such as Candle Cafe, Good Health Cafe and others, the dated menu, crowded atmosphere are spacey service is not the greatest choice.",menu neutral <sep> atmosphere negative
0,0,"My one complaint: Even though we arrived at our reservation time, the host asked us to wait at the bar -- then forgot to seat us (I had to ask).",reservation neutral <sep> host negative <sep> bar neutral
0,0,I was NOT told this before when I made the reservation and explained to the manager RICHARD who has the poorest customer service ever and rude and said he didn't believe me.,reservation neutral <sep> manager negative <sep> service negative
0,0,"We tried explaining nicely to them that we were just finishing up a drink, and after a brief, unprofessional discussion with the two waiters, they told us never to come back again.",drink neutral <sep> waiters negative
0,0,"Waited 30 min for a brick they call bread and water, another hour for food (tiiiiiiiny portions).",bread neutral <sep> water neutral <sep> food neutral <sep> portions negative
0,0,"Although Sweet Melissa's food and pastries are very tasty, the unfriendly folks who work there sour the experience.",Melissa positive <sep> food positive <sep> pastries positive <sep> experience negative
0,0,"BTW, the prices are very affordable, which make the mediocer service tolerable.",prices positive <sep> service negative
0,0,"Among the entrees, choose the stellar mole--deep, thick and chocolatey--blanketing tender chicken or poured over a chicken enchilada rather than the dry arroz con pollo.",entrees neutral <sep> stellar mole positive
0,0,Waiter had to lean on my husband to give people next to us their food.,Waiter negative <sep> food neutral
0,0,"The Scene Opened in 1993, Nick's may be the only great pizza place in the city of New York that isn't older than most of the people who eat there.",Scene neutral <sep> pizza positive
0,0,"The two cons were the lack of information on the menus (they had just sushi roll names, with no description of their contents, printed in a bland format), and music selection, which didn't fit the ambiance.",menus neutral <sep> music selection neutral <sep> ambiance negative
0,0,The only thing that was a little annoying was that the hostess didnt want to let us finish our first drinks at the bar and kept rushing us to sit down.,hostess negative <sep> drinks neutral <sep> bar neutral
0,0,"Shaved tuna and small tapioca balls--a playful substitute for roe--float in an addictive, tart-smooth pool of coconut water and kaffir lime juice.",tuna neutral <sep> tapioca balls neutral <sep> roe neutral <sep> coconut water positive <sep> kaffir lime juice positive
0,0,"i went there for dinner on friday night, the waiter had a terrible attitude.",dinner neutral <sep> waiter negative
0,0,Generous portions of rice porridge and noodles really hit the spot after fighting the crowds on a busy weekend in Chinatown.,portions of rice porridge positive <sep> noodles positive <sep> crowds negative
0,0,"The place was packed, but it didn't effect our service or getting our food/drinks promptly.",place negative <sep> service positive
0,0,"The waiter never came back to check on us or refill coffee, he got one of the orders wrong, and we both left wondering what we were going to eat when we got home.",waiter negative <sep> coffee neutral
0,0,It took about ten minutes to get out drink ordering after sitting down and once we recieved the bottle our waitress never once refilled our glasses!,bottle neutral <sep> waitress negative <sep> glasses neutral
0,0,"When my group complained to our waiter about a cake cutting fee that involved no cutting, the manager came over to the table and basically told us that it was our fault for not knowing that their policy was just to serve the plates, not to cut.",waiter negative <sep> cake neutral <sep> manager negative <sep> table neutral
0,0,I have to say that the food at Bread TriBeCa was a major letdown.,food negative <sep> Bread neutral
0,0,"Babbo and Lupa are significantly better, and this place should redo the menu, or empty seats could become the norm.",menu neutral <sep> seats negative
0,0,Mushroom appetizer was doused in a gross mayonnaise like sauce and had not been described that way on the menu.,Mushroom appetizer negative <sep> gross mayonnaise like sauce neutral <sep> menu neutral
0,0,"Excellent Steaks, the attitude of the Servers could be a little better but the food makes up for everything.",Steaks positive <sep> attitude negative <sep> Servers negative <sep> food positive
0,0,The space is small and reservations are definitly needed.,space negative <sep> reservations neutral
0,0,But Bobby Flay really steps up at Bar Americain--his passion and heart shine through the food.,Bar neutral <sep> food positive
0,0,Yesterday they had numerous bartenders as well as servers and the place wasn't packed and it still took 1/2 an hour to make a martini.,bartenders positive <sep> servers positive <sep> place positive <sep> martini neutral
0,0,"Went to Chow Bar for dinner, I thought it was kind of pricey, but the food and the service was good - but it wasn't incredibly busy, so maybe they just had more free time to devote to us.",Chow Bar neutral <sep> dinner neutral <sep> food positive
0,0,The dessert was as good as the waiter said it would be.,dessert positive <sep> waiter neutral
0,0,"-the bread served was cold  -the choices for restaurant week was very slim (no meat dish except pork) -there were no chef's treats or delights -the food was ok but not up to the quality expected There are more exciting, romantic restaurants in the city to visit.",bread served negative <sep> meat dish neutral <sep> chef neutral
0,0,"My friends and I made plans to go out on Friday for some good latin food and decide to go to Yuca Bar since we've been there for brunch and we love it, we figured dinner has to be good.",latin food positive <sep> brunch positive <sep> dinner neutral
0,0,Food again was not just a name on the menu but very well made and fresh.,Food positive <sep> menu neutral
0,0,"Evening started out nice w/ complimentary glass of champagne, but turned sour as mussels were extremely overcooked, steak came in kid size portion smothered with sauce and owner recommended a wine special off the standard wine menu that was double the price of the most expensive bottle but made no effort to describe the wine as extremely special or significantly more expensive that what they typically serve.",glass of champagne positive <sep> mussels negative <sep> steak negative <sep> portion smothered with sauce negative <sep> owner recommended negative <sep> price negative
0,0,"Bar BQ will knock your socks off with every entree (pulled pork and the ribs -- go full rack, kid, it won't do you wrong) and the homey taste of the sides (love that slaw, them beans, and all that tater salad) matches up perfectly.",Bar neutral <sep> ribs neutral <sep> rack neutral <sep> sides positive <sep> salad positive
0,0,"Usually you lose food quality the trendier you go, but not at this place.",food quality negative <sep> trendier neutral
0,0,"Although the atmosphere was lacking, I could definitely recommend a trip to Esca for the fish alone!",atmosphere negative <sep> fish positive
0,0,"When we first walked in, we saw other diners wiping their plates with bread- so we though that the food was good -but we very soon realized that the portions really were so small that you really have to lick your plate clean - afterall, their dinners costs a fortune.",food positive <sep> portions negative
0,0,"No bread basket for the table, the server came around with a basket and we each got 1 piece of bread.",table neutral <sep> server positive
0,0,"We weren't sure we'd even get a table,surprisingly the lovely hostess assured us she'd get us in if we gave her 15 minutes in the bar.",table neutral <sep> hostess positive <sep> bar neutral
0,0,"The atmosphere was a+, until a friend and I were rudely interrrupted and rushed out by the attendant at the door when the check was only returned to us just 5 mins.",attendant negative <sep> check neutral
0,0,"I highly suggest you make reservations, as wait times can be extremely long.",reservations neutral <sep> wait negative
0,0,"The only complaint I have is that the tables for 2 along the booth are very close together so it wasn't as romantic a dinner as we wanted but all in all, we were in our own world, more like in heaven.",tables neutral <sep> booth neutral <sep> dinner negative
0,0,"On the night I went to Yakiniku Juju, my plate came first wet, then streaked with grease; the waitress brought the wrong beer, smeared the grill with pork fat despite our having indicated that some in our party were on a kosher diet, and the music was recycled three times.",waitress negative <sep> beer negative <sep> grill with pork neutral <sep> music negative
0,0,"For dessert I had the green tea tiramisu and ice cream- I loved both, my bf who doesn't really like green tea actually really liked the tiramisu.",dessert neutral <sep> green tea tiramisu positive
0,0,"Our server didn't have the sommelier stop by when we were trying to decide on wines, he never brought the bread we requested and didn't crack a smile the whole evening until he saw that I was paying the tab when he suddenly became nicer.",server negative <sep> wines neutral
0,0,I love the steak and eggs with a bloody mary that costs around $7 bucks.,steak neutral <sep> eggs positive
0,0,"Fun atmosphere, good beer selection, but meals were skimpy portions on big plates and the service was weak - never had the same server/waitperson come back twice.",atmosphere positive <sep> portions negative <sep> service negative
0,0,"Now, I expressed my surprise and then the bartender and manager chimed in with a simpleton's remark sir, with restaurants at this time, reservations start coming in.",manager negative <sep> reservations neutral
0,0,"All of us enjoyed our meal, and for the price (~$185, w/ taxtip, 2 bottles of wine, 1 appetizer each, plus entrees) it was pretty impressive.",meal positive <sep> price positive <sep> bottles of wine neutral <sep> entrees neutral
0,0,The food did not come out on time or together and the waiter never came to explain why.,food neutral <sep> waiter negative
0,0,"For the price and quality of the food, the service should have been a lot better than it was.",price neutral <sep> food neutral <sep> service negative
0,0,I went to the tasting before Nobu opened and the menu and service has greatly improved since then.,menu neutral <sep> service positive
0,0,The service is excellent -- the staff is attentive and the waitress was well-informed about the menu.,service positive <sep> staff positive <sep> waitress positive <sep> menu neutral
0,0,The food was served promptly but the meal wasn't rushed - we had plenty of time to enjoy the appetizers and our entrees as well as sit and chat while finishing up our drinks even after we paid.,decor negative <sep> food positive <sep> prices positive
0,0,I order the Jerk Chicken full price off the menu.,price negative <sep> menu neutral
0,0,Olives served at the bar are wonderful.,Olives served positive <sep> bar neutral
0,0,"The waitress had zero knowledge about wine, and even knowledge about the dishes they were serving.",waitress negative <sep> wine neutral
0,0,"We explained that we had left a standard 15% on food, and a slightly smaller percentage on alcohol (At least 10%).",food neutral <sep> percentage negative
0,0,"After being treated like we were at Nobu by the hostess, our waitress brought us our check before we even asked for it and denied us a 2nd round of drinks because.",hostess negative <sep> waitress negative <sep> drinks neutral
0,0,"They have a great selection of wines, and have recently expanded with a Wine Bar around the corner that's accessible through the main dining room.",selection of wines positive <sep> Wine Bar neutral
0,0,"The Scene Superfine is an easygoing, instantly appreciable neighborhood hangout that boasts a kitchen staff armed with serious cooking chops.",Scene positive <sep> kitchen staff neutral <sep> cooking chops positive
0,0,"The calamari salad was great while the lamb ribs were fat, fattier and fattiest.",calamari salad positive <sep> lamb ribs negative
0,0,dining with my mother this past Saturday must have signaled to the wait staff that I wasn't cool enough to merit their attention.,dining neutral <sep> wait staff negative
0,0,"The Scene The bruising thoroughfare that is East 57th Street is the last place you'd expect to find an intimate, adorably decorated Northern Italian spot where it's actually possible to have a quiet, pleasant dinner.",Scene neutral <sep> dinner positive
0,0,"throughout the whole meal, all I kept thinking was AVERAGE, AVERAGE, AVERAGE until the bill came, which was a little more than average,to say the least.",meal neutral <sep> bill negative
0,0,"Even if you're just a middling junior exec, staff service makes you feel like a board member.",exec neutral <sep> staff service positive
0,0,"If you're looking for barbeque like Dallas BBQ (soaked in sauce from a bottle, generic, homogeneous food) then you won't like Blue Smoke.",food positive <sep> Smoke negative
0,0,"When we got there, the wait was just as everyone here has described, Domenico's process was just as described, but the pizza?",wait neutral <sep> pizza negative
0,0,"I asked the waiter about the vintages of the wines, to which he replied, I don't know, probably 2003/2004.",waiter negative <sep> vintages neutral <sep> the wines neutral
0,0,It's also a good place to unwind after dinner and have some coffee and cake.,dinner neutral <sep> coffee positive <sep> cake positive
0,0,"No condiments on table or offered, service average, smokey upon arrival as the kitchen is fully exposed and the space very tight.",condiments neutral <sep> kitchen negative <sep> space negative
0,0,Get in before peak dinner time (7-8 PM) to avoid harried service.,dinner neutral <sep> service negative
0,0,"It is never a ridiculous wait no more than 30 minutes, in the meantime you can chat with your friends and start the week-end off right with a signature drink from the bar!",wait negative <sep> bar neutral <sep> drink neutral
0,0,Hunan Delight has one page in their menu full of Vegetarian dishes.,menu neutral <sep> Vegetarian dishes positive
0,0,"We decided to order soup (over $6 a bowl), thinking that would be quick, however our waitress then said the soup is OUT OF A CAN and still would be a 20 minute wait since the tickets are processed in order.",bowl neutral <sep> waitress negative
0,0,I had to wait 1hr since I got there around 8pm but you could have a few drinks by the bar since the ambiance is very loungy/ club like.,drinks neutral <sep> bar neutral <sep> ambiance negative
0,0,"The line moves quickly, perhaps because there are no alcoholic drinks, which cuts lingering at the tables to a minimum.",line positive <sep> drinks neutral
0,0,"The spicy tuna is great, as is the seasonal spider roll, (soft shell crab).",spicy tuna positive <sep> spider roll positive <sep> soft shell crab neutral
0,0,"The brightly-lit takeout spot with a few non-descript tables and chairs looks like any other, but it tastes ten times more homespun.",takeout spot positive <sep> tables neutral
0,0,"Room is impressive, but service is slow and taste was almost like fast food.",Room positive <sep> service negative <sep> food negative
0,0,"We sat in the garden out back, and the calm atmosphere with the waterfall rock wall on the side completed the setting.",garden neutral <sep> atmosphere positive <sep> setting neutral
0,0,"Great place for dinner or late night for a few drinks and something to eat, the kitchen will be open till 3am.",place positive <sep> dinner neutral <sep> drinks neutral
0,0,"Half an hour after our appetizer was cleared, the waiter told us it would take more time to get our main courses.",appetizer neutral <sep> waiter negative <sep> courses neutral
0,0,The service was a bit inadequate-and be warned they bring your food as it is ready- so be sure to order apps then after being served order entrees.,service negative <sep> food neutral <sep> entrees neutral
0,0,why go there to deal with staffs' attitude and eat bad food?,staffs neutral <sep> attitude neutral <sep> food negative
