review_id,sentences_ids,sentences_texts,sentences_opinions
0,0,"When we finally got to order, we were told the bartender wasn't there, so we couldn't order any drinks.",bartender negative <sep> drinks neutral
0,0,"Though the wait staff was attentive, when the raw (really, not al dente) potatoes were brought to our server's attention, she listened but didn't respond.",wait staff positive <sep> potatoes negative
0,0,"While the food isn't out of this world, it offers a decent meal at a decent price.",food negative <sep> meal positive
0,0,"Pastas include shellfish-stocked linguine with tomato sauce, and an excellent homemade cheese ravioli--all are available in half portions.",Pastas neutral <sep> linguine with tomato sauce positive <sep> homemade cheese ravioli positive <sep> portions negative
0,0,"Perhaps I chose the wrong place, not fully appreciating that another reviewer's remark that diners here won't be rushed could translate to my timely-arrived party having to wait 'til 9:50PM to be seated for a 9PM Saturday reservation.",place negative <sep> diners neutral
0,0,"i went on a thurs night and it was a bit loud due to the many businessmen eating their dinner, but the food and service more than outdid the lack of peaceful dining.",dinner neutral <sep> service negative
0,0,"After finishing your meal, you can drop by their natural food market next door for organic all natural grocery.",meal neutral <sep> food positive
0,0,"too bad that the 2 sushi chefs have become a bit too busy to chat away with the guests at the counter, but they try and hey, we are here for the food !!!",counter neutral <sep> food positive
0,0,"When our turn came to get in, we were told that the place was full due to the Labor Day weekend and we could not get inside unless we bought a 200$ bottle of vodka.",place negative <sep> vodka neutral
0,0,"Its the perfect place to take a date, start out with dinner and then stick around for dancing!",place positive <sep> dinner neutral
0,0,"We had to ask the busboy if bread came with our meal, which it did and we received after waiting about 30 minutes.",busboy neutral <sep> meal neutral <sep> waiting negative
0,0,"Delicious appetizers and entrees, our server recommended a wonderful bottle of wine, and we couldn't resist dessert.",appetizers positive <sep> entrees positive <sep> server neutral <sep> bottle of wine positive <sep> dessert positive
0,0,get the mussels as an appetizer and try to save room for dessert.,mussels neutral <sep> appetizer neutral <sep> dessert positive
0,0,"I was their for Saturday lunch, adn I think that there's a different dinner menu, but everything was great.",Saturday lunch neutral <sep> dinner menu positive
0,0,"Sure, the burgers are good, but not good enough to make up for the abominable service and disgusting, filthy atmosphere.",burgers positive <sep> atmosphere negative
0,0,"A bright spot: the server was immeadiately apologetic and whisked problem plates away, and replacements were prompt.",server positive <sep> plates negative
0,0,"At any rate, the waiter totally forgot about us and we had to hail him down a couple of times just to get the specials and to order.",waiter negative <sep> specials neutral
0,0,"The appetizers were tasty and the snail ravioli quite adventurous, however the main courses were quite bland and even though the steak was featured with mustard sauce it really was just plain stone ground mustard.",appetizers positive <sep> snail ravioli positive <sep> mustard sauce negative
0,0,"Not only is the sushi mostly stellar, you'd have to be a real bonehead to not take advantage of their cooked items.",sushi neutral <sep> items negative
0,0,"The wine list is good, and overall it is not too expensive, though, and the atmosphere is very dark and brick-covered, much like any damp basement.",wine list positive <sep> atmosphere negative
0,0,They were more than happy to seat us even though we were early for our reservation.,seat positive <sep> reservation neutral
0,0,And don't forget to try the Korean rice wine to go with your dinner (Sansachun is one of my favorite).,Korean rice wine positive <sep> dinner neutral
0,0,"We weren't sure we'd even get a table,surprisingly the lovely hostess assured us she'd get us in if we gave her 15 minutes in the bar.",table neutral <sep> hostess positive <sep> bar neutral
0,0,"noteworthy menu items that we tried - tasting menu 6 courses for $50 with 2 glasses of wine - great value - frog's legs, knuckle sandwich, lobster mac cheese, octopus salad and venison chop - just fantastic.",courses neutral <sep> glasses of wine neutral <sep> frog neutral <sep> sandwich positive <sep> lobster mac cheese positive <sep> octopus salad positive
0,0,"The Food Mi Nidito's menu offers a considerable array of Mexican standards, with a separate page for seafood, such as King crab enchiladas, and another for vegetarian dishes such as almond-sauteed vegetables.",menu neutral <sep> array positive <sep> seafood neutral <sep> vegetables neutral
0,0,It's very reasonably priced considering the size of portions.,priced positive <sep> portions neutral
0,0,I went for dinner at Lucy the other night with five friends and it was the best experience I've had in a long time.,dinner neutral <sep> time negative
0,0,"The menu offered unique options and my friends enjoyed their food, but my lentil avacado salad was not better or more interesting than the lunch counter at Saks and my John Dory was overcooked.",menu positive <sep> lentil avacado salad negative <sep> lunch counter neutral
0,0,"In addition, I've always found the waiters helpful with the wine selection, and there is always a good selection of wines by the glass.",waiters positive <sep> wine selection neutral <sep> wines positive <sep> the glass neutral
0,0,"Unless you like getting bumped by waiters and people walking by, do not sit at a middle table.",waiters negative <sep> table neutral
0,0,"Forget Brunch- there are usually people waiting outside, although the brunches are delish as well!",waiting neutral <sep> brunches positive
0,0,The waiter did not take a drink order from us.,waiter negative <sep> drink neutral
0,0,In Short Take a quick trip to Maine at this classic lobster pound where the outdoor picnic tables are the prime seats in summertime.,lobster positive <sep> outdoor picnic tables neutral <sep> seats positive <sep> summertime neutral
0,0,"The Bollos appetizer, this deliciouss black bean, roasted corn fritter w/ a tsty dipping sauce and the Mahi Mahi was grilled just right.",Bollos appetizer neutral <sep> roasted corn fritter w/ a tsty dipping sauce positive <sep> Mahi Mahi positive
0,0,"We arrived, were greeeted and sked by the hostess I think if we were there for the Brunch, that was starting up again on today(3/12) the cost $25 per person.",hostess positive <sep> Brunch neutral
0,0,I especially love the korean dish's they add into there menu consider its 2 for 1 its hard not to resist with asian cuisine being so expensive in all in New York.,korean dish positive <sep> menu neutral
0,0,Extensive menu plenty of dishes to choose from my dinner was so-so but my BF entree was delicious.,menu positive <sep> dishes positive <sep> dinner neutral
0,0,"The kitchen also offers just a few sushi-free entree options, such as a masterful tempura dinner and chicken or salmon teriyaki.",entree options positive <sep> chicken neutral <sep> salmon teriyaki neutral
0,0,They need to change the overall decor if they want to get a serious dinner crowd though.,decor neutral <sep> dinner negative
0,0,"The salad I received was Iceberg lettuce with nothing else in it (no tomatoes, carrots).",salad neutral <sep> Iceberg lettuce neutral <sep> carrots negative
0,0,"Be warned that this place can get pretty crowded, though the $3 bloody mary's at the bar and the killer DJ make the wait more than bearable.",bar neutral <sep> killer DJ negative
0,0,"There is a long bar area wide enough to accommodate large crowds, large screen tv's on the walls to view games, but not that do not dominate the atmosphere, and up front there is a large lounge are with several booths and a working fireplace.",crowds negative <sep> atmosphere neutral <sep> lounge positive
0,0,"They may love the wacky/tacky decore, the overly gracious host, Gus, and his staff, the loads of freebies (oranges, cookies, lollies and wet naps), but the food is just mediocre.",decore positive <sep> staff neutral <sep> lollies neutral <sep> food negative
0,0,"For far better fish at the same price (but less interesting roll combinations), try Yama, just around the corner.",fish positive <sep> price neutral <sep> roll negative
0,0,"Good Italian spot, but should raise the bar on the food before some newcomers challenge its standings.",spot positive <sep> bar neutral <sep> food neutral
0,0,mapQuest before you go and you'll arrive early enough start off at the bar with a fabulous old school cocktail.,bar neutral <sep> school cocktail positive
0,0,"NOTE: Plan ahead, make a reservation and arrive early - parking is tight in the area - valet service is available if all else fails!",reservation neutral <sep> service positive
0,0,"The notable array of refreshing drinks includes raspberry lemonade, an assortment of smoothies and iced teas, and a black cow ice-cream float.",drinks includes raspberry lemonade positive <sep> assortment of smoothies neutral <sep> iced teas neutral
0,0,Your drink is at your fingertips and you don't have to wait for the waitress to come back with your cocktail.,drink neutral <sep> waitress negative <sep> cocktail neutral
0,0,"The crab croquettes were fried and completely lacking in crabmeat, our meat appetizer was dripping with grease and mostly fatty, and our main course was mushy rice drowned in some sauce with the consistency of baby food.",crabmeat negative <sep> meat appetizer negative <sep> main course neutral <sep> rice negative <sep> sauce neutral
0,0,"With dessert, the pre-theater is a great deal/meal.",dessert neutral <sep> pre-theater positive
0,0,You cannot beat having the waiter spooning butter over your steak before you are served!!,waiter spooning butter positive <sep> steak neutral
0,0,I have been dining at Narita for 6 years and have thoroughly enjoyed every meal.,dining neutral <sep> meal positive
0,0,"It's very cheap, food is great you can bring your own bottle of wine (saves sooo much money) The waiters will uncork it bring you glasses too !",food positive <sep> bottle of wine neutral <sep> waiters positive <sep> glasses neutral
0,0,"My wife and I, from Houston, and another couple from Conneticut were visiting Manhattan for the weekend and I chose Shula's for dinner because I had heard that it was a good steak house.",dinner neutral <sep> steak house positive
0,0,"The only downer was the fruit fondue desert from the prie fixe menu wasn't as good as it looked (the chocolate was runny), and the wait between our salad and main course was too long.",fruit fondue negative <sep> prie fixe menu neutral <sep> wait negative
0,0,"I discovered recent new management has made major improvements at this location ie the bar, dining areas, party room and bathrooms and keeping the kitchen open after 11PM.",management positive <sep> bar neutral <sep> dining areas neutral <sep> kitchen neutral
0,0,"The food's ok here, but AVOID this place for brunch, dinner or any other time!",food positive <sep> brunch neutral <sep> dinner neutral
0,0,The ambiance and service is great but I wish I could say the same about the food.,ambiance positive <sep> service positive <sep> food negative
0,0,"The white tablecloths covering closely-packed, old wood tables; waitresses with accents and up-turned noses; warm firelight ambience; boisterous crowds drinking wine -- it's all here.",waitresses neutral <sep> crowds drinking wine positive
0,0,"Not very crowded, the wait staff seemed to be in full force except when you needed their attention for something like water or tea.",wait staff negative <sep> tea neutral
0,0,"To the amusement of our server, I wrote everything down, lest I forget a single morsel (about 21 different dishes).",server positive <sep> dishes neutral
0,0,The portions are big so you can split an appetizer.,portions positive <sep> appetizer neutral
0,0,The food was served promptly but the meal wasn't rushed - we had plenty of time to enjoy the appetizers and our entrees as well as sit and chat while finishing up our drinks even after we paid.,decor negative <sep> food positive <sep> prices positive
0,0,I had spicy halibut with some sauces I can't remember.,halibut positive <sep> sauces neutral
0,0,"On top of which, the waiter doesn't write down your order, the busboy brought us the wrong food 3 times, and there's barely any room while you're waiting to sit and have a drink.",waiter negative <sep> busboy negative <sep> food negative <sep> drink neutral
0,0,"The liquid brunch consisting of 3 drinks (bloody marys, mimosas or screwdrivers) and coffee and an entree is quite a bargain.",brunch neutral <sep> drinks neutral <sep> mimosas neutral <sep> entree positive
0,0,"A hint of wasabi enlivens the shrimp; while the vegetarian, stuffed with seasonal greens, gets overwhelmed by its healthful-tasting herb dipping sauce.",hint of wasabi enlivens the shrimp neutral <sep> vegetarian neutral <sep> herb dipping sauce positive
0,0,The decor is a little plain and the seating is a touch too close but its worth it for the food.,decor negative <sep> food positive
0,0,If you're not looking for a pretentious atmosphere and a restaurant that serves the best steak you've ever eaten.,atmosphere positive <sep> steak positive <sep> restaurant neutral
0,0,"There are specials and it's the kind of place sure to please, whether you're seated at the window near the bar or in the outdoor (covered heated when needed) garden in the rear.",place positive <sep> bar neutral
0,0,The outdoor garden more than doubles the dining space and is tented in winter.,outdoor garden positive <sep> dining space neutral
0,0,MY FATHER ASKED FOR A MARTINI MADE A CERTAIN WAY THE WAITER HAD NO CLUE WHAT HE WAS TALKING ABOUT.,MARTINI neutral <sep> WAITER negative
0,0,"Unfortunately it gets very crowded on the weekends, so if you don't mind dining at the bar you can skip the wait for a table.",dining negative <sep> wait negative <sep> table neutral
0,0,Where else can you go to get freshly made Italian food at ridiculously low prices?,food positive <sep> prices negative
0,0,"8pm reservation, place was half empty on a Saturday.",reservation neutral <sep> place negative
0,0,I can't even remember if they serve anything else -- a busy hole in the wall sized place and atmosphere.,place negative <sep> atmosphere neutral
0,0,"There was a fire crackling in the dining room, the bar was a finished copper, the stools were leather, and the lighting wasn't dim nor bright, but just.",dining room neutral <sep> bar negative <sep> stools negative <sep> lighting negative
0,0,my personal favorite is the meat pie (which uses meat sauce instead of regular marinara sauce).,meat pie positive <sep> meat sauce neutral
0,0,From the complimentary chef app of a delicate butternut squash ravioli in a delicious truffle sauce to an amazing buttery and tender langostine entree to a dessert that I can't remember because of the fabulous Cakebread Cabernet we were drinking -- the whole evening was amazing.,chef app positive <sep> dessert neutral <sep> Cakebread Cabernet positive
0,0,You must think that the quality is poor for them to sell it for such a low price.,quality negative <sep> price positive
0,0,Those waiting inside to get a free table and waitresses carlessly walking by only served to make matters worse.,waiting neutral <sep> table positive
0,0,The owner circles the place asking patrons if their meals are fine.,owner positive <sep> meals neutral
0,0,The Scene The bright mix of colors painted on the cafe's walls matches the vivid margaritas that sit on nearly every table and litter the sceney bar.,mix positive <sep> bar neutral
0,0,The hostess was snooty since we did not have a reservation but the rest of the dining experience amply made up for it.,hostess negative <sep> dining neutral
0,0,"The service is almost stifling polite (they pushed in my chair behind me every time I returned from the bathroom), though the sushi chef preparing my food was casual and chatty.",chair neutral <sep> food negative
0,0,"Go for drinks, but not food it will leave you asking, where's the beef?",drinks positive <sep> beef neutral
0,0,"The Food The French-Belgian menu is small, but everything on it is satisfyingly savory, from a simple pot of mussels in a choice of sauces (beer and bacon, creamy mushroom, or white wine and garlic broth), to beef stewed with beer and prunes; from a juicy croque monsieur and beyond.",Food negative <sep> French-Belgian menu negative <sep> pot positive <sep> mussels positive <sep> beef stewed with beer neutral
0,0,I've been here several times for Sunday brunch now - (note: it helps if you're a late riser as I find the wait is always reasonable if you show up after 3pm).,brunch neutral <sep> wait positive
0,0,My nice waitress even came running out of the restaurant to hand me a tiny box I had forgotten on the table.,waitress positive <sep> table neutral
0,0,"This is one of my first dining experiences in NYC when I first moved here 10 years ago, and although Hudson Corner is consistently good, it has gone downhill over the years in both food quality and service!",dining experiences neutral <sep> food quality negative <sep> service negative
0,0,"It's listed under appetizers, but it's definitely filling enough to have as a meal.",appetizers neutral <sep> meal positive
0,0,"B/c the dinner focused on good friends and good food, not waiting around for service or being bothered by rude staff to leave.",food positive <sep> service neutral <sep> staff negative
0,0,The hostess finally seated us at a table for two when there were three of us in an empty restaurant.,hostess negative <sep> table neutral
0,0,"In Short Despite the tacky Hellenic decor, replete with faux columns and signs of the zodiac carved into plaster walls, this Greek restaurant and bar bursts with authenticity when it comes to menu and atmosphere.",decor negative <sep> bar neutral <sep> atmosphere positive
0,0,"The place was jumping on a Mon nite, as was the bar, but with a nice mixed crowd.",bar neutral <sep> mixed crowd positive
0,0,I was really excited when our waiter read off the list of specials.,waiter neutral <sep> specials positive
0,0,"Ofcourse the restaurant is new and perhaps they have some kinks to work out, but it for the same price you can get a higher caliber brunch at Banania or Cafe Luluc on Smith St.",price neutral <sep> brunch positive
0,0,"Do not use this place unless you want to waste your money on horrible stale cheese and food, service which takes your drinks away from the table once you've placed it on the table, waiters that eat your desert while its on the table, non working faucets in the bathroom, and overall very unporfessional service and food.",cheese negative <sep> drinks neutral <sep> waiters negative <sep> bathroom neutral
0,0,food is heaven  we were greeted by the hostess and sat down immediatly the space was very crowded and and we decided to order drinks promptly food can wait.,hostess positive <sep> drinks neutral
0,0,"Our apetizers took quite a while to be served, in fact, while all the other tables that sat way after us were being served I asked the waiter what happened to our appetizers, the calamari was tough; The entrees were tasteless and really!, one have to be really bad to mess a simple pasta dish.",apetizers neutral <sep> tables neutral <sep> waiter negative <sep> appetizers neutral <sep> calamari negative <sep> pasta dish negative
0,0,"Service was a little slow, but going on a Monday night during the Brooklyn Restaurant Week, where 20 bucks each got a friend and I appetizer, entree, and dessert was phenomenal.",Service negative <sep> appetizer neutral <sep> dessert positive
0,0,We had over 100 beers to choose from and the food and service was excellent.,beers neutral <sep> food positive <sep> service positive
0,0,Bartenders look like model wannabes and threw out my friend's beer before he was finished (about 1/4 left).,Bartenders negative <sep> beer neutral
0,0,"This time, I ordered the tasting menu and the only two dishes I enjoyed were the squab and the sorbet.",menu positive <sep> dishes positive <sep> sorbet neutral
0,0,"We had to ask for water even after we were asked what type we preferred, and then the busboy spilled it while he was pouring it out.",water neutral <sep> busboy negative
0,0,"We went there just for dinner, and the place was so good we didn't leave.",dinner neutral <sep> place positive
0,0,"I can't speak on the food, but I went there for a show the other week and here is my experience: one of the friendliest servers ever (no attitude); the drinks were avg.",food neutral <sep> servers positive <sep> drinks neutral
0,0,Our waiter suggested a fantastic Greek wine that was far less expensive then we were willing to spend.,waiter neutral <sep> Greek wine positive
0,0,"When we were finally seated about half an hour after my reservation, the waitress took her time taking our order.",reservation neutral <sep> waitress negative
0,0,"You get plenty of food for the price, enough leftovers for lunch and they actually serve garlic chicken with lots of chicken and chinese vegetables.",food positive <sep> price neutral <sep> lunch neutral
0,0,"My date and I had entrees, soup, and appetizers (fresh spinach pierogies) for $33 - ($40 with the tip).",entrees neutral <sep> soup neutral <sep> and appetizers positive <sep> fresh spinach pierogies neutral
0,0,Basic facts: sub-par limited menu; poorly made drinks; random crowd; and a waitress (although entertaining) that was doing shots behind the bar.,waitress negative <sep> bar neutral
0,0,It took about ten minutes to get out drink ordering after sitting down and once we recieved the bottle our waitress never once refilled our glasses!,bottle neutral <sep> waitress negative <sep> glasses neutral
0,0,The manager finally came by to apologize and offered to give us a greek salad on the house.,manager positive <sep> greek salad neutral
0,0,"I would only recommend this restaurant to a friend if waiting at least 40 minutes for your RESERVATION is acceptable, and you don't mind paying for relatively standard fare.",RESERVATION neutral <sep> fare negative
0,0,"Our waiter disappeared entirely, our food, when we were finally able to order it, arrived without plates (we had to go and track down a busboy to get them), and when we were finished, we couldn't get the check, even after walking across the restaurant to request it.",waiter negative <sep> food neutral <sep> plates neutral <sep> check neutral
0,0,"The Scene Superfine is an easygoing, instantly appreciable neighborhood hangout that boasts a kitchen staff armed with serious cooking chops.",Scene positive <sep> kitchen staff neutral <sep> cooking chops positive
0,0,The front desk person gave us quite a struggle to find a good seat.,person negative <sep> seat positive
0,0,"calle ocho is definitely high on my list, the food and mojitos are excellent (the sangria is a miss, flor de sol has much better sangria) but the service leaves much to be desired.",calle positive <sep> food positive <sep> mojitos positive <sep> service negative
0,0,Our group of 8 had about five small plates that we thought were the best on the menu.,plates positive <sep> menu neutral
0,0,I expected there to be more options for tapas the food was mediocre but the service was pretty good.,tapas neutral <sep> service positive
0,0,"Don't know about the rest of the food, but the burgers are one of New York's hidden treats.",burgers positive <sep> treats neutral
0,0,"No condiments on table or offered, service average, smokey upon arrival as the kitchen is fully exposed and the space very tight.",condiments neutral <sep> kitchen negative <sep> space negative
0,0,"The Scene This stylish, golden-hued noodle house spiffs up a dull stretch of Sixth Avenue with a crowd ranging from Japanese visitors to NYU students taking advantage of full-flavored, sustaining soups at bargain prices.",Scene neutral <sep> crowd neutral <sep> soups positive
0,0,"the atmosphere is that of a diner, but if you get a booth that is the best!",atmosphere positive <sep> diner neutral
0,0,"I noticed many of the other comments had negative things to say about the service and food - my thoughts and suggestions are: eat at the bar to avoid a rude waiter or bad service here and Artisanal's reputation is based on the cheese, get the CHEESE and not the steak or whatever.",food neutral <sep> bar neutral <sep> waiter negative
0,0,i took another 45 minutes so i called back the waiter and said that if the food was ready now ill just pay for it.,waiter negative <sep> food neutral
0,0,"The waiter did not know the menu, and was very unaccomidating about substutions.",waiter negative <sep> menu neutral
0,0,"I especially recommend ordering the duck, foie gras, and beef cheeks although it's probably hard to go wrong with anything on the menu.","duck, foie gras positive <sep> beef positive <sep> menu neutral"
0,0,Perhaps it's early and they will improve but service is VERY slow - took a good 25min for waiter to take our order on both visits and the second time I was one of three tables at a 5:30pm reservation so not like it was busy.,service negative <sep> waiter negative <sep> tables neutral <sep> reservation neutral
0,0,"The small shrimp were dry and rubbery and when I sent the dish back to the kitchen, the waitress returned saying that they use 'frozen shrimp so that is wny they have that texture.",small shrimp negative <sep> dish neutral <sep> kitchen neutral <sep> waitress negative
