review_id,sentences_ids,sentences_texts,sentences_opinions
0,0,"Diners sit around large tables where chefs ostentatiously chop, slice, stir-fry and grill.",chefs negative <sep> Diners neutral
0,0,"The waiters actually roll their eyes when you order something, as if you are imposing on them by ordering food.",waiters negative <sep> food neutral
0,0,"Food was ok, but not worth the 1 hour wait (we sat down an hour after our reservation time) If you are going to make people wait a LONG time, then at least build a bigger bar.",Food positive <sep> reservation neutral <sep> bar positive
0,0,I would definitely recommend getting reservations as the wait can be very long.,reservations neutral <sep> wait negative
0,0,We told the manager it was not worth a few appetizers to be treated that way and left.,manager neutral <sep> appetizers positive
0,0,My nice waitress even came running out of the restaurant to hand me a tiny box I had forgotten on the table.,waitress positive <sep> table neutral
0,0,"My advice: go the bathroom at home, and then go to Ginza for EXCELLENT sushi and service.",bathroom neutral <sep> sushi positive <sep> service positive
0,0,"you go all out with dress, tastes, and performance, and in the end its really about having a good time where you truly indulge yoursef in good vodka, compnay, music, and food.",dress neutral <sep> vodka positive <sep> music neutral <sep> food neutral
0,0,We asked for a side of dressing but the waiter told us that all the salads just had oil and vinegar so we should just use the oil and vinegar that was on the table.,side of dressing neutral <sep> waiter negative <sep> salads neutral
0,0,"For far better fish at the same price (but less interesting roll combinations), try Yama, just around the corner.",fish positive <sep> price neutral <sep> roll negative
0,0,"After I inquired why the food was taking so long, the waitress told us that the 2 dishes we ordered take a long time.",food neutral <sep> waitress neutral <sep> time negative
0,0,"The only concern i have is with the slighly all-business waitstaff who order and throw the food down, rushing you out.",waitstaff negative <sep> food neutral
0,0,"The staff is constantly disappearing from the restaurant, making it impossible to get drink refills or to get the check.",staff negative <sep> drink neutral
0,0,I requested a Riesling and the waiter recommended staying with the Sencere which didn't come by the glass according to the menu but he provided it to us any ways.,waiter negative <sep> glass neutral <sep> menu neutral
0,0,"although the food was well-prepared, it was not worth the price, especially when it does not include dessert!",food positive <sep> price negative <sep> dessert negative
0,0,"The entree -- a decent filet mignon, soupy mashed potatoes, and, believe it or not, frozen mixed veggies!",entree neutral <sep> filet mignon positive <sep> mixed veggies positive
0,0,) My date and I were greeted by the host and informed there would be a slight wait.,host positive <sep> wait neutral
0,0,The salsa always tastes like V8 with onion pieces.,salsa positive <sep> onion pieces neutral
0,0,"The service is disorganised, no one gave us a menu for 15 mins once we were seated, but after that it went smoothly enough but no where near the stella performance of many half as pretensious restaurants.",service negative <sep> menu neutral
0,0,"To be honest, it cost $95 for two adults and a kid (including only two beers for the adults), and the only things worth eating were the raw oysters, information about which the staff was not too sure.",beers neutral <sep> staff negative
0,0,"The place is small, or at lease it felt that way b/c tables were right on top of each other.",place negative <sep> tables neutral
0,0,"Most dishes are smothered in melted cheese or merely mediocre; flan is flat and pedestrian, drenched in tasteless sugar syrup; and even its supposedly best feature - the margarita - is a hit-or-miss affair.",dishes negative <sep> cheese negative <sep> flan negative <sep> sugar negative <sep> margarita neutral
0,0,Generous portions on the entrees.,portions positive <sep> entrees neutral
0,0,"My roommate says she has had good food here at night, at the bar.",food positive <sep> bar neutral
0,0,"The first time we went there had been a party of 10 that was just seated and the rest of the tables were all full, so we decided to take the drinks to go.",tables negative <sep> drinks neutral
0,0,"the atmosphere is trendy, i think it's better to come here for a drink rather than dinner.",atmosphere positive <sep> drink neutral <sep> dinner neutral
0,0,Generous portions of rice porridge and noodles really hit the spot after fighting the crowds on a busy weekend in Chinatown.,portions of rice porridge positive <sep> noodles positive <sep> crowds negative
0,0,Any sandwich or appetizer on the menu is delicious.,sandwich positive <sep> menu neutral
0,0,"Nothing on the menu jumped out at me, but when we tasted the chicken and the pork tenderloin.",menu negative <sep> pork tenderloin neutral
0,0,"The Scene Superfine is an easygoing, instantly appreciable neighborhood hangout that boasts a kitchen staff armed with serious cooking chops.",Scene positive <sep> kitchen staff neutral <sep> cooking chops positive
0,0,"When I told the staff that I was displeased and wanted to write a letter to the owner, I was told the owner had no name and that I should just give the letter with no formal greeting (Dear Pick a Bagel Owner) to the cashier and that she would pass it along.",staff negative <sep> Bagel Owner neutral
0,0,The place got really crowded around 8ish when I went right before Christmas so reservations might be necessary.,place negative <sep> reservations neutral
0,0,I ordered dessert and it was they gave me the wrong flavor of ice cream.,dessert neutral <sep> flavor negative
0,0,Had dinner here this past Friday night with some friends and Salmon River definitely did not disappointment.,dinner neutral <sep> Salmon positive
0,0,"The restaurant has a Family feel, not least with regard to the portions which are enormous; the veal alone could have single-handedly solved third world famine.",portions positive <sep> veal neutral
0,0,"There are a few things I can forgive at any popular place: somewhat long waits even with reservations, service staff that mistakenly believes they're there to act haughty rather than serve, and a way over-the-top interior.",reservations neutral <sep> service staff negative <sep> interior negative
0,0,Bartender made a bad drink for me and I sent it back and was charged for it.,Bartender neutral <sep> drink negative
0,0,"Well, literally 7 minutes later we were being served dinner, with no apologies from the server who was too scared to come to our table.",served dinner neutral <sep> server negative <sep> table neutral
0,0,"Chicken with Mixed vegetables is an explosion of flavor, many great spicy dishes too.",Mixed vegetables neutral <sep> flavor positive <sep> dishes positive
0,0,"We were served by two very rude waitresses who slammed every glass and dish they brought onto the table, and then got so caught up by hanging out at the bar that I eventually had to hunt them down to pay my bill.",waitresses negative <sep> dish neutral <sep> table neutral <sep> bar neutral
0,0,"The Food  Kolonaki serves up everything from a European tuna sandwich (made with tuna, lemon juice, capers, parsley, onions, carrots, olive oil and basil) to scrumptious specialty desserts.","Food positive <sep> tuna, lemon juice neutral <sep> capers neutral <sep> parsley neutral <sep> onions neutral <sep> specialty desserts positive"
0,0,We asked for the check and had to wait 20mins for the waitress to come back and take our card.,check neutral <sep> waitress negative
0,0,The food and drinks held up to eatery's rep and the service was just as good if not better.,drinks neutral <sep> service positive
0,0,they didn't have to change anything about the menu except add a leg of chicken seperatley and the guy mumbled very rudely that I had already ordered and I should've decided earlier.,menu neutral <sep> guy negative
0,0,my boyfriend's fish was overwhelmed by the sauce.,fish negative <sep> sauce neutral
0,0,"The Food Despite a menu that seems larger than the restaurant, great care goes into the preparation of every dish.",Food positive <sep> menu neutral <sep> dish positive
0,0,My only complaint is waiting a bit between the appetizer and the main course but it was well worth it.,waiting negative <sep> main course neutral
0,0,The restaurant didn't mind me sitting on their doorstep to the extent that the bartender invited me in for a drink.,bartender positive <sep> drink neutral
0,0,"The waiter, who was missing when we wanted to place our order, hovered over us throughout the meal, as if in a hurry to get us out of there.",waiter negative <sep> meal neutral
0,0,There are some reviews complaining about the menu but I had the same dish the first three times that I was there - and any specials that I have had have been excellent.,menu neutral <sep> specials positive
0,0,We decided to share order of filet mignon for the table because there was just not enough food.,filet mignon neutral <sep> the table neutral <sep> food negative
0,0,"That bastion of authentic Mexican food in Spanish Harlem that earned raves by white reviewers, leading other gringos to nervously venture to Spanish Harlem and pretend they're trendy to pay too much for food that is only marginally better than the place around the corner.",Mexican food positive <sep> reviewers neutral
0,0,"The service was very rushed and as we were finishing our drinks and paying our bill, the owner asked us to leave so he could seat other people at our table.",service negative <sep> drinks neutral <sep> owner negative
0,0,"Myself along with every other patron were forced to wait in an overcrowded bar while employees carry chairs and such over our heads to prepare for dinner in the next room, shoulder to shoulder we stood there like cattle waiting to be fed.",bar negative <sep> employees neutral <sep> chairs neutral <sep> dinner neutral <sep> cattle waiting neutral
0,0,I think the person who says it has a wierd taste must have had very bad luck because I think this is the most authentic thai I've had in NYC (and I'm comparing it to food in Thailand).,taste negative <sep> food neutral
0,0,"We waited 15 minutes for a menu, another 20 for a tea, another 15 for an appetizer, then when the plates came out, the waitress had to ask me what I'd ordered.",menu neutral <sep> tea neutral <sep> appetizer neutral <sep> plates neutral <sep> waitress negative
0,0,"We asked the waitress very nicely to please change the playlist to something more appropriate for dinner, she chuckled to herself and said sure but never changed it.",waitress negative <sep> dinner neutral
0,0,one waiter couldn't remember what we had to drink and we were the only people in the place.,waiter negative <sep> drink neutral
0,0,"The scene is a bit much some time, but the food is worth it.",scene negative <sep> food positive
0,0,"Service was a tad spotty, but the food was VERY good and the noise never detracted from the dining experience.",Service negative <sep> food positive <sep> experience negative
0,0,"BTW, the prices are very affordable, which make the mediocer service tolerable.",prices positive <sep> service negative
0,0,"Be warned though, this plaice gets packed at lunch - and the service can be rottenly slow-going.",lunch neutral <sep> service negative
0,0,When asked to explain the hostess told us she would lose money by seating us instead of them.,hostess negative <sep> seating neutral
0,0,"The first time around, we had the $80 tasting menu, which included some sushi items, which I found to be pretty average, especially for the price.",menu negative <sep> price neutral
0,0,"The Scene Opened in 1993, Nick's may be the only great pizza place in the city of New York that isn't older than most of the people who eat there.",Scene neutral <sep> pizza positive
0,0,OK so the decor is a little old and tacky but it adds to the atmosphere.,decor negative <sep> atmosphere positive
0,0,"then, the waiter had nerve to charge me for the fruit salad and bloody mary (which we didn't drink) that came with the omelet (brunch special).",waiter negative <sep> fruit salad neutral <sep> omelet neutral
0,0,Yoguart/mint/jalipeno sauce for instance didn't work with asparagus.,Yoguart/mint/jalipeno sauce negative <sep> asparagus neutral
0,0,"Atmosphere in the formal room was nice, but the informal dining room was extremely loud which ultimately made the formal room louder than my perference.",Atmosphere positive <sep> informal dining room negative
0,0,Waiter dropped check on table while I was in the middle of handing my wife her anniversary present.,Waiter negative <sep> check neutral
0,0,MeetLESS gives you a dance club w/o the dance floor a restaurant w/ horrendous service and limited menu selections (the ONLY steak is a top sirloin?!!!),club neutral <sep> service positive <sep> menu neutral <sep> steak neutral
0,0,OUr waiter was a little confused about how to serve champagne.,waiter negative <sep> champagne neutral
0,0,"The waiters are very kind and helpful, and I regularly get something on the house - coffee, dessert or a drink.",waiters positive <sep> coffee neutral
0,0,"we told our waiter to make five selections for each of us, and he decided instead to charge us for each glass separately instead ($80 instead of $20).",waiter negative <sep> glass separately neutral
0,0,my date's non veg thali was really expensive and had like one or two pieces of meat in each sauce.,thali negative <sep> meat neutral <sep> sauce neutral
0,0,For dinner we decided to take our servers advice and order several items to share.,dinner neutral <sep> servers positive
0,0,"After asking several different people find our waiter, he returned to say he couldn't find any wine and begged us to order sake instead.",waiter negative <sep> wine neutral
0,0,"I had the lentils and cous cous for lunch the next day because my friend and I had appetizers before our entrees-- portions are pretty decent for the price, and tasty to boot.",lunch neutral <sep> appetizers neutral <sep> entrees neutral <sep> portions positive <sep> price neutral
0,0,"SKIP THIS PLACE FOR LUNCH, BUT MAKE SURE YOU GET THERE FOR DINNER.",LUNCH negative <sep> DINNER positive
0,0,Why would anyone ever go here when the same food (and menu) is double the price of Baba and Jaya in Chinatown.,food neutral <sep> menu neutral <sep> price negative
0,0,"Fast and Fresh is also a bodega, and they have the usual offerings: cold drinks in the fridge (Corona and other beers available), bagels, sammiches and salads to order.",drinks positive <sep> sammiches neutral <sep> salads neutral
0,0,"I've had the ribeye, the salmon, and a burger/fries at the bar, and they were all exceptional.",salmon positive <sep> bar neutral
0,0,"Don't go for the decor or the location, go for the food!",decor negative <sep> location negative <sep> food positive
0,0,Service was slow and our drink order took forever (and the place wasn't crowded).,Service negative <sep> drink neutral <sep> place positive
0,0,"We tried explaining nicely to them that we were just finishing up a drink, and after a brief, unprofessional discussion with the two waiters, they told us never to come back again.",drink neutral <sep> waiters negative
0,0,"Guacamole+shrimp appetizer was really great, we both had the filet, very good, didn't much like the frites that came with, but the filet was so good, neither of us cared.",Guacamole+shrimp appetizer positive <sep> frites neutral
0,0,We got there before our reservation and the seated us quickly.,reservation neutral <sep> seated positive
0,0,"My boyfriend took me to dinner for an early Valentine's Day, we showed up early for our reservation to meet an incredibly rude host who told us the bar was full, to just wait behind a rope.",reservation neutral <sep> bar negative
0,0,"In Short Custard Beach is located in the lower-level dining concourse of Grand Central Terminal, which features seating, many dining choices and a crowd of tourists and commuters.",dining concourse positive <sep> seating neutral <sep> dining choices neutral
0,0,"Though you will undoubtedly be seated at a table with what seems like barely enough room (no matter what the size of your party), the warm atomosphere is worth the cramped quarters- you'll have fun and forgot about the tight spot you're in.",table neutral <sep> room negative <sep> spot negative
0,0,"Although the tables may be closely situated, the candle-light, food-quality and service overcompensate.",tables negative <sep> candle-light positive <sep> food-quality positive <sep> service positive
0,0,On the menu says Free delivery (Minimun order $10) but I was charged a couple of dollars on both opportunities.,menu neutral <sep> delivery positive
0,0,"Seemed to be many problems just getting our appetizers out (guacamole, which was delicious when it finally came) and we were there an hour before entrees arrived.",appetizers neutral <sep> guacamole positive
0,0,"When there is so much GREAT food in New York, why go for the high-priced mediocre meal?",food positive <sep> meal negative
0,0,"The food, though good for the most part (very good duck and chicken with rice dish, but awful charred squid salad - tasted bitter going down), was the least memorable part of the meal.",food positive <sep> charred squid salad negative <sep> meal neutral
0,0,"Although we didn't have a reservation, my husband and I enjoyed the food and drinks at the kitchen side seating.",reservation neutral <sep> food positive <sep> seating neutral
0,0,"Corner Bistro, despite the hoopla and critical praise, is nothing more than a burger joint with long lines.",burger neutral <sep> lines negative
0,0,"When we received the bill, we asked the manager to do something about the drinks, considering how poor the service was and her reply was, Well, you got them!",bill neutral <sep> manager positive <sep> drinks neutral <sep> service negative
0,0,"We went ot Al di La a bit earlier than we usually go to dinner, mainly due to the fact that reservations are not accepted.",dinner neutral <sep> reservations negative
0,0,"Management had always been rude, but without the great staff as a buffer, Jesse's is just another pubby place with poor decor and average food.",Management negative <sep> decor negative <sep> food neutral
0,0,Out waitress never came back to our table after taking our food orders.,waitress negative <sep> food neutral
0,0,"A hard-drinking, upscale crowd, holding conversations over loud Latin jazz music, packs the small, open dining room and attached bar.",Latin jazz music negative <sep> bar neutral
0,0,who seemed honestly offended that we asked why our table was 45 minutes late; a cold cafeteria room that was clearly designed to intimidate; and haute chinese food that was over-salted to make up for the lack of flavor.,table neutral <sep> cafeteria room negative <sep> chinese food positive <sep> flavor negative
0,0,"The tea wasn't much good, the menu and the food was pretty much the same as the $5 curry row fare and the waiter need constant prodding.",tea negative <sep> food negative <sep> curry row fare neutral <sep> waiter negative
0,0,45 minutes later our less-than-stellar pizza and their even less-than-stellar gnoccho was dropped at the table; no explanation or apology or attempt to acknowledge the ridiculous wait.,pizza neutral <sep> table neutral <sep> wait negative
0,0,"You can go to all these gormet places and eat expensive pizza this is the best cheese, sauce, bread its a done deal.",pizza negative <sep> cheese positive <sep> sauce positive <sep> bread positive
0,0,"Silky black bass with porcini mushrooms carries smoky, earthy and buttery overtones that somehow never overpower the fish, and whole-roasted baby pig includes belly meat, braised for 24 hours in five spice-ginger glaze, and yet the pork flavor is still fully present.",fish neutral <sep> braised neutral <sep> pork flavor positive
0,0,"Self-important people, please stay at home and cook and dump as much parmesan on as you like.",people negative <sep> parmesan positive
0,0,"While admitably, the seating is a bit cramped, and the menu a tad pricey, the staff does its best to remedy concerns.",seating negative <sep> staff positive
0,0,"it was really good, but i also mistakenly chose the lobster course as my entre and it turned out to be the same dish as my appetizer (but warmed).",lobster course negative <sep> dish neutral <sep> appetizer positive
0,0,The Fettucine Alfredo was appropriately cheesy and dense but the show stopper was the Linguine with white clam sauce.,Fettucine Alfredo positive <sep> white clam sauce neutral
0,0,The waiters were getting a wine class from a very loud manager and ignoring all the patrons - someone should have been giving them a class on serving instead.,waiters neutral <sep> wine neutral <sep> manager negative <sep> patrons negative
0,0,"Just expect to wait a good twenty minutes before they take your order (even when the restaurant is half empty), you'll have to ask at least 5 waiters and a manager for coffee before they bring it to you and when they bring your orders out wrong, expect the manager to side with the chef and not you.",waiters negative <sep> coffee neutral <sep> chef neutral
0,0,"Without another word when we arrived, they added a chocolate decoration saying Happy Anniversary to our desserts.",chocolate decoration positive <sep> desserts neutral
0,0,The food is not five star but the prices reflect that.,food negative <sep> prices positive
0,0,The pieces were small but the fish was good quality and there wasn't a lot of rice to mess with.,fish neutral <sep> quality positive <sep> rice negative
0,0,"The server rolled his eyes when we ordered only an entree per person (with no appetizers), spoke curtly to us, and ignored our requests for more water etc.",server negative <sep> entree neutral <sep> appetizers neutral
0,0,Green bean salad was tasty but could have used a bit more of a kick  Baby backs - Wow!,Green bean salad positive <sep> Baby backs neutral
0,0,"The Food The free chips-and-salsa may suggest casual Tex-Mex cooking, but this menu is a couple notches above.",Food neutral <sep> menu negative
0,0,The table next to us recommended that share because the portions are big(we split two entrees)The food was so good I wish that there was some left over to take home for the next day.,portions positive <sep> entrees neutral
0,0,"I've eaten at this Zen Palate location a few times, and each time have had the same reaction- I feel the food's sub-par, but decide to give it another chance and order something else.",location neutral <sep> food negative
0,0,Portions are fairly generous and the staff brings out multiple little bites and treats throughout dinner.,Portions positive <sep> staff positive <sep> dinner neutral
0,0,"The service is great - they are very attentive and fast, however, they do make faces and comments when you order alot of the ALL YOU CAN EAT food.",service positive <sep> food neutral
0,0,"Instead of doing so, the manager came to our table and told us he'd be happy to take our orders off if we didn't like the way he ran his restaurant.",manager positive <sep> table neutral
0,0,"Its not kept frozen, but close to room temperature so you get the real taste of the ice cream and not just the ice.",taste positive <sep> ice cream neutral
0,0,my personal favorite is the meat pie (which uses meat sauce instead of regular marinara sauce).,meat pie positive <sep> meat sauce neutral
0,0,"The Food The menu seems quirky, but upon a closer look ingredients are familiar and made into appealing combinations, with influences from Maine to the Mediterranean.",Food positive <sep> menu positive <sep> ingredients neutral
0,0,on the food-front while adding just enough of a civilized atmosphere where you won't worry about either your neighbor or the wait staff biting off one of your fingers.,atmosphere positive <sep> wait staff neutral
0,0,"In addition to Italian staples like pasta, chicken and veal parmigiana, house specials like chicken Giovanni (chicken breast with sausage, sauteed in white wine) and linguini Giovanni (shrimp and clams in red sauce) keep the menu interesting.",veal parmigiana neutral <sep> white wine neutral <sep> linguini Giovanni neutral <sep> menu interesting positive
0,0,"After dinner the manager grabbed my boyfriend, asked him: Where are you from.",dinner neutral <sep> manager negative
0,0,"But even on New Years, when they were busy, the owners took the time out to visit our table frequently, even pouring us drinks herself from her own creations.",owners positive <sep> drinks neutral
0,0,It's very reasonably priced considering the size of portions.,priced positive <sep> portions neutral
0,0,The menu was much too narrow - 4 pastas and 6 meat dishes or so.,menu positive <sep> meat dishes neutral
0,0,The wine did not come until we were half way through our entree and the waitress overcharged us by a bottle of wine.,entree neutral <sep> waitress negative <sep> wine neutral
0,0,"The Food Mi Nidito's menu offers a considerable array of Mexican standards, with a separate page for seafood, such as King crab enchiladas, and another for vegetarian dishes such as almond-sauteed vegetables.",menu neutral <sep> array positive <sep> seafood neutral <sep> vegetables neutral
0,0,"After finally choosing banana-macadamia nut pancakes (a Hawaiian favorite of mine) after being unable to decide between 4 or 5 dishes that all sounded spectacular, I sat back and enjoyed the (complementary) tall shot glass of the smoothie of the day.",dishes neutral <sep> glass positive
0,0,The waitresses are so nice and will even help you pick a meal if you are new to spanish food.,waitresses positive <sep> meal neutral <sep> food neutral
