review_id,sentences_ids,sentences_texts,sentences_opinions
0,0,The owner lied to me when i asked where our food was 1 hour after we placed the order - he said oh your friend said you were not ready for it.,owner negative <sep> food neutral
0,0,"We ended up having appetizers in the lounge, while listening to a really great DJ.",lounge neutral <sep> DJ positive
0,0,Ate at the bar and started with an amazing bowl of french onion soup with 3 cheeses (3!),bar neutral <sep> bowl of french onion soup with 3 cheeses positive
0,0,The menu offers favorites from all over China: mellow Lake Tung-Ting shrimp from Hunan; peppery Sichuan tofu with minced pork; and Shanghainese soups with pickled mustard greens.,menu neutral <sep> Tung-Ting shrimp positive <sep> Sichuan tofu with minced pork positive <sep> soups positive
0,0,"The pretty waitstaff is always pleasant, but service is inconsistent at best.",waitstaff positive <sep> service negative
0,0,"I particularly like the side dishes -- the eggplant dip, for example -- and the appetizers.",side dishes positive <sep> eggplant dip positive <sep> appetizers neutral
0,0,"After I inquired why the food was taking so long, the waitress told us that the 2 dishes we ordered take a long time.",food neutral <sep> waitress neutral <sep> time negative
0,0,The waiter was pleasant and I thought how bad could someone screw up basic Italian food?,waiter positive <sep> Italian food neutral
0,0,"Only problem was - an older gentleman (well-dressed but a little enebriated) chose to sit down right next to me - despite the fact that all 15 other seats were free - order himself a martini, and then describe how dry and dissapointing the burger was when he ordered it a few days ago.",gentleman negative <sep> seats negative <sep> martini neutral
0,0,"We complained to our waiter serveral times about this and the stares continued and to top it all off as the manager walked around to each table asking if they enjoyed their dinner, he conveniently did not ask us!",waiter neutral <sep> table neutral <sep> dinner positive
0,0,"A few years ago I would have rated it much higher, but now - with other better choices such as Candle Cafe, Good Health Cafe and others, the dated menu, crowded atmosphere are spacey service is not the greatest choice.",menu neutral <sep> atmosphere negative
0,0,"On top of that, the portions were hearty enough that we barely had any appetite left for dessert.",portions positive <sep> dessert neutral
0,0,Waiters and busboys were taking our water glasses and the tip tray off the table before we had counted the change.,Waiters negative <sep> water glasses neutral
0,0,The calamari salad was huge (but delicious)--it could be a meal unto itself.,calamari salad positive <sep> meal neutral
0,0,"our waitress couldn't explain or describe the specials to us, and a group of five people seemed to overwhelm her.",waitress negative <sep> specials neutral
0,0,the food is still awesome - the twist on mexican is perfect - but the service is terrible - from the apathetic hosts to the unbelievably slow servers.,food positive <sep> hosts negative <sep> servers negative
0,0,"The Food Diners are prompted to order several shareable dishes which, considering the food isn't what's drawing most of the crowd, are surprisingly good.",Food Diners positive <sep> crowd neutral
0,0,"The portions are miniscule -- a pasta entree was the size of a small appetizer, we were all hungry at the end of the meal but they certainly supersize the prices.",appetizer negative <sep> meal neutral <sep> prices negative
1433,1177,Take your time and go through the tutorials patiently.,tutorials neutral
164,2985,"My daughter uses it for games, email, facebook, pictures and music.",games neutral
140,2470,Its ease of use and the top service from Apple- be it their phone assistance or bellying up to the genius bar- cannot be beat.,use positive <sep> service positive <sep> phone assistance positive <sep> genius bar positive
2263,1171,"I chose the iBookG4, a laptop that is an attractive computer with a large screen big enough to please anyone.",screen positive
1399,1436,"I have Vista, so I am unable to install and uninstall  some programs.",Vista negative <sep> programs negative <sep> install negative <sep> uninstall negative
2035,2725,Sound card is limited though.,Sound card negative
112,103,"The reality was, it heated up very quickly, and took way too long to do simple things, like opening my Documents folder.",opening my Documents folder negative
1068,2902,"I have found also, it is very easy to be able to access wireless internet access;",wireless internet access positive
172,1374,"Also, if you need to talk to a representive at Microsoft, there is a charge, which I believe is robbery, since you are charged enormous amounts for a very badly designed system, which most people would have went with XP if they could.",representive at Microsoft negative <sep> system negative <sep> XP positive
1141,2337,"the touch pad is fine - again, it's a real touch pad.",touch pad positive <sep> touch pad positive
361,1691,The paint wears off easily due to the keyboard being farther back than usual.,paint negative <sep> keyboard negative
2441,1626,"I used to build my own desktops from the component parts, and recently my 7 year old Pentium 4 with HT 1 GB ram SATA desktop stopped working (this was a rock star 7 years ago).",Pentium 4 neutral <sep> 1 GB ram neutral
1418,888,The mousepad is a huge pain in the arse!,mousepad negative
1081,1748,Typing on the keyboard becomes uncomfortable after extended use due to the sharp edges that your wrists rest on.,keyboard negative <sep> edges negative
926,2973,"It has plenty of memory, lots of hard drive, and great graphics.",memory positive <sep> hard drive positive <sep> graphics positive
1030,2319,With Windows laptops a wireless mouse is an absolute must.,wireless mouse neutral
896,3011,"Great OS, fabulous improvements to the existing line bumping up the processor speed and adding the thunderbolt port.",OS positive <sep> processor speed positive <sep> thunderbolt port positive
432,2030,None of the techs at HP knew what they were doing.,techs at HP negative
1567,735,"I bought this last week, and the very next day had to return it because it over heated and the touch-mouse stopped responding.",touch-mouse negative
1631,3085,I looked around and based off my price/features comparison from a brand I trusted I landed here.,price neutral <sep> features neutral
242,1686,Another thing I might add is the battery life is excellent.,battery life positive
2491,1811,"The Mac Snow Leopard O/S is extremely easy to use, although very different than Win XP, Visa or Win7.",Mac Snow Leopard O/S positive <sep> Win XP neutral <sep> Visa neutral <sep> Win7 neutral <sep> use positive
1347,19,Everything from the design to the OS is simple and to the point.,design positive <sep> OS positive
14,338,"My only disappointment with the 13"" model is that they're the only ones in the MacBook Pro line up without an i5 or i7 processor and dual graphics cards, however the trade-off is that you achieve a longer battery life (of about 2 more hours).",processor negative <sep> graphics cards negative <sep> battery life positive
647,756,PC never worked right even after BIOS fixed.,BIOS negative
864,1385,"Again, the same problem, the right speaker did not work.",right speaker negative
3034,2272,"We also use Paralles so we can run virtual machines of Windows XP Professional, Windows 7 Home Premium, Windows Server Enterprise 2003, and Windows Server 2008 Enterprise.",Paralles neutral <sep> Windows XP Professional neutral <sep> Windows 7 Home Premium neutral <sep> Windows Server Enterprise 2003 neutral <sep> Windows Server 2008 Enterprise neutral
1744,1876,I already have a HP laptop I bought last year that's standard size.,size neutral
611,799,then on top of it all their cusromer service center is in the middle east.,cusromer service center negative
1450,1843,  I could not find a phone number anywhere to call an actual live person for tech support and had to result the their online chat.,tech support negative <sep> online chat neutral
2299,1497,"The PhotoBooth is a great program, it takes very good pictures with the built-in camera.",PhotoBooth positive <sep> program positive <sep> built-in camera positive
1885,14,"Not too much ""junk"" software to remove.",software positive
1791,753,Took several hours with customer support before I could even start the PC out of the box.,customer support negative
2566,1268,Could not keep up with me and finally the hard drive went out.,hard drive negative
918,2871,I always have used a tower home PC and jumped to the laptop and have been very satisfied with its performance.,performance positive
1959,1740,The Material this Pro is made out of seems a lot nicer than any PC  Specs: Like I said this performs a lot better than any computer I've had in the past.,Material positive <sep> Specs negative <sep> performs positive
2985,2112,Even out of warranty!,warranty neutral
1537,956,"  I sent it back and found this time that the battery was faulty, so I got a new one and some other fixes they found.",battery negative
2741,2301,when i first got it i thought the size of it was a joke.,size negative
2439,32,"First, it does not have a push button to open the lid.",push button negative <sep> lid neutral
480,220,"Although the price is higher then Dell laptops, the Macbooks are worth the dough.",price negative
2075,1228,The computer is currently in West Verginia doe to the method of shipping choosen by Toshiba.,shipping negative
1417,2497,BUT there's this application called Boot Camp which allows you to add another OS X like Windows.,application neutral <sep> OS X neutral <sep> Boot Camp neutral <sep> Windows neutral
1122,2944,I love to write and play with graphics and html programming and my new Toshiba works great on both!,works positive
1253,377,Awesome laptop and the perfect size to carry around in college.,size positive
1905,2508,PC users use the Powerpoint program for slide-show presentation and Mac users utilize Keynote.,Keynote neutral <sep> Powerpoint program neutral
2100,550,The speakers on it are useless too.,speakers negative
1588,264,Vista is a nightmare.,Vista negative
1705,2588,"Its Office compatible, but the features and its functioning is all new again so you might as well save the money and just learn the pre installed mac programs.",features neutral <sep> functioning neutral <sep> programs neutral <sep> Office positive
502,2141,"this computer will last you at least 7 years, thats an amazing life spanned an electronic.",life positive
2779,2686,Didn't work when shipped from Walmart.com but went into a store and exchanged for a working laptop (same make/model).,work negative
2879,1689,It is good to know that I can mobilize without having to worry about the battery life.,battery life positive
147,1718,I eventually did the migration from my iMac backup disc which uses USB.,iMac backup disc neutral <sep> USB neutral
545,1953,"My Toshiba did not have sound on everything, just certain things.",sound negative
843,3035,It works really well.,works positive
998,1088,A SECOND PROBLEM INVOLVES THE BATTERY WHICH IS ADVERTISED AS HAVING A STORAGE LIFE OF 11 HOURS BUT WHEN FULLY CHARGED SHOWS ONLY 7 HOURS OF SERVICE.,BATTERY negative <sep> SERVICE negative
3005,1039,Keyboard is plastic and spongey feeling.,Keyboard negative
2989,1582,"Crisp screen, great battery life, and plenty of storage.",screen positive <sep> battery life positive <sep> storage positive
1853,1534,"I have had another Mac, but it got slow due to an older operating system.",operating system negative
1623,91,Later it held zero charge and its replacement worked for less than three months.,charge negative
2074,2694,Peformance is good for the price.,Peformance positive <sep> price positive
855,2787,"Overall the computer is very easy to use, the screen is perfect, great computer, my daughter loves.",screen positive <sep> use positive
2579,1366,  After the warrenty expired the hard drive went bad and it would have cost more to fix then to replace.,warrenty neutral <sep> hard drive negative
1180,3030,It's so bad that I'm thinking I only got half a battery or something.,battery negative
2238,821,"  Also, I have had alot of trouble with the keys sticking and will not type correctly.",keys negative
376,2660,The body is a bit cheaply made so it will be interesting to see how long it holds up.,body negative
324,340,They also have a longer service life than other computers (I have several friends who still use the older Apple PowerBooks).,service life positive
2747,2781,The speakers are terrible and are probably the cheapest ones I have ever seen in a laptop so if your planning to listen to music I suggest you get something better.,speakers negative
1808,286,The display is beyond horrible.,display negative
1408,237,"I had my IWORKS, Itunes, Email, MS Office, network and printers set up and completely working perfectly within an hour.",IWORKS positive <sep> Itunes positive <sep> MS Office positive
2313,926,But guess what?  (you have to buy an external dvd drive it doesn't have a built in type) The notebook can't be used because it doesn't read anything for an external drive.,external dvd drive negative <sep> external drive negative
1851,519,"The battery life sucked the juice from my laptop and when the extended life battery went out we were SOL there to, so much for that warranty covering all the products we purchased.",battery life negative <sep> warranty negative
2057,1061,Every driver on the drivers/applications DVD is everything you will need for a reload.,driver positive <sep> drivers/applications DVD positive
2768,2212,"The applications are also very easy to find and maneuver, much easier than any other computer I have ever owned.",applications positive
107,2033,"I wanted to purchase the extended warranty and they refused, because they knew it was trouble.",extended warranty neutral
568,2956,"It is well worth the money it cost, Very good investment.",cost positive
2607,1480,"My friend reports the notebook is astonishing in performance, picture quality, and ease of use.",performance positive <sep> picture quality positive <sep> use positive
1922,3046,"So, I took it back to the apple store and they narcissist genius bar staff) fixed it by resetting the fan at boot up.",genius bar staff) negative <sep> fan neutral <sep> boot up neutral
612,1668,The only bad part is the size/weight.,size negative <sep> weight negative
1005,1921,"Programs would crash all the time, and it turned out to be a very unstable, unreliable laptop for me.",Programs negative
1366,2949,It discharges too quickly.,discharges negative
2410,1401,so in a brief summary i would have to say that i would not recommend dell vostro 1000 to anyone due to it being a down right awful setup so in my opinion you should steer clear of them if you want a decent laptop.,setup negative
1570,1987,"The cover for the DVD drive soon came off, too--a mark of poor construction quality.",cover for the DVD drive negative <sep> construction quality negative
321,2698,I went to Toshiba online help and found some suggestions to fix it.,Toshiba online help positive
2140,945,  Again I sent it back and they replaced the motherboard and some fan inside.,motherboard neutral <sep> fan neutral
2409,2680,"Again, decent comp for the price, and I was in need of one quickly as my other laptop died on me.",price positive
1865,2352,A key contributor that led me to Mac is the art aspect.,art aspect positive
2236,1805,Good for every day computing and web browsing.,web browsing positive <sep> every day computing positive
1375,1430,"I am not much of a computer techie, so I can understand some of the internal problems, though I do have trend micro as an antiviral program.",trend micro neutral <sep> antiviral program neutral
2853,925,You can call HP and they want you to buy more software to fix it.,software neutral
1377,1942,"The computer continued to give me issues and in Late June it completely died again and I tried to call Acer again to get it fixed and they refused to help me, they said my warrenty was up and hung up on me.",warrenty negative
3022,394,"The leather carrying case, keyboard and mouse arrived in two days from Memphis warehouse.",leather carrying case neutral <sep> keyboard neutral <sep> mouse neutral
377,206,The i5 blows my desktop out of the water when it comes to rendering videos.,i5 negative
2535,836,The AC power port becomes loose over time,AC power port negative
1954,2868,True quality at a great price!,quality positive <sep> price positive
972,1418,  Toshiba is aware of the issue but unless the extended warrenty is bought Toshiba will do nothing about it.,extended warrenty negative
1890,2786,The extended warranty for the $4000 and up computers was the only one available for purchase on the drop drown menu.,extended warranty neutral
1772,1598,"I was a little weary at purchasing another 13"" macbook almost 2 years later but t looks like the newer macbooks have gotten its current line of graphics cards in order this time around.",graphics cards positive
2966,617,"No luck, although I waited for hours on the phone-Visited MacHouse, they stated the their call center is down due to too many phonecalls (difficult to believe).",call center negative
2666,1173,(No problem with the ordering or shipping by the way.,shipping positive
34,2587,"One suggestion I do have, is to not bother getting Microsoft office for the mac expecting it will work just like you knew it to on a PC.",Microsoft office for the mac negative
174,2864,I love WIndows 7 which is a vast improvment over Vista.,WIndows 7 positive <sep> Vista negative
2380,1097," I actually had the hard drive replaced twice, the mother board once, the dvd drive twice, then they FINALLY agreed to replace it, (ALL OF THIS IN LESS THAN 1 1/2 YEARS!",hard drive negative <sep> mother board negative <sep> dvd drive negative
2507,2689,"I dislike the weight and size, cubersome.",weight negative <sep> size negative
2269,2970,I did not have to call the support line at all.,support line neutral
2526,2625,The resolution on the screen is almost pure HD.,resolution on the screen positive
766,36,This is the complete opposite to an ergonomic design.,design negative
1071,652,"It was a great laptop, ran great and was really fast.",ran positive
2798,1392,sometimes you will be moving your finger and the pointer will not even move.,pointer negative
891,1906,"  Only a few days after I received the computer back, the screen froze again.",screen negative
212,2335,The keyboard feels good and I type just fine on it.,keyboard positive
1160,1420, Then after paying for it to be examined I was told it was same problem cited on website but I'd have to pay anyways since it was past warrenty.,warrenty negative
2373,1154,"So, after Apple replaced the hard drive I enjoyed another 4 months of my new computer, until it froze this morning--completely.",hard drive neutral
120,900,"Then, within 5 months, the charger crapped out on me.",charger negative
2176,448,Also the display is exceptional!,display positive
2828,2235,also it comes with very useful applications like iphoto that it is the best photo application i have ever had,applications positive <sep> iphoto positive <sep> photo application positive
2835,2455,"The acer one computer that I bought is 17 ince screen and its hard to find lap top bags for it, but I like the big screen on it.",17 ince screen neutral <sep> screen positive
845,2511,"Bigger HD, better graphics card, and a bid HD.",HD positive <sep> HD positive <sep> graphics card positive
1270,2813,Memory is upgradable.,Memory positive
1812,1956,"Actually, I had noticed the one on the sales floor also didn't have sound!",sound negative
2651,828,"  It was loaded with Windows Vista Home Premium--delivered with only 1GB of RAM, and it was a *dog*.",Windows Vista Home Premium neutral <sep> 1GB of RAM negative
2019,2904,"I also love the small, convenient size of my laptop, making it a perfect tool for my academic studies.",size positive
1995,1879,2.The wireless card is low quality.,wireless card negative
1998,2420,They are about the same size keys.,keys neutral
2929,2196,The powerpoint opened seamlessly in the apple and the mac hooked up to the projector so easily it was almost scary.,powerpoint positive
1667,3022,It's still beautiful and has better color reproduction than I could ever expect from a notebook.,color reproduction positive
1827,1447,I loved the netbook (minus the fact that it was windows OS) until this started happening.,windows OS negative
889,2777,Great wifi too.,wifi positive
775,1657,Theres a built in camera with special effects- for video and photography.,built in camera positive
990,39,The much lauded combined touch pad and clicker is a nightmare.,combined touch pad and clicker negative
2048,98,It took several weeks just to get them to acknowledge that I owned the warranty.,warranty negative
1256,1379,"Some problems can be fixed if you purchase new software, but there is no guarentee.",software negative
72,463,Spent 2 hours on phone with HP Technical Support.,HP Technical Support neutral
708,532,All I will say now is that it was over two grand less expensive and so much better quality than my hunk of crap Vaio.,quality positive
337,2696,I would like to have volume buttons rather than the adjustment that is on the front.,volume buttons negative
790,2453,Clear picture on it and everything.,picture positive
1863,508,Just a black screen!,screen negative
2230,2144,the speed is fine.,speed positive
457,1839,The salesman talked us into this computer away from another we were looking at and we have had nothing but problems with software problems and just not happy with it.,software negative
1502,2807,"the headphone and mic jack are in front of touch-pad making the touch-pad hard to use when using headphones/mic, not to mention the laptop was designed for right handed person.",headphone negative <sep> mic jack negative <sep> touch-pad neutral <sep> touch-pad negative <sep> headphones negative <sep> mic negative
680,2626,The switchable graphic card is pretty sweet when you want gaming on the laptop.,switchable graphic card positive <sep> gaming neutral
2810,2731,The first one sent: Touchpad didn't work The second sent: USB didn't work The third sent: Touchpad didn't work The fourth sent: Hasn't arrived yet.,Touchpad negative <sep> USB negative <sep> Touchpad negative
1398,333,"It's graphics aren't bad at all, for the lower end of the MacBook Pro spectrum, easily capable of running StarCraft II and other games with comparable graphics.",graphics positive <sep> graphics neutral
2982,3048,"I had the staff telling me older version did not make the fan noise cause it is a ""different"" computer.",staff negative <sep> fan noise negative
1702,1082,Sony parts reliability and quality of service is recenlty the worst.,service negative
2629,396,"My laptop cost approximately $2,300 and DIED after only 2-years, 10-months and 18-days of use.",cost negative
1057,967,of course my warranty runs out next month.,warranty neutral
1677,2563,Getting the Apple Care plan is a must.,Apple Care plan positive
340,2916,The processor a AMD Semprom at 2.1 ghz is a bummer it does not have the power for HD or heavy computing.,processor negative <sep> computing negative
2961,2595,Keyboard was also very nice and had a solid feel.,Keyboard positive
125,2752,I am using the external speaker- sound is good.,external speaker positive <sep> sound positive
587,1189,Now for the hardware problems.,hardware negative
3007,2380,"previous laptops were pc's, still have them, but the mac osx is a clean and smooth operating system.",mac osx positive <sep> operating system positive
2919,504,When I called Sony the Customer Service was Great.,Customer Service positive
1152,2495,"The flaws are, this computer is not for computer gamers because of the OS X.",OS X negative
2852,543,after much effort and 10 days ASUS replaced itThe WiFi is very weak.,WiFi negative
2527,2173,"With all the programs that came with it, such as iLife and iWork, I was set from the very beginning.",programs neutral <sep> iLife neutral <sep> iWork neutral
2570,2621,"I upgraded it's RAM to 2GB, I am very happy with it.",RAM positive
2320,1744,Supplied software: The software that comes with this machine is greatly welcomed compared to what Windows comes with.,Supplied software neutral <sep> software positive <sep> Windows negative
199,902,"2 months later, the battery went.",battery negative
276,2124,Mostly I love the drag and drop feature.,drag and drop feature positive
295,311,"The display is incredibly bright, much brighter than my PowerBook and very crisp.",display positive
2400,1074,"But, buy this model and just purchase 4GB of RAM (2x2GB for $92 or 1x4GB for $99), and save yourself $100 than the other model with 8GB of RAM.",4GB of RAM neutral <sep> 8GB of RAM neutral
2458,653,It played various games without problems and ran aero smoothly and flawlessly.,games neutral <sep> aero neutral
1452,1128,Keyboard could use some trimming.,Keyboard negative
617,353,"From the build quality to the performance, everything about it has been sub-par from what I would have expected from Apple.",build quality negative <sep> performance negative
2850,2242,The graphics are stunning.,graphics positive
2108,1768,Iphoto is great for adding pictures right to facebook and other social networking sites.,Iphoto positive
618,2290,"I love the dock where I can simply drop a file ontop of a particular program, and the program will simply open that file.",dock positive <sep> program neutral <sep> program positive
