review_id,sentences_ids,sentences_texts,sentences_opinions
0,0,"When we followed the waiter to get back the card, the Manager explained that their machine did work, but someone else's bill was charged on our card (total charge=$140).",waiter neutral <sep> Manager neutral <sep> machine positive <sep> bill negative
0,0,Service was a treat from my French (Canandian)waiter who knows more about wine than anyone waiting on me in NYC in a long time.,wine positive <sep> time neutral
0,0,"We ordered 1/2 bottle of Gruner, 2 appetizers - foie gras and oysters, 2 entrees - steak and diver scallops, and 1 dessert, the pastry chef's favorite a mixture of crushed avocado, salt glazed caramel and lime sorbet (which really tasted like margarita infused guacamole, to try only if you're feeling wd-50 adventurous) for around $100.",appetizers neutral <sep> foie gras and oysters neutral <sep> entrees neutral <sep> scallops neutral <sep> dessert neutral <sep> pastry chef positive
0,0,The party space worked out well for our rehearsal dinner.,party space positive <sep> dinner neutral
0,0,It took the waiter over 30 minutes to get our food because the order was misplaced.,waiter negative <sep> food neutral
0,0,I was shocked by the amount of butter used in the pork and lamb dishes -- the smell of butter was literally wafting off the plate!,smell of butter negative <sep> plate neutral
0,0,The prices did not reflect the quality of the meal.,prices negative <sep> meal neutral
0,0,Stumbled unto this little gem early one saturday afternoon and was thoroughly pleased with the wonderful little backyard.,afternoon neutral <sep> backyard positive
0,0,Still my favorite part of the restaurant and bar adjacent are the drinks.,bar neutral <sep> drinks positive
0,0,The happy hour crowd at the bar was mostly just out of worker blowing off steam.,crowd positive <sep> bar neutral
0,0,"Kid faves include grilled cheese and, quite possibly, the biggest peanut butter and jelly sandwich in New York City.",grilled cheese neutral <sep> peanut butter and jelly sandwich positive
0,0,"For the price you pay, you get good quality and deliciously thin sliced beef.",price neutral <sep> quality positive <sep> beef positive
0,0,"The ambience is stunning and the food is really good, but the portions are RIDICULOUSLY small.",ambience positive <sep> food positive <sep> portions negative
0,0,"THE SERVICE WAS CIVILIZED INFORMATIVE;WE NEVER FELT RUSHED , EVEN THOUGH PATRONS WERE WAITING TO BE SEATED.",SERVICE positive <sep> WAITING neutral
0,0,"A dining beacon in an otherwise residential 4 or 5 block radius, Sorrel pleases on every course--from the cold spicy tomato soup and beet salad starters to the delectable skate, the scallops, or steak tartare, straight through to the strange but tasty melon soup or flan-esque orange-and-caramel custard (so bad with names).",dining neutral <sep> tomato soup positive <sep> beet salad neutral <sep> scallops positive <sep> steak tartare positive <sep> melon soup positive <sep> orange-and-caramel positive
0,0,"However, the cheese fondue had too much wine and not enough cheese, the escargot was too stewy and the salmon was very average.",wine positive <sep> escargot negative
0,0,"i've been here for brunch twice, and the food's not bad -- was getting sick of teddy's and relish every weekend.",brunch neutral <sep> food positive
0,0,"In fact, you can't really say you've arrived in this town until you've scored a table here and made the pilgrimage to east Harlem for luscious pastas and chicken in vinegar and lemon.",table neutral <sep> pastas positive <sep> chicken in vinegar neutral <sep> lemon neutral
0,0,"My sashimi was just ok with very little flavor from the sauces they supposedly put on them and the napolean had something that stuck out in the flavor, not in a good way.",sashimi positive <sep> sauces neutral
0,0,"Place was okay, the food was definitely not worth the money, however the appetizers were good, we had the jumbo shrimp and oysters.",Place positive <sep> food negative <sep> appetizers positive <sep> shrimp neutral <sep> oysters neutral
0,0,"The server was dutiful yet insincere, the brunch drinks above average.",server negative <sep> brunch drinks positive
0,0,The best dish is not listed on their menu - it is a special - the flat pasta with truffle mushroom sauce.,dish positive <sep> menu neutral <sep> flat pasta with truffle mushroom sauce positive
0,0,We actually enjoy eating there earlier for lunch definatly a more relaxed atmosphere.,lunch neutral <sep> atmosphere positive
0,0,"great decor, unfortunately the worst service possible.",decor positive <sep> service possible negative
0,0,"Although almost the entire back room had tables available, the owner made people wait to be seated while dragging waitresses around by the arm and loudly telling them they were doing things wrong.",tables neutral <sep> owner negative <sep> waitresses negative
0,0,"The smell near the bar is unbearable, the food is so so, nothing out of the norm, just very plan.",bar neutral <sep> food negative
0,0,"And the waitstaff has very little knowledge of the food, they served me the wrong dish and no one could identify what it was that they gave me, someone said pork chop, someone said lamb, and then they insisted it should be fine since it was the same price.",waitstaff negative <sep> food neutral <sep> served neutral <sep> dish negative <sep> pork chop negative <sep> lamb negative <sep> price neutral
0,0,"Order a beer and then sit and wait for the steamy, salty soup dumplings that burst with a snap.",beer neutral <sep> soup dumplings negative
0,0,Reasonable prices for Cuban food in the city.,prices positive <sep> Cuban food neutral
0,0,The food ranges from okay to delicious and the service varies from great to poor.,food positive <sep> service neutral
0,0,Although we were seated 35 minutes after our reservation the service from then on was outstanding.,reservation neutral <sep> service positive
0,0,"The Food An ideal meal here starts with lusty, cheese-encrusted onion soup or a salad of frisee and bacon capped with a soft-poached egg.",Food neutral <sep> meal positive <sep> salad of frisee neutral
0,0,I would definitely recommend getting reservations as the wait can be very long.,reservations neutral <sep> wait negative
0,0,"The steak au poivre certainly lives up to its lofty reputation, but it shuoldn't overshadow many of the other delicacies on the menu, such as the crab cakes and the frisee salad.",steak au poivre positive <sep> menu neutral <sep> crab cakes neutral
0,0,"Great place for dinner or late night for a few drinks and something to eat, the kitchen will be open till 3am.",place positive <sep> dinner neutral <sep> drinks neutral
0,0,"After waiting 40 minutes for a table and 30+ for our entrees, our waiter was distracted.",waiting neutral <sep> table neutral <sep> entrees neutral <sep> waiter negative
0,0,Our waiter took our drink orders and never came back!,waiter negative <sep> drink neutral
0,0,"Yellowtail tuna carpaccio, lightly dressed with a hint of mint, sings of summer, and crab salad partnered with sweet-hot mango mustard and greens hits all the right flavor notes.",Yellowtail tuna carpaccio neutral <sep> hint neutral <sep> mint neutral <sep> crab salad partnered with sweet-hot mango mustard neutral <sep> greens neutral <sep> flavor notes positive
0,0,Weekday lunch is less crowded and the staff cheerfully tolerated a 3-year-old.,Weekday lunch neutral <sep> staff positive
0,0,I have been coming here for several years and know that the staff and bartender would be there with my favorite drinks and dishes I like to eat and drink on any given night.,staff neutral <sep> drinks positive <sep> dishes positive
0,0,"For entree selections we had the chicken cacciatore, head on shrimp (in a honey glaze) spectacular, mozzarella en carozza (a little bit on the fishy side due to the anchovies) and the sliced italian meats, sapprosota to die for.",entree neutral <sep> shrimp positive
0,0,Order the jalapeno cheddar potatoes- My meal tasted like mom's homemade cooking!,jalapeno cheddar neutral <sep> meal positive <sep> cooking positive
0,0,It was somewhere between our waiter not knowing what sushi came as part of the tasting platter and the copious amounts of wine that he spilt while trying to pour me a taste that I realized.,waiter negative <sep> sushi neutral <sep> wine neutral
0,0,"I went with a party of 7, we all had drinks, tomato and onion salad, slabs of bacon, all the extras and magnificent steaks.",drinks neutral <sep> tomato and onion salad neutral <sep> slabs of bacon neutral <sep> steaks positive
0,0,"By the end of the meal, we were shaking hands with/hugging our waiter as we stumbled/rolled out the door.",meal neutral <sep> waiter positive
0,0,The $9 glass of wine which the waitress called good was like grape juice with alcohol and no sugar.,glass of wine neutral <sep> waitress negative <sep> grape juice neutral <sep> alcohol neutral <sep> sugar negative
0,0,"I did like the shrimp dish, but I don't know if I'd seek out their cuisine again.",shrimp dish negative <sep> cuisine neutral
0,0,nicely decorated with cool rock and roll photos and after dinner the nightlife tends to pick up.,rock positive <sep> dinner neutral
0,0,"Apparently, the waitress informed us that they change the menu at 5 Ninth every few days, which kind of explains the hit or miss situation.",waitress negative <sep> menu neutral
0,0,"Expect to get average food, a big bill and lots of attitude from the service.",food neutral <sep> bill negative
0,0,"For entrees, the Ground Lamb in Spicy Sauce (can't remember the name on the menu) was perfectly cooked and had just enough kick for the average person.",Ground Lamb in Spicy Sauce positive <sep> menu neutral
0,0,The waiter placed the wrong entree in front of us each time.,waiter neutral <sep> entree negative
0,0,"I must start by stating plainly that I love Jeollado, but it is loud, the service is bad, but the rolls are great and it is the best deal (CHEAP) in town.",service negative <sep> rolls positive
0,0,We have been waiting for months for a 8pm reservation at this very average restaurant.,waiting negative <sep> reservation neutral
0,0,"After admitting that the items on the bill were not in line with the menu, the manager reserved the right to price at her own discretion!",bill neutral <sep> menu neutral <sep> manager negative <sep> price neutral
0,0,"However, the service has SIGNIFICANTLY declined since they expanded into the back room.",service negative <sep> room neutral
0,0,The server was condescending and was unable to provide assistance with menu selections.,server negative <sep> menu selections neutral
0,0,The price was right too--I spent under $30 for my entree and two drinks.,price positive <sep> drinks neutral
0,0,"Don't ask for menu,steak is what you will have,along with great creamed spinach.",steak neutral <sep> spinach positive
0,0,"never had a bad pizza, the staff has always been friendly, if not overly solicitous, and the only downside is the occasional wait on line outside.",pizza positive <sep> staff positive <sep> wait negative
0,0,"Because of the delicate thin crust, take-out pies get soggy in their boxes.",crust positive <sep> take-out pies negative
0,0,Those appetizers only appeared after we complained to the manager.,appetizers neutral <sep> manager negative
0,0,"I had their eggs benedict for brunch, which were the worst in my entire life, I tried removing the hollondaise sauce completely that was how failed it was.",eggs benedict negative <sep> brunch neutral <sep> hollondaise sauce negative
0,0,and salads( try mixed green with mozzarella or chicken).,salads neutral <sep> mixed green with mozzarella positive <sep> chicken positive
0,0,"But if you're looking for a fun time at a place that isnt trying so hard to be the next it place, then just hang at rice to riches instead where they actually value their patrons and dont make you wait.",rice neutral <sep> patrons positive
0,0,The waiter disappeared after dropping off the food so I had no choice but to eat it as is.,waiter negative <sep> food neutral
0,0,The kids really enjoyed their food and the value on the kids menu is good.,food positive <sep> value positive <sep> menu neutral
0,0,"Food took over an hour despite at least two chasers, we had to track the server down to get extra drinks, the manager seemed to try and deliberately mislead us about the reason behind the delay and in the end the food was poor.",server negative <sep> drinks neutral <sep> manager negative
0,0,Went to dinner with some girlfriends on Wednesday at Calico Jacks and had a fun time.,dinner neutral <sep> time positive
0,0,The second time we went the waiter didn't put in our pizza order!,waiter negative <sep> pizza neutral
0,0,"Myself along with every other patron were forced to wait in an overcrowded bar while employees carry chairs and such over our heads to prepare for dinner in the next room, shoulder to shoulder we stood there like cattle waiting to be fed.",bar negative <sep> employees neutral <sep> chairs neutral <sep> dinner neutral <sep> cattle waiting neutral
0,0,The high prices and small portions reflect the hype of a new Battali restaurant as well as the cache that comes with having to make a reservation a week in advance only to wait to be seated.,prices negative <sep> reservation neutral
0,0,I went there for lunch with co-workers and found the service to be prompt and very friendly.,lunch neutral <sep> service positive
0,0,"Although the food what adequate, the service was preposterous.",food positive <sep> service negative
0,0,"My favorite is a dish I've treasured since childhood, linguine with white clam sauce, cooked with pepperoncino.",dish positive <sep> white clam sauce neutral <sep> pepperoncino neutral
0,0,"In the 20 minutes we spent waiting just for a server to take our wine order, the host of this establishment proceeded to let couple after couple walk right in in-front of us because he obviously knew them.",server neutral <sep> wine neutral <sep> host negative
0,0,The food was simple but exploded with flavor and the presentation was as if it was out of a cook book.,food neutral <sep> flavor positive <sep> presentation positive
0,0,"You can't go wrong with this spicy sausage, better than the chicken or beef which would be much better if it were seared rather than limply fried on the skillet.",chicken positive <sep> fried negative
0,0,Plenty of tables avail for no reservation in bar areain case you want to go on an expensive date for not so great food.,tables positive <sep> food negative
0,0,The wait can be long especially during brunch time but worth it.,wait negative <sep> brunch neutral
0,0,We didn't order-the waiter just kept piling the food in front of us.,waiter negative <sep> food neutral
0,0,"Although the place had an actual makeover not long ago, the food or chef needs to be changed.",place neutral <sep> food negative
0,0,"The service was good, but not excellent; however, the waiter was initially huffy with me when my guest was only 5 minutes late, threatening to make me move!",service positive <sep> waiter negative
0,0,"The Scene With its long zinc bar, plush couches and patterned suede walls, the lounge is a swank spot for midtown's cocktail crowd.",Scene positive <sep> bar neutral
0,0,"From the intricately decorated plates to the elaborate sushi dishes, it is everything a Japanese dinner should be.",elaborate sushi dishes neutral <sep> Japanese dinner positive
0,0,Once we were seated our water order was taken promptly but they never came back with a menu.,water order positive <sep> menu negative
0,0,The food is very good for the price.,food positive <sep> price neutral
0,0,"my husband has certain food allergies, and they were 100% accomodating even for the tasting menu which is seven courses for $50 - they even substituted dishes for ones that he couldn't have.",food neutral <sep> menu positive <sep> dishes neutral
0,0,"It is expensice, but the portions are big and include a side, salad, nan and rice along with your main meal!",portions positive <sep> salad neutral <sep> nan neutral <sep> rice neutral
0,0,"It's always exciting to see celebrities hiding in the corner banquettes or behind sunglasses at the bar, but the real draw is the chef's short ribs and the volumous wine list.",bar neutral <sep> chef neutral <sep> ribs positive <sep> volumous wine list positive
0,0,The entire restaurant staff was disappointing to begin with (any waiters over 17 with some knowledge of the menu or wine?,staff negative <sep> waiters negative <sep> menu neutral
0,0,The actors try to draw your attention away from the better stuff that is happening below.,actors neutral <sep> stuff positive
0,0,The waiter returned and said the bartender refused to take my drink back because there was nothing wrong with it and I would have to pay for it.,waiter neutral <sep> bartender negative <sep> drink neutral
0,0,"The atmosphere couldn't be better, and the service was outstanding -- at the time there were only two people working the entire bar, and we still got taken care of like it was a five star restaurant.",atmosphere positive <sep> service positive <sep> bar neutral
0,0,"They might be all business at the counter when you give your order, but their food says I love you.",counter neutral <sep> food positive
0,0,The waitress only stopped at our table to take our order and pick up the check.,waitress negative <sep> table neutral <sep> check neutral
0,0,"The food quality is good, but the prices are not worth it!",food quality positive <sep> prices negative
0,0,"However, we were never served bread with our meals and the restaurant is too crowded.",served bread negative <sep> meals neutral
0,0,"For entrees, my favorites were the coriander and honey pork ribs or the seared scallops, both of which were to die for.",entrees neutral <sep> coriander and honey pork ribs positive
0,0,"I've eaten here a couple times and the food is always good (jerk chix wings, fried chicken, meat loaf, etc) but the service is terrible.",food neutral <sep> fried chicken negative
0,0,We ended up hanging out for a few hours at their bar with a staff that we felt like we've known for years.,bar neutral <sep> staff positive
0,0,"We got seated right away, We got a nice starter from the kitchen, unfortunately the waiter that brought it could not explain what it was, it was delicious though.",starter positive <sep> kitchen neutral <sep> waiter negative
0,0,"He may be a little hard to take, but he knows how to run a kitchen and put together a creative menu.",kitchen neutral <sep> menu positive
0,0,"Although there was a 30 min wait I didn't mind because I was able to sit at the bar and have some drinks while talking to the beautiful, charming hostess there.",bar neutral <sep> drinks neutral <sep> hostess positive
0,0,The staff was knowledgeable about the cuisine and answered my dining questions with professionalism and style.,staff positive <sep> cuisine neutral
0,0,"The Food  Kolonaki serves up everything from a European tuna sandwich (made with tuna, lemon juice, capers, parsley, onions, carrots, olive oil and basil) to scrumptious specialty desserts.","Food positive <sep> tuna, lemon juice neutral <sep> capers neutral <sep> parsley neutral <sep> onions neutral <sep> specialty desserts positive"
0,0,Not ony did our waiter impose on the dessert we were trying to enjoy to take the money -- he didn't even ask us if we wanted change -- nor did he bring us back any!!!,waiter negative <sep> dessert neutral <sep> money neutral
0,0,Get a Big beer to wash it all down and a side of potatoes and garlic bread.,beer positive <sep> garlic bread neutral
0,0,"Get a bottle of wine, and eat what your heart has been desiring because all the things you would love to be on one menu--are!",bottle of wine neutral <sep> menu positive
0,0,"The bar was so crowded there was no point in ordering a drink, and when we were finally seated we got no service at all for 20 minutes.",ordering neutral <sep> drink neutral <sep> service negative
0,0,"But the service, though invariably genial and helpful, can be weirdly haphazard -- waiters disappear mysteriously, only to reemerge just when you've decided their shift must have ended -- possibly an understaffing issue?",service positive <sep> waiters negative
0,0,I was told by the hostess that a specific table would be mine once the customers left and I waited 45 minutes for that to happen.,hostess negative <sep> specific table neutral
0,0,"The bar gets out of control busy due to it's proximity to Fordham University--but the Fordham kids are cool, so it's alright!",bar neutral <sep> Fordham kids positive
0,0,"When we got there, they refused to seat us because our 4th wasn't there yet-even thought there were only two other people there and we assured them we would order some starters and drinks.",seat negative <sep> drinks neutral
0,0,"The host was aloof; my waitress, though sweet, didn't seem to know the food or the menu very well; and the waiter we flagged over to order our wine seemed as if he had never looked at the wine list before.",host negative <sep> waitress positive <sep> menu neutral <sep> waiter negative <sep> wine list neutral
0,0,"The menu looked good, except for offering the Chilean Sea Bass, but the server does not offer up the specials that were written on the board outside.",menu positive <sep> Chilean Sea Bass negative <sep> server negative <sep> specials negative
0,0,The waiter comes over and says You changed the salad and made us throw it out!,waiter positive <sep> salad neutral
0,0,"Not the most adventurous nor exquisite food, but generous portions (at least, on the 3-course prix fixe) that were faultlessly executed, complemented by a varied wine list ranging from that special bottle for a celebratory splurge to excellent choices under $50.",food negative <sep> portions positive <sep> wine list positive <sep> bottle positive
0,0,"Be prepared to sip the finest wines and dine on such splendid flavors as the Torellini Bottega (hand-made tortellini filled with prosciutto, veal and beef in a porcini-butter sauce -- it is to die for!",dine neutral <sep> flavors positive <sep> tortellini filled with prosciutto positive <sep> beef in a porcini-butter sauce positive
0,0,"I had fried chicken of which KFC runs circles around, and the fries were a knock off of poor burger king spuds.",fries neutral <sep> burger negative
0,0,"While service is still ok, the food has been not up to par on my last few visits.",service positive <sep> food negative
0,0,"Although the restaurant was far from crowded (maybe three tables), service was abysmally slow, to the point that we wondered if the server was trying to avoid us.",tables neutral <sep> service negative <sep> server negative
0,0,"Hostess finally brought it, saying if we wanted dessert, we could move to another table.",Hostess negative <sep> dessert neutral
0,0,"He let us be seated, but told the hostess to make sure we didn't get menus until it was our arrival time.",hostess negative <sep> menus neutral
0,0,"There might be a wait for brunch or even for dinner, but the quality of the food is always worth the wait.",brunch neutral <sep> dinner neutral <sep> quality of the food positive
0,0,"The Happy Hour is the best I've ever been too, and the chocolate chip cookies that are passed around throughout dinner are to die for.",chocolate chip cookies positive <sep> dinner neutral
0,0,"Actually she want to eat sushi, but their staff reject to serve it.",sushi neutral <sep> staff negative
0,0,"The manager also refused to remove the drink from the check, suggesting that if we didnt like it, we could simply remove the corn ourselves.",manager negative <sep> drink neutral
0,0,"A reservation did not save us from a wait at the bar, but the food was worth it; a grilled calamari appetizier with mushrooms was delicious as was a mixed seafood pasta main course.",reservation neutral <sep> bar neutral <sep> grilled calamari appetizier with mushrooms positive <sep> mixed seafood pasta main course positive
0,0,Went to dinner on a Friday night and the place was packed and hot.,dinner neutral <sep> place negative
0,0,"we told our waiter to make five selections for each of us, and he decided instead to charge us for each glass separately instead ($80 instead of $20).",waiter negative <sep> glass separately neutral
0,0,"Though the wait may be long because they only have 16 tables it is worth it, and it seems to go by fast after a drink or two at the bar.",wait negative <sep> tables neutral <sep> drink neutral <sep> bar neutral
0,0,"I tried almost everything on the menu, but my fav is the pumkin raviloi, too bad it's only seasonal.",menu neutral <sep> pumkin raviloi positive
0,0,I spent more time looking for a waiter than I did enjoying my meal.,waiter negative <sep> meal positive
0,0,"Among the entrees, choose the stellar mole--deep, thick and chocolatey--blanketing tender chicken or poured over a chicken enchilada rather than the dry arroz con pollo.",entrees neutral <sep> stellar mole positive
0,0,"The salads were like those we were served in Paris, and the Eggs Benedict were out of this world.",salads neutral <sep> Eggs Benedict positive
0,0,Our waiter didn't know the menu or the ingredients.,waiter negative <sep> menu neutral <sep> ingredients neutral
0,0,"When we got there (6 women), we were not even allowed in when a staff member with a bad attitude wearing a suit told us that we absolutely needed a reservation (yes, we've gone from an artsy community to this)!",staff member negative <sep> reservation neutral
0,0,"sam adams on tap, french fries served out of a brown paper bag and a burger cooked perfectly.",tap neutral <sep> french fries served neutral <sep> burger positive
0,0,"In addition to the two rounds of drinks, the bartender and owner were a hoot.",drinks neutral <sep> owner positive
