review_id,sentences_ids,sentences_texts,sentences_opinions
0,0,"we ordered filets, and ny steaks eventhough our waiter kept pushing up to get the porterhouse.",steaks neutral <sep> waiter negative
0,0,I dined in the Main Dining Room which is surrounded by authentic Spanish decorations.,Main Dining Room neutral <sep> decorations positive
0,0,"sort of crouched in a chair, leaning over a table, while someone did that obnoxious karate chop sort of thing on her back for way too long.",chair neutral <sep> table neutral <sep> chop negative
0,0,Even some of the staff that was working that night was served their dinner before my table got our dinner entrees.,staff negative <sep> dinner entrees neutral
0,0,"This is one of my first dining experiences in NYC when I first moved here 10 years ago, and although Hudson Corner is consistently good, it has gone downhill over the years in both food quality and service!",dining experiences neutral <sep> food quality negative <sep> service negative
0,0,"And like all McNally hot spots, it crackles with energy, particularly from the groups who gather to share a bite in the bar.",spots positive <sep> bar neutral
0,0,"After waiting an hour and a half, a delivery man - with heavily bleeding gums - told me not to worry, that my meal had been replaced with fresh food, and that my old order had been RE-SERVED to another customer.",delivery man negative <sep> meal neutral
0,0,"My reservation for 2 was during lunch and it seemed that because I was literally 2 minutes late, the hostess felt the need to seat every party before mine.",reservation neutral <sep> lunch neutral <sep> hostess negative
0,0,Got the check tossed on table 10 minutes after being served and hostess came by to rush us some more.,served neutral <sep> hostess negative
0,0,"Went there a few months ago, and while the food was really good, and I was ready for it to be pricey, the one thing that bothered me was the waiter was standing in a corner watching us eat.",food positive <sep> waiter negative
0,0,"Id say a little better than most Thai Ive eaten, and the menu had an astounding selection, which isnt bad for such a reasonable price.",menu neutral <sep> selection positive <sep> price positive
0,0,"All in all this is a place that attracts people of all races, colors and economic status, as I noticed suited clients as well as hippies, or soiled clothed laborers who stop in for a quick good meal or a business lunch or dinner.",meal positive <sep> business lunch neutral <sep> dinner neutral
0,0,Nice decor poor food poor service.,decor positive <sep> food negative <sep> service negative
0,0,They brought my mother a chicken enchiladas instead of cheese and then it took her 10 minutes to explain what the error was to the waiter and bus boy who then finally had to tell the manager who was also confused and my mother is fluent in Spanish.,cheese neutral <sep> waiter negative <sep> manager negative
0,0,"Even at lunch, when lawyers and publishers flock in to wheel and deal over the justly-popular lunch buffet, the atmosphere remains serene.",justly-popular lunch buffet neutral <sep> atmosphere positive
0,0,"The only thing better than the pizza (if possible), are the meatball and the eggplant parm heros.",pizza neutral <sep> meatball positive <sep> eggplant parm heros positive
0,0,"Also, try to get a seat at the main bar, because I sat at the smaller bar by the entrance and it was getting so crowded with people waiting that it became a bit unpleasant towards to end of the meal.",seat neutral <sep> main bar neutral <sep> waiting negative <sep> meal neutral
0,0,He met me for wine tasting/sampling of food the week before and made sure that the service was on their toes.,food neutral <sep> service positive
0,0,"The collard greens were tasty, but in too much liquid that made it seem more like a soup.",collard greens positive <sep> soup neutral
0,0,"It was a crowded Wednesday night but we were seated near the kitchen right away, talked to all of the staff who were friendly and made the evening special for my date and I.",staff positive <sep> special neutral
0,0,I was back-to-back with the diner at the table behind me and wait staff had to hoist trays over our heads as they squeezed past us again and again.,diner neutral <sep> staff negative <sep> trays negative
0,0,Most laughable moment of night was when waiter offered me a free drink to make up for th 50 minute appetizer wait.,waiter positive <sep> drink neutral
0,0,"Salads vary, but dinner specials (standard diner fare) are usually more than adequate.",Salads negative <sep> dinner specials positive <sep> diner fare positive
0,0,The owner lied to me when i asked where our food was 1 hour after we placed the order - he said oh your friend said you were not ready for it.,owner negative <sep> food neutral
0,0,"However for one appetizer, three entree's, one shared dessert, and two bottles of white, the bill was a cool $100!",appetizer neutral <sep> entree neutral <sep> dessert neutral <sep> white neutral <sep> bill positive
0,0,"My one complaint: Even though we arrived at our reservation time, the host asked us to wait at the bar -- then forgot to seat us (I had to ask).",reservation neutral <sep> host negative <sep> bar neutral
0,0,"Everyone says that their round slice is no good, but the Sicilian is so good that I have never tried the round.",slice negative <sep> Sicilian positive
0,0,"The loud belly dancer with her scarf dragging across my food and table, almost knocked over my water glass.",belly negative <sep> food neutral <sep> glass neutral
0,0,"When one of our party brazenly asked to substitue a flavor of gelato for one of the desserts on the menu, the waiter snobbishly told us that, Mario and the chef don't like to do that.",desserts neutral <sep> menu neutral <sep> waiter negative <sep> chef negative
0,0,"i love this pizza, its not greasy or filled with mounds of cheese, its just fresh tomatoes basil and buffalo mozz.",pizza positive <sep> mounds neutral <sep> tomatoes basil positive
0,0,Staff wouldn't take no for an answer on pitchers of sangria.,Staff negative <sep> sangria neutral
0,0,"The slices are pricey for the neighborhood (and always has been), but the fact that it is always packed attests to the value.",slices positive <sep> neighborhood neutral
0,0,"Now residing in Chicago, the only quality pies are the deep dishes, which I do like.",quality pies neutral <sep> deep dishes positive
0,0,"Succulent, buxom mussels can be had four ways: with classical white wine, tomatoes, luxurious Pernod and cream, or chorizo and white beans.",mussels positive <sep> white wine neutral <sep> tomatoes neutral <sep> Pernod positive
0,0,If you can get a corner table you can see the entire room while eating in elegance.,corner table neutral <sep> room positive
0,0,"Well, what can I say about a restaurant with a takeaway menu completely devoid of sugar, butter, or deep-fried anything?",sugar negative <sep> butter neutral
0,0,My dining partner ordered the turkey burger and declared this also to be the best one ever.,dining neutral <sep> turkey burger positive
0,0,The place was empty with three waiters working and it still took 15 minutes to bring us menus.,place negative <sep> waiters negative <sep> menus neutral
0,0,"A+  was planning a party for my staff, and was treated rudely by another restaurant when trying to add more people to reservation (a simple no would have worked).",staff negative <sep> reservation neutral
0,0,"Once we eventaully got seated (all tables are practically on top of each other), we were hustled through our meal by a waitstaff that clearly knows how quickly they need to turn the table over.",tables neutral <sep> meal neutral <sep> waitstaff positive
0,0,The manager was very thoughtful to have the chef make me a dish not on the menu to my liking.,manager positive <sep> chef neutral
0,0,"Service at the bar was fine, just as you would expect.",Service positive <sep> bar neutral
0,0,"$20/person value included a drink, some bread, and various breakfast selections.",drink neutral <sep> bread neutral <sep> breakfast selections positive
0,0,"The pro's: Good ambience,service The Con's: For the 4 to 5 star price (200 dollars for 2 people which included 2 drinks each, an appetizer, main course, and a hsared dessert), the food and presentation was just average.",ambience positive <sep> service positive <sep> price neutral <sep> drinks neutral <sep> hsared dessert neutral
0,0,"I went with a party of 7, we all had drinks, tomato and onion salad, slabs of bacon, all the extras and magnificent steaks.",drinks neutral <sep> tomato and onion salad neutral <sep> slabs of bacon neutral <sep> steaks positive
0,0,"Went to Public last Saturday, couldn't get a table so the lovely host suggested that my partner and I dine at the bar.",table neutral <sep> host positive <sep> bar neutral
0,0,"Though it might be a wait and the service might leave a little to be desired, anyone that has ever eaten there agrees that the food is worth it.",wait neutral <sep> service negative <sep> food positive
0,0,"I dined there on a Wednesday night, the restaurant was practically empty, and we had to ask our waiter for everything, the menu, more water, the check, etc.",waiter negative <sep> menu neutral <sep> water neutral
0,0,"I love the creative rolls that they have on their menus, and none of them were a disappointment.",rolls negative <sep> menus neutral
0,0,The food choices were a bit unique so if you are a steak and potatos person then this may not be the place for you.,food choices positive <sep> steak neutral
0,0,"My best friend and I went to dinner on Friday, November 8, 2002 and we both enjoyed our meals.",dinner neutral <sep> meals positive
0,0,"Dinner was recently a lamb special - large gristly hunks of lamb slopped on plate, swimming in a pool of watery sauce with chopped asparagus thrown all over plate.",Dinner neutral <sep> sauce with chopped asparagus negative
0,0,I went here with my family for dinner expecting the usual great pizza.,dinner neutral <sep> pizza positive
0,0,Nice ambience and bar while waiting for a table.,ambience positive <sep> bar positive <sep> table neutral
0,0,"My grandmother-in-law had a problem with her meal, and the manager AND chef came over and offered to replace it and/or take it off the check.",meal neutral <sep> manager positive <sep> chef positive
0,0,The place was not crowded for dinner on a Sunday night at 8:30pm.,place positive <sep> dinner neutral
0,0,"I'm sorry, but the prices at Boi are outrageous for this type of cuisine.",prices negative <sep> cuisine neutral
0,0,"The white tablecloths covering closely-packed, old wood tables; waitresses with accents and up-turned noses; warm firelight ambience; boisterous crowds drinking wine -- it's all here.",waitresses neutral <sep> crowds drinking wine positive
0,0,Needless to say I will rather go spend $400 on dinner somewhere else wirh better service.,dinner neutral <sep> service positive
0,0,"Recommend eating at the bar for an intimate, relaxed dinner.",bar neutral <sep> dinner positive
0,0,We wouldn't bother quibbling over the price of a few drinks anyway but I wonder why they would offer if they weren't intending to back it up.,price negative <sep> drinks neutral
0,0,"Last visit, ignored by our waiter, we finally got beers and ordered food.",waiter negative <sep> food neutral
0,0,"Starting off with an excellent carafe of Cotes du rhone suggested by the waiter, we soon ordered a few appetizers like the steak tartare, the escargot and the goat cheese tart.",waiter positive <sep> appetizers neutral <sep> steak tartare neutral <sep> escargot neutral <sep> goat cheese tart neutral
0,0,"And the waitstaff has very little knowledge of the food, they served me the wrong dish and no one could identify what it was that they gave me, someone said pork chop, someone said lamb, and then they insisted it should be fine since it was the same price.",waitstaff negative <sep> food neutral <sep> served neutral <sep> dish negative <sep> pork chop negative <sep> lamb negative <sep> price neutral
0,0,The busboy kept our glasses full; the waiter warmed up to our table at the end of the night by cracking jokes.,glasses neutral <sep> waiter positive
0,0,"Unfortunately, the food along with the unhelpful service doesn't make up for the atmosphere.",food neutral <sep> service negative <sep> atmosphere neutral
0,0,"Unfortunately, that lunch can take a loooooong time as the waiters seem to forget food orders, forget drink orders, and forget to refill water glasses.",lunch neutral <sep> waiters negative <sep> water glasses neutral
0,0,"Maybe it was because we went during the restaurant week lunch special, but the service was not impressive at all and the food was okay, but not great.",lunch neutral <sep> service negative
0,0,"They might be all business at the counter when you give your order, but their food says I love you.",counter neutral <sep> food positive
0,0,The hostess did not verify/review the menu prices with us nor did they inform us of the logistics of the brunch.,hostess negative <sep> brunch neutral
0,0,"They have recently fired their staff and brought in new people who dont even know how to serve a beer, I might add you are on average paying $6.",staff negative <sep> beer neutral
0,0,While the food was good (certainly no Il Mulino) the service was horrendous.,food positive <sep> service negative
0,0,"Being a basil fanitac, the fresh leaves that come on the pizza pie I ordered were a delight.",basil neutral <sep> pizza positive
0,0,"not only did we not get our 'bombay' fries until after the entire meal, but we then had to wait nearly an hour for our inattentive waiter to bring our check, and only after we flagged him down.",meal neutral <sep> waiter negative
0,0,Our agreed favorite is the orrechiete with sausage and chicken (usually the waiters are kind enough to split the dish in half so you get to sample both meats).,orrechiete with sausage and chicken positive <sep> dish neutral
0,0,Our cocktails were ok but at ridiculous dance club prices.,cocktails positive <sep> prices negative
0,0,the bread they served as we sat down had a pastry-like crunch on the outside and still warm.,bread positive <sep> served neutral
0,0,Great from appetizer to dessert including a wonderfully created vegetarian plate that is not on the menu.,appetizer positive <sep> dessert positive <sep> menu neutral
0,0,The prices were very resonable when you don't factor in the cost of beer (which seemed to be on the high side).,prices positive <sep> cost of beer neutral
0,0,"But if you're looking for a fun time at a place that isnt trying so hard to be the next it place, then just hang at rice to riches instead where they actually value their patrons and dont make you wait.",rice neutral <sep> patrons positive
0,0,The staff knows all about the food and the Chef is very visible visiting tables and overseeing the dining room.,staff positive <sep> food neutral <sep> Chef positive
0,0,Expect to stand around for a while before one of the waiters desides that they can be bothered to actually get you to a seat.,waiters negative <sep> seat neutral
0,0,I do not understand how this place can stay in business with its prices and quality of food.,quality negative <sep> food neutral
0,0,"I'll second the recommedation for the Purity--which has much faster, better service at half the price and a whole lot more selection.",Purity positive <sep> price neutral
0,0,"Food is decent but portions so small that after 5 appetizers, 2 sides and three entrees, the three of us left still hungry!",portions negative <sep> appetizers neutral <sep> sides neutral <sep> entrees neutral
0,0,"Long wait for our meal (approx 30 minutes), unusual slow service, waitresses (especially the preety one with black hair) louder thn clients, do not care much for customers.",meal neutral <sep> service negative <sep> waitresses negative
0,0,The waiter just slapped my food down and then never returned until he slapped my check down.,waiter negative <sep> food neutral
0,0,"While the design of the space and the atmosphere is quite enjoyable (with a great view of Union Square), the food has once again proved to be less than favorable and the service mediocre.",space positive <sep> atmosphere positive <sep> food negative <sep> service negative
0,0,"One example, I ordered an appetizer that was not prepared as the menu stated and had to argue with waitress to get it fixed.",appetizer neutral <sep> menu neutral <sep> waitress negative
0,0,"For the high price you would pay (dinner for the two could run $80), you sure do get alot.",price negative <sep> dinner neutral
0,0,"It had not been made fresh at the bar, but kept in the freezer till we ordered, they also forgot our soup, kept us waiting for the frozen sushi for close to an hour.",bar neutral <sep> soup negative <sep> waiting negative <sep> frozen sushi neutral
0,0,"Food was blend and overcooked and the waitress kept on coming over every 10 minutes to ask whether if things were ok, do we want to refill drinks (when my drink was half full!!",Food negative <sep> waitress negative <sep> drinks neutral
0,0,Buffet fare is better than the regular menu and you don't have to deal with the waitstaff.,menu neutral <sep> waitstaff negative
0,0,"Finally, the manager had the audacity to lock the doors, presumably to prevent us from skipping out on the bill, while one of our friends went to an ATM to get cash.",manager negative <sep> doors neutral
0,0,"finally, onto dessert, wherebv the waiter told us he would have to scrape the bottom to give us any ice cream.",dessert neutral <sep> waiter negative <sep> cream neutral
0,0,"i thought the food was great but kind of expensive for that atmosphere, the tables were too close and it was too noisy.",food positive <sep> atmosphere positive <sep> tables negative
0,0,"The wait could be long because of the limited number of seats but it is worth it, especially if you leave your cell phone # with them and go off for a drink at any one fo the excellent bars nearby, like lokie, great lake, etc.",wait negative <sep> drink neutral
0,0,"With only 2 tables occupied in the whole place, the waitress spent her time behind the bar and only came to help us when we got up and asked her to.",tables neutral <sep> waitress negative <sep> bar neutral
0,0,"Nice family place, nice atmosphere, but don't go there for pizza.",family place positive <sep> atmosphere positive <sep> pizza negative
0,0,"The service isn't spectacular and neither is the ambience, but on a lunch hour, all you're looking for is a satisfied stomach.",service negative <sep> ambience negative <sep> lunch neutral
0,0,Obviously we did not get right service and nobody said soory for that and other restaurant guests who came after us got quicker dish than us.,service negative <sep> dish positive
0,0,"Though there are a handful of Japanese a la carte offerings on the menu, the prix fixe is most popular by far.",menu neutral <sep> prix fixe positive
0,0,"But, quickly all would realize that most items on the menu are grease-laden, and the portions are so big that you'd get tired of the flavors before you finish half a plate.",menu neutral <sep> portions positive <sep> flavors negative <sep> plate neutral
0,0,"The combination of fresh tomato sauce, fresh mozz cheese, basil and the dough they make with imported flour, makes this is one of the better pizza's in NY.",basil neutral <sep> dough neutral <sep> flour neutral <sep> pizza positive
0,0,"I highly suggest you make reservations, as wait times can be extremely long.",reservations neutral <sep> wait negative
0,0,"The menu had more selections, price points that fit all our budgets and a new Sushi menu that went over huge with the table.",new Sushi menu positive <sep> table neutral
0,0,(try the Queso Fundido and fire) Upstairs there is a dining room which is decorated with brightly colored mexican theme.,Queso neutral <sep> dining room neutral <sep> theme positive
0,0,"I would recommend this place as a great introduction to someone who has never tried indian food as they give you tiny appetizer like portions of a myriad of items(that they keep bringing you more of), so if you aren't crazy about an item it's not a big deal b/c there are a ton of other dishes to try.",indian food neutral <sep> appetizer negative <sep> portions negative
0,0,"The only thing that I was unhappy about was that one time, the restaurant received a delivery of supplies and the rolled it in through the dining area into the back kitchen, with the deliverymen shouting loud things to each other in chinese.",dining area neutral <sep> back kitchen neutral <sep> deliverymen negative
0,0,"Their seafood is fresh-- have their fried soft-shell crab, or their whole fish with red chiles and basil.",seafood positive <sep> fried soft-shell crab neutral <sep> whole fish with red chiles neutral <sep> basil neutral
0,0,Even the expensive (11-20$) fru-fru drinks lacked flavor and quality ingredients.,drinks negative <sep> flavor negative <sep> ingredients neutral
0,0,"Small dishes, a bit pricier than you'd pay in Miami or LA, but the atomsphere is on the sexy side (however pared down) and its cozy.",dishes negative <sep> Miami neutral
0,0,"the rest of my table disliked their food, and also had to send drinks back because it was not what they ordered.",food negative <sep> drinks neutral
0,0,"They brought us one teacup sized bowl of chips for the 4 of us, which disappeared within minutes, and didn't replenish our chips until an hour later--after we finally got our food and after we asked them for some more chips 2 TIMES!",bowl of chips negative <sep> food neutral
0,0,"If you go in, make sure to listen to the unbelievably loud microphone that the folks at the counter use to dictate orders to the cooks who stand about two feet behind them.",counter neutral <sep> cooks negative
0,0,"our waitress couldn't explain or describe the specials to us, and a group of five people seemed to overwhelm her.",waitress negative <sep> specials neutral
0,0,"The simple corn tamale comes with a mild homemade sour cream, and the inexpensive enchiladas, prepared with expertly spiced strips of beef, could easily serve as an entree.",corn tamale positive <sep> homemade sour cream positive <sep> spiced strips positive <sep> entree neutral
0,0,employees not fighting with each other in front of clients 3 having ALL the ingredients for the meals they have on there menue.,employees negative <sep> ingredients neutral
0,0,"They have samosas, chicken tikka masala, and a lot of other dishes you can think of.",chicken tikka masala neutral <sep> dishes positive
0,0,Suprising was the cheese selections that were sort of dessert as well.,cheese selections positive <sep> dessert neutral
0,0,really bad service took half an hour just to get a drink.,service negative <sep> drink neutral
0,0,"the food isn't spectacular, but I have yet to be disappointed in anything I've been served, and there's a definite attempt by the kitchen to keep the menu fresh and interesting.",food negative <sep> kitchen neutral <sep> menu positive
0,0,Unfortunately the food and the service don't live up to the spectacular setting.,food negative <sep> setting positive
0,0,"the kimchi and other sides were off, the rice had red bean mixed in, and the waitress gave us a double order of the bulgogi instead of two single orders of different meats.",rice neutral <sep> waitress negative <sep> meats neutral
0,0,"This place is pricey, and yes, the food is worth it; but the service makes you feel like you should be paying a quater of the price.",food positive <sep> service negative
0,0,"The portions were very big for appetizers (calimari and fried zucchini) but average for the entrees (chicken marsala, spaghetti w/ meatballs) and very expensive of course.",portions positive <sep> appetizers neutral <sep> calimari and fried zucchini neutral <sep> chicken marsala neutral <sep> spaghetti w/ meatballs neutral
0,0,Were told we could not share one menu and called over the horrible manager.,menu neutral <sep> manager negative
0,0,"when tables opened up, the manager sat another party before us.",tables neutral <sep> manager negative
0,0,"The food is just ok, not at all worth having to put up with the disgusting staff, the manager/owner in particular.",food positive <sep> staff negative
0,0,"Their new style of all you can eat is: They bring barely enough food for the table, mostly just bread ,until you ask a waiter to bring some more.",food neutral <sep> waiter negative
0,0,"In my opinion, the bar is not very well laid out, its narrow design makes it hard to meet a group for drinks.",bar neutral <sep> design negative <sep> drinks neutral
0,0,"A cocky, arrogant and shockingly condescending manager (all of 22 years-old) then told us we should leave the restaurant if we wouldn't move to the bar.",manager negative <sep> bar neutral
0,0,"since it is kinda small less than 20 tables, but room downstairs for private parties.",tables negative <sep> downstairs neutral
0,0,There was no price on the menu and the waitress recommended it.,price neutral <sep> menu neutral <sep> waitress positive
0,0,"AND, the waitstaff likes to lick its fingers when cutting cakes/pies and serves hot and cold drinks by holding the glass or cup around the brim/top.",waitstaff negative <sep> drinks neutral <sep> glass neutral
0,0,Even though the place was more than half empty he refused to do so because we had already given our order to the waiter and a change of tables would cause too much confusion.,place negative <sep> waiter neutral <sep> change negative <sep> tables negative
0,0,"The wine list is short and the wine glasses suck (not spigleau or riedel, in addition they are small for the big italian wines on the menu).",wine list negative <sep> italian wines positive <sep> menu neutral
0,0,"The sauce was fresh, sweet, and had a bit of a garlic kick.",sauce positive <sep> garlic kick neutral
