review_id,sentences_ids,sentences_texts,sentences_opinions
0,0,"The service, which was horrendous - they charged us for two appetizers when we asked to split one (when we brought it up, he insisted that the appetizer really did only consist of 2 sliced tomatoes and 1 slice of cheese).",service negative <sep> appetizers neutral <sep> slice of cheese neutral
0,0,"Got 2 apps that were delicious and the bartender made some strong drinks, he could have at least smiled said my girl, but his service was great with our orders.",bartender positive <sep> drinks positive <sep> service positive <sep> orders neutral
0,0,Meat wasn't fall-off-the bone (a sign of over-cooking) but was tender and had deep flavor.,Meat negative <sep> flavor positive
0,0,"However, you don't even really need the menu, because the daily specials are always tempting and delicious.",menu neutral <sep> daily specials positive
0,0,"Went with three people last saturday night - half way through our entrees we tried to order a second bottle of wine - both the hostess and waitress told us no, cause, ehh, the place is very crowded this night guys.",entrees neutral <sep> bottle of wine neutral <sep> hostess negative <sep> waitress negative <sep> place negative
0,0,"Choices are standard and plentiful: omelettes and egg dishes, pancakes, bagels, muffins, croissants, mini-doughnuts, cookies, etc.",Choices positive <sep> egg dishes neutral <sep> pancakes neutral <sep> muffins neutral
0,0,"the first was dinner opening week some time ago - not a good piece of sushi to be had, the robata was so so and nothing was remotely memorable.",dinner neutral <sep> sushi negative <sep> robata negative
0,0,"I went there for lunch with my mom, it was just excellent, the sole and cremed spinach dish I had was divine.",lunch neutral <sep> sole positive <sep> spinach dish positive
0,0,"Try the stir fried cube steak, shabu sahbu, or the Oden, or anything else you want to try on the menu.",stir fried cube steak positive <sep> menu neutral
0,0,If you are looking for service and all the frills $$$ - Il Mulino is the best for both - if you are looking for a fabulous dinner in/out - this restaurant is it!,service neutral <sep> dinner in/out positive
0,0,"We waited 30 minutes to be seated, 40 minutes for water, bread, menus, 30 more for wine and soft drinks and when the food finally arrived an hour later, it was inedible, burned on top from sitting under a heat lamp.",water neutral <sep> bread neutral <sep> menus neutral <sep> wine neutral <sep> drinks positive
0,0,"the wait for our drinks, appetizers and food was very long, the food was mediocre, and it was a bit pricey.",wait negative <sep> drinks neutral <sep> appetizers neutral <sep> food negative
0,0,The Scene The windowed bar and front waiting area seems bright and airy compared to the somewhat stuffy main room.,Scene neutral <sep> windowed bar positive <sep> front waiting area positive
0,0,Our server never bothered to inquire as to whether or not we wanted coffee.,server negative <sep> coffee neutral
0,0,After the rude waitress took our order we were sipping our drinks when the manager comes over and says we have to leave as the tables are reserved for dinner patrons.,waitress negative <sep> drinks neutral <sep> manager negative
0,0,"When I really need good pizza I fly in From Arizona for a few pies, go to friends house , freeze them and fly home.",pizza positive <sep> pies neutral
0,0,"If you consider throwing food at your when they remember good service, then go for it.",food neutral <sep> service positive
0,0,"Generally, the food was fine, but the table is too small to eat comfortably.",food positive <sep> table negative
0,0,"After stopping by on a whim a few months ago, I was so extremely impressed by the fresh Sushi and quality service that I now go there quite often for lunch as well as the occasional take-out dinner.",Sushi positive <sep> service positive <sep> lunch neutral
0,0,"On top of it all, I was with family from out of town and the only reason I took them there was because a friend had mentioned the place and Coffee Shop had a little wait.",place neutral <sep> Coffee neutral <sep> wait positive
0,0,"Also excellent is the okonomiyaki, a tangy cabbage, pork and shrimp frittata topped with bonito flakes and a dollop of mayonnaise.",cabbage positive <sep> pork positive <sep> shrimp frittata topped neutral <sep> mayonnaise neutral
0,0,Didn't get a call so I thought all was ok-they didn't have a reservation and wouldn't seat us for over an hour even though no one else was waiting and I saw several empty tables.,reservation neutral <sep> tables negative
0,0,"I work nearby so I've eaten here countless times (breakfast, lunch, dinner, even Sunday brunch), and been to several really cool parties--the food's delicious, and the setting is spectacular.",brunch neutral <sep> food positive <sep> setting positive
0,0,"i always get the apple pie, but the past two times i visited, the waiter burnt the pie while he was supposed to warm it up.",apple pie neutral <sep> waiter negative
0,0,"The atmosphere of the place is nice as well as the location, but I found food mediocre and too expensive for the quality offered.",atmosphere positive <sep> place neutral <sep> food negative
0,0,"It took an hour for us to order, another hour and 15 min to get our entree's I had to go to the bar to order my champange, and carry it back myself, the waiter got our entrees mixed up and placed them in the wrong place and sat there and watched me switch them around.",bar neutral <sep> waiter negative <sep> entree's neutral
0,0,"All in all, I would not recommend for the food or drinks but I guess I can't expect better for the prices.",drinks negative <sep> prices neutral
0,0,The waitstaff told us that they had already run out of one of the entrees (before 8 p.,waitstaff negative <sep> entrees neutral
0,0,The free champaign and desserts do not really help me to even consider going back.,champaign positive <sep> desserts negative
0,0,"Amarin's food is always fresh, although the quality does vary--avoid ordering on Friday Saturday nights, prime dining hours, when they seem to throw things togehter a little too haphazardly.",food positive <sep> quality negative
0,0,My friend was looking forward to her favorite dish on the menu had made reservations for the 14 of us a few weeks beforehand.,dish positive <sep> menu neutral
0,0,The manager came over to our table at the end of our entree course to get our review.,manager positive <sep> entree neutral
0,0,"But the appetizer is a litlle pricey, especialy $6 for 3 pieces sushi, but iutside that it was a great experience, food was great, and not too costly over all.",sushi neutral <sep> food positive
0,0,"The Scene With three outposts around town, Sarabeth's Kitchen has become a well-known and reliable spot for casual dining at breakfast, lunch or dinner.",Scene neutral <sep> Kitchen neutral <sep> spot positive <sep> dining neutral <sep> breakfast neutral <sep> lunch neutral <sep> dinner neutral
0,0,"Our reservation was for 9, didn't get seated until 9:20 with no acknowledgment by the staff of the delay.",reservation neutral <sep> staff negative
0,0,The waitstaff is helpful and they'll get your favorite meats to circle your table more often if you just ask.,waitstaff positive <sep> meats positive <sep> table neutral
0,0,"The food was good but our waiters were pushy,rude and dumb.",food positive <sep> waiters negative
0,0,A great place to eat or just hang out at the bar.,place positive <sep> bar neutral
0,0,"Though the menu includes some unorthodox offerings (a peanut butter roll, for instance), the classics are pure and great--we've never had better sushi anywhere, including Japan.",menu neutral <sep> peanut butter roll negative <sep> classics positive <sep> sushi positive
0,0,"first of all, the hostess was not pleasant and had a bit of an attitude when seating us.",hostess negative <sep> seating neutral
0,0,bartenders management and at first were a bit disappointed with food.,bartenders management neutral <sep> food negative
0,0,"The food OK (DRY fried chicken, overcooked pork, great mac and cheese) I dont understand the high rating.",fried chicken negative <sep> pork negative <sep> mac and cheese positive
0,0,"when the wine is the best thing at dinner, its not a good thing.",wine positive <sep> dinner neutral
0,0,Food - The cheese plate contained flavored spreads instead of decent chesses.,Food neutral <sep> cheese positive
0,0,Our server seemed to be new because he continually had to go back to the kitchen to check on menu items.,server negative <sep> menu neutral
0,0,"We had to call him over 3 times during the meal because he gave us the wrong food, did not bring water after we asked twice, gave me the wrong drink, and did not check on us once.",meal neutral <sep> food negative <sep> drink negative
0,0,"The food is mediocre, burgers are ok, the pizza tastes like the box it's delivered in.",burgers positive <sep> pizza negative
0,0,"From soups (love the pumpkin corn bisque), to sandwiches (gilled cheese is my favorite), to the hot food that's mostly asian influenced, and salads that even include seared tuna, there's something for everyone.",pumpkin corn bisque positive <sep> sandwiches neutral <sep> hot food neutral <sep> salads neutral <sep> tuna positive
0,0,"Besides the price, here are some other annoyances: bleaching the floors during the dinner and automatically charging you 20% gratuity on your credit card without your knowledge.",price negative <sep> dinner neutral
0,0,One of my favorite places to get a cup of tea or to have a casual brunch with the newspaper.,cup of tea neutral <sep> brunch neutral <sep> places positive
0,0,We saw the waitress twice - once to tell us the night's specials and once to take our order.,waitress negative <sep> specials neutral
0,0,Their food is delicious and they send you cut up oranges to cleanse your palate after dinner which is a very nice touch.,food positive <sep> dinner neutral
0,0,The owner promised my party a table and bottle service and took care of it immediately as we all arrived.,owner positive <sep> table neutral
0,0,"The waiter took my boyfriend's order, snatched away the menus and stormed away from the table without even looking at me.",waiter negative <sep> menus neutral
0,0,Extremely RUDE servers who intially took our order and never returned with drinks or to see if we required anythign else.,servers negative <sep> drinks neutral
0,0,"Service is coddling and correct and there's no sense of hurry, so diners linger over a cheese course or a round of liqueurs.",Service positive <sep> cheese neutral
0,0,They make pizza the way you should with lots of sauce.,pizza neutral <sep> sauce positive
0,0,"Sit at the bar (no reservations necessary), eat, talk to the bartender, and enjoy, b/c come dinnertime you will pay quadruple the price (but it's still worth it).",reservations neutral <sep> price negative
0,0,"The service was very rushed and as we were finishing our drinks and paying our bill, the owner asked us to leave so he could seat other people at our table.",service negative <sep> drinks neutral <sep> owner negative
0,0,"It's called OYSTER BAR, and yet no oyster selection at all!",OYSTER BAR neutral <sep> oyster selection negative
0,0,"In Short The few window-front tables fill quickly, but most customers prefer not to linger in the nondescript space, in favor of taking their Thai food to go, or phoning in for delivery.",window-front tables neutral <sep> space negative
0,0,"Though there are a handful of Japanese a la carte offerings on the menu, the prix fixe is most popular by far.",menu neutral <sep> prix fixe positive
0,0,When I went back to the hostess (yes it was past the time we had for our original reservation) - she said that it was fine to get seated but we needed to leave in an hour.,hostess negative <sep> reservation neutral
0,0,Don't go if you want a serene environment to go with your sushi.,environment positive <sep> sushi neutral
0,0,"After ordering a couple beers from the pleasant bartender, my date and I took a seat at one of MANY vacant tables next to the bar (The bar stools were full).",bartender positive <sep> seat neutral <sep> bar stools negative
0,0,"We asked for our check (to pay for our drinks and leave), and received the quickest service all evening.",drinks neutral <sep> service positive
0,0,"The staff is constantly disappearing from the restaurant, making it impossible to get drink refills or to get the check.",staff negative <sep> drink neutral
0,0,"The host was aloof; my waitress, though sweet, didn't seem to know the food or the menu very well; and the waiter we flagged over to order our wine seemed as if he had never looked at the wine list before.",host negative <sep> waitress positive <sep> menu neutral <sep> waiter negative <sep> wine list neutral
0,0,"Cheeses get short shrift by waitstaff, who all seem hurried.",Cheese neutral <sep> waitstaff negative
0,0,"It's a place for the owner staff's friends, so if you're not one of them, you're in for a wait.",owner staff negative <sep> wait neutral
0,0,"I don't think the menu is particularly creative, but I've gotten solidly tasty sushi here and it's always enormous.",menu negative <sep> sushi positive
0,0,"Ok, so the service can be a little spotty, but despite this Cafe Con Leche has good food, and decent prices.",service negative <sep> Cafe neutral <sep> food positive <sep> prices positive
0,0,"To finish, the cost of the dinner was over-priced.",cost negative <sep> dinner neutral
0,0,"* Rude waiter - he kept pushing us to get appetizer (after been told twice that we would like to start ordering entree) and after dinner, told us to check out the shelf ourselves on our way to the restroom for dessert menu.",waiter negative <sep> appetizer neutral <sep> entree neutral <sep> dinner neutral
0,0,"Our server was a delight, she helped guide us through the menu with honest insight.",server positive <sep> menu neutral
0,0,"Yellowtail tuna carpaccio, lightly dressed with a hint of mint, sings of summer, and crab salad partnered with sweet-hot mango mustard and greens hits all the right flavor notes.",Yellowtail tuna carpaccio neutral <sep> hint neutral <sep> mint neutral <sep> crab salad partnered with sweet-hot mango mustard neutral <sep> greens neutral <sep> flavor notes positive
0,0,"Our waitress (and the chef himself) helped us a bit with the Austrian cuisine where we had questions, and every recommendation was right on.",waitress positive <sep> chef positive <sep> Austrian cuisine neutral
0,0,"However for one appetizer, three entree's, one shared dessert, and two bottles of white, the bill was a cool $100!",appetizer neutral <sep> entree neutral <sep> dessert neutral <sep> white neutral <sep> bill positive
0,0,"The calamari, the penne and vodka sauce, the friendly service the parking and the open area kitchen to see all the action in the making!",calamari neutral <sep> penne and vodka sauce neutral <sep> service positive <sep> open area kitchen neutral
0,0,We went there on New Year's Day around 7 pm without a reservation and were able to get a table right away thanks to the very accomodating hostess.,reservation neutral <sep> hostess positive
0,0,When asked to explain the hostess told us she would lose money by seating us instead of them.,hostess negative <sep> seating neutral
0,0,"You can't go wrong with this spicy sausage, better than the chicken or beef which would be much better if it were seared rather than limply fried on the skillet.",chicken positive <sep> fried negative
0,0,The service on our visit was absolutely awful - a waiter and two helpers couldn't get our orders right and ignored several pleas for basics such as water and beverage refills and utensils to eat desserts with.,service negative <sep> waiter negative <sep> water neutral
0,0,"The other food they serve is also very good, but the pizza keeps calling me back!",food positive <sep> serve neutral <sep> pizza positive
0,0,"Wether you want a Regular Slice, their DELICIOUS marinara sicilian, or one of their specialty pizzas like Chicken Parm, Ravioli, or Taco pizza once you eat a Rosas Pizza you will never go anywhere else.",marinara sicilian positive <sep> specialty pizzas positive <sep> Chicken Parm neutral <sep> Ravioli neutral <sep> Rosas Pizza positive
0,0,We got up from the bar and got pushy with the hostess and finally were seated at an excellent table.,bar neutral <sep> hostess positive
0,0,"But once we spoke up (and they figured out what happened with the menus) they re-did the dish in a butter sage sauce, which was awesome.",menus neutral <sep> a butter sage sauce positive
0,0,After I have my dinner I try to talk to the manager and let him know that he had very good workers and that he should be more considerate with them and the answer that I got from him was (THey can leave I don't care).,dinner neutral <sep> manager positive <sep> workers positive
0,0,"Yes the wait is dreafully long, the place feels a bit uncomfortable to talk in with your dining partner, but the food is excellent none the less.",wait negative <sep> dining neutral <sep> food positive
0,0,The Scene Bo Ky is a Vietnamese no-frills noodle shop with some 30 different soups.,noodle neutral <sep> soups positive
0,0,"since it is kinda small less than 20 tables, but room downstairs for private parties.",tables negative <sep> downstairs neutral
0,0,I went there for lunch with co-workers and found the service to be prompt and very friendly.,lunch neutral <sep> service positive
0,0,"Always try one of the daily specials, in addition to all the tasty morsels on the menu.",daily specials positive <sep> menu neutral
0,0,"huuge portions, which made it much easier paying the $350 bill.",portions positive <sep> bill neutral
0,0,"The food and decor is above average, but it is clear the restaurant has bad management and service.",food positive <sep> decor positive <sep> management negative <sep> service negative
0,0,"The service and surroundings couldn't have been better, but the food was very disapointing at best.",surroundings positive <sep> food negative
0,0,We sat in the tables in front of the bar and it was a good people watching spot.,bar neutral <sep> spot positive
0,0,"The kitchen finds success with classics like a homemade, cognac-rich duck terrine and well-seasoned steak frites (although the fries tend to be heavily salted).",kitchen positive <sep> cognac-rich duck terrine neutral <sep> well-seasoned steak frites neutral <sep> fries negative
0,0,Amazing views of NYC regaled us at lunch earlier in the week and then at dinner this evening.,views positive <sep> dinner neutral
0,0,"Granted, it's loud and sometimes obnoxious and it's such a pain to get seats for, but the the food is great.",seats negative <sep> food positive
0,0,The food came cold and a sauce that came with one of the dishes had developed a skin.,food negative <sep> sauce negative <sep> dishes neutral
0,0,"Corner Bistro, despite the hoopla and critical praise, is nothing more than a burger joint with long lines.",burger neutral <sep> lines negative
0,0,"i would not go after the early bird b/c its not worth it, find better food for full prices.",food positive <sep> prices negative
0,0,"In other words, conserative types craving simpler things like grilled chicken or salmon probably would not appreciate Tabla's distinctive and unusual menu.",salmon neutral <sep> menu negative
0,0,"Our last experience: Waiting for a table at the bar (we always make reservations), the bartender ignored us until my husband intervened with one of the owners.",table neutral <sep> reservations neutral <sep> owners negative
0,0,"The coffee by the name of the place is delicious and although the space is a bit tight, it's a great place to chat, chill or simply enjoy a great cup of joe.",coffee positive <sep> space negative <sep> cup positive <sep> joe positive
0,0,"The waiter made no effort to remember who had orderd what (just threw it on the table and bailed), or even who ordered (I had to flag him so my wife could order her main dish 15 min after he had taken orders from others).",waiter negative <sep> dish neutral
0,0,"The baked penne came out in a small bowl, burnt with barley any sauce for $18.",baked neutral <sep> sauce negative
0,0,"We got the cold appetizer sampler and the dish was FULL of food, all for $12.",dish neutral <sep> food positive
0,0,I didn't realize how good the food was until I went for dinner the other night.,food positive <sep> dinner neutral
0,0,"The atmosphere is fun -- dark, pulsing, basement room; a place where you feel like you can relax.",atmosphere positive <sep> room neutral
0,0,"My husband and I sat at the bar, and service was excellent.",bar neutral <sep> service positive
0,0,"Our server paid little attention to refilling our drinks, the runners brought the entrees out less than 1 minute after the appetizer, the server delivered another table's bill to us before we had even had entrees, and my partner's entree has a very noticable hair on his plate.",drinks neutral <sep> runners positive <sep> appetizer neutral <sep> table neutral <sep> bill neutral
0,0,"The meal arrived just as we were finishing the appetizers, each good portions.",appetizers neutral <sep> portions positive
0,0,"Chef Richard is always eager to please, and will be happy make something special 'off the menu' if you ask.",Chef positive <sep> menu neutral
0,0,"For breakfast, thick, fluffy brioche French toast, served with maple butter and fresh berries, excels; likewise, a clever sandwich of scrambled eggs and tomato jam in a light, salty buttermilk biscuit.",breakfast neutral <sep> brioche French toast positive <sep> sandwich of scrambled eggs and tomato jam positive <sep> biscuit negative
0,0,"Didn't have room for dessert, but will definitely be back to try the coconut mousse.",dessert neutral <sep> coconut mousse positive
0,0,Though the service is speedy be prepared to wait at least 20 minutes for the soup dumplings.,service positive <sep> soup dumplings negative
0,0,"After arriving for a pre-theatre reservation to find the kitchen closed due to a mechanical failure, the problem was fixed an hour later (after many drinks at the bar, none of which management offered as a concession to the wait) and we were served a very good dinner in time to make the play.",bar neutral <sep> management negative <sep> wait neutral <sep> served neutral <sep> dinner positive
0,0,"Please, please don't waste your money (85 cents for a slice of tomato on your overpriced sandwich.",slice of tomato neutral <sep> sandwich negative
0,0,"The menu features mild versions of Lone Star state favorites, from double-basted baby back ribs and steak fajitas to red-beef chili and deep-fried onions.",menu neutral <sep> baby back ribs positive <sep> red-beef chili positive <sep> deep-fried onions positive
0,0,"The food at Parish was tasy and well-prepared, but the portions were absurdly miniscule, especially in proportion to the prices.",food positive <sep> portions negative <sep> prices negative
0,0,"Even as a stranger, the service at the bar was excellent as was the wait staff who continuously checked back to see if I was okay while waiting for my party.",service positive <sep> bar neutral <sep> wait staff positive <sep> waiting neutral
0,0,"not large portions - my boyfriend's entree looked more like an appetizer, and all we got out of the dinner was a $100 tab and hunger for more food.",portions negative <sep> entree neutral <sep> appetizer neutral <sep> dinner neutral <sep> food neutral
0,0,The food was phenomenal- brought me back to Tuscany with that olive oil.,food positive <sep> olive oil neutral
0,0,The table next to us recommended that share because the portions are big(we split two entrees)The food was so good I wish that there was some left over to take home for the next day.,portions positive <sep> entrees neutral
0,0,I saw a waitress yell at 2 customers for moving a table out a little bit in order to have more seating space.,waitress negative <sep> space neutral
0,0,I will say that often times they make their drinks very strong (may tell your bartender / waitress to keep it mild).,drinks negative <sep> bartender neutral <sep> waitress neutral
0,0,"Overall, reasonable food for price for Pre-fixe dinner (got salad, entree and dessert for 20 dollars a person).",food positive <sep> price positive <sep> Pre-fixe dinner neutral <sep> salad neutral <sep> dessert neutral
0,0,"From having an appetizer, a glass of wine and reading a magazine to sitting by a table to work on my grades, to meeting other fellow teachers for a book club to partying with the owners all my experiences at Futura have always been extremely postive!",appetizer neutral <sep> glass of wine neutral <sep> table neutral <sep> owners positive
0,0,"When my family and I visited, we were hearded in and out of the restaurant like cattle; not once did our waiter ask how are meal was, and the waitress mixed up our steaks.",meal neutral <sep> waitress negative
0,0,"Forget what it was called, but it had some kind of onion puree on top that ROCKED and the steak was a grass-fed organic type and very tender.",onion puree neutral <sep> steak positive
0,0,Dominic will give you the ambience of the old times when they were all immigrants and good food was equivalent of good friends and unforgettable times.,ambience neutral <sep> food positive
0,0,The only drawback is the need for reservations around the typical pre-theatre times.,reservations neutral <sep> times positive
0,0,"the manager will be very defensive and tell you the chef, his brother, has not changed in 4 years.",manager negative <sep> chef neutral
0,0,"I guess Mars 2112 keeps the food bland for the family fare, but it only serves to detract from its overall experience.",food negative <sep> family fare neutral
