review_id,sentences_ids,sentences_texts,sentences_opinions
0,0,"Three course meal for lunch was $13, the prices for dinner were just as great!",course meal neutral <sep> lunch neutral <sep> prices positive <sep> dinner neutral
0,0,Then another pleasant surprise - the menu said we had to share the entree for each couple.,menu neutral <sep> entree neutral <sep> surprise positive
0,0,The wait for brunch is kinda long (what can you say?,wait negative <sep> brunch neutral
0,0,"The dinner special is amazing, although I would pick the meat option rather than seafood.",dinner special positive <sep> meat positive <sep> seafood negative
0,0,"The manager also refused to remove the drink from the check, suggesting that if we didnt like it, we could simply remove the corn ourselves.",manager negative <sep> drink neutral
0,0,"The food, service, and atmosphere are all pretty good, but a little pricy, coming to about 40$ a person if you order 1 drink and 1 appetizer each.",food positive <sep> service positive <sep> atmosphere positive <sep> drink neutral <sep> appetizer each neutral
0,0,"I don't claim to know enough about authentic Italian cuisine but the food is good, provided they have the menu item you order.",Italian cuisine positive <sep> food positive <sep> menu neutral
0,0,"I sat at the bar to receive faster service, and boy was i wrong!",bar neutral <sep> service positive
0,0,"Fajitas, a house specialty, are available with nearly a dozen different fillings, from mesquite-grilled chicken to portobello mushrooms and asparagus.",fillings positive <sep> chicken to portobello mushrooms neutral <sep> asparagus neutral
0,0,"And after we ordered our food, their wine guy suggested the wine that he thought would go best with our selections, and it was surprisingly not a high-priced bottle.",food neutral <sep> bottle positive
0,0,"I haven't eat a lamb chop as delicious as that,the salads are really nice dressed with lemon and extra virgnin olive oil.",lamb chop positive <sep> salads positive <sep> lemon neutral <sep> extra virgnin olive oil neutral
0,0,"For instance, the Spicy Potatoes were merly home fries with Red Hot sauce on them.",Spicy Potatoes positive <sep> fries with Red Hot sauce neutral
0,0,I waited for 45 minutes for my entree to realize that the waiter never put the order in.,entree neutral <sep> waiter negative
0,0,"I have to agree with the previous review that the atmosphere isn't much, but Mister Falafel can't be beat for quick, delicious, cheap takeout.",atmosphere negative <sep> Falafel positive
0,0,"There are decent selections if you are a seafood person, but not a lot if you aren't!",selections negative <sep> seafood neutral
0,0,"After a short wait at the bar (which was very crowded), we were seated upstairs at a private table.",wait neutral <sep> bar negative
0,0,"The portion size / price combo makes it expensive if you're really hungry, but we went for a late dinner.",portion size / price combo negative <sep> dinner neutral
0,0,My friend ordered the scallops which were served in a light red sauce that was complemented very nicely with atichoke palms.,served neutral <sep> light red sauce neutral <sep> palms positive
0,0,"The downside is that perhaps due to rice's eclectic nature, the chef has trouble cooking any single type to perfection.",rice neutral <sep> chef negative
0,0,I have seen the crowd go from ultra hip to BT and I still love it becuause of the food.,crowd neutral <sep> food positive
0,0,This set off our critical eye: ceramic bowls having edges higher than the table votives hid the fact that the food was presented cafeteria-style; a rolling-eyed waiter pushing water; the awkward Italian menue gimmick; and the bill.,table neutral <sep> food negative <sep> waiter negative <sep> bill neutral
0,0,a red curry shrimp dish where the only thing on the plate that's tasty is the rice?,red curry shrimp dish neutral <sep> rice positive
0,0,"I am not good with using chopsticks and asked for a fork, instead the owner insisted that I try using a chopstick an made me an easy-to-use chop stick right there on the spot!",chopsticks neutral <sep> owner positive
0,0,"With one drink each, apps, entrees, and three desserts (nothing great) the bill came to $200 for four.",drink negative <sep> entrees negative <sep> bill neutral
0,0,While waiting we asked the bartender for at glass of red wine which he not only forgot to serve but when we asked him again 10min later he poured us white wine.,bartender negative <sep> glass of red wine neutral
0,0,"Come here to drink, but don't come here for a meal.",drink negative <sep> meal positive
0,0,"The food was not good at all, starting with the green salad, and the entrees (garlic chicken, chicken extreme) were chicken doused in oily sauce.",green salad neutral <sep> sauce negative
0,0,"When there is so much GREAT food in New York, why go for the high-priced mediocre meal?",food positive <sep> meal negative
0,0,We had to request water and chips (tostades) and salsa three times (the third time my date had to go and track down the waitress) before finally being served (by the busser) and the place wasn't even a quarter full.,water and chips (tostades) neutral <sep> waitress negative <sep> served neutral <sep> place negative
0,0,This place is even good for just drinks after work (nice bar) I am going back there as soon as I get a chance.,drinks positive <sep> bar positive <sep> chance neutral
0,0,"hard to work a buzz with the server taking so long between every round, but worth trying the signature african rum cocktail and happily surprised they had our favorite white - sancerre by the glass at this japanese restaurant.",server negative <sep> glass neutral
0,0,"I don't like places that sacrifice quality for money or play tricks on you by hiding drink prices till check time (everyone at the place was drinking Sangria, so that, it seems, must be the money-maker).",quality negative <sep> drink prices negative <sep> Sangria neutral
0,0,"I ordered chicken vindaloo, the delivery took about an hour, and it cost me $13 with tip.",chicken vindaloo neutral <sep> cost negative
0,0,"When my friend's chicken salad sandwich arrived, she noticed a nice crust, and it wasn't part of the bread.",chicken salad sandwich neutral <sep> crust positive <sep> bread neutral
0,0,The waiter came back after I had finished my appetizer to correct himself and let me know that it wasn't vegetarian (chicken stock) after all.,waiter negative <sep> appetizer neutral
0,0,"The line gets a bit claustrophobic, since you're jammed against the counter, but the enormous Greek salad (replete with herbed feta, slightly sweet dolmades and a plethora of olives), the baba ghanouj and the eponymous falafel are great, as are the spanokopita and other spur-of-the-moment pastries they always seem to be featuring.",Greek salad positive <sep> plethora of olives neutral <sep> eponymous falafel positive <sep> pastries positive
0,0,"There is NO waiting area - waiters, diners,and staff all converge in a tight space.",waiters neutral <sep> diners neutral <sep> staff neutral <sep> space negative
0,0,"- , the desserts are sinful, the moroccan hospitality evident in the wait staff's friendliness and there is an overall ambience that makes you want to stay all night!",desserts positive <sep> wait staff positive <sep> ambience neutral
0,0,That was totally acceptable and we found some great seats at the bar.,seats positive <sep> bar neutral
0,0,We tried to get the manager who flatly refused to come to our table and discuss the problem with us.,manager negative <sep> table neutral
0,0,"Service is not particularly warm, but I've gone back again and again (for dinner) over the years on an almost monthly basis.",Service negative <sep> dinner neutral
0,0,"The crowd doesn't disappoint: A well-heeled, fashionable clientele packs the polished-wood-and-glass-partitioned space, settling into one of two dining rooms, or the bar, which is located at the farthest corner from the entrance.",crowd positive <sep> dining rooms neutral <sep> bar neutral
0,0,"We wouldn't have had a problem with this if the burger had actually been tasty but even with the foie-gras, cheddar cheese, apple smoked bacon, leaks, etc.",burger negative <sep> cheddar cheese neutral <sep> apple smoked bacon neutral
0,0,05 bar of melted chocolate in a cup.,bar neutral <sep> chocolate positive <sep> cup neutral
0,0,The rude and unaccomodating hostess (who we later learned was the manager) repeatedly promised us the next table but never offered to buy us a drink while we waited.,hostess negative <sep> manager negative <sep> drink neutral
0,0,First had a cheese platter at the bar and then enjoyed a nice dinner with friends.,cheese platter neutral <sep> bar neutral <sep> dinner positive
0,0,"For an entree I should have been more adventurous, but every menu item that aroused my interest had some form of pork in it (ham, bacon, prosciutto, you name it), most of the time superfluously, I went for the Portabello sandwich.",entree positive <sep> prosciutto neutral
0,0,"Overall, it is a nice place and if you don't mind possible attitude and the not-so-cheap prices, it is a great place to meet for coffee or drinks (they have a nice selection of that too!",prices negative <sep> coffee positive <sep> drinks positive
0,0,"For entrees, my favorites were the coriander and honey pork ribs or the seared scallops, both of which were to die for.",entrees neutral <sep> coriander and honey pork ribs positive
0,0,"Beautiful rooms filled with beautiful people, but expensive for what it is ($68 prix fixe), limited menu, tiny portions, reeeeeeeally slow service, undercooked potatoes with the cod, less than fascinating desserts.",prix fixe neutral <sep> portions negative <sep> service negative <sep> cod neutral
0,0,"The food, admittedly, was tasty (we came prepared for high prices and small portions) but I could not believe that with entrees, appetizers, and wine that the servers would rush us through each course.",food positive <sep> entrees neutral <sep> appetizers neutral <sep> wine neutral
0,0,"Sit at the bar, order a glass of wine, and grab an appetizer: they'll also bring you olives, parmesan cheese, a huge loaf of delicious bread and 3 dipping sauces.",bar neutral <sep> glass of wine neutral <sep> appetizer neutral <sep> bread positive
0,0,Those appetizers only appeared after we complained to the manager.,appetizers neutral <sep> manager negative
0,0,"The Scene Quartino's airy dining room, wrapped in high windows, hinges around a trendy bar where regulars sip wine out of blunt tumblers while swapping stories--often in Italian.",Scene neutral <sep> airy dining room neutral <sep> bar positive
0,0,"It's got funky, fun furniture and a round bar at the front, which is convenient for those waiting to be seated and be prepared to wait for a while, if you don't have reservations.",furniture positive <sep> reservations neutral
0,0,During the summer the outdoor area is a great place to sit and eat you pizza.,outdoor area positive <sep> pizza neutral
0,0,"After some good food and spotty service, my friends and I were surprised to get a bill that had a 20% tip included post-tax.",service positive <sep> bill neutral
0,0,"i think the $5 dollar breakfast is great hangover food, but then again, it's hard to mess up eggs, right?",breakfast positive <sep> eggs neutral
0,0,"I must say I enjoyed their soup dumplings more than Joe's,but the other dishes were disappointing.",soup dumplings positive <sep> dishes negative
0,0,"7A is open 24/7 and is great for lunch, brunch or a late night visit after partying all night.",7A neutral <sep> lunch positive <sep> brunch positive
0,0,They charge $24 for entrees and ask additional price of $3 for rice or $6 for vegetables as side dish!,entrees neutral <sep> price negative <sep> vegetables neutral
0,0,The kicker was when there were three items on our check that were priced higher than stated on the menu and by the server.,priced negative <sep> menu neutral <sep> server negative
0,0,"They have samosas, chicken tikka masala, and a lot of other dishes you can think of.",chicken tikka masala neutral <sep> dishes positive
0,0,"The only downer was the fruit fondue desert from the prie fixe menu wasn't as good as it looked (the chocolate was runny), and the wait between our salad and main course was too long.",fruit fondue negative <sep> prie fixe menu neutral <sep> wait negative
0,0,Enough space between tables that you don't feel crowded or that it's too loud.,space positive <sep> tables neutral
0,0,I have been a waiter for many years and I can tell you that if bad service is given you at least apologize to the costumer.,waiter neutral <sep> service negative
0,0,The owner roasts his own meats and makes fabulous and interesting sandwiches--the house-roasted ham with celery-root salad and tomatoes on a baguette deserves a prize.,owner neutral <sep> meats neutral <sep> sandwiches positive <sep> house-roasted ham with celery-root salad neutral
0,0,The kitchen staff either cannot or will not accomodate special diets which is surprising given that there are so many fine dining establishments that do have special menus to cater to vegetarians.,kitchen staff negative <sep> menus neutral
0,0,The food is simply remarkable as is the fiery female master sommelier!,food positive <sep> sommelier neutral
0,0,"The waitstaff was helpful but watch out, after you pay your hefty bill managment will ask you to leave if they think you've lingered too long.",waitstaff positive <sep> bill neutral
0,0,"I used to eat there two meals a day until my company moved to stupid Madison avenue (UGH, nasty food for rip off tourist price!)",meals neutral <sep> food negative <sep> price negative
0,0,I understand its a very busy night of the week but it is unacceptable that I was hung up on by the hostess twice (I also called back and she refused to answer the phone for 15 minutes) and was told that I should have picked up my food instead of having it delivered.,hostess negative <sep> food neutral
0,0,5 hour meal (we ordered the tasting menu).,hour meal neutral <sep> menu positive
0,0,while I think the menu could use better appetizers all of the main courses are DELICIOUS- also the service is so much better than the ratings.,menu neutral <sep> appetizers neutral <sep> ratings positive
0,0,"The service was terrible- our waiter was unable to make any recommendations, mumbled the special and failed to check back during the course of our meal.",service negative <sep> waiter negative <sep> meal neutral
0,0,"The $75 tasting menu features seafood which is both unusual and powerfully fresh, but the chef's appetizers which preceed it like sesame flavored tile fish with raw vegetable salad and japanese spiced flan with seafood were unbalanced and far too delicate on the palate (although the tuna tartare with avocado is a standout).",menu positive <sep> chef's appetizers neutral <sep> sesame flavored tile fish with raw vegetable salad negative <sep> japanese spiced flan with seafood negative <sep> tuna tartare with avocado positive
0,0,"The smell near the bar is unbearable, the food is so so, nothing out of the norm, just very plan.",bar neutral <sep> food negative
0,0,"It's made with cauliflower, wild mushrooms, and no rice at all.",wild mushrooms neutral <sep> rice negative
0,0,"The grilled calimari is *scrumptious*, and the must have is a cheese plate ordered with assorted meats, and for dessert, make sure someone has the roasted fruits and someone else has the expresso with ice cream.",grilled calimari positive <sep> cheese plate positive <sep> dessert neutral <sep> roasted fruits positive <sep> expresso with ice cream positive
0,0,"They don't take reservations, though, so you have to get there by 8:00 to get a good table.",reservations neutral <sep> table positive
0,0,"Faux Models/Waiters hustle around the tight spaced restaurant, while the bar is crowded with waiting patrons and dates enjoying a drink.",bar neutral <sep> waiting patrons negative
0,0,"The singing wait staff are great, the food is just awful!!",singing wait staff positive <sep> food negative
0,0,"Tables are a little cramped, but dinner or lunch for 2 is fine.",Tables negative <sep> dinner neutral
0,0,"Unless you like getting bumped by waiters and people walking by, do not sit at a middle table.",waiters negative <sep> table neutral
0,0,I have been there for dinner as well and one would think that if you pay more for dinner than the buffet you would get better quality food from the tandoor.,buffet neutral <sep> food positive
0,0,the service was very slow and his knowledge of the menu wasnt that good.,service negative <sep> menu neutral
0,0,"The bar was a disaster because there were no tables for anyone, and drinks took 20 minutes to receive.",bar negative <sep> tables negative <sep> drinks neutral
0,0,"The steak, duck and soft shell crab are musts for dinner and almost every side dish was great.",steak positive <sep> duck positive <sep> soft shell crab positive <sep> dinner neutral <sep> dish positive
0,0,"While admitably, the seating is a bit cramped, and the menu a tad pricey, the staff does its best to remedy concerns.",seating negative <sep> staff positive
0,0,The hostess failed to inform us of that the restuarnt was hosting a private company party when we made the reservation.,hostess negative <sep> reservation neutral
0,0,Our meal was capped of with the waiter rudely saying he needed the table for other customers.,meal neutral <sep> waiter negative <sep> table neutral
0,0,"the 2 tables next us had undercooked beans, tough hanger steak, mediocre dessert and same vibe about the chicken.",beans negative <sep> hanger steak negative <sep> dessert negative <sep> vibe negative <sep> chicken neutral
0,0,"UNREAL LUNCH can't go wrong with pastas or sandwiches, thin crust pizza is good, would steer away from the deep dish.",LUNCH neutral <sep> pastas neutral <sep> sandwiches neutral <sep> crust pizza positive <sep> dish negative
0,0,4-Got attitude from the waitress at every moment she was at the table.,waitress negative <sep> table neutral
0,0,"Denny's serves a better Grand Slam breakfast--and at a quarter of the price (I paid $21 w/o tip for b-fast--I went back a second time, because the restaurant was highly touted and I thought the first bad experience was a fluke.",Grand Slam breakfast positive <sep> price neutral <sep> tip neutral
0,0,"The small shrimp were dry and rubbery and when I sent the dish back to the kitchen, the waitress returned saying that they use 'frozen shrimp so that is wny they have that texture.",small shrimp negative <sep> dish neutral <sep> kitchen neutral <sep> waitress negative
0,0,And for families they have high chairs and waiters were really nice to my kid.,chairs neutral <sep> waiters positive
0,0,"Reserve a cozy window seat for more privacy, or hop onto a stool at the bar to dine solo.",privacy positive <sep> bar neutral
0,0,"A friendly staff works the room, delivering favorites like crisp, crackling spring rolls and shredded pork rolls wrapped in rice paper.",staff positive <sep> room neutral <sep> spring rolls positive <sep> pork rolls positive <sep> rice paper neutral
0,0,"The waitress even gave us a complimentary dessert- warm chocolate lava cake with a scoop of cinnamon ice cream, what a perfect end to a perfect dinner!",waitress positive <sep> ice cream neutral
0,0,"If you live downtown, definitely grab one of their menus, make a phone call and relax in front of the tv while they pound the pavement to get to you (although they do take about 45 minutes on average to get to you)-- the in restaurant service is likewise very very good.",menus neutral <sep> service positive
0,0,Food and Service of the same high quality elsewhere in NY would have been twice the cost.,Food positive <sep> cost neutral
0,0,"went for dinner with two friends and all of us were raving about our meals--the best steak i've had in a long time, and the duck and salmon were also delicious.",dinner neutral <sep> meals positive <sep> steak positive <sep> duck positive <sep> salmon positive
0,0,"We didn't see him the rest of the night, the other courses come out sporadically, and no one ever asked if we wanted more wine (which we did) or refilled our water -- even after we flagged down another waiter, nothing happened.",wine neutral <sep> water neutral <sep> waiter negative
0,0,"The pasta, chicken and veal dishes are one of the best values in town, almost always served with bread and salad (and pasta for the meat dishes).",chicken and veal dishes positive <sep> bread and salad neutral <sep> meat dishes neutral
0,0,"Both appetizers arrived cold/luke-warm, which we had to send back, only to have the waiter tell us that one was supposed to be cold.",appetizers negative <sep> waiter neutral
0,0,"The tasting menu was delivered at a break-neck pace, leaving no time to enjoy the wine or even digest the food.",menu positive <sep> wine positive <sep> food positive <sep> pace neutral
0,0,"Food was served very promptly, but our wait for drinks was surprisingly long.",served positive <sep> wait negative <sep> drinks neutral
0,0,"The service was lacking a bit, we waited about 20 mins for a waiter and water to come to us once we were sat and we had to ask for everything twice, even drink orders - I think maybe we just got stuck with a bad waiter though.",service negative <sep> drink neutral
0,0,"Order a beer and then sit and wait for the steamy, salty soup dumplings that burst with a snap.",beer neutral <sep> soup dumplings negative
0,0,"They gave us desert menus but never came back for a desert order, instead we had to ask for the check and a bus boy retreived it for us.",desert menus neutral <sep> desert order negative <sep> check neutral
0,0,Don't look for sushi on the menu although there's tons of sake and it's served properly.,sushi neutral <sep> menu neutral <sep> served positive
0,0,"The staff is nice, but they have the awful job of having to sell bland food as amazing treats.",staff positive <sep> food negative
0,0,Sometimes when I come home from work I stop at the bar to have a plate of oysters and something delicious for dinner.,bar neutral <sep> plate of oysters neutral <sep> dinner positive
0,0,The food is so good that there tends to be a little bit of a wait.,food positive <sep> wait neutral
0,0,"We hung out by the bar mostly to ourselves, not an overwelming social crowd, but there were some georgous groups of hipsters looking like it was their meeting up before going out to the clubs (a few of the girls looked like top models), but the vibe was real chill.",bar neutral <sep> crowd negative
0,0,"Deborah, the chef and co-owner, is an extraordinary talent - she has not received the notoriety she deserves - and her food, while not expensive, really merits a two or three star rating.",chef positive <sep> food neutral
0,0,"beside i have to wait long time with my food, waiter service ok but unfriendly.",food neutral <sep> waiter service negative
0,0,"There are 1 or 2 vegetarian dishes, but the sides platter has a bit of everything, so you get the full flavor of Latin American food.",vegetarian dishes neutral <sep> Latin American food positive
0,0,"Food is average, service is awful, and the attitude isn't New York - it's just plain rude - and most of NYC is caring and courteous.",Food neutral <sep> service negative
0,0,"What made our visit extra special was that we didn't have room for dessert at the end of our meal (the pasta was so amazing we just kept eating), our waiter suggested we come back after our show, which we did.",dessert neutral <sep> pasta positive <sep> waiter positive
0,0,"The sauce is filled with spices, including fresh garlic and basil.",sauce neutral <sep> spices positive <sep> garlic and basil positive
0,0,Don't let the all-Italian menu intimidate; the waitstaff patiently translates each item.,menu neutral <sep> waitstaff positive
0,0,"I had lunch with 3 friends of mine, all ordered different pasta dishes and we all loved each of ours!",lunch neutral <sep> pasta dishes positive
0,0,"Here's how it works: you walk in, sit down, and have a vegetarian thali (group of little portions of curries) that invariably includes lentiles, a small salad, some rice, some kind of samosa-like pastry, yogurt, rice, and a couple of sauces.",portions negative <sep> yogurt neutral <sep> sauces neutral
0,0,"Apart from the rare to medium rare mistake on my steak, the food was ok and and not worth the money.",steak neutral <sep> food negative
0,0,"When our turn came to get in, we were told that the place was full due to the Labor Day weekend and we could not get inside unless we bought a 200$ bottle of vodka.",place negative <sep> vodka neutral
0,0,"Although the food was in small portions, it was good.",food positive <sep> portions negative
0,0,"Lunch (a chicken sandwich on baguette with fries) was decent, brunch (dry, hard pancakes) was pretty bad.",Lunch positive <sep> a chicken sandwich on baguette neutral <sep> brunch positive <sep> pancakes positive
0,0,"Well, literally 7 minutes later we were being served dinner, with no apologies from the server who was too scared to come to our table.",served dinner neutral <sep> server negative <sep> table neutral
0,0,"This is the place to come for coffee and dessert; they have an enormous and decadent selection of cakes, pies, and other things involving chocolate.",coffee positive <sep> dessert positive <sep> selection of cakes positive <sep> pies neutral <sep> chocolate neutral
0,0,I had to chase down our waitress for the food and the bill.,waitress negative <sep> food neutral
0,0,I went anyway and was greeted by the rude owner who practicly ripped our outside drink from our hands (although we were trying to throw it out anyway.,owner negative <sep> drink neutral
0,0,Today I placed a lunch order and the guy hung up on me while I was saying thank you!,lunch neutral <sep> guy negative
