review_id,sentences_ids,sentences_texts,sentences_opinions
0,0,Food was good (get a crepe or steak!),Food positive <sep> crepe neutral <sep> steak neutral
0,0,"I'm a chef (30 years), and I can honestly say that I've finally found Italian food worth eating at a reasonable price.",chef neutral <sep> price positive
0,0,"Forget about the staff and go for the food and pleasant, if a bit cramped Lancaster, Pennsylvania like decor for comfort.",staff negative <sep> food positive <sep> decor positive
0,0,After we finished our salad our waitress told us that they had run out of roast lamb and pastitichio.,salad neutral <sep> waitress negative <sep> roast lamb neutral
0,0,Greek Glasswine is still on menu along side good value bottle selections fromaround the world.,menu neutral <sep> value bottle selections positive
0,0,Went the next day for lunch - menu too pricey for lunch and the waiter was the WORST !!,day neutral <sep> menu negative <sep> waiter negative
0,0,The only problem we had was with an incompetent waitress and floor manager which slowed down our food and seating.,waitress negative <sep> floor manager negative <sep> food neutral
0,0,"Good location, but tourist-y and poor quality food.",location positive <sep> food negative
0,0,The chefs and staff are welcoming and happy to make substitutions or tune the spice up or down to your requests.,chefs positive <sep> staff positive <sep> spice neutral
0,0,"Service was at best distracted, at worst disdainful, even though we came early with a reservation and are not food novices.",Service negative <sep> reservation neutral
0,0,"as written below, the drinks were watered down, and they didn't have the ginger martini available nor all of the wine list.",drinks neutral <sep> wine list negative
0,0,"great food, even better price, they also have a dj spinning great music, definitely a must try.",food positive <sep> price positive <sep> dj neutral <sep> music positive
0,0,"No matter what you order, you're almost certain to get so much food you'll be leaving with a doggie bag.",food positive <sep> bag negative
0,0,"Good wines under $100 are included in the predominantly French list, but take some ferreting out to find.",wines positive <sep> French list neutral
0,0,"Since we already have our drinks there is no choice, so we are forced to pay full price.",drinks neutral <sep> price negative
0,0,If the staff actually got it together and showed some customer service this place would be good.,staff negative <sep> service neutral
0,0,"Waitress forgot drinks, and watched us begin our dinner without even water, strange.",Waitress negative <sep> drinks neutral <sep> dinner neutral
0,0,"After paying for our meal, we left some feedback with the manager (a chap named J.",meal neutral <sep> manager negative
0,0,Order the porterhouse and they put it between you and you kind of eat family style at a wooden table.,eat neutral <sep> style positive <sep> table neutral
0,0,"In any case, the food was quite yummy and on monday nights, they have a prix fixe $25 dinner which is definitely a deal.",food positive <sep> prix neutral <sep> dinner neutral
0,0,Someone should tell these people that high prices on the menu does not make your restaurant better.,prices negative <sep> menu neutral
0,0,"When we were finally seated about half an hour after my reservation, the waitress took her time taking our order.",reservation neutral <sep> waitress negative
0,0,"(and don't miss the olive oil when dining in - not sure what they put in it, but it is de-licious!",olive oil negative <sep> dining neutral
0,0,I ordered dessert and it was they gave me the wrong flavor of ice cream.,dessert neutral <sep> flavor negative
0,0,"Nice decor and an extensive menu lured me in, but the horrible service and rude staff drove me out.",menu positive <sep> staff negative
0,0,I was surprise with the Champagne toast from the concierge who booked our dinner.,Champagne toast positive <sep> dinner neutral
0,0,"The rice that we were served for dinner was dry and hard, obviously left over from lunch.",rice negative <sep> dinner neutral
0,0,"The atmosphere was wonderful, however the service and food were not.",atmosphere positive <sep> service negative <sep> food negative
0,0,I had a tasty Caesar salad for an appetizer and ordered the 10 oz Fillet Mignon medium rare.,Caesar salad positive <sep> appetizer neutral <sep> oz Fillet Mignon neutral
0,0,Bartenders look like model wannabes and threw out my friend's beer before he was finished (about 1/4 left).,Bartenders negative <sep> beer neutral
0,0,"The place is packed, they don't take reservations and waited almost 2 hours.",place negative <sep> reservations neutral
0,0,"When it came time to get the check, they couldn't seem to determine which of the servers had it.",check neutral <sep> servers negative
0,0,"Get a bottle of wine, and eat what your heart has been desiring because all the things you would love to be on one menu--are!",bottle of wine neutral <sep> menu positive
0,0,"Granted, it's loud and sometimes obnoxious and it's such a pain to get seats for, but the the food is great.",seats negative <sep> food positive
0,0,Unfortunately the food and the service don't live up to the spectacular setting.,food negative <sep> setting positive
0,0,The place has a sort of trendy pseudo-asian decor that seems perfectly casual or romantic.,place neutral <sep> decor positive
0,0,The staff was great - and all guests are seated by the owners.,staff positive <sep> owners neutral
0,0,"With dessert, the pre-theater is a great deal/meal.",dessert neutral <sep> pre-theater positive
0,0,"Smallish menu, but more than adequate, and not that heavy on sauces which is so typical of italian restaurants.",menu negative <sep> sauces positive
0,0,"When the manager came over, he accused my friend of offending the chef and continued to argue with her about the dish.",manager negative <sep> chef negative <sep> dish neutral
0,0,"For around $50 per person for brunch, it was a great value and the food really was fantastic.",brunch neutral <sep> food positive
0,0,The waitress/hostess seemed a bit sad when we told her we weren't ordering dessert (those arepas are deceptively filling!,waitress/hostess negative <sep> dessert neutral
0,0,"The food was ok, good bread.",food neutral <sep> bread positive
0,0,"I am a martini guy - vodka, not gin - and their classic martini with blue cheese olives is pretty damn near definitive.",martini guy neutral <sep> martini with blue cheese olives positive
0,0,We made reservations for 6pm on Friday and it was not necessary BUT the place got packed really quick around 7-8pm.,reservations neutral <sep> place negative
0,0,"The pooris were miniscule, about 2 bites each; they serve 4 of those as a dinner for $25!",pooris negative <sep> dinner neutral
0,0,Highly suggest you sit at the bar for added atmosphere and generally friendly people.,bar neutral <sep> atmosphere positive
0,0,"As a lover of everything humus and cucumber, there is no other restaurant in the city that compares to Mogador's appetizers.",humus positive <sep> cucumber positive <sep> appetizers neutral
0,0,A great coal fired crust provides a backyard BBQ taste.,crust positive <sep> backyard BBQ taste neutral
0,0,"Although the food was great, the service was so bad that I can't see myself ever returning.",food positive <sep> service negative
0,0,Tried to get a table during restaurant week but there was an over an hour wait.,table neutral <sep> wait negative
0,0,The cultured wait staff were accommodating and helped explain and pronounce the items off the menu.,cultured wait staff positive <sep> menu neutral
0,0,When I saw it on the menu I didn't beleive it and was not expecting the real thing.,menu neutral <sep> thing negative
0,0,"You can undoubtedly get better food and service for the price at other places, but certainly not with those views!",food positive <sep> price neutral
0,0,We held a birthday dinner for my friend and were very impressed w/ both food and service.,dinner neutral <sep> food positive <sep> service positive
0,0,"My favorite dishes all involved squash of some kind, which i would not expect to love.",dishes positive <sep> squash neutral
0,0,The waitresses and the diners have to scream at one another to give an order.,waitresses negative <sep> diners neutral
0,0,"We a menu that rearely changes,e xcept for one or two specials, the quality and care they put in thier food in evident.",quality positive <sep> care positive <sep> food neutral
0,0,Had an OK dinner that was made better by the attention the owners pay to the patrons.,dinner neutral <sep> owners positive
0,0,"We sat near the sluggish, hot and very loud kitchen and the service area was not wiped down once during the entire time.",kitchen negative <sep> time neutral
0,0,"There might be a wait for brunch or even for dinner, but the quality of the food is always worth the wait.",brunch neutral <sep> dinner neutral <sep> quality of the food positive
0,0,The $9 glass of wine which the waitress called good was like grape juice with alcohol and no sugar.,glass of wine neutral <sep> waitress negative <sep> grape juice neutral <sep> alcohol neutral <sep> sugar negative
0,0,The waitresses are at your table filling your water or oil before your last sip or dip.,waitresses positive <sep> water neutral <sep> oil neutral
0,0,"Personally, I like my food fresh, so you just have to tell the waiter that you would like to order by ear.",food positive <sep> waiter neutral
0,0,The mint love letters and spaghettini primi we ordered as entrees were perfection.,letters positive <sep> primi positive <sep> entrees neutral
0,0,"the waiter was extremely helpful, basically we gave him carte blanche to order small plates for us that he thought we'd like.",carte neutral <sep> plates neutral <sep> waiter positive
0,0,"Their service needs some work, but it is safe to say that you will enjoy the food.",service negative <sep> food positive
0,0,Food is decent but portions are so tiny and the whole meal is served on huge plate which makes it look even more ridiculous.,Food positive <sep> portions negative <sep> meal negative <sep> served negative
0,0,"Nothing on the menu jumped out at me, but when we tasted the chicken and the pork tenderloin.",menu negative <sep> pork tenderloin neutral
0,0,"Our waiter fast to get our drinks, aptz, and orders.",waiter positive <sep> drinks neutral
0,0,And don't forget to try the Korean rice wine to go with your dinner (Sansachun is one of my favorite).,Korean rice wine positive <sep> dinner neutral
0,0,"I have tried to make reservations, but both times, the hostess didn't have my name.",reservations neutral <sep> hostess negative
0,0,"We had to ask for the bill twice, and our water was refilled only when we asked for it.",bill neutral <sep> water negative
0,0,"Appetizers were OK, steak was not as good as what I would have prepared at home on the grill.",Appetizers positive <sep> steak negative
0,0,I've been a few times for dinner and dessert and the food is always old-tasting and bland.,dinner neutral <sep> food negative
0,0,words can't even describe how delicious that dessert was post a bottle of wine and pesto ravioli.,dessert positive <sep> pesto ravioli neutral
0,0,"but no reservations makes for a very long wait, usually of an hour.",reservations neutral <sep> wait negative
0,0,The wait for brunch is kinda long (what can you say?,wait negative <sep> brunch neutral
0,0,"The seafood sausage is ok, but the rest of the appetizers outshine them.",seafood sausage neutral <sep> appetizers positive
0,0,"The Food Pies come in three sizes, from a petite five inches (perfect for the solo diner) up to 10.",Food Pies neutral <sep> diner positive
0,0,best chicken in queens.,chicken positive <sep> queens neutral
0,0,"The ambience is extremely romantic, even if you get seated upstairs.",ambience positive <sep> upstairs neutral
0,0,I don't know why people complain about the service - our waiter brought our drinks and food out promptly.,waiter positive <sep> drinks neutral <sep> food neutral
0,0,My dining companion had a steak with so much fat on it that he had to send back it.,dining neutral <sep> steak neutral <sep> fat negative
0,0,I have been a waiter for many years and I can tell you that if bad service is given you at least apologize to the costumer.,waiter neutral <sep> service negative
0,0,"Waited an hour for the food to come out, couldnt even find the waitress.",food neutral <sep> waitress negative
0,0,"The decor is nothing great to speak of, but who cares - the food is top notch.",decor negative <sep> food positive
0,0,I forget the name of the dish but anyone going here must get the shrimp cooked in molases and rum.,dish neutral <sep> shrimp positive
0,0,Wait staff started swarming around us as if we just ordered cokes throughout lunch.,Wait staff negative <sep> lunch neutral
0,0,"When I questioned the purpose of waiting on this line, I was asked to leave the bar.",waiting neutral <sep> bar negative
0,0,This is definately a place to go for drinks and then get dinner somewhere else!,drinks positive <sep> dinner neutral
0,0,In the hour we waited for our food we had to remind our mentally challenged waitress 3times to bring our chipssalsa.,food neutral <sep> waitress negative
0,0,"The kitchen is fast, but you sometime may have trouble getting a seat, since this place is very small.",kitchen positive <sep> seat negative
0,0,"Good date place too, if the date isn't prissy about food (I'll marry the woman who splits the grilled sardines with me).",food negative <sep> grilled sardines positive
0,0,"Food was served very promptly, but our wait for drinks was surprisingly long.",served positive <sep> wait negative <sep> drinks neutral
0,0,"But the price tag was high, and the food was comparable to a Las Vegas buffet for flavor and quality.",price tag negative <sep> food positive
0,0,"In Short At this Upper East Side bar and restaurant, it's both the dinner and drinks that reel in the well-heeled clientele.",drinks neutral <sep> clientele positive
0,0,About the wait - be prepared to - it isn't just anyplace offering top notch cuisine for about $25 all in.,wait neutral <sep> cuisine positive
0,0,I had to ask for bread for the table (several times).,bread negative <sep> table neutral
0,0,"At $16 a burger and $26 for a lobster roll, the food is definitely expensive.",burger neutral <sep> lobster roll neutral <sep> food negative
0,0,"The freshness of the ingredients down to the perfection of the crust, it is truly the best.",freshness positive <sep> ingredients neutral <sep> crust positive
0,0,Delivery portions are bigger and 2 can easily share 1 entree.,Delivery portions positive <sep> entree neutral
0,0,Good value for breakfast.,value positive <sep> breakfast neutral
0,0,The waitress waited until I went to the bathroom to ask my friend to order more food.,waitress negative <sep> food neutral
0,0,Great food -- but some of the worst service in the neighborhood.,food positive <sep> service negative
0,0,"We ordered two appetizers and two entrees and were absolutely stuffed, we couldn't even finish our meals.",appetizers neutral <sep> entrees neutral <sep> meals negative
0,0,The menu is a bit different and all of the selections are pretty tasty.,menu neutral <sep> selections positive
0,0,"Reserve a cozy window seat for more privacy, or hop onto a stool at the bar to dine solo.",privacy positive <sep> bar neutral
0,0,"The sandwiches, platters, and pitzas are top notch too, but I could make a meal just out of their pita bread and babaganoush.",platters positive <sep> meal neutral
0,0,My friend was a vegetarian and the staff went out of their way to provide her with a special entree.,staff positive <sep> entree neutral
0,0,"The waitress came three times: to take our order, to bring the order, and to bring the check.",waitress negative <sep> check neutral
0,0,The second time we went the waiter didn't put in our pizza order!,waiter negative <sep> pizza neutral
0,0,The restaurant didn't mind me sitting on their doorstep to the extent that the bartender invited me in for a drink.,bartender positive <sep> drink neutral
0,0,"Although the service can be a bit brusque at times, the food is always good, hearty and hot.",service negative <sep> food positive
0,0,"Entrees are right around $10, with fried rice and noodles being a little cheaper.",Entrees neutral <sep> noodles positive
0,0,The server was condescending and was unable to provide assistance with menu selections.,server negative <sep> menu selections neutral
0,0,The portions are like a buffett for breakfast.,portions negative <sep> breakfast neutral
0,0,17 for a small cup of tea.,cup negative <sep> tea neutral
0,0,"He let us be seated, but told the hostess to make sure we didn't get menus until it was our arrival time.",hostess negative <sep> menus neutral
0,0,Hostess was extremely accommodating when we arrived an hour early for our reservation.,Hostess positive <sep> reservation neutral
0,0,"Furthermore, while the fish is unquestionably fresh, rolls tend to be inexplicably bland.",fish positive <sep> rolls negative
0,0,Wide range of dim sum and food.,range positive <sep> dim sum neutral
0,0,For entrees the suckling pig is a ho-hum pile of pulled pork and the fish-of-the-day was merely good.,entrees neutral <sep> suckling pig positive <sep> pork positive
0,0,Sure the service isn't the best but the food is tasty and the prices are great.,service negative <sep> food positive <sep> prices positive
0,0,"I tried almost everything on the menu, but my fav is the pumkin raviloi, too bad it's only seasonal.",menu neutral <sep> pumkin raviloi positive
0,0,"we had to wait at the bar for a table, but the atmosphere is bustling and is well worth it.",bar neutral <sep> atmosphere positive
0,0,We could have made a meal of the yummy dumplings from the dumpling menu.,meal neutral <sep> dumplings positive <sep> dumpling menu neutral
0,0,Our meals were a moderate portion and they weren't too spicy.,meals neutral <sep> portion negative
0,0,large portions so unless you are of large stature you should not get 2 appetizers.,portions positive <sep> appetizers neutral
0,0,this is the style of cooking that takes normal dishes to new highs.,style of cooking positive <sep> dishes negative
0,0,"Fantastic flavor, but certainly not worth the high price of the small glass.",flavor positive <sep> price negative <sep> glass negative
0,0,The portions were overly generous for both the apps and entrees without sacrificing the quality.,portions negative <sep> apps positive
0,0,"While dining, none of us were impressed with the food.",dining neutral <sep> food negative
0,0,"Even if you're just a middling junior exec, staff service makes you feel like a board member.",exec neutral <sep> staff service positive
0,0,"Two complaints- their appetizer selection stinks, it would be nice to get some mozzarella sticks on the menu.",appetizer selection negative <sep> menu neutral
0,0,my sister asked for iced tea twice and the waitress said they didn't have.,iced tea neutral <sep> waitress negative
0,0,The service could be better but the management (Mariano) is quite helpful if there are any problems.,service neutral <sep> Mariano positive
0,0,"Twister shrimp - too salty and nothing spectacular; Mango sorbet - so flavorful and rich, it tasted like ice cream!",Twister shrimp negative <sep> Mango sorbet positive <sep> ice cream positive
0,0,"If you are expecting big portions, go find a Cheesecake Factory.",portions positive <sep> Cheesecake Factory neutral
0,0,"We explained that we had left a standard 15% on food, and a slightly smaller percentage on alcohol (At least 10%).",food neutral <sep> percentage negative
0,0,better for dining with friends/significant others.,dining positive <sep> others neutral
0,0,"Subtle decor, above average wine list and a menu with a difference.",decor positive <sep> wine list positive <sep> menu neutral
0,0,Great wine list with an extra expensive selection for all you big spenders.,wine list positive <sep> selection negative
0,0,The salsa always tastes like V8 with onion pieces.,salsa positive <sep> onion pieces neutral
0,0,I always trek to Bar 89 and get one of their huge sandwiches that comes with fries.,Bar neutral <sep> sandwiches positive <sep> fries neutral
0,0,"Expect to be cramped and you may have to wait a little for your food, but the service is really friendly and helpful.",food neutral <sep> service positive
0,0,The waitress told me that their dessert chef was trained in Sicily.,waitress negative <sep> dessert chef neutral
0,0,Each course was accompanied by a new wine.,course neutral <sep> wine positive
0,0,"Although, a limited menu, we had no trouble picking out our delicious meal.",menu negative <sep> meal positive
0,0,Service was bad enough that we decided to head out after the first round of drinks.,Service negative <sep> drinks neutral
0,0,Mojitos were good and prices werent bad but sides should be included in price as portions are tiny.,Mojitos positive <sep> prices negative <sep> portions negative
0,0,"When asked to compare between two dishes, the server said whatever you like.",dishes neutral <sep> server negative
0,0,"The bar tender didn't know where the tea was, waiters started making the drinks if the bar tender wasn't around.",tea neutral <sep> waiters negative <sep> drinks neutral
0,0,i had a horrible experience with a waiter while trying to have breakfast friday morning.,waiter negative <sep> breakfast neutral
0,0,"I have been surrounded with Indian food my entire life, and my lunch time experience at Devi was absolute bliss.",Indian food neutral <sep> lunch positive
0,0,"tender grilled calamari, shrimp with spinach in puff pastry, delicious fried brie.",tender grilled calamari neutral <sep> shrimp with spinach in puff pastry neutral <sep> fried brie positive
0,0,"I always get cantonese wonton noodle soup here, but the chicken is also almost always good.",wonton noodle soup neutral <sep> chicken positive
0,0,"Get the bacon (best ever, hands down) and shrimp cocktail to start and steak for how many ever to finish.",bacon positive <sep> shrimp cocktail neutral <sep> steak neutral
0,0,"The waiters can shoot off a 5 minute long list of specials, and they know the menu very well.",waiters positive <sep> menu neutral
0,0,Another hostess came by and told us that since we were now 5 we were a different table and couldnt' stay.,hostess negative <sep> table neutral
0,0,They cook the cheese so that it turns a nice brown color and it is absolutely the best pizza I've ever had in New York.,cheese neutral <sep> pizza positive
0,0,"The staff is constantly disappearing from the restaurant, making it impossible to get drink refills or to get the check.",staff negative <sep> drink neutral
0,0,Reservations for parties under 5 people isn't allowed but their yummy cocktails and handsome waiters help soothe the pain.,Reservations neutral <sep> waiters positive
0,0,"I had fried chicken of which KFC runs circles around, and the fries were a knock off of poor burger king spuds.",fries neutral <sep> burger negative
0,0,"If you go, try the marinara/arrabiatta sauce, the mozzarella en Carozza is mmmmmmmm.",marinara/arrabiatta sauce positive <sep> mozzarella en neutral
0,0,We were not offered the dessert menu and that waiter was so rude!~ I was very offended after a good meal.,dessert menu neutral <sep> waiter negative
0,0,The manager sent us a complimentary glass of wine for the steak not being cooked like he wanted.,manager negative <sep> glass of wine neutral <sep> steak neutral
0,0,"Don't let the ambiance of this place fool you, the food is far better than many pricey establishments.",ambiance negative <sep> food positive
0,0,"The pot pie, pork chop and chicken were cleaned off the plates so well they didn't need washing.",pot pie neutral <sep> pork chop neutral <sep> chicken neutral <sep> plates positive
0,0,our dinner was marred by painfully slow service.,dinner neutral <sep> service negative
0,0,Drinks are overpriced; wine list is good.,Drinks negative <sep> wine list positive
0,0,I was interrupted by the waiter to say that when we are done with dinner he'd bring one.,waiter negative <sep> dinner neutral
0,0,There was only one server on duty and we waited a while for menus.,server positive <sep> menus neutral
0,0,"Great place to meet friends or co workers for drinks, dinner or both.",workers neutral <sep> drinks neutral <sep> dinner neutral <sep> place positive
0,0,"After waiting to get a table for over a half hour even though we had reservations, we went up to the host.",waiting negative <sep> reservations neutral <sep> host neutral
0,0,While the food was good (certainly no Il Mulino) the service was horrendous.,food positive <sep> service negative
0,0,"I go in for lunch whenever I can and have the thinnest sliced pastrami, along with fresh cut home-made potato chips.",lunch neutral <sep> potato chips positive
0,0,The kids really enjoyed their food and the value on the kids menu is good.,food positive <sep> value positive <sep> menu neutral
0,0,"Great decor, expensive drinks but worth the price, but the music is bland and the crowd is very cheezy.",decor positive <sep> price negative
0,0,Could have gone to Pastis for a salad three times the size for the same price.,salad neutral <sep> size positive <sep> price negative
0,0,"Friendly service, and outdoor seating in the warm months, eases the crush.",service positive <sep> seating neutral
0,0,We asked for the check and had to wait 20mins for the waitress to come back and take our card.,check neutral <sep> waitress negative
0,0,"Crowds do come on weekends, so be sure to make reservations.",Crowds negative <sep> reservations neutral
0,0,"When I really need good pizza I fly in From Arizona for a few pies, go to friends house , freeze them and fly home.",pizza positive <sep> pies neutral
