review_id,sentences_ids,sentences_texts,sentences_opinions
0,0,We had some sorta of kobe sashimi salad with coconut shavings which was phenomenol and a lobster ravioli.,kobe sashimi salad with coconut shavings positive <sep> lobster ravioli neutral
0,0,My friends and I went to dinner last weekend and had a great time.,dinner neutral <sep> time positive
0,0,The Food The best homestyle Italian cooking and service (Menu?,Food neutral <sep> homestyle Italian cooking positive <sep> service positive
0,0,"The waitress, host, and bus staff were sitting around at the bar while the patrons were all complaining about the service.",waitress negative <sep> host negative <sep> staff negative <sep> bar neutral <sep> patrons neutral <sep> service negative
0,0,The hostess SLOWLY walked by our table scribbing something on paper.,hostess negative <sep> table neutral
0,0,i went here on a whim and found out you could get sushi for half price kind of like happy hour.,sushi neutral <sep> price positive
0,0,The menu was much too narrow - 4 pastas and 6 meat dishes or so.,menu positive <sep> meat dishes neutral
0,0,We ordered the Tuna a la carte and Wild Salmon and chicken breast on the Prix Fixe.,Tuna a la carte positive <sep> Wild Salmon and chicken breast positive <sep> Prix Fixe neutral
0,0,"after dinner we went downstairs atmosphere was completely different , nice crowd , we stayed there more time than expected.",dinner neutral <sep> atmosphere positive
0,0,When we asked the waiter for water - he gave us dirty looks and it took at least 15 minutes to get it.,waiter negative <sep> water neutral
0,0,if you do though just wait at the bar (yummy drinks!,bar neutral <sep> drinks positive
0,0,"Food is decent but portions so small that after 5 appetizers, 2 sides and three entrees, the three of us left still hungry!",portions negative <sep> appetizers neutral <sep> sides neutral <sep> entrees neutral
0,0,"I have tried to make reservations, but both times, the hostess didn't have my name.",reservations neutral <sep> hostess negative
0,0,"An order of roast chicken is nicely crisped and moist, although the potato cubes alongside are limp.",roast chicken positive <sep> potato cubes negative
0,0,"Great when the band is playing, not so great when there's a large party at the bar.",band positive <sep> bar neutral
0,0,"We ordered off the restaurant week menu, which at other establishments means automatic second-rate service, but not here.",menu neutral <sep> service negative
0,0,Hostess was extremely accommodating when we arrived an hour early for our reservation.,Hostess positive <sep> reservation neutral
0,0,"The lunch specials are reasonably priced, but I avoid this place when I can only order off the regular menu.",lunch specials neutral <sep> priced positive <sep> menu neutral
0,0,"The tables are a little too close together, but when the food is this good it's difficult to be distracted.",tables negative <sep> food positive
0,0,Still the bill was close to $300(with 1 bottle of lower-priced wine).,bill neutral <sep> wine positive
0,0,But when the bartender messes up the returned drinks something is wrong.,bartender negative <sep> drinks neutral
0,0,our dinner was marred by painfully slow service.,dinner neutral <sep> service negative
0,0,The host greeted us warmly and eagerly and the wait staff was just as receptive.,host positive <sep> wait staff negative
0,0,The spaghetti with ricotta cheese is hands down my favorite thing on the menu and I am big fan of the house wine.,spaghetti with ricotta cheese positive <sep> menu neutral
0,0,The best out of the three entree's we had was the goat cheese ravioli.,entree neutral <sep> goat cheese ravioli positive
0,0,The happy hour crowd at the bar was mostly just out of worker blowing off steam.,crowd positive <sep> bar neutral
0,0,We had a 9:30pm reservation for two which stretched out to an hour wait.,reservation neutral <sep> wait negative
0,0,Particularly good is the chicken verde burrito with a refreshingly spicy salsa that avoids the heat overkill.,chicken verde burrito positive <sep> overkill negative
0,0,"Tables are a little cramped, but dinner or lunch for 2 is fine.",Tables negative <sep> dinner neutral
0,0,"We ordered two appetizers and two entrees and were absolutely stuffed, we couldn't even finish our meals.",appetizers neutral <sep> entrees neutral <sep> meals negative
0,0,Brunch at Cafe des Artistes was hands down the most terrible dining experience I have had in New York.,Brunch neutral <sep> dining negative
0,0,"our waiter noticed it was my bday w/o me saying, and brought me cake w/ candles.",waiter positive <sep> candles neutral
0,0,Our waiter brought the wrong dinner for me (shrimp provencal instead of the salmon) but then comped my meal with no question.,waiter negative <sep> dinner negative <sep> salmon neutral <sep> meal neutral
0,0,A few of us went the other night for cocktails (half price!),cocktails neutral <sep> price positive
0,0,"The salad I received was Iceberg lettuce with nothing else in it (no tomatoes, carrots).",salad neutral <sep> Iceberg lettuce neutral <sep> carrots negative
0,0,"BBQ is ordinal, and cole slaw is not even worth trying.",BBQ neutral <sep> cole slaw negative
0,0,The mussles appetizer was delicious along with my peppercorn steak.,mussles appetizer positive <sep> steak neutral
0,0,We made reservations for 6pm on Friday and it was not necessary BUT the place got packed really quick around 7-8pm.,reservations neutral <sep> place negative
0,0,"At the end of the meal, I politely asked the waitress whether she would comp something, and she said yes.",meal neutral <sep> waitress positive
0,0,"the wait for our drinks, appetizers and food was very long, the food was mediocre, and it was a bit pricey.",wait negative <sep> drinks neutral <sep> appetizers neutral <sep> food negative
0,0,No bar only a waiting area with about 10 tables where you can have drinks prior to dinner.,bar negative <sep> waiting area neutral <sep> tables neutral <sep> drinks neutral <sep> dinner neutral
0,0,My group and I cancelled whatever drinks we ordered (no food order since there was NO wait staff) and left.,drinks neutral <sep> wait staff negative
0,0,"It is a nice diner atmosphere, they have booths all around and a couple of middle tables.",diner atmosphere positive <sep> tables neutral
0,0,"I said, that would be fine and had the hostess confirm my reservation before hanging up.",hostess negative <sep> reservation neutral
0,0,The chef even came out with a sample some new appetizers he's working on (the tuna tartare is a keeper!,chef positive <sep> new appetizers neutral <sep> tuna tartare positive
0,0,"The Food The fun factor is high on the menu of experimental, multi-ethnic shared plates.",Food positive <sep> menu neutral
0,0,"Overall, I good place to take a date or have a small group of friends for dinner.",place positive <sep> dinner neutral
0,0,"The Crystal Ballroom was closed for a private party, so we couldn't even enjoy the decor.",Crystal neutral <sep> decor negative
0,0,"The Food When the counter guy asks, Would you like better fries with that?",Food neutral <sep> counter neutral <sep> fries positive
0,0,I had the lobster ravioli--good size portion with a delicious vodka cream sauce.,lobster ravioli neutral <sep> vodka cream sauce positive
0,0,"Although Sweet Melissa's food and pastries are very tasty, the unfriendly folks who work there sour the experience.",Melissa positive <sep> food positive <sep> pastries positive <sep> experience negative
0,0,"However, everything we ate was salted to an extreme, and the steak, so regrettably, was saturated with butter.",steak negative <sep> butter neutral
0,0,"One friend had the steak which he didn't care for, but after waiting so long to be seated he was hungry.",steak neutral <sep> waiting negative
0,0,We went inside to the lounge and found that there were several empty tables (which never ended up being occupied).,lounge neutral <sep> tables negative
0,0,"I drank beer, but I tried her apple martini, It was great not sour at all.",beer neutral <sep> apple martini positive
0,0,I took 8 clients to lunch and was appaled by the overall service.,lunch neutral <sep> service positive
0,0,"For breakfast there are a wide variety of whole grain pancakes; pumpkin is my favorite, blueberry second!",breakfast neutral <sep> grain pancakes positive
0,0,"For desert take the tiramisu, it is by far the best there.",desert neutral <sep> tiramisu positive
0,0,"They don't take reservations, though, so you have to get there by 8:00 to get a good table.",reservations neutral <sep> table positive
0,0,The staff had apparently booked the room for 2 groups with a 30 minute overlap.,staff negative <sep> room neutral <sep> overlap neutral
0,0,I can't imagine how small the fish portion on the $10 lunch menu must be if I got the large one.,fish portion negative <sep> lunch menu neutral <sep> one positive
0,0,I waited for 45 minutes for my entree to realize that the waiter never put the order in.,entree neutral <sep> waiter negative
0,0,The pizza is baked in a wood burning oven and the flavor is fantastic.,pizza neutral <sep> flavor positive
0,0,"Or better yet, if on a budget and want to do something romantic, stop at the bar for a drink and enjoy the sunset.",bar neutral <sep> sunset positive
0,0,"The place is hip and the decorations funky, but the food is lacking.",place positive <sep> food negative
0,0,"None of us were able to get drinks in a timely fashion, and the bartender was EXTREMELY rude to us.",drinks neutral <sep> bartender negative
0,0,The turkey burgers are thick and juicy and they pile the mushrooms on!,turkey burgers positive <sep> mushrooms neutral
0,0,"Coffee, treats, and the best of eerything.",Coffee neutral <sep> treats neutral <sep> eerything positive
0,0,"Many meals were delivered by two servers, besides having a waiter to oversea the process.",meals positive <sep> servers neutral <sep> waiter neutral
0,0,"We arrived about 15 minutes late for a Friday 12:30 reservation, but the staff couldn't have been nicer.",reservation neutral <sep> staff negative
0,0,"The portion size / price combo makes it expensive if you're really hungry, but we went for a late dinner.",portion size / price combo negative <sep> dinner neutral
0,0,"The singing wait staff are great, the food is just awful!!",singing wait staff positive <sep> food negative
0,0,I went on a saturday and the atmosphere was no more exciting than eating dinner at home.,atmosphere negative <sep> dinner neutral
0,0,"The spring rolls are great, tastes like any other rolls with meat filling and I had the soy protein ham dish (bad idea).",spring rolls positive <sep> meat neutral <sep> soy protein ham dish negative
0,0,We walked out the door with only a drink in each of us and the bill was still over $100.,drink neutral <sep> bill negative
0,0,We were rudely told by the waiter that chips are only available at the bar.,waiter negative <sep> chips neutral <sep> bar neutral
0,0,And to end the meal try some hazelnut gelato.,meal neutral <sep> gelato positive
0,0,"Space aside, service is ok but the food is really well done.",Space neutral <sep> food positive
0,0,It is a nice room with a cool bar and you should stop in for a drink and Tapas but dinner was very weak!!!!,room positive <sep> bar positive <sep> drink neutral <sep> dinner negative
0,0,I have been a waiter for many years and I can tell you that if bad service is given you at least apologize to the costumer.,waiter neutral <sep> service negative
0,0,My nice waitress even came running out of the restaurant to hand me a tiny box I had forgotten on the table.,waitress positive <sep> table neutral
0,0,"However, the food, once you get over the price, was very good.",food positive <sep> price negative
0,0,Their cappuccino's are served in a generous mug with a bit too much milk and too-sudsy foam.,served positive <sep> milk negative
0,0,"Other than the too fruity drinks at the bar which wasn't my cup of tea, everything else was excellent.",bar neutral <sep> tea negative
0,0,My only complaint is waiting a bit between the appetizer and the main course but it was well worth it.,waiting negative <sep> main course neutral
0,0,My partner had ordered an appetizer that was no longer available; the waitress did not inform us when reviewing the specials.,waitress negative <sep> specials neutral
0,0,"Smiling servers quiz diners with movie trivia, but forget to fill their water glasses.",servers positive <sep> diners neutral <sep> water glasses neutral
0,0,They were more than happy to seat us even though we were early for our reservation.,seat positive <sep> reservation neutral
0,0,I went with my sister and neither of us had wine so the final bill was a bit shocking.,wine neutral <sep> final bill negative
0,0,"Ignoring the plain decor, Jo-An is one of the best options for cheap japanese food on the Upper West Side.",decor negative <sep> japanese food positive
0,0,"I would recommend the Risotto with pear and spinach, the lasagna, and the salads.",Risotto positive <sep> spinach neutral
0,0,Food and service were very good but prices were a bit high for the portions.,Food positive <sep> service positive <sep> prices negative <sep> portions neutral
0,0,The only con is the price ($110 for two people for a full meal).,price neutral <sep> meal positive
0,0,"When you crave comfort food, make a reservation and head to Piccolo Angolo, they never dissappoint.",food positive <sep> reservation neutral
0,0,"service, one would be overpaying for the experience and for the food.",service positive <sep> food neutral
0,0,"The restaurant is loud, the tables are wooden and the service is OK.",tables neutral <sep> service positive
0,0,A collection of stormy sea paintings and two mermaid figureheads hoisting lights above the bar set a lulled maritime mood.,sea paintings positive <sep> bar neutral
0,0,Heartland is the best place in mid-town to grab a beer after work and meet the cuties that work in the building.,beer positive <sep> cuties neutral
0,0,The final blow came when the waitress scorned our 16% tip for the meal.,waitress negative <sep> meal neutral
0,0,The wine list was small but had a nice variety.,wine list negative <sep> variety positive
0,0,The wine did not come until we were half way through our entree and the waitress overcharged us by a bottle of wine.,entree neutral <sep> waitress negative <sep> wine neutral
0,0,Theme and actors are kinda cool but you are charged some entertainment fee on top of the expensive food and drinks.,actors positive <sep> food negative <sep> drinks negative
0,0,"Nice family place, nice atmosphere, but don't go there for pizza.",family place positive <sep> atmosphere positive <sep> pizza negative
0,0,"Go in, take a deep breath and expect great food, fairly priced with just about the worst service in North Jersey!",food positive <sep> service negative
0,0,"HIGHLY RECOMMENDED, MAKE RESERVATIONS FAR IN ADVANCE TO AVOID LONG WAIT TIMES.",RESERVATIONS neutral <sep> WAIT TIMES negative
0,0,"The ambience is diner-like and the wait staff is rushed, but at these prices, I can't complain.",ambience positive <sep> wait staff negative <sep> prices positive
0,0,"If you go, you have to order the beef ribs for appetizer, coconut char for entree and green donuts for dessert.",beef ribs positive <sep> appetizer neutral
0,0,"When our entrees came, at least 3 or 4 waiters / waitresses came by at different times to wish us bon apetit.",entrees neutral <sep> waitresses negative
0,0,When we arrived there was no free table so we waited at the bar for quite a long time.,table negative <sep> bar neutral
0,0,"The food is decent, but for what the bill comes to, it's just not worth it.",food positive <sep> bill negative
0,0,"Spring roll did not taste very fresh, soup ok but only had 2 shrimps.",Spring roll negative <sep> soup positive <sep> shrimps negative
0,0,"I have been a vegetarian for over 10 years, I do eat cheese but when a person is on a diet it is so hard to enjoy PIZZA.",cheese neutral <sep> PIZZA positive
0,0,I'd like to try their brunch - the menu looks good.,brunch neutral <sep> menu positive
0,0,"if you don't mind slow service and limited selections on the menu occasionally, then you might consider dining there.",service negative <sep> menu neutral
0,0,"The ambience was nice, but service wasn't so great.",ambience positive <sep> service negative
0,0,"I have to say that I've been there only during brunch time but the service even though slow, it was good.",brunch neutral <sep> service negative
0,0,"The waitress had zero knowledge about wine, and even knowledge about the dishes they were serving.",waitress negative <sep> wine neutral
0,0,The tasting menu experience lasted close to three hours and included six or seven food courses and three desert courses.,menu positive <sep> food courses neutral
0,0,This coffee shop offers many varieties of food.,coffee neutral <sep> food positive
0,0,The lemon goat cheesecake was extremely dry and practically begged for a nice sauce or some fresh fruit.,lemon goat cheesecake negative <sep> sauce positive <sep> fruit positive
0,0,Plenty of tables avail for no reservation in bar areain case you want to go on an expensive date for not so great food.,tables positive <sep> food negative
0,0,"I ordered chicken vindaloo, the delivery took about an hour, and it cost me $13 with tip.",chicken vindaloo neutral <sep> cost negative
0,0,The scene is reasonably cool but unworth more than a drink.,scene positive <sep> drink negative
0,0,"The Food In a health-conscious century, it's as likely to be the pub grub as it is the booze that does you in.",Food positive <sep> pub neutral
0,0,"It was my birthday and although they came out with of a bottle of bub, I felt embarrassed about the lack of service.",bottle neutral <sep> service negative
0,0,"Nothing too special about the location or the atmosphere, but DAMN, the pizza is good.",atmosphere negative <sep> pizza positive
0,0,I expected there to be more options for tapas the food was mediocre but the service was pretty good.,tapas neutral <sep> service positive
0,0,You wanna wait a hour for a cramped table to eat mom's macaroni and cheese?,wait neutral <sep> table negative <sep> cheese neutral
0,0,"Recently a seafood dish was so salty that that one flaw overshadowed otherwise excellent 'side' dishes, apps desert.",seafood dish negative <sep> 'side' dishes positive
0,0,Bread bar couldn't get anything right except water refills (good job to the water guy).,bar negative <sep> refills neutral
0,0,"Zero decor, this is not a date place--just a great place to get a quick, tasty and cheap meal.",decor negative <sep> meal positive
0,0,"fish was fresh enough, but the quality was only so-so (the salmon was especially sinewy).",fish positive <sep> quality negative <sep> salmon negative
0,0,The space is small and reservations are definitly needed.,space negative <sep> reservations neutral
0,0,For dessert the waiter reccomended his favorite which was a Torreja.,dessert neutral <sep> waiter positive
0,0,"Not the best ambience and the service is sometimes just mediocre, but the quality of the food is incredible.",ambience negative <sep> service negative <sep> food positive
0,0,the place is small but everything else is 'big' in terms of quality variety and smiles of the wait service.,place negative <sep> quality variety positive <sep> service positive
0,0,The plum wine at the end of the meal was a nice touch.,plum wine positive <sep> meal neutral
0,0,") Scores of employees walking around, but no one seems to clear a plate or offer more drinks.",employees negative <sep> drinks neutral
0,0,"The hummus was not flavorful and when we ran out of bread and asked for more, it never came.",hummus negative <sep> bread neutral
0,0,"One example, I ordered an appetizer that was not prepared as the menu stated and had to argue with waitress to get it fixed.",appetizer neutral <sep> menu neutral <sep> waitress negative
0,0,4 of had dinner here last Saturday and we were all very disappointed with the food and the service.,dinner neutral <sep> food negative
0,0,The Food Palm dry ages its steaks--as opposed to vacuum packing--and the result is evident.,Food negative <sep> steaks neutral
0,0,Although the prices are kind of high for lunch the atmosphere is nice.,prices negative <sep> atmosphere positive
0,0,"They also have great vegearian sushi options, try the AAC (avocado, asparagus and cucumber) roll!",sushi options positive <sep> asparagus and cucumber neutral
0,0,Waiters had to reach over people to deliver food.,Waiters negative <sep> food neutral
0,0,"Its great for people who want to try Korean food, but can't understand the servers or the menu on 32nd St.",Korean food positive <sep> servers neutral <sep> menu neutral
0,0,"The service and surroundings couldn't have been better, but the food was very disapointing at best.",surroundings positive <sep> food negative
0,0,"Noise level is high, and if you are a non smoker ask to be seated away from the bar.",Noise negative <sep> bar neutral
0,0,"Sometimes, the take-out and seating lines can be long, but the staff help move things along.",take-out neutral <sep> seating lines neutral <sep> staff positive
0,0,"The menu was nicely sized with five small plates, eight appetizers and seven entrees.",menu positive <sep> plates neutral <sep> appetizers neutral <sep> entrees neutral
0,0,"So maybe I'm naive to the latest trends in dining, but I really didn't like it.",trends negative <sep> dining neutral
0,0,"Her attitude put a damper on the evening, as did the stares from some servers when we took a peek into the cheese cellar.",servers negative <sep> cheese cellar neutral
0,0,On the table you will also find individual bottles of fine imported olive oil which we put on the bread-fantastic!,table neutral <sep> olive oil positive
0,0,"i went there for dinner on friday night, the waiter had a terrible attitude.",dinner neutral <sep> waiter negative
0,0,The service is excellent and always informative without an air.,service positive <sep> air neutral
0,0,Great wine list with an extra expensive selection for all you big spenders.,wine list positive <sep> selection negative
0,0,"Our waitress left halfway through dinner, without explanation, and was replaced by another waiter.",waitress negative <sep> dinner neutral
0,0,I had to chase down our waitress for the food and the bill.,waitress negative <sep> food neutral
0,0,Try the Duck Confit Hash (topped with two eggs) or the Beer Battered Fish Chips on the Brunch menu.,Duck Confit Hash positive <sep> Beer Battered Fish Chips positive <sep> Brunch menu neutral
0,0,The portions were overly generous for both the apps and entrees without sacrificing the quality.,portions negative <sep> apps positive
0,0,"The Food The secret to Nick's pizza is the sublime crust, which arrives caked in soot.",Food neutral <sep> pizza neutral <sep> crust positive
0,0,Their food is delicious and they send you cut up oranges to cleanse your palate after dinner which is a very nice touch.,food positive <sep> dinner neutral
0,0,"Be prepared to make friends with the people sitting next to you, tight seating.",people neutral <sep> seating negative
0,0,During the summer the outdoor area is a great place to sit and eat you pizza.,outdoor area positive <sep> pizza neutral
0,0,"The atmosphere was embracing and enticing and the costs of the meal, $45 to $55 in value.",atmosphere positive <sep> costs neutral
0,0,"Once seated, there was no waitress to give us our menus.",seated neutral <sep> waitress negative <sep> menus neutral
0,0,"We ordered the recommended dessert ahead of time as they suggested but when it came time for it, the waiter had forgotten it.",dessert neutral <sep> waiter negative
0,0,Someone should tell these people that high prices on the menu does not make your restaurant better.,prices negative <sep> menu neutral
0,0,"Although the homefried potatoes were not worth the plate space, next time I'll ask to substitute a nice salad.",plate space negative <sep> salad positive
0,0,"Come in the evening, sip a glass of wine, or two, and enjoy the great live jazz along with your dinner.",live jazz positive <sep> dinner neutral
0,0,"I sometimes long for their chicken fried steak and a beer, this place does the trick every time.",chicken fried steak positive <sep> beer neutral
0,0,This place is even good for just drinks after work (nice bar) I am going back there as soon as I get a chance.,drinks positive <sep> bar positive <sep> chance neutral
0,0,"I highly suggest you make reservations, as wait times can be extremely long.",reservations neutral <sep> wait negative
0,0,They later told us that our waiter had to fix the 'computer' - that was the reason he couldn't bring us our drinks.,waiter negative <sep> drinks neutral
0,0,"I go in for lunch whenever I can and have the thinnest sliced pastrami, along with fresh cut home-made potato chips.",lunch neutral <sep> potato chips positive
0,0,I went there for Easter Dinner and the pork chops were quite tasty.,Dinner neutral <sep> pork chops positive
0,0,"Although the prices is a bit on the high, you do get big portions for it.",prices negative <sep> portions positive
0,0,"After being seated at an outdoor table on a 45 degree tilt, the surly waitress gave us menus.",seated neutral <sep> outdoor table neutral <sep> waitress negative
0,0,I just had dinner there with my girlfriend and we had the best time.,dinner neutral <sep> time positive
0,0,Hey - What better excuse to sit at the bar and try another one of their fantastic drinks.,bar neutral <sep> drinks positive
0,0,"I have yet to visit for dinner, but had a lovely brunch there recently - the french toast is to DIE for.",dinner neutral <sep> brunch positive <sep> french toast positive
0,0,"From the goat cheese and caperberry dish to hangar steak to pancottas, the food was amazing!",goat cheese neutral <sep> dish positive <sep> steak neutral <sep> food positive
