review_id,sentences_ids,sentences_texts,sentences_opinions
35867,id_0,"Здравствуйте! 12.08.2014 мы отмечали нашу свадьбу в ресторане ""Фаворит"".",
27169,id_10,"Очень порадовал персонал: администраторы Елена, Марина, официант Николай.",персонал positive <sep> администраторы positive <sep> официант positive
2747,id_4,Хорошая вентиляция и меньше народу.,вентиляция positive
10847,id_10,"Суши панированные в рыбных сухарях или как-то так вызвали очень много восхищения, т.к. это было действительно вкусно.",Суши панированные в рыбных сухарях positive
13912,id_7,"Блюда в ресторане очень вкусные, качество приготовления, на наш вкус, гораздо лучше, чем в Харбине на Приморской (в целях сравнения заказали несколько блюд, таких же как и в другом ресторане).",Блюда positive <sep> качество приготовления positive
35486,id_8,"Мне хотелось встать и уйти, но так как это единственное место, где можно выпить пиво в окрестности, пришлось остаться.",
33252,id_4,"Первый раз попробовал свежесваренное пиво, теперь, наверное, никогда больше не смогу пить обычное разливное, а бутылочное - так тем более :))",свежесваренное пиво positive
15363,id_1,"Заведение светлое, стильное.",Заведение positive
34232,id_8,"Стейк был именно стейком, а не куском жаренного мяса.",Стейк positive
22970,id_3,"Я съела только тыквенный суп (понравилось, и булочки к нему подали очень вкусные), муж пил кофе.",тыквенный суп positive <sep> булочки positive
3480,id_2,"Ходим сюда с подругой поболтать и съесть бизнес-ланч,а с мужем поесть хорошее мясо и попить вино!)",мясо positive <sep> вино neutral
36725,id_5,"Очень вкусные десерты: тирамису, черничный пирог и черный лес.",десерты positive <sep> тирамису positive <sep> черничный пирог positive <sep> черный лес positive
24713,id_7,Фрукты были на последнем издыхании.,Фрукты negative
18430,id_0,В прошлую субботу посетили с друзьями это заведение.,
32206,id_6,"Суши в Асахи так себе, но их можно и не заказывать - есть отличные роллы, в любой по вашему желанию добавят сыр Филадельфия, кроме того, есть роллы без риса; неплохие сашими, замечательные легкие салаты (с лососем, крабом, тунцом), порции салатов большие, из горячего - душевный лосось терияки.",Суши neutral <sep> роллы positive <sep> сыр Филадельфия positive <sep> роллы без риса positive <sep> сашими neutral <sep> салаты positive <sep> порции салатов positive <sep> лосось терияки positive
1434,id_0,"Я как-то увидела, что на месте не безызвестного магазина открылся новый ресторан.",
31071,id_7,Чек на 4 девушек с вином получился около 6000.,
33591,id_2,"Все было замечательно - вкусная и обильная еда, большие блюда, обстановка, вежливая администратор Александра.",еда positive <sep> блюда positive <sep> обстановка positive <sep> администратор positive
34334,id_10,После праздника осталась куча еды и алкоголя!,
23878,id_6,"Меню разнообразное, цены адекватные.",Меню positive <sep> Меню neutral
1749,id_1,Пару дней назад заходили туда с друзьями.,
33665,id_7,"Что касается меню,мы заказывали по 2150 на человека,еды было такое огромное количество,что мы еще три дня ели.",еды positive
15655,id_4,Играет приятная музыка!,музыка positive
28083,id_9,"Обслуживала наш столик девушка Мария, еще раз хочется сказать ей большое спасибо!",девушка positive
35486,id_9,"Мой друг заказал цезарь с креветками (курицы не оказалось), который оказался и на вид и на вкус совершенно отвратительным.",цезарь с креветками negative <sep> курицы negative
35325,id_3,"Удобное место расположение, есть парковка.",место расположение positive <sep> парковка positive
16137,id_8,Провели.,
2606,id_5,"И эта официантка вместо, того чтобы вежливо разобраться, поступила по-хамски, в итоге принесла новый счет, со словами, не знаю...я не помню, что вы заказывали, но будь по-вашему...короче, подпортила настроение....так что приду я в это заведение еще не скоро снова",официантка negative <sep> заведение negative
36017,id_9,"Блюдо было нежнейшим, таяло во рту!",Блюдо positive
32859,id_6,"Судак просто сказка, очень вкусный и красивый и весь коллектив был просто в восторге.",Судак positive
10354,id_1,"Впервые посетили ""Чебурек"" c месяц назад - отмечали с друзьями прошедшую ранее свадьбу.",
12467,id_1,"Выбрали этот ресторан, так как живем поблизости...",
30368,id_5,"Перепробовали почти весь пивной ряд, каждый нашел пиво по вкусу.",пиво positive
9870,id_2,"Очень красивый и уютный каминный зал, прекрасный декор и интерьер!",каминный зал positive <sep> декор positive <sep> интерьер positive
36,id_5,"Делали много заказов, мой выбор пал на пасту с копчёной грудкой.",
14539,id_15,Обслуживали нас девушка и молодой человек.,
36017,id_0,Небольшой и уютный ресторан.,ресторан. positive
19111,id_6,"Сначала хотели заказать чешские спиртные напитки, но их не оказалось к сожалению, немного расстроились, но не сильно.",чешские спиртные напитки negative
33524,id_7,"И именно из за человеческого отношения официантов, я рад просто зайти на чашку кофе в свободное время.",официантов positive
32771,id_5,Мне очень хотелось отпраздновать День Рождение в хорошем грузинском ресторане.,
29321,id_3,Второй этаж просто рай какой-то=),Второй этаж positive
28710,id_2,"Ресторанов в Питере немало, но на этот раз наш выбор пал на Legran.",
1269,id_0,Добрый день!,
11825,id_8,"Филадельфию мне удалось только попробовать, сделали на отлично, хороший кусок лосося-филадельфии-чуток риса, смело возьму в следующий раз Десерт Тирамису просто таял во рту)))",Филадельфию positive <sep> лосося-филадельфии-чуток риса positive <sep> Десерт Тирамису positive
36381,id_5,"Ресторан создавал впечатление пустого, только приглядевшись можно было увидеть посетителей.",
9837,id_6,"В общем, атмосфера более чем радушная.",атмосфера positive
36589,id_2,"Ресторан очень уютный, вид из окон шикарный на центр города.",Ресторан positive <sep> вид из окон positive
1269,id_3,Но это на самом деле именно так.,
34232,id_13,Давненько я не покидала заведение такой довольной.,заведени positive
35085,id_1,Просто сходить стоит.,
12341,id_8,"В общем - я не в восторге от этого заведения, туда больше не пойду.",заведения negative
16714,id_4,Сервис оставляет приятное впечатление.,Сервис positive
33976,id_1,Праздничный ужин проходил на 3 этаже.,
33720,id_6,"Обслуживание понравилось, персонал вежливый, заказы приносят достаточно быстро.",Обслуживание positive <sep> персонал positive
6668,id_3,"Часто проезжали мимо, и вот выдался повод зайти.",
35635,id_1,Несколько лет посещаем ресторан 'Хутор Водограй'.,
36,id_15,"По контингенту можно понять, что ресторан для тех кому за 30, для семейных пар, просто для влюблённых.",
17999,id_5,"К столику постоянно приходили разные официанты, может 3 или 4....кому платить чаевые???????????????",официанты negative
19467,id_7,"Часов в 11 (сидели мы довольно долго) к нам подсели трое молодых людей, чтобы познакомиться.",
20784,id_12,"Порции вполне нормальные, не огромные, но и не маленькие.",Порции neutral
3976,id_2,Но теперь о ресторане.,
11116,id_9,"Причем начиная от официанток, заканчивая администраторами.",официанток negative <sep> администраторами negative
2364,id_3,"И кухня вкусная, а интерьер...",кухня positive <sep> интерьер positive
25960,id_0,Первые месяцы после открытия просто не могли нарадоваться такому классному местечку.,местечку positive
225,id_14,На десерт попробовали шоколадные кексы с горячим шоколадом внутри и мороженым.,
11102,id_4,Кроме того в одном из залов есть детский уголок!,детский уголок positive
1052,id_5,НО!,
18220,id_7,"""Капрезе"", медальоны,"" Цезарь"", фирменный ролл - особого восторга не произвели, но и нареканий тоже, а это уже не плохо, зато атмосфера (повторюсь) произвела неизгладимое впечатление.","""Капрезе"" neutral <sep> медальоны neutral <sep> "" Цезарь"" neutral <sep> фирменный ролл neutral <sep> атмосфера positive"
36166,id_4,"Живу в другом районе, но с радостью приезжаю именно сюда, да простят меня остальные мексиканские рестораны, за мексиканкой едой, атмосферой и отлично провести вечер!",мексиканкой едой positive <sep> атмосферой positive
11027,id_18,Спасибо огромное за чудесный ресторан.,ресторан positive
1200,id_5,"И уже итоговая сумма была дописана карандашом, я дала официантке банковскую карту на что она меня попросила счет который на чеке пробит оплатить картой,а обслуживание наличными.",официантке negative
9230,id_12,"В общем, все весьма достойно.",
35790,id_5,"Официант вежливый, быстрый, отвечает на вопросы, никаких претензий.",Официант positive
27169,id_1,"Выбор остановился на ресторане ""Эскалибур"".",
32771,id_9,"Интерьер - спокойные, теплые цвета.",Интерьер neutral
34307,id_7,"Официанта то не дождешься, то еще доесть не успел, уже тарелку забирают.",Официанта negative
33693,id_2,"Интерьер простой как внутри, так и снаружи.",Интерьер neutral
225,id_1,"Давно смотрели проезжая мимо на машине и, наконец, решились.",
35501,id_6,Что касается кухни….,
19467,id_0,"На днях я таки посетила Террасу, в которой не была уже пару месяцев.",
2073,id_3,"Да, неплохой интерьер, неплохая кухня... но все остальное просто ужас.",интерьер neutral <sep> кухня neutral
12467,id_0,В воскресенье посетили данное заведение с подругой.,
20784,id_9,Приборы даются не одни.,Приборы positive
3705,id_5,"Все очень вкусно и сытно, порции большие, объелись!",порции positive
34761,id_4,"Менеджер Алексей, который принимал наш заказ и подписывал договор, провёл всё мероприятие сам, чем очень нас порадовал.",Менеджер positive
31004,id_0,"Были с мужем, хотели отметить дату знакомства, НО!",
10625,id_1,"Было без пятнадцати девять, а кафе, как оказалось, закрывается ровно в девять вечера.",
33798,id_3,"Очень радует, что есть японская и итальянская кухни.",японская и итальянская кухни positive
18003,id_8,"НО, о, ужас, тут и был шок.",
6668,id_2,"""Квартиру №55"" выбрали из-за расположения и графика работы, ну и отзывы неплохие.","""Квартиру №55"" positive <sep> расположения positive"
3705,id_9,"Персонал дружелюбный, все улыбаются, постоянно подходят убирают со стола, предложили оформить накопительную скидку, что очень даже неплохо!",Персонал positive <sep> накопительную скидку positive
13225,id_4,"Отличная атмосфера заведения, обязательно будем посещать его ещё!!!",атмосфера positive
10663,id_10,"Девушка официантка (в чеке было написано Луиза) вежливая, обслуживание ненавязчивое, качественное.",Девушка официантка positive <sep> обслуживание positive
12131,id_6,"Кухня тоже порадовала,- отличные сочетания, хорошие порции, и все очень вкусно. я - сладкоежка, поэтому десертам - дополнительный плюс!)",Кухня positive <sep> порции positive <sep> десертам positive
13252,id_3,"Всегда выбираем второй зал, нам там кажется уютнее.",второй зал positive
35904,id_3,"Сервис на высочайшем уровне, большой выбор по меню и напиткам )приятный интерьер, тихо, спокойно!",Сервис positive <sep> меню positive <sep> напиткам positive <sep> интерьер positive
11155,id_4,"К сервису действительно никаких нареканий все было прекрасно(конечно долго ждали, но достойную еду можно и подождать),интерьер такого рода мне нравится, но еда была ужасна(может быть нам не повезло).",сервису positive <sep> интерьер positive <sep> еда negative
11155,id_15,"Вообщем сходили, посмотрели, поели...",
2692,id_9,Даже не так.,
10798,id_5,коктели и алкоголь видно что не разбавленные и тоже на 5+. в общем вывод один - еще и еще туда будм приходить и не раз! советую.,коктели positive <sep> алкоголь positive
12943,id_0,Были сегодня первый раз!,
12341,id_5,"Заказали чай, по вкусу был на самый дешевый похож.",чай negative
25507,id_11,"Но это того стоило..хорошо приготовлен, приправа в меру.",приправа positive
36407,id_7,"Ресторан красивый, большой, людей много, но никто не кому не мешает.",Ресторан positive
10354,id_3,"Кухня всем друзьям понравилась, обслуживание тоже (девушки-официантки замечательные).",Кухня positive <sep> обслуживание positive <sep> девушки-официантки positive
1427,id_5,"Обслуживание ненавязчивое, почувствовали себя как дома.",Обслуживание positive
15159,id_5,Недавно решил отпраздновать день рождения небольшой компанией и решил сходить сюда и освежить воспоминания.,
16137,id_19,Отличное место для большой компании.,место positive
27841,id_10,"Обслуживание на 10, все вовремя, мило и с улыбкой.",Обслуживание positive
12814,id_2,Но есть одно НО...,
3452,id_3,Но вполне съедобно.,
1032,id_2,Очень много недочетов как в работе официантов так и в блюдах. 1.,официантов negative <sep> блюдах negative
24713,id_15,"Свадьба, конечно, прошла весело, но качество еды ее не украсило.",еды negative
1434,id_3,Очень красивое и уютное место.,место positive
26152,id_17,Тирамису - выше всяких похвал.,Тирамису positive
18220,id_4,"Дело было вечером, поэтому зажгли свечи, убавили свет и..... господа и дамы, скажу Вам, что там стало настолько уютно, что никогда бы не подумал, что это заведение при дневном свете выглядит как кафе.",свечи positive <sep> заведение positive
31140,id_2,"Отличная кухня, обслуживание на высшем уровне,обстановка внутри как на картинке, давно такой красоты не видела=)",кухня positive <sep> обслуживание positive <sep> обстановка positive
23858,id_4,"Столик заказал заранее, еще в понедельник.",
11770,id_10,А жаль.,
14568,id_4,"Подруга брала один из восточных салатов, к сожалению не смогу воспроизвести точно название, но тоже осталась довольна!",восточных салатов positive
3236,id_2,"На мой взгляд, в меню нужно добавлять новые блюда хотя бы раз в год, чтобы людям было интересно попробовать что-то новое.",меню negative
12131,id_1,"Интерьер, интерьер, и еще раз интерьер!!! общее цветовое решение и каждая деталь - просто восхитительны!!! особенно на контрасте с популярным сейчас минимализмом, Дача - самое домашне-уютное и при этом очень красивое место.",Интерьер positive <sep> цветовое решение positive <sep> Дача positive
3152,id_2,"всего было много, и все было вкусно! в конце вечера мы забрали то, что осталось из еды и доедали дома.",еды positive
19439,id_5,"Интерьер впечатляющий, очень добротно, красиво, стильно.",Интерьер positive
16647,id_3,Кухня...это нечто.,Кухня positive
2965,id_5,"Ресторан выгодно отличается спокойной атмосферой,приятной, НЕ громкой живой музыкой,что оставляет шанс для приятной беседы.",атмосферой positive <sep> живой музыкой positive
33405,id_6,"И напоследок десерт, миндальный рулет....я не знаю как выразить это в словах, но вот пишу и уже облизываюсь!!!!",десерт positive <sep> миндальный рулет positive
26330,id_11,Всем Гроссенштрассе!!!!!!!!!!!!!!!!!,Гроссенштрассе positive
16378,id_0,"Сегодня были компанией из 4х человек, были уже далеко не в первый раз, но только сегодня вот собрался оставить отзыв.",
2468,id_11,сервис как он должен быть - в классическом стиле.,сервис positive
31778,id_6,Еще там очень пикольный бармен- внешне напоминает повара из мультиков!,бармен positive
16137,id_7,"Не дождавшись хоть какого-то внимания в наш адрес, подошли к ближайшей девушке-официанту, и попросили посадить нас за столик, заказанный ранее.",девушке-официанту negative
3152,id_8,"Очень веселый и позитивный человек, профессионал своего дела.",человек positive
32692,id_5,"Хочу отметить интерьер - стильный, теплый и уютный.",интерьер positive
11770,id_2,Хорошее обслуживание.,обслуживание positive
24578,id_6,Нас было четверо и мы все заказали пасту.,
32367,id_4,Ну а тут по совету начальника пригласил её в Дачу.,
24578,id_13,"На наше замечание девушка сказала, что у них какие-то проблемы на кухне.",девушка negative
17398,id_6,Надежда С.,
33252,id_9,"Развлекательная программа ресторана тоже понравилась, не только попили – поели, но и потанцевать удалось, короче, было весело :)",Развлекательная программа positive
2468,id_0,"Итак, начну с конца.",
36085,id_1,"Искала долго, так как по натуре достаточно привередливый человек и нашла это прекрасное кафе.",кафе positive
9878,id_1,Заказали из говядины и свинины.,
19111,id_4,"Были в воскресенье в 15:30, народу никого не было, это немного удивило, потом подошли еще люди конечно.",
34889,id_13,Здесь объективно - отличное место.,место positive
36321,id_1,Два дня подряд.,
