review_id,sentences_ids,sentences_texts,sentences_opinions
0,0,"The servers didn't know what tables the meals were going to, it was a complete comedy show.",servers negative <sep> tables neutral <sep> meals neutral
0,0,"Brunch is what Friend of a Farmer is known for, however dinner is equally impressive.",Brunch positive <sep> dinner negative
0,0,"One of the waitstaff spilled a huge drink on the floor that splattered everyone nearby, no offering of apology was made or to foot the drycleaning bill and no comp was offered either.",waitstaff negative <sep> drink positive <sep> drycleaning bill neutral
0,0,Dinner was very rushed - the waiter was bringing out the main course even before we had finished the appetizer.,Dinner negative <sep> waiter negative <sep> appetizer neutral
0,0,the quantity of food was a good size with tons of shrimp in our noodle dish.,quantity of food positive <sep> shrimp positive <sep> noodle dish neutral
0,0,"Asked for recommendations, waitress said read everything on the menu which already wasn't to unique.",waitress negative <sep> menu neutral
0,0,We approached the host and manager politely after the meal but only received a simple and insincere Sorry.,host negative <sep> manager negative <sep> meal neutral
0,0,"We are 30 plus year olds, very gainfully employed, were not being loud or obnoxious, there were other diners around us as well as a bunch of people at the bar and nobody seemed to have a problem with us except for this manager.",bar neutral <sep> manager negative
0,0,"At the end of the meal the waitress asked if we wanted another drink, the after agreeing to have one she stated, actually there's a list of people waiting, can you go next door to the bar.",meal neutral <sep> waitress negative <sep> drink neutral <sep> people waiting neutral
0,0,Hostess was extremely accommodating when we arrived an hour early for our reservation.,Hostess positive <sep> reservation neutral
0,0,Order the porterhouse and they put it between you and you kind of eat family style at a wooden table.,eat neutral <sep> style positive <sep> table neutral
0,0,I think that argentine cuisine can be match more interesting better that the insipid expirience that I had in this overpriced place.,argentine cuisine neutral <sep> place negative
0,0,"Went for lunch but wanted to order a la carte, which was so highly discouraged by the waiter (pushing the 10.",lunch neutral <sep> waiter negative
0,0,We were a large group and would highly recommend all the drinks and foodThe manager on duty was understanding that our friends were very late and held our reservation.,drinks positive <sep> manager positive <sep> reservation neutral
0,0,who seemed honestly offended that we asked why our table was 45 minutes late; a cold cafeteria room that was clearly designed to intimidate; and haute chinese food that was over-salted to make up for the lack of flavor.,table neutral <sep> cafeteria room negative <sep> chinese food positive <sep> flavor negative
0,0,"This is the place to come for coffee and dessert; they have an enormous and decadent selection of cakes, pies, and other things involving chocolate.",coffee positive <sep> dessert positive <sep> selection of cakes positive <sep> pies neutral <sep> chocolate neutral
0,0,"I wouldn't say Bubby's will blow you out of the water, but they provide a solid bunch served with good coffee.",water neutral <sep> coffee positive
0,0,The staff treated them like true royalty.,staff neutral <sep> royalty positive
0,0,"The inattentive waiters never refilled our water glasses, never offered more drinks, our silverware was never replaced, and it took almost half an hour at times for them to clear our table after we finished a course.",waiters negative <sep> drinks neutral
0,0,"It's the nicest place to nurse a cup of coffee (and the coffee is good), especially out in the little back garden.",place positive <sep> cup of coffee positive <sep> garden neutral
0,0,The Scene A stone-faced facade welcomes diners to a restaurant that feels barely touched by the neighborhood's rapid transformation into a nighttime hot spot.,Scene neutral <sep> spot positive
0,0,"The service is sweet and attentive, the wine is delicious and the new wine bar around the corner has the most amazing selection, as well as cheeses and tapas.",service positive <sep> new wine bar neutral <sep> selection positive <sep> cheeses positive <sep> tapas positive
0,0,"The service was good, but not excellent; however, the waiter was initially huffy with me when my guest was only 5 minutes late, threatening to make me move!",service positive <sep> waiter negative
0,0,"Increedible value, 3 courses $20 price fixe(menu changes everyday), organic seldom seen wines all around $20.",value positive <sep> menu neutral
0,0,I will have to say the food was good and the chance to sample wines not often found in other restaurants was a positive but the abyssmal service left a bad taste.,food positive <sep> wines neutral <sep> service negative
0,0,"I've been accustomed by the restaurant group's great service, so I was disappointed by the long wait for my lunch.",service positive <sep> wait negative
0,0,"Although the restaurant was far from crowded (maybe three tables), service was abysmally slow, to the point that we wondered if the server was trying to avoid us.",tables neutral <sep> service negative <sep> server negative
0,0,"Other than its impossible reservation (no matter how many months you call in advance, the only available time slots for dinner on a Saturday are always 4:45 or 9:45), Peter Luger is worth the drive over to Brooklyn.",reservation negative <sep> dinner neutral
0,0,"YYMV, we visited for Restaurant Week so the quality of the food may have been below normal standards because of the crowds.",quality negative <sep> food neutral
0,0,"The waiters can shoot off a 5 minute long list of specials, and they know the menu very well.",waiters positive <sep> menu neutral
0,0,"This is a don't miss if you are anywhere close to the area, but if you're going for lunch, be there by noon to avoid a wait.",are a neutral <sep> lunch neutral <sep> wait negative
0,0,"Went to dinner with friends, food was good, but the waitress was snippy, gave several exasperated sighs, kept pushing us to order more wine - on a sunday night - and now I realize that she added an eztra 20% to my debit charge.",dinner neutral <sep> food positive <sep> wine positive
0,0,Where else can you go to get freshly made Italian food at ridiculously low prices?,food positive <sep> prices negative
0,0,Have the kitchen split as an appetizer its signature cheese and linguini pasta that is curled in a large round cheese bowl that look like a giant candle right at your table.,appetizer neutral <sep> signature cheese neutral <sep> pasta neutral <sep> round cheese bowl positive
0,0,from the legendary Big Mac to new and exciting menu items like Chicken Parm and the Big Extra Mickey D's is always expanding their menu!,legendary Big Mac neutral <sep> menu items positive <sep> Chicken Parm positive
0,0,"My companion went to the bathroom and overheard the waiter singing near the back of the place The cappuccino machine is broken, It's broken.",bathroom neutral <sep> waiter negative
0,0,Come hungry but be careful not to order too large an appetizer because it would be a shame to waste their scallion pancakes because you've gotten too full prematurely.,appetizer positive <sep> scallion pancakes neutral
0,0,A few of us went the other night for cocktails (half price!),cocktails neutral <sep> price positive
0,0,Amazing views of NYC regaled us at lunch earlier in the week and then at dinner this evening.,views positive <sep> dinner neutral
0,0,"When spending upwards of $200 for dinner for two, I expect better service.",dinner neutral <sep> service positive
0,0,The portions are big so you can split an appetizer.,portions positive <sep> appetizer neutral
0,0,"We had to wait 30-45mins after we were already seated to get our orders in, waited what felt like an hour to get our food, was not given utensils with our dinner (had to wait for that too), and had the wrong dessert brought to our table and never remedied even after we brought it to the waiter's attention.",food neutral <sep> dinner neutral <sep> dessert negative <sep> waiter negative
0,0,"My experience at the The Pearl Room was like no other place in Bay Ridge, you walk into a dimly lit atomsphere and a well dressed crowd.",Pearl Room neutral <sep> crowd positive
0,0,"Fresh, original, creative, absolutely delicious - Perhaps I would chose a table at this cozy Italian corner versus an NYC top 5?",table neutral <sep> corner positive
0,0,"I had fried chicken of which KFC runs circles around, and the fries were a knock off of poor burger king spuds.",fries neutral <sep> burger negative
0,0,"The restaurant has a Family feel, not least with regard to the portions which are enormous; the veal alone could have single-handedly solved third world famine.",portions positive <sep> veal neutral
0,0,"We asked the chef if it was possible to have two different tasting menus, to which he was quick and eager to comply.",chef neutral <sep> menus positive
0,0,"The wait could be long because of the limited number of seats but it is worth it, especially if you leave your cell phone # with them and go off for a drink at any one fo the excellent bars nearby, like lokie, great lake, etc.",wait negative <sep> drink neutral
0,0,For entrees the suckling pig is a ho-hum pile of pulled pork and the fish-of-the-day was merely good.,entrees neutral <sep> suckling pig positive <sep> pork positive
0,0,"straining to read the menu under the low-lighting-tag-sale-chandelier motif, we were able to order a salad, tapas, and entrees from the first of several waiters, none of whom were able to introduce themselves, recommend dishes, present silverware, remove plates, or deliver water when asked.",menu neutral <sep> salad neutral <sep> entrees neutral <sep> waiters negative <sep> dishes neutral <sep> plates neutral
0,0,"Our server seemed out of it, and drinks took 15 minutes to arrive.",server negative <sep> drinks neutral
0,0,"Customers MUST order one entre each if dining outdoors, they will not seat you unless your entire group is present (nor will they hold a table) and they make it clear that they want to turn tables.",dining outdoors neutral <sep> seat negative
0,0,"The restaurant has a somewhat unique decor, with portrait of the owner meditating and books about meditation.",decor positive <sep> owner neutral
0,0,"Also, be wary of what time of the day you go; around dinnertime, the restaurant becomes a jungle of diners and hustling waitresses.",diners neutral <sep> waitresses negative
0,0,This review is based on breakfast/brunch: I called on Saturday for a table the next day (knowing it was unlikely that I'd get one) and the reservations person told me that there were no tables available.,reservations neutral <sep> tables negative
0,0,"When the pizza arrived it was definitely hot, however the topping was rather soggy from the moisture from the fresh tomatoes.",pizza positive <sep> topping negative <sep> tomatoes positive
0,0,I realized that you dont have to wait hours and pay crazy prices for food.,prices negative <sep> food neutral
0,0,"The service is a bit slow, but harkens back to my years growing up in Napoli, Italy where things are not rushed and when you sit down for dinner the table is yours all night.",service negative <sep> dinner neutral
0,0,The bright point of dinner was dessrt.,point positive <sep> dinner neutral
0,0,"food arrived quickly and was hot and v good, just don't be on a diet if you are going to eat here as no real options for slimmers!!",food positive <sep> options neutral
0,0,Chef Anthony is warm and is always fixing up something unique and tasty in the kitchen to send to your table.,Chef positive <sep> table neutral
0,0,"From the intricately decorated plates to the elaborate sushi dishes, it is everything a Japanese dinner should be.",elaborate sushi dishes neutral <sep> Japanese dinner positive
0,0,Went for dinner around 9pm on a Sunday night and sourdough bread they brought right away was warmed to perfection and delicious.,dinner neutral <sep> bread positive
0,0,"An order of roast chicken is nicely crisped and moist, although the potato cubes alongside are limp.",roast chicken positive <sep> potato cubes negative
0,0,The staff was knowledgeable about the cuisine and answered my dining questions with professionalism and style.,staff positive <sep> cuisine neutral
0,0,The waiter (someone I know has been working there since it was just LCB) POURED MY WINE FROM THE DIRTY GLASS INTO A CLEAN ONE AND SERVED IT TO ME!,waiter negative <sep> WINE neutral
0,0,I think I'm going to start taking the food and coffee to go b/c everytime I go there (which is quite often) I get more frustrated with the service.,food neutral <sep> coffee neutral <sep> service negative
0,0,The kitchen would do well to offer more desserts--the one option of Eight Treasure Sticky Rice connotes a Chinese fruit cake--but the drinks downstairs encourage one to linger.,kitchen positive <sep> desserts positive <sep> Rice connotes positive <sep> Chinese fruit cake neutral
0,0,The guacamole was below average compared to any other decent Mexican restaurant.,guacamole negative <sep> Mexican restaurant positive
0,0,"However, the service has SIGNIFICANTLY declined since they expanded into the back room.",service negative <sep> room neutral
0,0,"The main meal, a red snapper, was not bad, but after hoping I would experience a true spanish experience, the remaining dinner lost its appeal.",red snapper positive <sep> remaining dinner negative
0,0,"Risotto's, Sushi Tuna, wasabi aioli, Steak Frite, and the Best weekend Brunch in Queens.",Sushi Tuna neutral <sep> wasabi aioli neutral <sep> Steak neutral <sep> Brunch positive
0,0,i also like their cocktail menu and dessert menu (try the black tea rose ice cream and the coconout waffles).,cocktail menu positive <sep> dessert menu positive <sep> black tea rose ice cream neutral
0,0,"There's no bar, only beer and wine, and you're likely to be annoyed by unruly Park Slope offsprings, so come late and enjoy the smart wine list.",bar neutral <sep> wine list positive
0,0,Lobster bisque is a 10+ and Steaks ; fish and cajun shrimp app are standouts!,Lobster bisque positive <sep> Steaks neutral <sep> fish and cajun shrimp app positive
0,0,"For every simple winner like Newport steak with pistachio salsa verde, there's an overconceived braised lamb with cinnamon, olives and cilantro or a meek salt- and pepper-crusted shrimp with citrus slices.",steak with pistachio salsa neutral <sep> braised lamb positive <sep> olives neutral <sep> citrus slices neutral
0,0,Waiters had to reach over people to deliver food.,Waiters negative <sep> food neutral
0,0,"They offer a small but good selection of beer and wine from India, and their cuisine can please the most spice-averting palates of those American friends of yours who claim to not like Indian food.",beer and wine positive <sep> cuisine positive <sep> Indian food negative
0,0,After being seated the waiter was prompt with coffee and taking my order.,waiter positive <sep> coffee neutral
0,0,I had oysters for my appetizer and the Turbot with a delicate creamy lemon sauce with a hint of dill for dinner.,oysters neutral <sep> appetizer neutral <sep> Turbot neutral <sep> creamy lemon sauce positive <sep> hint of dill neutral <sep> dinner neutral
0,0,And Mondays fajita are half price all night.,fajita neutral <sep> price positive
0,0,The only problem my party found was that when people asked for knives and forks (there were only chopsticks on the table) the waitress laughed at them.,chopsticks neutral <sep> waitress negative
0,0,"the food was excellent, although they didn't have any dishes with meat, and the soy replacements definitely were not a replacement for meat.",food positive <sep> dishes negative <sep> soy negative
0,0,Generous portions of rice porridge and noodles really hit the spot after fighting the crowds on a busy weekend in Chinatown.,portions of rice porridge positive <sep> noodles positive <sep> crowds negative
0,0,"After reading all the reviews here and many glowing recommendations on food blogs, I thought I MUST try this pizza!",food neutral <sep> pizza positive
0,0,The waiter never once came back to our table to ask how our meal was OR if we needed another drink.,waiter negative <sep> meal neutral
0,0,"The margaritas took me on an instant vacation, and although there was a bit of a wait for a table, the food was well worth it.",margaritas neutral <sep> wait neutral <sep> food positive
0,0,Our meal was capped of with the waiter rudely saying he needed the table for other customers.,meal neutral <sep> waiter negative <sep> table neutral
0,0,"The Food The free chips-and-salsa may suggest casual Tex-Mex cooking, but this menu is a couple notches above.",Food neutral <sep> menu negative
0,0,Serving things like Chicken Kiev with a garlic mashed potato egg roll for $$ with the snooty attitude to match!,Chicken Kiev neutral <sep> attitude positive
0,0,Yuckity Yuck Yuck  The Burritos were horrible but the Sangria was decent.,Yuckity negative <sep> Sangria positive
0,0,"Do not use this place unless you want to waste your money on horrible stale cheese and food, service which takes your drinks away from the table once you've placed it on the table, waiters that eat your desert while its on the table, non working faucets in the bathroom, and overall very unporfessional service and food.",cheese negative <sep> drinks neutral <sep> waiters negative <sep> bathroom neutral
0,0,Even the expensive (11-20$) fru-fru drinks lacked flavor and quality ingredients.,drinks negative <sep> flavor negative <sep> ingredients neutral
0,0,The service on our visit was absolutely awful - a waiter and two helpers couldn't get our orders right and ignored several pleas for basics such as water and beverage refills and utensils to eat desserts with.,service negative <sep> waiter negative <sep> water neutral
0,0,"My friends and I dropped by on a Sunday, and there was absolutely NO SERVICE (the supposed only female bartender even told us there was no one else but her, and given that there were people in there waiting to dine and drink, that was ridicoulas!",SERVICE negative <sep> dine neutral <sep> drink neutral
0,0,"It's got funky, fun furniture and a round bar at the front, which is convenient for those waiting to be seated and be prepared to wait for a while, if you don't have reservations.",furniture positive <sep> reservations neutral
0,0,"The Food Meat is the name of the game here, especially if you are a fan of mutton: the legendary chop is rightly gamey and thick as a brick.",Food Meat neutral <sep> chop positive
0,0,"Best Baked Ziti in the area, great classic NY pizza.",Baked Ziti positive <sep> area neutral <sep> NY pizza positive
0,0,"my husband has certain food allergies, and they were 100% accomodating even for the tasting menu which is seven courses for $50 - they even substituted dishes for ones that he couldn't have.",food neutral <sep> menu positive <sep> dishes neutral
0,0,"Didn't have room for dessert, but will definitely be back to try the coconut mousse.",dessert neutral <sep> coconut mousse positive
0,0,"Although the homefried potatoes were not worth the plate space, next time I'll ask to substitute a nice salad.",plate space negative <sep> salad positive
0,0,"There is a huge line, usually a 45 minute wait; they take no reservations and no tables of more than five people.",wait neutral <sep> reservations negative <sep> tables negative
0,0,"The french fries are soggy, the service is so/so and while it looks like a cute little homestyle cafe you'd find in SF, the food is below average.",service neutral <sep> food negative
0,0,"We ordered the recommended dessert ahead of time as they suggested but when it came time for it, the waiter had forgotten it.",dessert neutral <sep> waiter negative
0,0,"The hamburger showed up long before the mussels, and the waiter suggested I start eating because he didnt want my food to get cold.",mussels neutral <sep> waiter positive <sep> food neutral
0,0,their filet mignon was prepared very well but lacked the flavor and savvy I generally require food at that price to have.,filet mignon positive <sep> food neutral
0,0,One server came and gave us food that turned out to be someone else's.,server negative <sep> food neutral
0,0,"the food was pretty nice, but it's on the expensive side.",food positive <sep> side negative
0,0,"We had to wait an hour before our food was served, then another hour inbetween courses, all the while whilst the staff were naughtily hiding in an attempt to avoid our 'where's out food?'",served neutral <sep> courses neutral <sep> staff negative
0,0,Though the service is speedy be prepared to wait at least 20 minutes for the soup dumplings.,service positive <sep> soup dumplings negative
0,0,"Though the menu is brief, entrees range from a deeply satisfying, wintry seared calf's liver with oven-dried tomatoes to a much lighter striped bass drizzled with textbook perfect beurre blanc.",menu neutral <sep> entrees positive <sep> striped bass positive
0,0,The waiter set down my companion's meal and didn't return with my dish for some time.,waiter negative <sep> meal neutral <sep> dish neutral
0,0,"The manager also managed to insult one of my dining partners, even using an expletive to mock his last name when returning his credit card.",manager negative <sep> dining neutral
0,0,"The staff were all partying with each other at the bar, so even though we were the only ones there for food, it took 15 minutes to get menus.",staff negative <sep> bar neutral <sep> menus neutral
0,0,If the food is out of your price range then at least go for happy hour for a drink - although the drinks cost a bit more then the average happy hour bar after you receive one you would agree that it is worth it.,price negative <sep> bar neutral
0,0,"Twister shrimp - too salty and nothing spectacular; Mango sorbet - so flavorful and rich, it tasted like ice cream!",Twister shrimp negative <sep> Mango sorbet positive <sep> ice cream positive
0,0,"Their seafood is fresh-- have their fried soft-shell crab, or their whole fish with red chiles and basil.",seafood positive <sep> fried soft-shell crab neutral <sep> whole fish with red chiles neutral <sep> basil neutral
0,0,I recently attended a celebratory dinner here and I just want to warn everyone that the service is the worst I have ever experienced!,celebratory dinner neutral <sep> service negative
0,0,"The Food There's more here than top-quality sushi and sashimi, like sugar-coated foie gras with cashews and balsamic ginger sauce.",Food neutral <sep> sashimi positive
0,0,The food is well thought out and each bite should contain a little of everything on your dish for the full effect.,food positive <sep> dish neutral <sep> effect positive
0,0,"After waiting to get a table for over a half hour even though we had reservations, we went up to the host.",waiting negative <sep> reservations neutral <sep> host neutral
0,0,"We were lucky because chef Gari was there when we visited, and himself prepared the platter for us.",chef positive <sep> platter neutral
0,0,"26 seats also has the most reasonable prices in NYC, it is a true gem.",seats neutral <sep> prices positive
0,0,"They don't take reservations, though, so you have to get there by 8:00 to get a good table.",reservations neutral <sep> table positive
0,0,The entire restaurant staff was disappointing to begin with (any waiters over 17 with some knowledge of the menu or wine?,staff negative <sep> waiters negative <sep> menu neutral
0,0,"Generally, the food was fine, but the table is too small to eat comfortably.",food positive <sep> table negative
0,0,I wasn't impressed by dessert - I ordered truffles w/ bisquits.,dessert negative <sep> w/ bisquits neutral
0,0,However when I returned to my table the waiter immediately came over and said So I guess we are celebrating a birthday here.,table neutral <sep> waiter negative
0,0,"i always scour citysearch for recommended dishes so here are mine: start with pork and pear appetizer (of asian pear and pork), have eel and cream cheese on top of multigrain rice (but do share it's big portion) and you must try beef with gingseng in stone pot.",dishes positive <sep> pear appetizer neutral <sep> asian pear neutral <sep> multigrain rice neutral <sep> beef positive
0,0,The food was scrumptious-not the usual wedding.,food positive <sep> wedding neutral
0,0,Before our server took our drink order she told us that the prices on the menu were going to be higher that night because of the party.,server negative <sep> drink neutral <sep> prices negative <sep> menu neutral
0,0,"Service was a tad spotty, but the food was VERY good and the noise never detracted from the dining experience.",Service negative <sep> food positive <sep> experience negative
0,0,The waitstaff can be hard to track down and uninformed about the menu.,waitstaff negative <sep> menu neutral
0,0,Waiter had to lean on my husband to give people next to us their food.,Waiter negative <sep> food neutral
0,0,"We asked for the manager who told us that it was their first time serving brunch, to be patient and that our bill would be discounted.",manager positive <sep> serving brunch neutral
0,0,"The wait staff was attentive without being overbearing, and our waiter gave thoughtful advice on dishes that would be suitable for the children.",wait staff positive <sep> dishes neutral
0,0,employees not fighting with each other in front of clients 3 having ALL the ingredients for the meals they have on there menue.,employees negative <sep> ingredients neutral
0,0,"Waited for a table, got disgusting martinis at the bar, and sat down.",table neutral <sep> martinis negative <sep> bar neutral
