review_id,sentences_ids,sentences_texts,sentences_opinions
0,0,"The line moves quickly, perhaps because there are no alcoholic drinks, which cuts lingering at the tables to a minimum.",line positive <sep> drinks neutral
0,0,Just look at all those people waiting outside to feat in an unadorned space of cramped shared tables?,waiting neutral <sep> space positive
0,0,"Beautifull people, and a dj that was making me just want to stay and drink more!",dj positive <sep> drink neutral
0,0,"We arrived on Tuesday (party of 2) at 6:55 sharp and the place was empty, with just a few people sitting at the bar.",place negative <sep> bar neutral
0,0,The hostess was snooty since we did not have a reservation but the rest of the dining experience amply made up for it.,hostess negative <sep> dining neutral
0,0,"I've only had take-out from here but a couple of their dishes, along with the spicy green and orange sauces, are amazing.",take-out neutral <sep> dishes neutral <sep> spicy green and orange sauces positive
0,0,"ONE OF THE BEST PIZZA IN BROOKLYN , NEED AN AC FOR SUMMER.",PIZZA positive <sep> SUMMER neutral
0,0,Portions were certainly substantial for lunch.,Portions negative <sep> lunch neutral
0,0,The food is spicy like it should be not swimming in oil like it is at song down the street.,food positive <sep> oil negative
0,0,The prices were very resonable when you don't factor in the cost of beer (which seemed to be on the high side).,prices positive <sep> cost of beer neutral
0,0,If you want to have fresh grill fish served just with virgin olive oil and lemon Telly's Taverna is the place for you.,grill fish served positive <sep> virgin olive oil neutral
0,0,"As for the food, it is way too rich/greasy, whether it was the calamari or grilled chicken.",food negative <sep> grilled chicken neutral
0,0,"Zero decor, this is not a date place--just a great place to get a quick, tasty and cheap meal.",decor negative <sep> meal positive
0,0,"My favorite is a dish I've treasured since childhood, linguine with white clam sauce, cooked with pepperoncino.",dish positive <sep> white clam sauce neutral <sep> pepperoncino neutral
0,0,"We sat near the sluggish, hot and very loud kitchen and the service area was not wiped down once during the entire time.",kitchen negative <sep> time neutral
0,0,Yes you have to wait to be seated and because its small there is no waiting area and the seat at the bar was all taken.,waiting area negative <sep> bar neutral
0,0,The waiter and busboy apologized for the host who claims to have done this many times in his 13 years in the biz.,waiter positive <sep> host negative
0,0,I used to love the Dog but now its become a metling pot of really undesirable people.,Dog positive <sep> pot negative
0,0,I had spicy halibut with some sauces I can't remember.,halibut positive <sep> sauces neutral
0,0,Particularly good is the chicken verde burrito with a refreshingly spicy salsa that avoids the heat overkill.,chicken verde burrito positive <sep> overkill negative
0,0,I dined at Belleville and my meal was distrupted by the manager yelling at the wait staff in the middle of the dining room.,meal neutral <sep> manager negative <sep> wait staff negative <sep> room neutral
0,0,the setup is cool with pool table and chill area in front and dining on side and back.,area positive <sep> dining neutral
0,0,"We asked for our check (to pay for our drinks and leave), and received the quickest service all evening.",drinks neutral <sep> service positive
0,0,The food is good whether you are going for dinner or just for a couple of drinks and a small appetizer.,food positive <sep> dinner neutral <sep> drinks neutral
0,0,"In summer, the small outdoor garden is an ideal place to sip coffee while reading under a canopy of trees and sky.",outdoor garden positive <sep> coffee neutral
0,0,A few times at the bar I felt as though the Sushi chef an older gentleman was laughing at me and my girlfriend.,bar neutral <sep> gentleman negative
0,0,"Although the pricing is on the more expensive side, this is a must try restaurant for its food.",pricing negative <sep> food positive
0,0,as an appetizer we had some amazing citrus shrimp and for our main courses we each got a pasta dish.,appetizer neutral <sep> citrus shrimp positive <sep> pasta dish neutral
0,0,The shrimps looked old and had a sheen to them that you see at an all you can eat buffet at Sizzler.,shrimps negative <sep> buffet neutral
0,0,"At this level, I want my servers to know more than me about the food and I didn't get that sense.",servers negative <sep> food neutral
0,0,We reserved the downstair lounge for private parties and the price was fairly reasonable.,downstair lounge neutral <sep> price positive
0,0,4 of had dinner here last Saturday and we were all very disappointed with the food and the service.,dinner neutral <sep> food negative
0,0,"Our waitress left halfway through dinner, without explanation, and was replaced by another waiter.",waitress negative <sep> dinner neutral
0,0,Knock off 15-20% of the prices and you have a decent night out.,prices neutral <sep> out positive
0,0,Any sandwich or appetizer on the menu is delicious.,sandwich positive <sep> menu neutral
0,0,"My husband and I sat at the bar, and service was excellent.",bar neutral <sep> service positive
0,0,interesting back patio - curious what it would be like for lunch.,back patio positive <sep> lunch neutral
0,0,"The service is smart and though they can be overwhelmed with the crowds, does a good job.",service positive <sep> crowds neutral
0,0,Enough space between tables that you don't feel crowded or that it's too loud.,space positive <sep> tables neutral
0,0,The good service started from the moment we walked in the front door.,service positive <sep> door neutral
0,0,Service during either brunch or dinner could be quicker and more attentive at times.,Service positive <sep> dinner neutral
0,0,I will say that often times they make their drinks very strong (may tell your bartender / waitress to keep it mild).,drinks negative <sep> bartender neutral <sep> waitress neutral
0,0,"Since the waiter NEVER checked on us during the meal, she never had the chance to ask for hoisin.",waiter negative <sep> meal neutral
0,0,The wasabi mashed potatoes were delicious while the chicken was dry.,wasabi mashed potatoes positive <sep> chicken negative
0,0,"Two minutes later, the waitress said we NEED the table, you can not have the appetizer that you ordered.",waitress negative <sep> appetizer neutral
0,0,"In addition, they lack basic ammenities like a toaster, and the decor was shabby, at best.",toaster neutral <sep> decor negative
0,0,Bread bar couldn't get anything right except water refills (good job to the water guy).,bar negative <sep> refills neutral
0,0,"I go in for lunch whenever I can and have the thinnest sliced pastrami, along with fresh cut home-made potato chips.",lunch neutral <sep> potato chips positive
0,0,The rolls are tiny so you have to order more anyway and they will often get your order wrong if you stray from the menu.,rolls negative <sep> menu neutral
0,0,Great place to get a good fulfilling meal but do not go for ambience or service.,fulfilling meal positive <sep> ambience negative <sep> service negative
0,0,Take out and delivery is next door and usually will be better if you are looking to get your food faster.,delivery neutral <sep> food positive
0,0,The crust was a crispy tan dream come true with those little blackened air bubbles and chewy center.,crust positive <sep> blackened air neutral
0,0,"Ok, it's not greasy steak and juicy burger good, but it's a light healthy fare, if you are into that kind of stuff.",fare positive <sep> stuff neutral
0,0,"), the BBQ salmon was good if not a bit too salty from the heavy miso.",BBQ salmon positive <sep> miso negative
0,0,"The place was jumping on a Mon nite, as was the bar, but with a nice mixed crowd.",bar neutral <sep> mixed crowd positive
0,0,Chef Anthony is warm and is always fixing up something unique and tasty in the kitchen to send to your table.,Chef positive <sep> table neutral
0,0,Service was good except the waitress brought over the check before I asked her.,Service positive <sep> waitress negative
0,0,"Waitress was nice but didnt know some specials and was alittle off, think she was new.",Waitress positive <sep> specials neutral
0,0,"Once we had ordered etc, the wait for our meal was not long and the food was fabulous.",wait positive <sep> food positive <sep> meal neutral
0,0,Mango ice cream or coffee-flavored gelatin finishes the flavorful journey.,Mango ice cream neutral <sep> journey positive
0,0,The service is ok since it is new and the staff didn't know the food items too well.,service positive <sep> staff negative <sep> food neutral
0,0,"Last visit, ignored by our waiter, we finally got beers and ordered food.",waiter negative <sep> food neutral
0,0,"I said, that would be fine and had the hostess confirm my reservation before hanging up.",hostess negative <sep> reservation neutral
0,0,The place was practically empty when my friends and I got there for dinner.,place negative <sep> dinner neutral
0,0,the foods so tasty(the soup maybe a little blandbut ill forgive them only because everything else is out of this world.,foods positive <sep> soup negative
0,0,"One thing that is great is there is a pitcher of water at each table, great for people who can't handle the spices.",water positive <sep> spices negative
0,0,The wait staff was better the second time around and our water glasses were always full.,wait staff positive <sep> water glasses neutral
0,0,"Got a table during restaurant week for lunch and the service was cordial, if slower than usual.",lunch neutral <sep> service positive
0,0,"The food was OK, but I could have had pasta with tomatoes anywhere.",food positive <sep> pasta with tomatoes anywhere neutral
0,0,"the waiters had a really hard time remembering to bring drinks, and when they did they were not what was ordered.",waiters negative <sep> drinks neutral
0,0,"We started at the bar with a nice bottle of wine, which was priced fairly and sampled several different cheeses.",bar neutral <sep> bottle of wine positive <sep> cheeses positive
0,0,"Justin our waiter, explained to us that the menu changes daily, more of a reason to return.",waiter negative <sep> menu neutral
0,0,"You can only sit on the stools with a slice, as the main dining area downstairs is for real food.",main dining area neutral <sep> food positive
0,0,"I did like the shrimp dish, but I don't know if I'd seek out their cuisine again.",shrimp dish negative <sep> cuisine neutral
0,0,tuesday at 545pm pre-show dinner - great food - amazing service - was strange to find both at one place!,pre-show dinner neutral <sep> food positive <sep> service positive
0,0,"We started at the bar with a round of mojitos, which were amazing, and went to our reserved table.",bar neutral <sep> round of mojitos positive
0,0,We too had reservations but the gentleman never checked a book to see our names or check us off.,reservations neutral <sep> gentleman negative
0,0,"The food was horrible, we had the Peking duck salad, tuna, vegetable fried rice, and the spinach.","food negative <sep> Peking duck salad neutral <sep> tuna, vegetable fried rice neutral <sep> spinach neutral"
0,0,We arrived at 5:30 and had leave at 7:30 without dessert or coffee because the kitchen took insanely long between courses.,kitchen negative <sep> courses neutral
0,0,While we enjoyed the appetizers (kobe beef quesadillas and a mix of fries) the burgers themselves were not nearly as good.,appetizers positive <sep> kobe beef positive <sep> mix of fries positive <sep> burgers themselves negative
0,0,"The salads were like those we were served in Paris, and the Eggs Benedict were out of this world.",salads neutral <sep> Eggs Benedict positive
0,0,The hostess did not verify/review the menu prices with us nor did they inform us of the logistics of the brunch.,hostess negative <sep> brunch neutral
0,0,Went back for lunch and had great Chicken Fajitas.,lunch neutral <sep> Chicken Fajitas positive
0,0,5 hour meal (we ordered the tasting menu).,hour meal neutral <sep> menu positive
0,0,Also the waiter anever asked if the steaks were cooked to out liking or if we wanted anything else.,waiter negative <sep> steaks neutral
0,0,"The waiters actually roll their eyes when you order something, as if you are imposing on them by ordering food.",waiters negative <sep> food neutral
0,0,Basically the comfort is lacking but the food is the focus.,comfort negative <sep> food positive
0,0,This is the kind of place that is suppose to have pushy waiters and a loud atmosphere.,place neutral <sep> waiters negative <sep> atmosphere negative
0,0,get the mussels as an appetizer and try to save room for dessert.,mussels neutral <sep> appetizer neutral <sep> dessert positive
0,0,"Lunch (a chicken sandwich on baguette with fries) was decent, brunch (dry, hard pancakes) was pretty bad.",Lunch positive <sep> a chicken sandwich on baguette neutral <sep> brunch positive <sep> pancakes positive
0,0,the food is neither tasty nor reasonably priced ($137 for four with one glass of wine total?,food negative <sep> priced negative <sep> glass of wine neutral
0,0,I have been dining at Narita for 6 years and have thoroughly enjoyed every meal.,dining neutral <sep> meal positive
0,0,"To enhance the dining experience, there is a live jazz band, which further isolates you from the world outside the gates.",dining positive <sep> live jazz band neutral
0,0,"we shared many dishes but none really stood out except the spinach, wow!!",dishes neutral <sep> spinach positive
0,0,Still my favorite part of the restaurant and bar adjacent are the drinks.,bar neutral <sep> drinks positive
0,0,"I wouldn't say Bubby's will blow you out of the water, but they provide a solid bunch served with good coffee.",water neutral <sep> coffee positive
0,0,"To the amusement of our server, I wrote everything down, lest I forget a single morsel (about 21 different dishes).",server positive <sep> dishes neutral
0,0,You can't go wrong with any of the mojitos and the food is very tasty and presented beautifully.,mojitos neutral <sep> food positive
0,0,"Nonetheless, it's an excellent pie -- and don't let the long lines scare you off -- they keep them moving.",pie positive <sep> lines negative
0,0,"Thankfully, the steak was good, but the food couldn't save the restaurant from a bad rating.",steak positive <sep> food negative
0,0,the roll was great as usual but the salmon was old the tuna did not look good at all.,roll positive <sep> tuna neutral
0,0,For the price I paid for a cup of Bustelo coffee w/ milk I could buy 2 vacumed packs for 3 bucks.,price negative <sep> cup neutral <sep> Bustelo coffee neutral
0,0,We were also seated promptly at the time of our reservation and the service was very quick and professional.,reservation neutral <sep> service positive
0,0,The Lunch box deal where you can pick two for $10 including rice and an ice tea is one of the best luches in the area.,Lunch neutral <sep> ice tea positive
0,0,"(The band is positioned in front of the windows, in a space roughly the size of a living room.",band positive <sep> space neutral
0,0,"i mean the place was empty and it seemed to take for ever to get food, drink or the check.",place positive <sep> food negative <sep> drink negative
0,0,Food was good but portions were quite tiny.,Food positive <sep> portions negative
0,0,"As expected, the beer selection is perfectly in synch with the menu.",beer selection positive <sep> menu neutral
0,0,While the decor is a bit bland--a white room with a few fake palm trees and thatched roof--the service is fast and friendly.,white room neutral <sep> service positive
0,0,"D, who can't decide on a single dish, the tapas menu allowed me to express my true culinary self.",dish negative <sep> tapas menu positive
0,0,"The lobster bisque was good, but the price of adding lobster meat was astronomical.",lobster bisque positive <sep> price of adding lobster meat negative
0,0,Prime Rib was cold and very fatty--Drinks were good though--Very expensive--I've had much better for less.,Prime Rib negative <sep> Drinks positive
0,0,"On our second trip, our waiter had an attitude, was slow to bring/refill drinks, and we had to flag him down for EVERYTHING.",waiter negative <sep> drinks neutral
0,0,My tuna tatare was laden with salt and soy sauce - tasted like cheap chinese instead of great fish.,tuna tatare neutral <sep> salt negative
0,0,A cold reception got even colder when we didn't have a reservation for a Tuesday night (the place was half empty).,reservation neutral <sep> place negative
0,0,However when I returned to my table the waiter immediately came over and said So I guess we are celebrating a birthday here.,table neutral <sep> waiter negative
0,0,Yet the maitre d still sat us next to the bar.,maitre negative <sep> bar neutral
0,0,The pizza is baked in a wood burning oven and the flavor is fantastic.,pizza neutral <sep> flavor positive
0,0,While the food was good (certainly no Il Mulino) the service was horrendous.,food positive <sep> service negative
0,0,"After the bar, they sat us on the side with the wine room with a nice view of everything.",bar neutral <sep> view positive
0,0,Yoguart/mint/jalipeno sauce for instance didn't work with asparagus.,Yoguart/mint/jalipeno sauce negative <sep> asparagus neutral
0,0,I ended up wasting $24 on the most expensive dish on the menu.,dish negative <sep> menu neutral
0,0,Still the bill was close to $300(with 1 bottle of lower-priced wine).,bill neutral <sep> wine positive
0,0,"Subtle decor, above average wine list and a menu with a difference.",decor positive <sep> wine list positive <sep> menu neutral
0,0,Hunan Delight has one page in their menu full of Vegetarian dishes.,menu neutral <sep> Vegetarian dishes positive
0,0,The bartenders could have been a lot nicer but the drinks they shook up kind of made up for their poor attitude.,bartenders negative <sep> drinks positive <sep> attitude negative
0,0,It is now nothing but an overpriced establishment that is shamelessly riding on the coat tails of its past.,establishment negative <sep> coat tails neutral
0,0,Our waitress kept forgetting our drinks.,waitress negative <sep> drinks neutral
0,0,"We sat, missing a place setting for a while before the waitress came to ask if we wanted water and then ran away.",setting neutral <sep> waitress negative
0,0,Each dish had its own distinct character and pleasant flavor surprises.,dish neutral <sep> flavor surprises positive
0,0,"when the wine is the best thing at dinner, its not a good thing.",wine positive <sep> dinner neutral
0,0,My dining companion had a steak with so much fat on it that he had to send back it.,dining neutral <sep> steak neutral <sep> fat negative
0,0,"the filet came out and was absolutely delicious, on a bed of julienned vegetables in a balsamic vinagarette sauce.",filet positive <sep> julienned vegetables neutral <sep> balsamic vinagarette sauce neutral
0,0,"The staff were very friendly, the prices were relatively average, not bad, and the food was great.",staff positive <sep> prices neutral <sep> food positive
0,0,"For lunch, walk in slightly after 1pm to avoid long lines.",lunch neutral <sep> lines negative
0,0,"Being a basil fanitac, the fresh leaves that come on the pizza pie I ordered were a delight.",basil neutral <sep> pizza positive
0,0,"We had to ask for the bill twice, and our water was refilled only when we asked for it.",bill neutral <sep> water negative
0,0,The silvery beige decor reflects the refined air of the store as a whole.,beige decor positive <sep> air neutral
0,0,Another hostess came by and told us that since we were now 5 we were a different table and couldnt' stay.,hostess negative <sep> table neutral
0,0,"pineapple, kiwi, guava, and raspberry sorbet.",pineapple neutral <sep> sorbet positive
0,0,And Mondays fajita are half price all night.,fajita neutral <sep> price positive
0,0,"Don't let the ambiance of this place fool you, the food is far better than many pricey establishments.",ambiance negative <sep> food positive
0,0,I organized a dinner for 20 and was extremely satisfied with the results.,dinner neutral <sep> results positive
0,0,Special touch -- my dessert plate had Happy Birthday drizzled in chocolate.,dessert plate positive <sep> chocolate neutral
0,0,"Sometimes people get up and dance, overall a pretty fun spot, although the crowd does tend to be over 30.",spot positive <sep> crowd negative
0,0,"The menu can give you price shock but the food, service and drinks are worth every stinking penny.",menu neutral <sep> price neutral <sep> food positive <sep> service positive <sep> drinks positive
0,0,(having asked for bread at this point 3 times and still with out) He dashed off before we even finished the drink order!,bread negative <sep> drink neutral
0,0,"After some good food and spotty service, my friends and I were surprised to get a bill that had a 20% tip included post-tax.",service positive <sep> bill neutral
0,0,"Room is impressive, but service is slow and taste was almost like fast food.",Room positive <sep> service negative <sep> food negative
0,0,"The food is decent, but WAY TOO SMALL of portions for what you pay for.",food positive <sep> portions negative
0,0,The oysters were warm as was the sushi that was served over dry rice.,oysters positive <sep> rice negative
0,0,"We often come with a baby and the staff is so sweet and kind to her, it is a joy to be there.",baby neutral <sep> staff positive
0,0,"90 for a porterhouse steak for 2 (ordered medium-rare, delivered well-done, dry and tasteless) and I'm not even full.",steak neutral <sep> delivered positive
0,0,There is actually space to breathe and the decor sets the tone for an intimate dinner.,space neutral <sep> decor positive <sep> dinner positive
0,0,The chef even came out with a sample some new appetizers he's working on (the tuna tartare is a keeper!,chef positive <sep> new appetizers neutral <sep> tuna tartare positive
0,0,"It has a large salad bar, many side dishes, soups, fruits, bread, crab legs and sushi.",salad bar positive <sep> side dishes positive <sep> soups neutral <sep> fruits neutral <sep> bread neutral <sep> sushi neutral
0,0,A few of us went the other night for cocktails (half price!),cocktails neutral <sep> price positive
0,0,"The first time I went, and was completely taken by the live jazz band and atmosphere, I ordered the Lobster Cobb Salad.",live jazz band positive <sep> atmosphere positive <sep> Lobster Cobb Salad neutral
0,0,"Our waiter was a bit weird as well, but the lounge area looked like a nice place to get a drink after work.",waiter negative <sep> lounge area positive <sep> drink neutral
0,0,waitress brought different food.,waitress neutral <sep> food negative
0,0,"Knapp Street Pizza also has a variety of pizzas including: eggplant, ziti, chicken parmigiana and so on.",pizzas positive <sep> eggplant neutral <sep> ziti neutral <sep> chicken parmigiana neutral
0,0,"I didn't take a look at the rest menu, but the oysters were fantastic.",menu neutral <sep> oysters positive
0,0,5 minutes later the same waitress came back to have us move to the next table so she could seat a party of 4.,waitress negative <sep> table neutral
0,0,We were ignored by our waitress after our entrees had been served.,waitress negative <sep> entrees neutral
0,0,"The salad looked as though they have a premixed trash bag full of it, and they just dump a heap of it on a plate.",salad neutral <sep> premixed negative
0,0,The managers aren't snobby for wanting reservations -- it's a new restaurant and they're trying to manage the flow of diners.,managers negative <sep> reservations neutral
0,0,"Upon entering, I was impressed by the room while the food on other peoples' tables seemed enticing.",food neutral <sep> tables positive
0,0,"the steak and chicken fajitahs were good, a bit too much sauce on the meat for my taste.",chicken fajitahs positive <sep> sauce negative <sep> meat negative
0,0,"The salad I received was Iceberg lettuce with nothing else in it (no tomatoes, carrots).",salad neutral <sep> Iceberg lettuce neutral <sep> carrots negative
0,0,"The service was punctual, having been asked for our drink orders even before opening our menus.",service positive <sep> drink neutral <sep> menus neutral
0,0,"Great place to meet friends or co workers for drinks, dinner or both.",workers neutral <sep> drinks neutral <sep> dinner neutral <sep> place positive
0,0,"Drinks took a while, and after a few rounds pf the we're sorry, we don't have this bottle sir routine.",Drinks neutral <sep> sir routine negative
0,0,"After a short wait at the bar (which was very crowded), we were seated upstairs at a private table.",wait neutral <sep> bar negative
0,0,"Then the waiter came back for our food order at 10, and we hadn't received our drinks yet.",waiter negative <sep> food neutral <sep> drinks neutral
0,0,"Flavors range from standards to hard-to-find Italian options, like tiramisu, hazelnut and zuppa inglese.",Flavors negative <sep> tiramisu neutral
0,0,"No dress codes, no attitudes, plenty of comfort companionship, a great place to relax in an always busy Midtown.",dress codes negative <sep> attitudes negative <sep> place positive
0,0,"From the outside this place looks cute, however, once inside loud as a disco!",place positive <sep> disco negative
0,0,"Although the prices is a bit on the high, you do get big portions for it.",prices negative <sep> portions positive
0,0,Called to make a reservation and b/c the man who answered was so nice decided to chance it.,reservation neutral <sep> man positive
0,0,"I haven't tried their brunch, partly because their coffee is a bit weak to me.",brunch neutral <sep> coffee negative
0,0,The pancakes I ordered were nothing like the menu's description.,pancakes negative <sep> menu neutral <sep> description neutral
