review_id,sentences_ids,sentences_texts,sentences_opinions
0,0,I'd like to try their brunch - the menu looks good.,brunch neutral <sep> menu positive
0,0,"The meal arrived just as we were finishing the appetizers, each good portions.",appetizers neutral <sep> portions positive
0,0,I had to wait quite a while to get my food and the waitress almost knocked me in the head with her tray.,food neutral <sep> waitress negative
0,0,"Since the service was so poor, we asked if they could offer any concessions - complimentary drinks?",service negative <sep> drinks neutral
0,0,Once we had our menus we were nearly assaulted by wait staff asking if we were ready to order.,menus neutral <sep> wait staff negative
0,0,better for dining with friends/significant others.,dining positive <sep> others neutral
0,0,The portions are big so you can split an appetizer.,portions positive <sep> appetizer neutral
0,0,The place was bustling at 8:30pm on a Wednesday night- we arrived earlier than our reservation and got situated at the bar.,place negative <sep> reservation neutral
0,0,"Aged beef charred on the outside, red on the inside.",beef negative <sep> outside neutral
0,0,"The Food The charming fireplaces and wooden chairs spell cozy cafe-romantic if you're in love, and comfy if you're not.",Food neutral <sep> fireplaces positive <sep> chairs positive <sep> cafe-romantic positive
0,0,"For a restaurant with such limited menu and wine list, each dish should better be darn good.",menu negative <sep> wine list negative <sep> dish positive
0,0,Rather you are paying rock bottom price for a meal that could cost you triple any where else.,price negative <sep> meal neutral <sep> cost negative
0,0,The cooks in the front are very friendly and helpful.,cooks positive <sep> front neutral
0,0,The ices and the spumoni were perfect desserts to the pizza.,spumoni positive <sep> desserts positive <sep> pizza neutral
0,0,"Diners sit around large tables where chefs ostentatiously chop, slice, stir-fry and grill.",chefs negative <sep> Diners neutral
0,0,"It is a nice diner atmosphere, they have booths all around and a couple of middle tables.",diner atmosphere positive <sep> tables neutral
0,0,"When there is so much GREAT food in New York, why go for the high-priced mediocre meal?",food positive <sep> meal negative
0,0,"While the bar is expansive, the ceilings are high, the tables are spacious and the plates are oversized, where is the food?",bar positive <sep> tables positive <sep> food neutral
0,0,"The decor isn't the best and the place is very modest, but if you're around Ditmars Blvd.",decor negative <sep> place positive
0,0,I had a tasty Caesar salad for an appetizer and ordered the 10 oz Fillet Mignon medium rare.,Caesar salad positive <sep> appetizer neutral <sep> oz Fillet Mignon neutral
0,0,Even the expensive (11-20$) fru-fru drinks lacked flavor and quality ingredients.,drinks negative <sep> flavor negative <sep> ingredients neutral
0,0,The waitress came back with the bill and money (with a calculator) and asked for more tips.,waitress negative <sep> money neutral
0,0,Today I placed a lunch order and the guy hung up on me while I was saying thank you!,lunch neutral <sep> guy negative
0,0,The place got really crowded around 8ish when I went right before Christmas so reservations might be necessary.,place negative <sep> reservations neutral
0,0,You cannot beat having the waiter spooning butter over your steak before you are served!!,waiter spooning butter positive <sep> steak neutral
0,0,"For as busy as this place is, the owner could afford to hire additional servers.",owner neutral <sep> servers positive
0,0,"I never have to wait a long time to get my food, so it's a great place to go if you're really hungry and/or in a hurry.",wait positive <sep> food neutral
0,0,"Forget about the staff and go for the food and pleasant, if a bit cramped Lancaster, Pennsylvania like decor for comfort.",staff negative <sep> food positive <sep> decor positive
0,0,"mistake on the check, overly salty morels stuffed with foie gras) but overall, Daniel's dishes are revelations in taste.",check neutral <sep> dishes positive
0,0,"If you consider throwing food at your when they remember good service, then go for it.",food neutral <sep> service positive
0,0,"The food is spectacular, from the appitizers to the main course, and then of course the desserts, (WOW) you'll need no more.",food positive <sep> appitizers positive <sep> main course positive <sep> desserts neutral
0,0,"Its the perfect place to take a date, start out with dinner and then stick around for dancing!",place positive <sep> dinner neutral
0,0,Also had to ask the host for our apps becasue our waiter was never around.,host neutral <sep> waiter negative
0,0,Food again was not just a name on the menu but very well made and fresh.,Food positive <sep> menu neutral
0,0,Our waiter suggested a fantastic Greek wine that was far less expensive then we were willing to spend.,waiter neutral <sep> Greek wine positive
0,0,Decent eggs (just about everything on the menu is coated in this amazing hollandaise).,eggs positive <sep> menu neutral
0,0,"The hummus was not flavorful and when we ran out of bread and asked for more, it never came.",hummus negative <sep> bread neutral
0,0,My prefix dinner was composed of garlic shrimp appetizer followed by a yummy skirt steak complete with handcut fries.,prefix dinner neutral <sep> garlic shrimp appetizer neutral <sep> steak positive <sep> fries positive
0,0,"Their seafood is fresh-- have their fried soft-shell crab, or their whole fish with red chiles and basil.",seafood positive <sep> fried soft-shell crab neutral <sep> whole fish with red chiles neutral <sep> basil neutral
0,0,The service always ruins your food if it's poor.,service negative <sep> food neutral
0,0,OUr waiter was a little confused about how to serve champagne.,waiter negative <sep> champagne neutral
0,0,"The food was equally outstanding: I had the fois gras and rack of lamb, along with the Brooklyn Bridge for dessert.",food positive <sep> fois gras neutral <sep> rack of lamb neutral
0,0,we literally waited for over 45 minutes to finally getting our sushi which was pretty simple rolls.,sushi positive <sep> rolls negative
0,0,"Cocktails were ok, not so good with chinese food so hot tea was fine for us.",Cocktails positive <sep> chinese food neutral
0,0,"But overall loved the place, outside of our waiter who literally tried to force us into ordering drinks.",waiter negative <sep> drinks neutral
0,0,Our waitress was so helpful with the wine list.,waitress positive <sep> wine list neutral
0,0,"The fondue was good, but not worth the very expensive price tag.",fondue positive <sep> price tag negative
0,0,Seemed like they got something wrong with every drink order Bartenders were def.,drink neutral <sep> Bartenders negative
0,0,"The small single room--wood panelling, large mirrors, white tablecloths, dim lighting--has few frills.",single room negative <sep> mirrors positive <sep> tablecloths neutral
0,0,The outdoor garden more than doubles the dining space and is tented in winter.,outdoor garden positive <sep> dining space neutral
0,0,Food : A++ Service : A++ Value : A++ No other steakhouse in Manhattan can beat Ruth's Chris.,Food neutral <sep> Service positive
0,0,"We recently visited Madiba for lunch, and our waitress was sweet but ineffective.",lunch neutral <sep> waitress positive
0,0,The waitresses and the diners have to scream at one another to give an order.,waitresses negative <sep> diners neutral
0,0,"The bartender was skilled, the owners were very friendly, but the wait for my burrito was longer than I would have liked.",owners positive <sep> wait negative <sep> burrito neutral
0,0,We ended our great experience by having Gulab Jamun (dessert) recommended by the waiter.,Gulab Jamun (dessert) positive <sep> waiter neutral
0,0,"The waiters can shoot off a 5 minute long list of specials, and they know the menu very well.",waiters positive <sep> menu neutral
0,0,I specifically recommend the eggs with potato pancakes for breakfast and the orange beef for dinner.,eggs with potato pancakes positive <sep> breakfast neutral
0,0,The wait (despite reservation) was 35 minutes (in an over-crowded bar) no apologies whatsoever.,wait neutral <sep> reservation neutral <sep> bar negative
0,0,"A friend and I had a lovely bottle of wine, two appetizers, two main courses and two coffees and we had change from $40.",bottle of wine positive <sep> appetizers neutral <sep> main courses neutral
0,0,"!While you are there, try the stuffed chicken wings, the salmon and take a stroll into the restroom.",stuffed chicken wings positive <sep> salmon neutral
0,0,and don't be ashamed to ask for more during the hour long wait for your entrees.,wait negative <sep> entrees neutral
0,0,We were never offered dessert because our waiter spent about 20 minutes at the bar calculating the checks instead.,dessert neutral <sep> waiter negative <sep> bar neutral
0,0,The Kitchen is only separated from its patrons by glass is immaculate and the service is undeniable heartfelt.,Kitchen neutral <sep> service positive
0,0,"Bland food, arroganrt waiters.",food positive <sep> waiters negative
0,0,"Her attitude put a damper on the evening, as did the stares from some servers when we took a peek into the cheese cellar.",servers negative <sep> cheese cellar neutral
0,0,"After being seated by a very kind, but quite stressed, young lady, we took in the room and menu.",seated neutral <sep> menu neutral <sep> lady positive
0,0,It's very reasonably priced considering the size of portions.,priced positive <sep> portions neutral
0,0,"The Food The fare is mostly traditional, with a few contemporary specials offered nightly.",Food positive <sep> fare positive <sep> specials neutral
0,0,"Half an hour after our appetizer was cleared, the waiter told us it would take more time to get our main courses.",appetizer neutral <sep> waiter negative <sep> courses neutral
0,0,after the main course the waitress brought desert menus and never came back.,waitress negative <sep> desert menus neutral
0,0,As appetizers we enjoyed the Drunken Goat Cheese Salad and Lobster Empanadas.,appetizers neutral <sep> Drunken Goat Cheese Salad positive <sep> Lobster Empanadas positive
0,0,"The server was dutiful yet insincere, the brunch drinks above average.",server negative <sep> brunch drinks positive
0,0,"Wonderful service, not too long a wait for tables, price is right - in a word, go!",service positive <sep> wait positive <sep> tables neutral
0,0,Food other than sushi is also very nice.,Food positive <sep> sushi negative
0,0,"The restaurant has a somewhat unique decor, with portrait of the owner meditating and books about meditation.",decor positive <sep> owner neutral
0,0,"great decor, unfortunately the worst service possible.",decor positive <sep> service possible negative
0,0,"The oil is changed frequently, and the food never tastes TOO HEAVY.",oil neutral <sep> food positive
0,0,The food choices were a bit unique so if you are a steak and potatos person then this may not be the place for you.,food choices positive <sep> steak neutral
0,0,"Although the service can be a bit brusque at times, the food is always good, hearty and hot.",service negative <sep> food positive
0,0,"Tuesdays are Wine Lovers nights, where everything on their wine list is half off - it's a great deal.",Tuesdays neutral <sep> wine list positive
0,0,The mariachi band that walked around during dinner was fun and like I stated before the food is delish!,dinner neutral <sep> food positive
0,0,"There was live music at the bar, which made our wait for a table wonderful (we didn't have reservations).",music positive <sep> bar neutral
0,0,Went to dinner on a Friday night and the place was packed and hot.,dinner neutral <sep> place negative
0,0,We held a birthday dinner for my friend and were very impressed w/ both food and service.,dinner neutral <sep> food positive <sep> service positive
0,0,The chorizo was a memory and sounded better on the menu.,chorizo positive <sep> menu neutral
0,0,"Don't go for the decor or the location, go for the food!",decor negative <sep> location negative <sep> food positive
0,0,Waiting for a table is par for the course.,Waiting negative <sep> table neutral
0,0,"It might be a good place to have a drink, but not for food.",drink neutral <sep> food negative
0,0,I had to physically get out of my seat and find the waitress twice just to ask for more water.,seat neutral <sep> waitress negative <sep> water neutral
0,0,"The pizzas are a MUST TRY, hence the name.",pizzas positive <sep> name neutral
0,0,The porterhouse is as good a steak you are going to find in NYC or the surrounding area.,steak positive <sep> area neutral
0,0,"Food is mediocre, except for Mushroom Custard and Foie Gras in Fire Ice.",Food negative <sep> Mushroom Custard positive
0,0,Tried to get a table during restaurant week but there was an over an hour wait.,table neutral <sep> wait negative
0,0,The service was slow (10 minutes for drinks??),service negative <sep> drinks neutral
0,0,"Its great for people who want to try Korean food, but can't understand the servers or the menu on 32nd St.",Korean food positive <sep> servers neutral <sep> menu neutral
0,0,"For dessert, try this pudding, translated Nipple of Venus.",dessert neutral <sep> pudding positive
0,0,I just think the prices are high for the type of food the kitchen turns out as well as the portion sizes.,prices negative <sep> food neutral <sep> portion sizes neutral
0,0,"Expect to get average food, a big bill and lots of attitude from the service.",food neutral <sep> bill negative
0,0,Within 3 minutes after we sat the waiter was hovering over us to get our food order.,waiter positive <sep> food neutral
0,0,"I went with a party of 7, we all had drinks, tomato and onion salad, slabs of bacon, all the extras and magnificent steaks.",drinks neutral <sep> tomato and onion salad neutral <sep> slabs of bacon neutral <sep> steaks positive
0,0,"Each week, Zutto's sushi chef never ceases to amaze me with new concoctions.",sushi chef negative <sep> concoctions neutral
0,0,PDiddy need a new staff you would have thought it was a bunch of old people cooking the food and waiting on us.,new staff negative <sep> food neutral
0,0,"Once seated, there was no waitress to give us our menus.",seated neutral <sep> waitress negative <sep> menus neutral
0,0,"but above all, they do have fresh fish, especially salmon and yellowtail.",fish positive <sep> salmon neutral <sep> yellowtail neutral
0,0,"i love this pizza, its not greasy or filled with mounds of cheese, its just fresh tomatoes basil and buffalo mozz.",pizza positive <sep> mounds neutral <sep> tomatoes basil positive
0,0,The actors try to draw your attention away from the better stuff that is happening below.,actors neutral <sep> stuff positive
0,0,When I pointed this out to the waiter he told me that all of the lox is like that.,waiter negative <sep> lox neutral
0,0,My friend and I enjoyed choosing from a very diverse menu of appetizers and entrees.,menu positive <sep> appetizers neutral <sep> entrees neutral
0,0,"Everything we had from the scallop starter to the rare ribeye, right through dessert was impeccible.",scallop starter neutral <sep> dessert positive
0,0,The service and atmosphere may not set your mood but when you're done you will realize that it's only the food that counts!,atmosphere negative <sep> food positive
0,0,"Pizza - the only pizza in NYC that should not have additional toppings - the crust tastes like the best, freshly baked bread!",toppings neutral <sep> crust positive <sep> bread positive
0,0,"There were many helpful people, not only one waiter - kept refilling the water, the wine, asking if everything was okay.",waiter positive <sep> wine neutral
0,0,Drinks are overpriced; wine list is good.,Drinks negative <sep> wine list positive
0,0,"The service is Ok, but they must have drank the coolade, as they believe that they are serving good food!",service positive <sep> serving neutral <sep> food positive
0,0,"I don't mind paying a high price for a really good meal, but this was really average food.",price negative <sep> meal positive <sep> food negative
0,0,"8pm reservation, place was half empty on a Saturday.",reservation neutral <sep> place negative
0,0,"The ambience is extremely romantic, even if you get seated upstairs.",ambience positive <sep> upstairs neutral
0,0,The Pink Pony's brunch is among the very best in the city!,Pony neutral <sep> brunch positive
0,0,The mussles appetizer was delicious along with my peppercorn steak.,mussles appetizer positive <sep> steak neutral
0,0,I had oysters for my appetizer and the Turbot with a delicate creamy lemon sauce with a hint of dill for dinner.,oysters neutral <sep> appetizer neutral <sep> Turbot neutral <sep> creamy lemon sauce positive <sep> hint of dill neutral <sep> dinner neutral
0,0,"Caravan can be a little slow sometimes, but more than makes up for it in the quality of the food and the care of wait staff.",food positive <sep> care neutral <sep> wait staff positive
0,0,One waiter came by and literally threw the $36 salad on the table.,waiter negative <sep> salad neutral <sep> table neutral
0,0,"Our waiter actually said he would check with the chef, like they might force us to share our food.",waiter negative <sep> food neutral
0,0,"He, however, gave great service even though he just brought our food since they didn't have a runner.",food neutral <sep> runner negative
0,0,"We ended up having appetizers in the lounge, while listening to a really great DJ.",lounge neutral <sep> DJ positive
0,0,the solitary waitress was friendly though i found her service a little slow.,solitary waitress positive <sep> service negative
0,0,"Hillarious lighting and ecclectic side dishes make you want to love the place, but the meal on the whole was abyssmal.",place positive <sep> meal negative
0,0,"Our waiter was pushing us all night to take our plates, and swiped my dessert before I was finised with it.",waiter negative <sep> plates neutral <sep> dessert neutral
0,0,Yuckity Yuck Yuck  The Burritos were horrible but the Sangria was decent.,Yuckity negative <sep> Sangria positive
0,0,All-night restaurant with excellent burgers and stella on tap.,burgers positive <sep> tap neutral
0,0,It took a long time for the waiter to bring the check and we had to flag him down.,waiter negative <sep> check neutral
0,0,"we ordered filets, and ny steaks eventhough our waiter kept pushing up to get the porterhouse.",steaks neutral <sep> waiter negative
0,0,"When the food arrived, the portions were really small, and didn't really reflect the awesome descriptions on the menu.",food neutral <sep> portions negative
0,0,"Not just that tapas was small portions (duh) but, for example, $10 piggy-back dates only came with 6 little appetizers.",tapas neutral <sep> portions negative <sep> appetizers negative
0,0,All dishes are an incredible dining experience.,dishes neutral <sep> experience positive
0,0,Lobster bisque is a 10+ and Steaks ; fish and cajun shrimp app are standouts!,Lobster bisque positive <sep> Steaks neutral <sep> fish and cajun shrimp app positive
0,0,The kicker was when there were three items on our check that were priced higher than stated on the menu and by the server.,priced negative <sep> menu neutral <sep> server negative
0,0,"We decided on several appetizers, the clear winner was the sardines, something I normally wouldnt have tried.",appetizers neutral <sep> sardines positive
0,0,Everything from the salmon dip at the bar (while waiting for our table) to the dessert was perfect.,salmon dip positive <sep> bar neutral <sep> dessert positive
0,0,"No bread basket for the table, the server came around with a basket and we each got 1 piece of bread.",table neutral <sep> server positive
0,0,the quantity of food was a good size with tons of shrimp in our noodle dish.,quantity of food positive <sep> shrimp positive <sep> noodle dish neutral
0,0,the waitress was slow and forgot our drinks about 3 times.,waitress negative <sep> drinks neutral
0,0,"The brunch entrees were shockingly overpriced, even for the area, and especially given the food quality.",brunch entrees negative <sep> area neutral <sep> food quality negative
0,0,"Service was fine and the food delivered in reasonable time given the crowd, but for the price I was disappointed.",Service positive <sep> food positive <sep> crowd neutral <sep> price negative
0,0,"We were promptly seated - the waitress was very attentive, got us drinks and menus.",waitress positive <sep> drinks neutral <sep> menus neutral
0,0,The price is cheap - 5 dumplings for $1.,price positive <sep> dumplings neutral
0,0,"Before we can even order desert, the waitress comes and tells us we have to leave because the host wanted our table.",waitress negative <sep> table neutral
0,0,"All of the dishes we had were very good, but the fries were a little on the salty side, which we actually didn't mind.",dishes positive <sep> fries negative
0,0,"When we sat down, the waiter barely looked in our direction and abruptly shoved our menus on the table.",waiter negative <sep> menus neutral
0,0,"It may not be cuisine at it's hautest, but Grand Canyon does a mean burger and great big fluffy fries.",cuisine negative <sep> burger positive <sep> fluffy fries positive
0,0,Our waiter didn't even bothered to ask for dessert.,waiter negative <sep> dessert neutral
0,0,"They bought the same surly staff, it still took way too long for food, drink, ANY SERVICE and the food is still $ 12.",surly staff negative <sep> drink neutral <sep> SERVICE neutral
0,0,The food was good but took long and the drinks she recommended to us were too strong.,food positive <sep> drinks negative
0,0,Great romantic place for a date (try to get the corner booth table for a little privacy and to sit close!,place positive <sep> corner booth table positive <sep> privacy neutral
0,0,"As for the menu, I've never been disappointed, but the Margarita chicken salad is my favorite.",menu neutral <sep> Margarita chicken salad positive
0,0,Don't miss the crema catalana the waiter recommended us for dessert.,waiter positive <sep> dessert neutral
0,0,"I'll give it to Sea; the decor is pretty cool and the food was good, but the service was beyond terrible!",food positive <sep> service negative
0,0,"We were left waiting a while after our food for our waiter to return, and thus we did not have time for dessert.",food neutral <sep> waiter negative <sep> dessert neutral
0,0,Before our food arrived I asked our waitress if we could be moved and she just stared blankly at me.,food neutral <sep> waitress negative
0,0,"While the environment is still fun and diverse, the food quality has been sliding lately.",environment positive <sep> food quality negative
0,0,"A bright spot: the server was immeadiately apologetic and whisked problem plates away, and replacements were prompt.",server positive <sep> plates negative
0,0,My group and I cancelled whatever drinks we ordered (no food order since there was NO wait staff) and left.,drinks neutral <sep> wait staff negative
0,0,"My girlfriend had a margarita she said was ok, and I had a soda that somehow tasted terrible, like the line was dirty.",margarita positive <sep> soda negative
0,0,Olives served at the bar are wonderful.,Olives served positive <sep> bar neutral
0,0,"Their appetizer portions are not huge, just right since the entrees are much larger.",appetizer portions negative <sep> entrees positive
0,0,By this I mean that the guy selling hotdogs outside of Grand Central has given me better service.,guy selling hotdogs neutral <sep> service positive
0,0,"Encouraged, I went back for dinner and was again impressed: crisp, spicy asparagus spears (tad too spicy?",dinner neutral <sep> asparagus spears positive
0,0,"Get the bacon (best ever, hands down) and shrimp cocktail to start and steak for how many ever to finish.",bacon positive <sep> shrimp cocktail neutral <sep> steak neutral
0,0,"service is quick, not overly friendly, but hey it's a small place and the servers are constantly busy.",service positive <sep> servers negative
0,0,The manager came over to our table at the end of our entree course to get our review.,manager positive <sep> entree neutral
0,0,Beautiful Chilled seafood platters (and I don't eat shellfish) that would make a Kosher person convert!,Chilled seafood platters positive <sep> Kosher neutral
0,0,We got there a bit early and the staff wasn't ready for us but we didn't mind b/c we got to wait by the beautiful bar.,staff negative <sep> bar positive
0,0,best chicken in queens.,chicken positive <sep> queens neutral
0,0,Although the dining area is a bit small you'll feel at home as the owner is very friendly and talkative.,dining area negative <sep> owner positive
0,0,The waiter kept pestering us for our order even though we were among the last diners.,waiter negative <sep> diners neutral
0,0,"The Food In a less-than-booming economy, it's a joy to find an East Village bistro with entrees that rarely top 15 bucks.",Food positive <sep> entrees neutral
0,0,Amazing views of NYC regaled us at lunch earlier in the week and then at dinner this evening.,views positive <sep> dinner neutral
0,0,"For the prices, the food is decidedly lackluster, and the service, unless you are a regular, can be quite rude.",prices neutral <sep> food negative <sep> service negative
0,0,My wife I went here for a Birthday dinner and were immediately impressed with the wine list.,dinner neutral <sep> wine list positive
0,0,"I would say it's suitable for a romantic date or quiet family meal, as there is no bar so the atmosphere is a little quiet.",family meal positive <sep> bar neutral <sep> atmosphere positive
0,0,"Great place for either appetizers and drinks at the bar, a romantic dinner or late night partying.",drinks positive <sep> bar neutral
