review_id,sentences_ids,sentences_texts,sentences_opinions
0,0,I went to the Hudson bar with my boyfriend and the guy at the front door was extremely rude.,Hudson bar neutral <sep> guy negative
0,0,Although the prices are kind of high for lunch the atmosphere is nice.,prices negative <sep> atmosphere positive
0,0,"The decor in the dinin room is a bit bland, but the service is always friendly.",decor negative <sep> dinin room neutral <sep> service positive
0,0,I ordered the plane no fuss SALMON and it was honestly the best salmon EVER.,plane neutral <sep> salmon EVER positive
0,0,"Food was good, but for the price of a plate of pasta here, four raviolis doesn't cut it as an entre for a big guy.",Food positive <sep> plate neutral <sep> pasta neutral <sep> guy neutral
0,0,"Delivery wasn't the fastest, but the food was still hot so I won't complain.",Delivery negative <sep> food positive
0,0,"It is nearly impossible to get a table, so if you ever have the chance to go here for dinner, DO NOT pass it up.",table negative <sep> dinner neutral
0,0,"The atmosphere was wonderful, however the service and food were not.",atmosphere positive <sep> service negative <sep> food negative
0,0,You must think that the quality is poor for them to sell it for such a low price.,quality negative <sep> price positive
0,0,"Desserts are showstoppers, namely the caramelized banana tower with toasted marshmallows in a tall hazelnut shell.",Desserts positive <sep> shell neutral
0,0,"The sauce is filled with spices, including fresh garlic and basil.",sauce neutral <sep> spices positive <sep> garlic and basil positive
0,0,"Food: Bland and unoriginal, despite the creative writing in their menu.",Food negative <sep> menu neutral
0,0,why go there to deal with staffs' attitude and eat bad food?,staffs neutral <sep> attitude neutral <sep> food negative
0,0,On the menu board posted outside - they got Passion Fruit Creme Brule.,menu neutral <sep> Fruit Creme Brule positive
0,0,The food is well thought out and each bite should contain a little of everything on your dish for the full effect.,food positive <sep> dish neutral <sep> effect positive
0,0,"I've been accustomed by the restaurant group's great service, so I was disappointed by the long wait for my lunch.",service positive <sep> wait negative
0,0,Besides ordering single dishes you can also order family style.,single dishes neutral <sep> style positive
0,0,The waitress was slow and forgot drinks and food we ordered.,waitress negative <sep> drinks neutral
0,0,Service was slow and spotty; had to flag the waiter down many a time to get drink and food orders in.,Service negative <sep> waiter negative <sep> drink neutral
0,0,"Keep in mind, no one else was even in the restaurant and we were asking the waitress questions about entree options.",waitress negative <sep> entree options neutral
0,0,"The goat cheese and sun dried tomato ravioli is great, the bread may be a little weak, but the calamari is nice.",goat cheese positive <sep> sun dried tomato ravioli positive <sep> bread negative <sep> calamari positive
0,0,"Mostly, this small restaurant offers eggs, hot sandwiches and traditional American platters.",eggs neutral <sep> hot sandwiches neutral <sep> American platters positive
0,0,"Trish, our waitress was really great - the food was mediocre.",waitress positive <sep> food negative
0,0,"The food was below average , I'm not a great cook and I could have cooked a better meal.",food negative <sep> meal positive
0,0,"The wait was much shorter than the hostess quoted, which was great.",wait positive <sep> hostess neutral
0,0,I have never had a bad meal or service (on a couple of occasions I waited past my reservation time).,meal positive <sep> service positive <sep> reservation neutral
0,0,We ended the dinner with a surprisingly light and flaky apple tarte tatin.,dinner neutral <sep> apple tarte tatin positive
0,0,"Just finished a tasty jerked chicken dinner that was too pricey for the subpar service and good, but not great food.",jerked chicken dinner positive <sep> service negative <sep> food neutral
0,0,"The menu offers all the usuals: inexpensive spring rolls, vegetable sweet-sours, pad thai.",menu positive <sep> spring rolls positive <sep> vegetable neutral <sep> thai neutral
0,0,"Although the homefried potatoes were not worth the plate space, next time I'll ask to substitute a nice salad.",plate space negative <sep> salad positive
0,0,"Meanwhile, our server was dancing and posing by the bar.",server negative <sep> bar neutral
0,0,We could have made a meal of the yummy dumplings from the dumpling menu.,meal neutral <sep> dumplings positive <sep> dumpling menu neutral
0,0,"Prompt local delivery, minimal seating and counter space.",delivery positive <sep> seating neutral <sep> counter space neutral
0,0,this is the style of cooking that takes normal dishes to new highs.,style of cooking positive <sep> dishes negative
0,0,I've only been here once for dinner but I think the lunch specials are definitely a better deal.,dinner neutral <sep> lunch specials positive
0,0,The pricing isn't quite clear and look out for that asterisk on the menu where they add on that extra 6-8 bucks.,pricing negative <sep> menu neutral
0,0,The Food The most dependable route is to stick to appetizers--the cheese bread is quite good--and drinks.,Food positive <sep> appetizers neutral <sep> cheese bread positive
0,0,"While the food was good, service tried way too hard.",food positive <sep> service negative
0,0,if you do though just wait at the bar (yummy drinks!,bar neutral <sep> drinks positive
0,0,so back to the Napoleon was pretty yamie but over deep fried.,Napoleon positive <sep> fried negative
0,0,"With some good sake, I tried the salmon, yellowtail, king crab, eel (thought this would turn my stomach), red white tuna.",sake positive <sep> salmon neutral
0,0,"The Food The meal begins slowly, with a plate of excellent garlic knots.",Food negative <sep> meal negative <sep> garlic knots positive
0,0,"This place basically has the same menu as Penang but everything is cheaper, including the atmosphere.",menu neutral <sep> atmosphere positive
0,0,"I love the creative rolls that they have on their menus, and none of them were a disappointment.",rolls negative <sep> menus neutral
0,0,my date's non veg thali was really expensive and had like one or two pieces of meat in each sauce.,thali negative <sep> meat neutral <sep> sauce neutral
0,0,"Their main chef Louie, makes the oddest specials you will ever see and the portions are quite large.",main chef neutral <sep> portions positive
0,0,"the manager was nice profecional and service was average but the food was not italian, a diner is better, try po'",manager positive <sep> service neutral <sep> food negative <sep> diner positive
0,0,"I'm sorry, but the prices at Boi are outrageous for this type of cuisine.",prices negative <sep> cuisine neutral
0,0,"When I asked for a particular drink, the waitress gave me dirty look and annoyed b/c they didn't know what it was.",drink neutral <sep> waitress negative
0,0,"The service and surroundings couldn't have been better, but the food was very disapointing at best.",surroundings positive <sep> food negative
0,0,"The owner walks around barking at his employees every chance he gets, and makes everyone----customers and staff----nervous.",owner negative <sep> employees neutral <sep> staff negative
0,0,Any of their desserts are the perfect finish to a picnic lunch in the park or a Romantic Dinner at home.,desserts positive <sep> lunch neutral <sep> Dinner positive
0,0,OK so the decor is a little old and tacky but it adds to the atmosphere.,decor negative <sep> atmosphere positive
0,0,"Waitstaff is preoccupied dancing on the bar and googling at beautiful people, but who can blame them.",Waitstaff positive <sep> bar neutral
0,0,"When we arrived, our table wasn't ready and we waited 30 minutes in the bar.",table negative <sep> bar neutral
0,0,This is definately a place to go for drinks and then get dinner somewhere else!,drinks positive <sep> dinner neutral
0,0,Order the porterhouse and they put it between you and you kind of eat family style at a wooden table.,eat neutral <sep> style positive <sep> table neutral
0,0,"I ordered the seafood platter - the shrimp was hard and overdone, as were the mussels.",seafood platter neutral <sep> shrimp negative <sep> mussels negative
0,0,"Ordered a beer from the bartender, she opened it and the told me that she didn't know the price !!",beer neutral <sep> bartender negative
0,0,They have even just expanded to include lunch hours at very reasonable prices.,lunch neutral <sep> prices positive
0,0,"Many meals were delivered by two servers, besides having a waiter to oversea the process.",meals positive <sep> servers neutral <sep> waiter neutral
0,0,"(We did make reservations, since we had a group of 8, but had a short wait when arriving a little early.",reservations neutral <sep> wait negative
0,0,"Even if you're just a middling junior exec, staff service makes you feel like a board member.",exec neutral <sep> staff service positive
0,0,"Nice decor and an extensive menu lured me in, but the horrible service and rude staff drove me out.",menu positive <sep> staff negative
0,0,The food was average; I could have had a better meal at the local pizza place.,meal positive <sep> pizza place neutral
0,0,A great coal fired crust provides a backyard BBQ taste.,crust positive <sep> backyard BBQ taste neutral
0,0,"The food quality is good, but the prices are not worth it!",food quality positive <sep> prices negative
0,0,Green bean salad was tasty but could have used a bit more of a kick  Baby backs - Wow!,Green bean salad positive <sep> Baby backs neutral
0,0,Food is pretty good but the service is horrific.,Food positive <sep> service negative
0,0,"When we proceeded to order our food, the waitress interrupted and told us that maybe we had ordered enough for now.",food neutral <sep> waitress positive
0,0,"great food, even better price, they also have a dj spinning great music, definitely a must try.",food positive <sep> price positive <sep> dj neutral <sep> music positive
0,0,"cause, I was bored by the club scene and too overdressed for the local bar.",club scene negative <sep> bar neutral
0,0,"Had a late-night dinner there on Friday, and while the decor is fabulous, we waited a long time for our check.",late-night dinner neutral <sep> decor positive
0,0,"While the food isn't out of this world, it offers a decent meal at a decent price.",food negative <sep> meal positive
0,0,"For far better fish at the same price (but less interesting roll combinations), try Yama, just around the corner.",fish positive <sep> price neutral <sep> roll negative
0,0,the staff prefers to watch TV in the main dining room infront of their waiting customers then serve their customers.,staff negative <sep> main dining room neutral
0,0,My only complaints are the less spectacular sides and menu items other than steak.,sides negative <sep> menu negative <sep> steak positive
0,0,Eventually another waiter cleaned up the table and allowed us to sit there.,waiter positive <sep> table neutral
0,0,Our food was delivered in a timely fashion but if you wanted another drink or your check you had to hunt down your server.,food positive <sep> check neutral
0,0,"Although, a limited menu, we had no trouble picking out our delicious meal.",menu negative <sep> meal positive
0,0,"The staff is warm and friendly, and the bartender makes an awesome drink with something called pisco.",staff positive <sep> bartender neutral <sep> drink positive
0,0,We approached the host and manager politely after the meal but only received a simple and insincere Sorry.,host negative <sep> manager negative <sep> meal neutral
0,0,Once seated the waiter took our drink orders only to return 10 minutes later with the wrong drinks.,waiter negative <sep> drinks negative <sep> drink orders neutral
0,0,"For appetizers try the tuna carpaccio with wasabi creme fraiche, lobster tempura with tarter sauce.",appetizers neutral <sep> tuna carpaccio with wasabi creme fraiche positive <sep> lobster tempura with tarter sauce positive
0,0,"Delicious food, just stay away from the specials of the day!",food positive <sep> specials negative
0,0,"The bartender informed me the place was full, and the wait was 30 minutes.",place negative <sep> wait neutral
0,0,"Without another word when we arrived, they added a chocolate decoration saying Happy Anniversary to our desserts.",chocolate decoration positive <sep> desserts neutral
0,0,They seem to put the sauce over the mozzarella which allows the sauce to be the primary taste.,sauce over the mozzarella neutral <sep> taste negative
0,0,"Sure, the burgers are good, but not good enough to make up for the abominable service and disgusting, filthy atmosphere.",burgers positive <sep> atmosphere negative
0,0,Crowded waiting area in entrance forced you to sweat out the wait for a table while standing over other diners.,waiting area negative <sep> table neutral
0,0,"I was their for Saturday lunch, adn I think that there's a different dinner menu, but everything was great.",Saturday lunch neutral <sep> dinner menu positive
0,0,I had the waiters bring back so much meat that that asked me if I wanted Flank steak for dessert.,waiters negative <sep> meat positive <sep> steak neutral <sep> dessert neutral
0,0,"My husband and I ate dinner there last weekend and the food was very good, and very reasonably priced, we thought.",dinner neutral <sep> food positive <sep> priced positive
0,0,I saw a waitress yell at 2 customers for moving a table out a little bit in order to have more seating space.,waitress negative <sep> space neutral
0,0,"The decor was pleasant, but the tables were way too much crowded for a restaurant of this presumptive caliber.",decor positive <sep> tables negative
0,0,"Sure, the hostess can be rude, but when in the mood for authentic Mexican food, there is no better place in NYC, yet.",hostess negative <sep> Mexican food positive
0,0,"Mysteriously, the reserved tables all stayed empty throughout our meal and were still empty when we left an hour later.",reserved tables negative <sep> meal neutral
0,0,"Half way through the meal my husband had to go to the bar to order his own beer, since the server never came back.",meal neutral <sep> bar neutral <sep> beer neutral <sep> server negative
0,0,The cajun food is great but there is something for everyone on the menu and I have yet to be disappointed.,cajun food positive <sep> menu neutral
0,0,"Although Sweet Melissa's food and pastries are very tasty, the unfriendly folks who work there sour the experience.",Melissa positive <sep> food positive <sep> pastries positive <sep> experience negative
0,0,A basic sandwich/burger menu is also served for pre-ice cream nourishment--just always remember to leave room for dessert!!,menu neutral <sep> pre-ice cream nourishment neutral <sep> dessert positive
0,0,The service is excellent and always informative without an air.,service positive <sep> air neutral
0,0,"Great food, but tiny portions and inexcusable service - disorganized, amateurish and definitely overpriced by a long shot.",food positive <sep> portions negative <sep> service negative
0,0,We had over 100 beers to choose from and the food and service was excellent.,beers neutral <sep> food positive <sep> service positive
0,0,"For lunch, try the white meat chicken salad.",lunch neutral <sep> white meat chicken salad positive
0,0,No compensatory nibbles or drinks were supplied -- even after we indicated to the waiter that it was 'the right thing to do',nibbles negative <sep> drinks neutral <sep> waiter negative
0,0,"The wait staff was all hanging at the bar, lounging around.",wait staff negative <sep> bar neutral
0,0,"Adding insult to injury, the waiter had to ask for the wine bottle by number (where are we?",waiter negative <sep> wine bottle neutral
0,0,"The dinner special is amazing, although I would pick the meat option rather than seafood.",dinner special positive <sep> meat positive <sep> seafood negative
0,0,"We went to Steinhof about a week ago and sat at the bar since the place was packed, but they have the full menu at the bar.",place neutral <sep> menu positive
0,0,"The menu reads well, and it sounds like the chef knows whats up.",menu neutral <sep> chef positive
0,0,"Service is not particularly warm, but I've gone back again and again (for dinner) over the years on an almost monthly basis.",Service negative <sep> dinner neutral
0,0,We recently went for dinner with two kids and the staff were very accomodating even without reservations.,dinner neutral <sep> staff positive
0,0,"The atmosphere is fun -- dark, pulsing, basement room; a place where you feel like you can relax.",atmosphere positive <sep> room neutral
0,0,Their food is delicious and they send you cut up oranges to cleanse your palate after dinner which is a very nice touch.,food positive <sep> dinner neutral
0,0,The waitress was not very responsive to requests and was slow to return with drinks.,waitress negative <sep> drinks neutral
0,0,"The ambience was nice, but service wasn't so great.",ambience positive <sep> service negative
0,0,"Def, Def try the green papaya salad for an appetizer.",green papaya salad positive <sep> appetizer neutral
0,0,I spent more time looking for a waiter than I did enjoying my meal.,waiter negative <sep> meal positive
0,0,"We also had an extra appetizer-some sort of fish roll, which was dipped in spicy sauce.",sort of fish roll neutral <sep> sauce positive
0,0,"The space is cool, but the food and service were awful.",space positive <sep> food negative <sep> service negative
0,0,"the wait for our drinks, appetizers and food was very long, the food was mediocre, and it was a bit pricey.",wait negative <sep> drinks neutral <sep> appetizers neutral <sep> food negative
0,0,"The food is decent, but for what the bill comes to, it's just not worth it.",food positive <sep> bill negative
0,0,The service was spotty as a couple of drink orders were forgotten and the waiter didn't really come to check on us.,service negative <sep> drink neutral <sep> waiter negative
0,0,Each course was accompanied by a new wine.,course neutral <sep> wine positive
0,0,After dinner our waiter takes the bill and the manager tells him to clear our table so that we could leave.,dinner neutral <sep> waiter negative <sep> bill neutral <sep> manager negative
0,0,"The staff is constantly disappearing from the restaurant, making it impossible to get drink refills or to get the check.",staff negative <sep> drink neutral
0,0,"Summary good service, bad food!",service positive <sep> food negative
0,0,"my table of four was not totaly neglected, but there was a lag in how promptly we were being served.",table negative <sep> served positive
0,0,And don't forget to try the Korean rice wine to go with your dinner (Sansachun is one of my favorite).,Korean rice wine positive <sep> dinner neutral
0,0,The Food There's no need to slump into a well-known comfort zone of teriyaki and udon.,comfort positive <sep> teriyaki neutral
0,0,I really like the decor and it made it feel like I was having drinks at a mansion.,decor positive <sep> drinks neutral
0,0,The waitress told me that their dessert chef was trained in Sicily.,waitress negative <sep> dessert chef neutral
0,0,"Although Nobu requires a 2-3 month advanced reservations, it's worth the wait!",reservations neutral <sep> wait positive
0,0,the food sucked straight up looks like a nice place to go out with date and have a couple of drinks.,food negative <sep> drinks neutral
0,0,My party did not love the meats on the menu maybe the pork dumplings but nothing else.,menu neutral <sep> pork dumplings positive
0,0,"While dining, none of us were impressed with the food.",dining neutral <sep> food negative
0,0,I order the Jerk Chicken full price off the menu.,price negative <sep> menu neutral
0,0,"But the service was absolutely terrible, and we watied 45 minutes for food.",service negative <sep> food neutral
0,0,"But the price tag was high, and the food was comparable to a Las Vegas buffet for flavor and quality.",price tag negative <sep> food positive
0,0,It was practically impossible to get the waitstaff's attention to order another bottle of wine.,waitstaff negative <sep> wine neutral
0,0,"the atmosphere is trendy, i think it's better to come here for a drink rather than dinner.",atmosphere positive <sep> drink neutral <sep> dinner neutral
0,0,"At $16 a burger and $26 for a lobster roll, the food is definitely expensive.",burger neutral <sep> lobster roll neutral <sep> food negative
0,0,The final blow came when the waitress scorned our 16% tip for the meal.,waitress negative <sep> meal neutral
0,0,The new server we had was surprisingly well-versed on the menu and gave really solid service.,new server positive <sep> menu neutral <sep> service positive
0,0,"although the food was good, the wait was so long; extremely snobby about seating you, we waited 45 min + for our reservation.",food positive <sep> seating negative
0,0,"They had a great wine selection to choose from, the single mixed drinks were a little pricey.",wine selection positive <sep> single mixed drinks negative
0,0,"The tasting menu was delivered at a break-neck pace, leaving no time to enjoy the wine or even digest the food.",menu positive <sep> wine positive <sep> food positive <sep> pace neutral
0,0,"South American additions to the menu, like perfectly fried green plantains and garlicky pork, are uniformly successful.",menu neutral <sep> fried green plantains positive <sep> pork positive
0,0,A simple dish like Fattouch or Tabbouleh are turned into the most delicious salad youll ever have.,dish positive <sep> Fattouch neutral <sep> salad positive
0,0,The food was very good but portions were small.,food positive <sep> portions negative
0,0,"The downside is that perhaps due to rice's eclectic nature, the chef has trouble cooking any single type to perfection.",rice neutral <sep> chef negative
0,0,"The food was OK at best, and if you don't LOVE cheese don't even consider going here.",food neutral <sep> cheese negative
0,0,"I drank beer, but I tried her apple martini, It was great not sour at all.",beer neutral <sep> apple martini positive
0,0,"Great roofdeck, nice group of 30 somethings, but no music, kind of quiet.",roofdeck positive <sep> music negative
0,0,"A server came shortly after that with a cheeseburger, which is not what i ordered.",server negative <sep> cheeseburger neutral
0,0,"It's the nicest place to nurse a cup of coffee (and the coffee is good), especially out in the little back garden.",place positive <sep> cup of coffee positive <sep> garden neutral
0,0,"The service was warm, but it took forever to get the check.",service positive <sep> check negative
0,0,Despite a slightly snotty server (our waitress was great) I cant wait to hop back on the L train and cruz on over.,server negative <sep> waitress positive
0,0,The waitress waited until I went to the bathroom to ask my friend to order more food.,waitress negative <sep> food neutral
0,0,The menu was much too narrow - 4 pastas and 6 meat dishes or so.,menu positive <sep> meat dishes neutral
0,0,"Usually you lose food quality the trendier you go, but not at this place.",food quality negative <sep> trendier neutral
0,0,"You have to wait in line most of the time, but the burgers are worth it and the beer is cheap.",wait negative <sep> burgers positive <sep> beer positive
0,0,"The atmosphere was fun and if you sit by the window, there is a lot of people-watching to be had!",atmosphere positive <sep> window neutral
0,0,"The food came out wrong, the waiter was no where to be found and the wine showed up at the end of the meal.",waiter negative <sep> meal neutral
0,0,The owner and his sister make you feel like you've been invited over to their house for dinner.,owner positive <sep> dinner neutral
0,0,"Overall, the food makes up for what is missing in the ambience and service.",food positive <sep> ambience negative <sep> service negative
0,0,"I don't think the menu is particularly creative, but I've gotten solidly tasty sushi here and it's always enormous.",menu negative <sep> sushi positive
0,0,"If you want peace quiet, ambience and patient service, go elsewhere.",ambience neutral <sep> service positive
0,0,"Great hamburgers, but the Corner Bistro has the worst service of any food establishment I've ever been to.",Corner Bistro neutral <sep> service negative <sep> food negative
0,0,The Scene Bo Ky is a Vietnamese no-frills noodle shop with some 30 different soups.,noodle neutral <sep> soups positive
0,0,but the wait for seating can be exasperating.,wait negative <sep> seating neutral
0,0,Even some of the staff that was working that night was served their dinner before my table got our dinner entrees.,staff negative <sep> dinner entrees neutral
0,0,"I don't know why the place was almost empty until 8PM, but the food and service were perfect for the price.",place negative <sep> food positive <sep> price neutral
0,0,Bartender made a bad drink for me and I sent it back and was charged for it.,Bartender neutral <sep> drink negative
0,0,"We ordered Brushetta, a 6 on a scale of 10, I like cold tomatoes on toasted bread, they had warm tomatoes.",Brushetta neutral <sep> cold tomatoes on toasted bread positive
0,0,"Unfortunately, the food along with the unhelpful service doesn't make up for the atmosphere.",food neutral <sep> service negative <sep> atmosphere neutral
0,0,This pizza is the BEST anywhere for grandma slices!,pizza positive <sep> grandma slices neutral
0,0,"Some of the waiters are lacking good communication skills, but that can be overlooked in light of the great food and prices.",waiters negative <sep> food positive
0,0,Food was good but we were forgotten after we finished our entrees.,Food positive <sep> entrees negative
