review_id,sentences_ids,sentences_texts,sentences_opinions
0,0,"I don't mind paying a high price for a really good meal, but this was really average food.",price negative <sep> meal positive <sep> food negative
0,0,The atmosphere was really nice and inviting but our waiter was awful!,atmosphere positive <sep> waiter negative
0,0,When I look at the menu I was surprised at the relatively high price compared with other korean restaurants.,menu neutral <sep> price negative
0,0,"While certain staples are excellent (the burger, some of the pastas), the food is not really the point.",staples positive <sep> burger positive <sep> pastas positive <sep> food negative
0,0,"The bar gets out of control busy due to it's proximity to Fordham University--but the Fordham kids are cool, so it's alright!",bar neutral <sep> Fordham kids positive
0,0,"also, when i was waiting to be seated the bartender gave great service and mixed a mean cocktail for me.",bartender neutral <sep> service positive <sep> cocktail positive
0,0,"The food and beer make up for it, but it would be nice if the staff weren't such buzz kills!",beer positive <sep> staff negative
0,0,"Don't know about the rest of the food, but the burgers are one of New York's hidden treats.",burgers positive <sep> treats neutral
0,0,"When I really need good pizza I fly in From Arizona for a few pies, go to friends house , freeze them and fly home.",pizza positive <sep> pies neutral
0,0,The food was pretty good but the portions were smaller than what I would expect for brunch.,food positive <sep> portions negative
0,0,I just think the prices are high for the type of food the kitchen turns out as well as the portion sizes.,prices negative <sep> food neutral <sep> portion sizes neutral
0,0,"It's called OYSTER BAR, and yet no oyster selection at all!",OYSTER BAR neutral <sep> oyster selection negative
0,0,"the atmosphere is trendy, i think it's better to come here for a drink rather than dinner.",atmosphere positive <sep> drink neutral <sep> dinner neutral
0,0,"Don't ask for menu,steak is what you will have,along with great creamed spinach.",steak neutral <sep> spinach positive
0,0,The waitstaff told us that they had already run out of one of the entrees (before 8 p.,waitstaff negative <sep> entrees neutral
0,0,"The salads were like those we were served in Paris, and the Eggs Benedict were out of this world.",salads neutral <sep> Eggs Benedict positive
0,0,"I thought it was great, best service I've ever had in a long time.",service positive <sep> time neutral
0,0,But what would have been a pleasant experience was spoiled by the attitude and actions of the wait staff and the management.,attitude neutral <sep> wait staff positive <sep> management positive
0,0,the most expensive dish on the menu was $14!!!,dish negative <sep> menu neutral
0,0,They cook the cheese so that it turns a nice brown color and it is absolutely the best pizza I've ever had in New York.,cheese neutral <sep> pizza positive
0,0,"Charging full price for half pie toppings, and refusing delivery (1 block) for orders under $20.",price negative <sep> half pie toppings neutral
0,0,"Not only is the sushi mostly stellar, you'd have to be a real bonehead to not take advantage of their cooked items.",sushi neutral <sep> items negative
0,0,Our waiter was confused and forgot an additional soda when we asked for it.,waiter negative <sep> soda neutral
0,0,On the menu board posted outside - they got Passion Fruit Creme Brule.,menu neutral <sep> Fruit Creme Brule positive
0,0,The entertainment was great they have shows that go on through out the dinner.,entertainment positive <sep> shows neutral
0,0,"The appetizers are ok, but the service is slow.",appetizers positive <sep> service negative
0,0,"After finishing your meal, you can drop by their natural food market next door for organic all natural grocery.",meal neutral <sep> food positive
0,0,"warm orangey glow, nice old mexican prints, wee bar that my bf and i vowed to go back and linger at.",mexican positive <sep> bar neutral
0,0,We tried to get the manager who flatly refused to come to our table and discuss the problem with us.,manager negative <sep> table neutral
0,0,"the atmosphere is that of a diner, but if you get a booth that is the best!",atmosphere positive <sep> diner neutral
0,0,(must try the fois gras appetizer and chocolate milkshake for dessert.,fois gras appetizer positive <sep> chocolate milkshake positive <sep> dessert neutral
0,0,About a half hour wait with reservations.,wait negative <sep> reservations neutral
0,0,"When the bill came, the waiter snatched it back so he could add the $3 difference to the wine.",waiter negative <sep> wine neutral
0,0,The bar area got a little too crowded but the ambiance was great.,bar area negative <sep> ambiance positive
0,0,"Teenie weenie overpriced appetizers were served at an agonizingly slow pace, one at a time 30 minutes between each.",appetizers negative <sep> served neutral
0,0,The best dish is not listed on their menu - it is a special - the flat pasta with truffle mushroom sauce.,dish positive <sep> menu neutral <sep> flat pasta with truffle mushroom sauce positive
0,0,I've eaten dinner here quite a few times and the sushi/sashimi has been very fresh on every occasion.,dinner neutral <sep> sushi/sashimi positive
0,0,"For the price and quality of the food we got, I would not dine here again.",price negative <sep> quality negative <sep> food neutral
0,0,"The calamari salad was great while the lamb ribs were fat, fattier and fattiest.",calamari salad positive <sep> lamb ribs negative
0,0,not to mention that the waiter offered putting a scoop of ice cream on my dessert.,waiter negative <sep> dessert neutral
0,0,"It was very loud, I felt too crowded, the man chair's next to me made it impossible for the waiters to pass.",man chair neutral <sep> waiters negative
0,0,"Room is impressive, but service is slow and taste was almost like fast food.",Room positive <sep> service negative <sep> food negative
0,0,"the specials were excellent, everything was delicious down to the olive oil they serve when you sit down.",specials positive <sep> olive oil neutral
0,0,Tried again for Brunch and really bad server with HUGE attitude.,Brunch positive <sep> server negative
0,0,"The waiters can shoot off a 5 minute long list of specials, and they know the menu very well.",waiters positive <sep> menu neutral
0,0,"sam adams on tap, french fries served out of a brown paper bag and a burger cooked perfectly.",tap neutral <sep> french fries served neutral <sep> burger positive
0,0,The food was good but not worth the price.,food positive <sep> price negative
0,0,"Was greeted and seated with no attitude from the host and hostess, despite no reservation.",hostess negative <sep> reservation neutral
0,0,"Grabbed a lunch here on a weekday and it was reasonably priced, well-portioned and generally well-prepared.",lunch neutral <sep> priced positive
0,0,"The bar downstairs is a lot of fun, so if you get stuck waiting, just have drink.",waiting negative <sep> drink neutral
0,0,"Although the wait staff was friendly, the atmosphere was not.",wait staff positive <sep> atmosphere negative
0,0,I would definitely recommend getting reservations as the wait can be very long.,reservations neutral <sep> wait negative
0,0,I had the item that they forgot to put on the menu; some very tasty fish over jasmine rice with shrimp.,menu neutral <sep> fish positive <sep> rice with shrimp positive
0,0,"I'd like to think that my brunch was an isolated incident, but just in case it is not, DON'T GET THE STEAK AND EGGS.",brunch neutral <sep> STEAK negative <sep> EGGS negative
0,0,Service was horrendous the night we went for dinner.,Service negative <sep> dinner neutral
0,0,"No extra pickles, no AC, no ice water, slow service, the whole thing was just dissapointing.",water neutral <sep> service negative
0,0,I even overheard the one waiter argue to the host about that and then they conveniently switched to speaking Spanish.,waiter negative <sep> host neutral
0,0,After dinner our waiter takes the bill and the manager tells him to clear our table so that we could leave.,dinner neutral <sep> waiter negative <sep> bill neutral <sep> manager negative
0,0,"The other food they serve is also very good, but the pizza keeps calling me back!",food positive <sep> serve neutral <sep> pizza positive
0,0,"40 minutes later, the waitress finally looked at our table and we asked about our dishes.",waitress negative <sep> dishes neutral
0,0,"Whole roasted branzino, a well-charred rib eye steak and roast suckling pig are typical dinner entrees.",roasted branzino neutral <sep> well-charred rib neutral <sep> roast suckling pig neutral <sep> dinner entrees positive
0,0,"The liquid brunch consisting of 3 drinks (bloody marys, mimosas or screwdrivers) and coffee and an entree is quite a bargain.",brunch neutral <sep> drinks neutral <sep> mimosas neutral <sep> entree positive
0,0,"Don't go for the decor or the location, go for the food!",decor negative <sep> location negative <sep> food positive
0,0,"We were here for lunch and were seated promptly in the bright, comfortable dining room.",lunch neutral <sep> seated positive
0,0,"The decor in the dinin room is a bit bland, but the service is always friendly.",decor negative <sep> dinin room neutral <sep> service positive
0,0,"02 one can have salad, great steak, and cheesecake or chocolate mousse, plus friendly service.",salad neutral <sep> steak positive <sep> cheesecake or chocolate mousse neutral <sep> service positive
0,0,"The value for this place was great-- we had 2 drinks, 2 appetizers, 2 entrees, and 1 chocolate cake (yummy!!)",value positive <sep> drinks neutral <sep> appetizers neutral <sep> entrees neutral <sep> chocolate cake positive
0,0,"Dining choices range from three-course, ingredient-themed tasting menus or a regular, seasonal a la carte menu.",Dining choices range neutral <sep> menus positive <sep> la carte menu positive
0,0,"Don't know if the bar is really that bad, BUT the food would more than compensate!",bar negative <sep> food positive
0,0,I walk in ask to take a look a the menu and was greeted by the a nasty not so passive aggressive hostess.,menu neutral <sep> hostess negative
0,0,One of my favorite places to get a cup of tea or to have a casual brunch with the newspaper.,cup of tea neutral <sep> brunch neutral <sep> places positive
0,0,My dinner partner loved some dishes even when they were too hot for her taste.,dinner neutral <sep> dishes positive
0,0,I dined at Belleville and my meal was distrupted by the manager yelling at the wait staff in the middle of the dining room.,meal neutral <sep> manager negative <sep> wait staff negative <sep> room neutral
0,0,The manager was very thoughtful to have the chef make me a dish not on the menu to my liking.,manager positive <sep> chef neutral
0,0,"At almost $70/person with a glass of wine, the food is overrated.",glass of wine neutral <sep> food negative
0,0,The dramatic space complements the food and will wow out-of-towners.,dramatic space neutral <sep> food positive
0,0,He roasts tomatoes in the oven to make his fantastic sauce.,tomatoes neutral <sep> sauce positive
0,0,"and they have this great deal: 6 oysters on the half shell and your choice of beer, or wine for only $7!",oysters neutral <sep> choice positive <sep> wine positive
0,0,"I would wait for a table next time, the food was that good.",table neutral <sep> food positive
0,0,"Although the food was in small portions, it was good.",food positive <sep> portions negative
0,0,"It is not a very stylish place, but we had some of the best Chinese food we ever had.",place negative <sep> Chinese food positive
0,0,The staff knows all about the food and the Chef is very visible visiting tables and overseeing the dining room.,staff positive <sep> food neutral <sep> Chef positive
0,0,"Lousy, hard as a rock home made potato chips that could slice a tomato as well as a soda can.",rock negative <sep> soda can neutral
0,0,"After reading all the reviews here and many glowing recommendations on food blogs, I thought I MUST try this pizza!",food neutral <sep> pizza positive
0,0,"Caravan can be a little slow sometimes, but more than makes up for it in the quality of the food and the care of wait staff.",food positive <sep> care neutral <sep> wait staff positive
0,0,"The decor is nothing great to speak of, but who cares - the food is top notch.",decor negative <sep> food positive
0,0,"I would say it's suitable for a romantic date or quiet family meal, as there is no bar so the atmosphere is a little quiet.",family meal positive <sep> bar neutral <sep> atmosphere positive
0,0,The Food There's something for fish fans of every stripe on the lengthy menu.,Food positive <sep> menu neutral
0,0,"Even when the chef is not in the house, the food and service are right on target.",chef neutral <sep> food positive <sep> service positive
0,0,"Good food, even if it's inauthentic Thai.",food positive <sep> Thai negative
0,0,"I don't expect an enormous, heaping plate of food, but c'mon.",plate positive <sep> food neutral
0,0,As appetizers we enjoyed the Drunken Goat Cheese Salad and Lobster Empanadas.,appetizers neutral <sep> Drunken Goat Cheese Salad positive <sep> Lobster Empanadas positive
0,0,Get a Big beer to wash it all down and a side of potatoes and garlic bread.,beer positive <sep> garlic bread neutral
0,0,I organized a dinner for 20 and was extremely satisfied with the results.,dinner neutral <sep> results positive
0,0,Get in before peak dinner time (7-8 PM) to avoid harried service.,dinner neutral <sep> service negative
0,0,"I tried the Crab Croquettes (delicious, and yes, the sauce IS hot) and the Salade Jumelle (a good, basic mesculen salad).",Crab Croquettes positive <sep> sauce positive <sep> Salade neutral <sep> Salad positive
0,0,The manager finally came by to apologize and offered to give us a greek salad on the house.,manager positive <sep> greek salad neutral
0,0,the roll was great as usual but the salmon was old the tuna did not look good at all.,roll positive <sep> tuna neutral
0,0,"The deserts are horrid, but the drinks are always good.",deserts negative <sep> drinks positive
0,0,"We first got a table next to a VERY loud speaker and had no view, but the waiter was kind enough to move us when we asked.",table neutral <sep> waiter positive
0,0,The waitress made a mental note about it and brought out a special dessert without being asked.,waitress positive <sep> dessert neutral
0,0,The mussels and fries at this place were amazing!,mussels positive <sep> fries positive <sep> place neutral
0,0,"She asked for only a glass of water, and the waitress refused, to her face, twice.",glass of water neutral <sep> waitress negative
0,0,In the hour we waited for our food we had to remind our mentally challenged waitress 3times to bring our chipssalsa.,food neutral <sep> waitress negative
0,0,"Despite the servers' best intentions, it's easy to feel rushed while perusing the menu -- an awkwardly large blackboard.",servers positive <sep> menu neutral <sep> blackboard negative
0,0,The food was scrumptious-not the usual wedding.,food positive <sep> wedding neutral
0,0,The birthday girl's dessert included a candle the staff came by with birthday wishes.,dessert neutral <sep> staff positive
0,0,"The place is very loud, good for drinks by the bar not to eat and yell.",place negative <sep> drinks positive <sep> bar neutral
0,0,"Brunch is what Friend of a Farmer is known for, however dinner is equally impressive.",Brunch positive <sep> dinner negative
0,0,"My group got charged an outrageuos $63/person for a family-style dinner, including a 23% tip added for the horrible service.",family-style dinner neutral <sep> service negative
0,0,I haven't tried a lot of their menu however their appitizers are tasty and fairly priced.,menu neutral <sep> appitizers positive <sep> priced positive
0,0,"I am a martini guy - vodka, not gin - and their classic martini with blue cheese olives is pretty damn near definitive.",martini guy neutral <sep> martini with blue cheese olives positive
0,0,Although we were seated 35 minutes after our reservation the service from then on was outstanding.,reservation neutral <sep> service positive
0,0,The only thing whihc i (and my partner) never heard before was: the waitress mentioned the price of the specials (?,waitress negative <sep> price neutral <sep> specials neutral
0,0,"We went to Steinhof about a week ago and sat at the bar since the place was packed, but they have the full menu at the bar.",place neutral <sep> menu positive
0,0,waitress brought different food.,waitress neutral <sep> food negative
0,0,"Flavors range from standards to hard-to-find Italian options, like tiramisu, hazelnut and zuppa inglese.",Flavors negative <sep> tiramisu neutral
0,0,"If it's just a quick martini at the bar (which I recommend Jeffery's) or a mind blowing Roast Chicken, go to Village!",martini positive <sep> bar neutral <sep> Roast Chicken positive
0,0,They spoon the FAT GREASE over your steak when they bring it to the table.,FAT GREASE negative <sep> steak neutral <sep> table neutral
0,0,"great decor, unfortunately the worst service possible.",decor positive <sep> service possible negative
0,0,By this I mean that the guy selling hotdogs outside of Grand Central has given me better service.,guy selling hotdogs neutral <sep> service positive
0,0,"The menu reads well, and it sounds like the chef knows whats up.",menu neutral <sep> chef positive
0,0,A basic sandwich/burger menu is also served for pre-ice cream nourishment--just always remember to leave room for dessert!!,menu neutral <sep> pre-ice cream nourishment neutral <sep> dessert positive
0,0,Our food took so long to be served that we nearly missed our curtain.,food neutral <sep> served negative <sep> curtain negative
0,0,"My husband and I ate dinner there last weekend and the food was very good, and very reasonably priced, we thought.",dinner neutral <sep> food positive <sep> priced positive
0,0,"The menu had more selections, price points that fit all our budgets and a new Sushi menu that went over huge with the table.",new Sushi menu positive <sep> table neutral
0,0,"You can't fault them for serving up some pretty good food, even if it's a bit overpriced.",serving neutral <sep> food positive
0,0,"Fantastic flavor, but certainly not worth the high price of the small glass.",flavor positive <sep> price negative <sep> glass negative
0,0,"For appetizers try the tuna carpaccio with wasabi creme fraiche, lobster tempura with tarter sauce.",appetizers neutral <sep> tuna carpaccio with wasabi creme fraiche positive <sep> lobster tempura with tarter sauce positive
0,0,The snooty manager asked us to leave and gave us our check in the middle of our meal.,manager negative <sep> meal neutral
0,0,We could not believe that the owner only laughed and continued serving him drinks.,owner negative <sep> serving neutral <sep> drinks neutral
0,0,I let the waiter know and he offered me a free dessert.,waiter positive <sep> dessert neutral
0,0,The atmosphere was so fun that we decided to have another cocktail at the bar and enjoy the scene.,atmosphere positive <sep> cocktail neutral <sep> bar neutral <sep> scene positive
0,0,For entrees the suckling pig is a ho-hum pile of pulled pork and the fish-of-the-day was merely good.,entrees neutral <sep> suckling pig positive <sep> pork positive
0,0,"Just finished a tasty jerked chicken dinner that was too pricey for the subpar service and good, but not great food.",jerked chicken dinner positive <sep> service negative <sep> food neutral
0,0,"The staff treated me as if I were a celebrity, which I am not and they did not make me feel uncomfortable as a single diner.",staff negative <sep> diner neutral
0,0,For the most part I enjoyed my dining experience at Revival (not to be confused with the bar on 15th).,dining experience positive <sep> bar neutral
0,0,") I'm sticking with Cafe Mozart--which has the same desserts, bigger slices, and lower prices!",Cafe neutral <sep> desserts neutral <sep> prices positive
0,0,"Once in the oven (electric, mind you), he shifts pies every few seconds to attain nicely-charred, chewy crust perfection.",pies neutral <sep> perfection positive
0,0,"However, we were never served bread with our meals and the restaurant is too crowded.",served bread negative <sep> meals neutral
0,0,"Apple sourdough pie, and orange cake are good, as is the bundt cake with a rich chocolaty filling and the cupcakes.",Apple sourdough pie positive <sep> orange cake positive <sep> bundt cake neutral
0,0,The wasabi mashed potatoes were delicious while the chicken was dry.,wasabi mashed potatoes positive <sep> chicken negative
0,0,Also had to ask the host for our apps becasue our waiter was never around.,host neutral <sep> waiter negative
0,0,After the waiter finally took our order and gave us our food he never came back.,waiter negative <sep> food neutral
0,0,They also have Korean BBQ and very beer-friendly Korean appetizer(like KimChee).,Korean BBQ neutral <sep> Korean appetizer positive
0,0,"The music was a bit loud but the song selection was great, so we blew off desert and had another round of drinks at the bar.",selection positive <sep> drinks neutral <sep> bar neutral
0,0,"i've had better mashed potatoes from a box, and the vegetables were soaked in oil.",mashed potatoes positive <sep> box neutral <sep> vegetables negative
0,0,"Expect to be cramped and you may have to wait a little for your food, but the service is really friendly and helpful.",food neutral <sep> service positive
0,0,The waitresses are at your table filling your water or oil before your last sip or dip.,waitresses positive <sep> water neutral <sep> oil neutral
0,0,"I ordered the seafood platter - the shrimp was hard and overdone, as were the mussels.",seafood platter neutral <sep> shrimp negative <sep> mussels negative
0,0,"The food was average for brunch anywhere in NYC, and priced well above average.",food negative <sep> brunch neutral
0,0,"the steak and chicken fajitahs were good, a bit too much sauce on the meat for my taste.",chicken fajitahs positive <sep> sauce negative <sep> meat negative
0,0,The dessert was as good as the waiter said it would be.,dessert positive <sep> waiter neutral
0,0,Diners at the bar watch busy chefs scoop lobster salad onto warm brioche rolls.,bar neutral <sep> lobster salad neutral <sep> brioche rolls positive
0,0,"Nothing on the menu jumped out at me, but when we tasted the chicken and the pork tenderloin.",menu negative <sep> pork tenderloin neutral
0,0,A friend was dieing for chorizo but it was only in the tapas menu which we couldn't have.,chorizo positive <sep> tapas menu neutral
0,0,The hostess did not verify/review the menu prices with us nor did they inform us of the logistics of the brunch.,hostess negative <sep> brunch neutral
0,0,that the waiting is horrific but the food is great.,waiting negative <sep> food positive
0,0,Serving things like Chicken Kiev with a garlic mashed potato egg roll for $$ with the snooty attitude to match!,Chicken Kiev neutral <sep> attitude positive
0,0,The waitress came back to our table several times to ensure we were well catered for.,waitress positive <sep> table neutral
0,0,"After paying for our meal, we left some feedback with the manager (a chap named J.",meal neutral <sep> manager negative
0,0,"There is always a fun and friendly crowd at the bar, mostly locals, if you just want to come by for happy hour.",crowd positive <sep> bar neutral
0,0,"This restaurant was a great value, even though I know nothing about the prix fixe menu.",value positive <sep> prix fixe menu neutral
0,0,the waitress was surly -- refused to bring sweetner for my tea!!,waitress negative <sep> tea neutral
0,0,"Go for drinks, but not food it will leave you asking, where's the beef?",drinks positive <sep> beef neutral
0,0,Start off with an expertly mixed cocktail or glass of wine at the beautiful bar.,mixed cocktail neutral <sep> bar positive
0,0,"Some other appetizers fell short of expectations though (ie, good, but not worth the price), like the tempura and veggies.",appetizers negative <sep> veggies neutral
0,0,USC has a cold smoker and smoked the avocado in order to make the dish more complex.,avocado neutral <sep> dish negative
0,0,The seafood salad was yummy as was the filet of sole stuffed with crabmeat.,seafood salad positive <sep> filet positive <sep> sole stuffed positive <sep> crabmeat neutral
0,0,I saw a waitress yell at 2 customers for moving a table out a little bit in order to have more seating space.,waitress negative <sep> space neutral
0,0,a red curry shrimp dish where the only thing on the plate that's tasty is the rice?,red curry shrimp dish neutral <sep> rice positive
0,0,This is definately a place to go for drinks and then get dinner somewhere else!,drinks positive <sep> dinner neutral
0,0,He met me for wine tasting/sampling of food the week before and made sure that the service was on their toes.,food neutral <sep> service positive
0,0,"Had a few appetizers; smoked duck was served cold but good flavor, tofu was good/fresh too, nothing to rave about though.",appetizers neutral <sep> flavor positive
0,0,"they continue to expand their garden space, w/out expanding their kitchen and cannot provide even adequate service.",garden space positive <sep> kitchen positive <sep> service negative
0,0,"If you consider throwing food at your when they remember good service, then go for it.",food neutral <sep> service positive
0,0,great trendy spot for a night out but to be honest the food was not worth the cost.,spot positive <sep> food negative
0,0,"they waited to get us water after they took our food orders, which took the waitstaff a long time to do.",food neutral <sep> waitstaff negative
0,0,"The food at Mercer Kitchen is great, flavorful and nicely portioned.",food positive <sep> Kitchen neutral
