review_id,sentences_ids,sentences_texts,sentences_opinions
0,0,Our waiter didn't even bothered to ask for dessert.,waiter negative <sep> dessert neutral
0,0,"My friend's entree wasn't presented as described in the menu, but we didn't want to add to the drama.",entree negative <sep> menu neutral
0,0,"Our waitress forgot to bring me another margarita, but somehow she managed to get it on the bill.",waitress negative <sep> margarita neutral
0,0,The appetizers are really pricey particularly once you see the size (or lack thereof).,appetizers negative <sep> size neutral
0,0,I like the smaller portion size for dinner.,portion negative <sep> dinner neutral
0,0,"The food was certainly fine, although prices were high by any standard, with dinner for four being over $300 without drinks.",prices negative <sep> dinner neutral <sep> drinks neutral
0,0,"Only reason to go is Eben, the most solicitious bartender in NYC (now) with drink knowledge and ability to spare.",bartender positive <sep> drink neutral
0,0,My snack was fava bean hummus chips which was the perfect amount to hold me til dinner.,fava bean hummus chips positive <sep> dinner neutral
0,0,The food was good but took long and the drinks she recommended to us were too strong.,food positive <sep> drinks negative
0,0,"the waiters had a really hard time remembering to bring drinks, and when they did they were not what was ordered.",waiters negative <sep> drinks neutral
0,0,When you order a ploughman's lunch you don't even get bread (which confounded me) and the mini yorkshires were dry as a bone.,lunch neutral <sep> mini yorkshires negative
0,0,They seem to put the sauce over the mozzarella which allows the sauce to be the primary taste.,sauce over the mozzarella neutral <sep> taste negative
0,0,But the wait staff's attitude will make me rethink about returning.,wait staff negative <sep> attitude neutral
0,0,"Sometimes people get up and dance, overall a pretty fun spot, although the crowd does tend to be over 30.",spot positive <sep> crowd negative
0,0,*There is a pre-theatre dinner menu for early diners that is of great value.,pre-theatre dinner menu positive <sep> diners neutral
0,0,"All of the dishes we had were very good, but the fries were a little on the salty side, which we actually didn't mind.",dishes positive <sep> fries negative
0,0,"All in all, it was a decent meal but dinner for two came to $172 with tip.",dinner neutral <sep> tip neutral <sep> meal positive
0,0,the food tastes like home cooking.,food neutral <sep> cooking positive
0,0,"Get a bottle of wine, and eat what your heart has been desiring because all the things you would love to be on one menu--are!",bottle of wine neutral <sep> menu positive
0,0,The hostess finally seated us at a table for two when there were three of us in an empty restaurant.,hostess negative <sep> table neutral
0,0,And price is over value for two persons dinner $ 90.,price negative <sep> dinner neutral
0,0,My friend and I enjoyed choosing from a very diverse menu of appetizers and entrees.,menu positive <sep> appetizers neutral <sep> entrees neutral
0,0,The waiter was pleasant and I thought how bad could someone screw up basic Italian food?,waiter positive <sep> Italian food neutral
0,0,"In Short The weathered bar, well-worn tables, and chipped black paint on the walls give this corner tavern a lived-in feel.",bar neutral <sep> tables negative
0,0,"The oil is changed frequently, and the food never tastes TOO HEAVY.",oil neutral <sep> food positive
0,0,Our waiter took his time taking our drink orders ('97 Italian red was good).,waiter positive <sep> drink neutral
0,0,"The staff has been nice, but they seemed really stressed and the unisex bathroom needs to be cleaned more often.",staff positive <sep> bathroom negative
0,0,If you like a cleaner (more generic) flavor then other places may provide the norm.,flavor positive <sep> norm neutral
0,0,Go there for dinner this time and find it unusually bad in taste and not pleasent service at all.,dinner neutral <sep> service negative
0,0,"Party of 4 after a Sunday matinee, no reservation, seated promtply, but service was slow.",reservation neutral <sep> seated positive <sep> service negative
0,0,"We got the tasting menu($100 for two), which was a selection of the signature dishes.",menu positive <sep> dishes neutral
0,0,"The small single room--wood panelling, large mirrors, white tablecloths, dim lighting--has few frills.",single room negative <sep> mirrors positive <sep> tablecloths neutral
0,0,"My dinner at Diner 24 is highlighted by rude waiters, overpriced food and unprepared dishes.",dinner neutral <sep> waiters negative <sep> food negative
0,0,"Waited an hour for the food to come out, couldnt even find the waitress.",food neutral <sep> waitress negative
0,0,The food came out really quick and the service overall was not bad.,food positive <sep> service neutral
0,0,"Then we were led downstairs to the main room, and were seated at the huge communal dining room table.",seated neutral <sep> dining room table positive
0,0,The service was average and the tables are really close together (but who cares when the food is this good).,tables negative <sep> food positive
0,0,"Smallish menu, but more than adequate, and not that heavy on sauces which is so typical of italian restaurants.",menu negative <sep> sauces positive
0,0,"We were left waiting a while after our food for our waiter to return, and thus we did not have time for dessert.",food neutral <sep> waiter negative <sep> dessert neutral
0,0,"We sat near the sluggish, hot and very loud kitchen and the service area was not wiped down once during the entire time.",kitchen negative <sep> time neutral
0,0,"I never have to wait a long time to get my food, so it's a great place to go if you're really hungry and/or in a hurry.",wait positive <sep> food neutral
0,0,The cultured wait staff were accommodating and helped explain and pronounce the items off the menu.,cultured wait staff positive <sep> menu neutral
0,0,The menu has many dishes that one can't find anywhere in the city.,menu neutral <sep> dishes positive
0,0,The Pink Pony's brunch is among the very best in the city!,Pony neutral <sep> brunch positive
0,0,I have been there for lunch many times and have always enjoyed my sushi.,lunch neutral <sep> sushi positive
0,0,"for instance, i sat next to this couple who experienced problems with their food and the asked to speak to a manager.",food negative <sep> manager neutral
0,0,The food is very good for the price.,food positive <sep> price neutral
0,0,I have never paid so much at a dinner in my life but we also got very nice 3 bottles of wine.,dinner neutral <sep> wine positive
0,0,"The choices for vegetarians are extremely limited, unless one is content with side dishes.",choices negative <sep> dishes positive
0,0,You can get a completely delish martini in a glass (that's about 2 1/2 drinks) for $8.,martini in positive <sep> drinks neutral
0,0,The food is OK but I have to ask WHY they serve noodles with steak???,food positive <sep> noodles with steak neutral
0,0,"The ambience is extremely romantic, even if you get seated upstairs.",ambience positive <sep> upstairs neutral
0,0,"It was worth the wait , an hour, without a reservation, for an out of this world meal.",wait positive <sep> reservation neutral
0,0,although I don't think there is any beef on the menu (but there is plenty of fish and chicken).,menu neutral <sep> fish positive
0,0,Those of you who are sick of the standard Italian fare will be blown away by the food at Arezzo.,Italian fare neutral <sep> food positive
0,0,Special touch -- my dessert plate had Happy Birthday drizzled in chocolate.,dessert plate positive <sep> chocolate neutral
0,0,"The place was packed, but it didn't effect our service or getting our food/drinks promptly.",place negative <sep> service positive
0,0,Before leaving the server gave us takeout menus.,server positive <sep> menus neutral
0,0,"Their yogurt breads are very good, but I wasn't impressed with their sandwiches.",yogurt breads positive <sep> sandwiches negative
0,0,The Scene Inconspicuous Bottino is an ideal stop for a light lunch or full dinner while gallery-hopping through Chelsea.,Scene neutral <sep> lunch positive <sep> dinner positive
0,0,"Got a table during restaurant week for lunch and the service was cordial, if slower than usual.",lunch neutral <sep> service positive
0,0,Meals not served at once and service was inattentive and forgetful.,Meals neutral <sep> served negative <sep> service negative
0,0,"The food is worth going for, but the boys in behind the bar in the lounge are what keep me coming back!",food positive <sep> bar neutral
0,0,"Among us, we ordered a large sampling of the menu, and everyone thoroughly enjoyed their meal.",menu neutral <sep> meal positive
0,0,Nice ambience and bar while waiting for a table.,ambience positive <sep> bar positive <sep> table neutral
0,0,The bean burritos and the cheese enchiladas are to die for and don't get me started on their refried beans.,bean burritos positive <sep> beans neutral
0,0,The only cuisines that will provide comparable quality in the vicinity are Greek (if you know where to look) and Pizza.,vicinity neutral <sep> Pizza positive
0,0,"i mean the place was empty and it seemed to take for ever to get food, drink or the check.",place positive <sep> food negative <sep> drink negative
0,0,"Although the service can be a bit brusque at times, the food is always good, hearty and hot.",service negative <sep> food positive
0,0,The Fettucine Alfredo was appropriately cheesy and dense but the show stopper was the Linguine with white clam sauce.,Fettucine Alfredo positive <sep> white clam sauce neutral
0,0,"The ambience is simple, yet elegant and be sure to finish your meal with their famous shlog.",ambience positive <sep> meal neutral
0,0,The quality of the food used to be worth the long waits but not anymore.,quality negative <sep> food neutral
0,0,I don't know why people complain about the service - our waiter brought our drinks and food out promptly.,waiter positive <sep> drinks neutral <sep> food neutral
0,0,"I must say I enjoyed their soup dumplings more than Joe's,but the other dishes were disappointing.",soup dumplings positive <sep> dishes negative
0,0,Coffee served without sugar/milk and took more than 10 min to catch the waiter to ask for it.,Coffee served neutral <sep> waiter negative
0,0,"While the food was good, service tried way too hard.",food positive <sep> service negative
0,0,Try the Bocadillos to start and don't forget to order a Mojito from the bar (they're the best!,Mojito positive <sep> bar neutral
0,0,the food is neither tasty nor reasonably priced ($137 for four with one glass of wine total?,food negative <sep> priced negative <sep> glass of wine neutral
0,0,The food is excellent so long as you like Austrian cuisine.,food positive <sep> cuisine neutral
0,0,The atmosphere is nice - it's all dark wood with the bar in the front.,atmosphere positive <sep> bar neutral
0,0,"To complain about waiting for a table, etc.",waiting negative <sep> table neutral
0,0,"The best tasting pizza by far, a long long wait for service but well worth it.",pizza positive <sep> wait negative <sep> service positive
0,0,"Two complaints- their appetizer selection stinks, it would be nice to get some mozzarella sticks on the menu.",appetizer selection negative <sep> menu neutral
0,0,I've been there for lunch many times and the service is always cheerful and efficient.,lunch neutral <sep> service positive
0,0,"Nonetheless, it's an excellent pie -- and don't let the long lines scare you off -- they keep them moving.",pie positive <sep> lines negative
0,0,"When there are ten open tables in a room, the hostess insisted on seating peopl on top of each other.",hostess negative <sep> seating neutral
0,0,The chef insisted that the meat was cooked properly!?,chef negative <sep> meat positive
0,0,"Because of the delicate thin crust, take-out pies get soggy in their boxes.",crust positive <sep> take-out pies negative
0,0,And Mondays fajita are half price all night.,fajita neutral <sep> price positive
0,0,"Cozy atmosphere, good food and service, good place to meet friends for dinner and a drink.",atmosphere positive <sep> food positive <sep> service positive <sep> dinner neutral <sep> drink neutral
0,0,"At this level, I want my servers to know more than me about the food and I didn't get that sense.",servers negative <sep> food neutral
0,0,"The seafood sausage is ok, but the rest of the appetizers outshine them.",seafood sausage neutral <sep> appetizers positive
0,0,We picked on a bunch of different appetizers as dinner and everything was yummy.,appetizers positive <sep> dinner neutral
0,0,The chef/owner is always walking around making sure everyone is having a good time.,chef/owner neutral <sep> time positive
0,0,We started with some drinks on the front porch and then continued at our table with a bottle of delicious red wine.,table neutral <sep> wine positive
0,0,"The ambience is cool, and the cocktails might be worth coming by, but head somewhere else for dinner.",ambience positive <sep> dinner neutral
0,0,"The sevice and food were excelent, but at the bottom of the menu were the words, cash only.",food positive <sep> menu negative
0,0,Don't miss the crema catalana the waiter recommended us for dessert.,waiter positive <sep> dessert neutral
0,0,"The bar is available while you waiting for the table, the DJ is nice.",bar neutral <sep> DJ positive
0,0,"finally they wanted to take our app order before taking our wine order, seemed like the waiter couldnt handle it all at once.",wine neutral <sep> waiter negative
0,0,"If I went back, I'd have dinner in the bar--better service and even better atmosphere.",dinner neutral <sep> bar neutral <sep> service positive
0,0,My prefix dinner was composed of garlic shrimp appetizer followed by a yummy skirt steak complete with handcut fries.,prefix dinner neutral <sep> garlic shrimp appetizer neutral <sep> steak positive <sep> fries positive
0,0,) My date and I were greeted by the host and informed there would be a slight wait.,host positive <sep> wait neutral
0,0,The waiter knew his menu and what to recommend.,waiter positive <sep> menu neutral
0,0,"The first time, the food was decent for lunch, but remember mediocre service.",lunch neutral <sep> service negative
0,0,"I've only had take-out from here but a couple of their dishes, along with the spicy green and orange sauces, are amazing.",take-out neutral <sep> dishes neutral <sep> spicy green and orange sauces positive
0,0,Our server never bothered to inquire as to whether or not we wanted coffee.,server negative <sep> coffee neutral
0,0,The bar seemed like a good place to sit and have some food as we were not even offered a table.,bar neutral <sep> place positive
0,0,The waitresses are so nice and will even help you pick a meal if you are new to spanish food.,waitresses positive <sep> meal neutral <sep> food neutral
0,0,Our waitress kept forgetting our drinks.,waitress negative <sep> drinks neutral
0,0,After dinner I thanked the bartender and told him how this was the only good French food we had found in Manhattan.,dinner neutral <sep> bartender positive <sep> French food positive
0,0,"We had to ask the busboy if bread came with our meal, which it did and we received after waiting about 30 minutes.",busboy neutral <sep> meal neutral <sep> waiting negative
0,0,I ordered the $39 filet and ordered it medium and it came to the table well done and tasted like a goodyear tire.,filet neutral <sep> tire positive
0,0,"We ended up having appetizers in the lounge, while listening to a really great DJ.",lounge neutral <sep> DJ positive
0,0,"He prepares the most authentic dishes, I guess that's why the bar is usually filled with Japanese.",dishes positive <sep> bar neutral
0,0,"Although the atmosphere was lacking, I could definitely recommend a trip to Esca for the fish alone!",atmosphere negative <sep> fish positive
0,0,The sandwiches from the take out window are delicious too.,sandwiches positive <sep> take out window neutral
0,0,"All the dishes that we had at our table were consistently good, although not great (nor poor, either).",dishes positive <sep> table neutral
0,0,"Its not kept frozen, but close to room temperature so you get the real taste of the ice cream and not just the ice.",taste positive <sep> ice cream neutral
0,0,My dining partner ordered the turkey burger and declared this also to be the best one ever.,dining neutral <sep> turkey burger positive
0,0,fresh home-made tomato sauce with chunks of awesome tomatoes fire it all up in a brick oven.,home-made tomato sauce positive <sep> chunks of awesome tomatoes neutral
0,0,"The steak, duck and soft shell crab are musts for dinner and almost every side dish was great.",steak positive <sep> duck positive <sep> soft shell crab positive <sep> dinner neutral <sep> dish positive
0,0,"Lovely place with the kind of Chinese food I like -- clean presentation, sizeable menu, and a bit of a French twist.",place positive <sep> menu positive <sep> twist neutral
0,0,We held a birthday dinner for my friend and were very impressed w/ both food and service.,dinner neutral <sep> food positive <sep> service positive
0,0,Amazing views of NYC regaled us at lunch earlier in the week and then at dinner this evening.,views positive <sep> dinner neutral
0,0,"The food is spectacular, from the appitizers to the main course, and then of course the desserts, (WOW) you'll need no more.",food positive <sep> appitizers positive <sep> main course positive <sep> desserts neutral
0,0,There's very little on their menu if you're trying to avoid cheese and oil - not many grilled entrees at all.,menu neutral <sep> oil negative
0,0,"The place was small and simple, but I never cared about service or decor.",place negative <sep> decor neutral
0,0,The waiter was conspicuously eyeing our table the entire meal and there was a lot of scurrying by the wait staff in general.,waiter negative <sep> table neutral <sep> meal neutral <sep> wait staff negative
0,0,Sam and the staff at Rialto were so accomodating and gave us a dinner event we will always remember.,staff positive <sep> dinner neutral
0,0,We didn't order-the waiter just kept piling the food in front of us.,waiter negative <sep> food neutral
0,0,The place was a bit busy when I got there so we ate at the bar.,place negative <sep> bar neutral
0,0,"We both got soup, and appetizer, and a main course (fabulous duck), so we didnt have space for dessert.",appetizer neutral <sep> duck positive <sep> dessert neutral
0,0,"The service was not great, the wait staff were not clear on the ingredients and or preparation details of the meals.",wait staff negative <sep> ingredients neutral <sep> meals neutral
0,0,Service during either brunch or dinner could be quicker and more attentive at times.,Service positive <sep> dinner neutral
0,0,The place was practically empty when my friends and I got there for dinner.,place negative <sep> dinner neutral
0,0,Great romantic place for a date (try to get the corner booth table for a little privacy and to sit close!,place positive <sep> corner booth table positive <sep> privacy neutral
0,0,Food other than sushi is also very nice.,Food positive <sep> sushi negative
0,0,The only drawback is the need for reservations around the typical pre-theatre times.,reservations neutral <sep> times positive
0,0,"The atmosphere was nice (tables were a bit too close together) and trendy, but waiters seemed rushed.",atmosphere positive <sep> tables negative
0,0,"The rest of the meal was good, but a little over priced for Chinese take out style food.",priced negative <sep> food neutral
0,0,Food was good but portions were quite tiny.,Food positive <sep> portions negative
0,0,"There is a litte bit of a wait on the food, but it is well worth it!",wait negative <sep> food neutral
0,0,The staff was knowledgeable about the cuisine and answered my dining questions with professionalism and style.,staff positive <sep> cuisine neutral
0,0,"If you want a quiet dinner don't show up late, cuz the atmosphere gets louder and more loungy as the nite goes on.",dinner positive <sep> atmosphere negative
0,0,There was only one server on duty and we waited a while for menus.,server positive <sep> menus neutral
0,0,also you dont mind waiting because theres such a buzz around the bar it makes you feel like you are out for drinks.,waiting positive <sep> bar neutral <sep> drinks neutral
0,0,"It was spaced out (we had the 80pp), toro appetizer was so smooth, we had quail, numerous sushi, soup, pumpin puree and more.",toro appetizer positive <sep> quail neutral <sep> sushi positive <sep> soup neutral <sep> pumpin puree neutral
0,0,my date's non veg thali was really expensive and had like one or two pieces of meat in each sauce.,thali negative <sep> meat neutral <sep> sauce neutral
0,0,"I had fried chicken of which KFC runs circles around, and the fries were a knock off of poor burger king spuds.",fries neutral <sep> burger negative
0,0,"The decor reminds me of Miami nightclubs, and we sat in a cool communal strip, where you share your table with people.",decor positive <sep> table neutral
0,0,The music is a mix of house radio as well as live band at the same time.,music neutral <sep> band positive
0,0,"There isn't a huge selection of food, but there's something on the menu for everyone to really enjoy.",food negative <sep> menu neutral
0,0,"One example: They literally took bread from my baby, after we ordered a brick oven pizza, not food (the waiter's words).",pizza negative <sep> waiter neutral
0,0,"Once we had ordered etc, the wait for our meal was not long and the food was fabulous.",wait positive <sep> food positive <sep> meal neutral
0,0,"I'm a chef (30 years), and I can honestly say that I've finally found Italian food worth eating at a reasonable price.",chef neutral <sep> price positive
0,0,We then split some appetizers as the portions are large - the calamari salad was fantastic.,appetizers neutral <sep> portions positive <sep> calamari salad positive
0,0,I ordered dessert and it was they gave me the wrong flavor of ice cream.,dessert neutral <sep> flavor negative
0,0,"Although there were many open tables, the manager insisted my party wait at the bar for over one hour.",manager negative <sep> bar neutral
0,0,"The food is fantastic, Gourmet comfort food and has gotten progressively better over the past year, as did the service.",Gourmet comfort food neutral <sep> service positive
0,0,It took a long time for the waiter to bring the check and we had to flag him down.,waiter negative <sep> check neutral
0,0,"The menu consists of a tasting selection, Austrian, traditional American, and the chef's recommended menu.",selection positive <sep> Austrian positive <sep> American positive <sep> chef neutral
0,0,"It's made with cauliflower, wild mushrooms, and no rice at all.",wild mushrooms neutral <sep> rice negative
0,0,The menu goes on to include some of traditional greek favorites but each has a twist that will suprise and delight you.,menu neutral <sep> traditional greek positive
0,0,But Bobby Flay really steps up at Bar Americain--his passion and heart shine through the food.,Bar neutral <sep> food positive
0,0,"The pork chops, cubed steak, pho bo and whole fried fish are among my favorites.",pork chops positive <sep> steak neutral <sep> fried fish positive
0,0,"The decor maybe great for young kids but as an adult this place was an horrible experiance, it didn't bring the kid in me.",decor positive <sep> place negative
0,0,"anyway, nice place for brunch for selection under $20 meals desserts were great (3 flavors for creme brulee!!",place positive <sep> brunch neutral <sep> selection neutral <sep> meals desserts positive <sep> flavors neutral <sep> creme brulee neutral
0,0,Great place to go for a lunch date or for coffee after a date.,lunch neutral <sep> coffee neutral <sep> place positive
0,0,Staff wouldn't take no for an answer on pitchers of sangria.,Staff negative <sep> sangria neutral
0,0,The wait staff while attentive did nothing to address the hair that was found in one of our dishes.,wait staff positive <sep> dishes neutral
0,0,"Well on a friday or sat, i think this place should take reservations as it gets pretty busy.",place negative <sep> reservations neutral
0,0,"To the amusement of our server, I wrote everything down, lest I forget a single morsel (about 21 different dishes).",server positive <sep> dishes neutral
0,0,The Food The best surprises on the El Salvadorean menu are the appetizers.,Food neutral <sep> appetizers positive
0,0,A shrimp dish that was boiled and in a sauce that tasted like unflavored jello.,shrimp dish neutral <sep> sauce neutral <sep> jello negative
0,0,Delivery portions are bigger and 2 can easily share 1 entree.,Delivery portions positive <sep> entree neutral
0,0,"Enjoy the food, because it is remarkable, but don't be too willing to be gratuitis to a server that does not deserve it.",food positive <sep> server negative
0,0,"Though there are a handful of Japanese a la carte offerings on the menu, the prix fixe is most popular by far.",menu neutral <sep> prix fixe positive
0,0,you may have to wait a bit for service but you will not be disappointed with the food.,service negative <sep> food positive
0,0,why go there to deal with staffs' attitude and eat bad food?,staffs neutral <sep> attitude neutral <sep> food negative
0,0,After a show we had surperb steaks and had cocktails at the bar.,steaks positive <sep> cocktails neutral <sep> bar neutral
0,0,"Our waiter told us he knew all the wines on it quite well, and he did!",waiter positive <sep> wines neutral
0,0,"Still, after all the fuss, the food makes you forget about the wait.",food positive <sep> wait neutral
0,0,Our group of 8 had about five small plates that we thought were the best on the menu.,plates positive <sep> menu neutral
