review_id,sentences_ids,sentences_texts,sentences_opinions
22527,id_1,Нас разместили в VIP зале.,
280,id_6,"Порции средние, блюда хорошо оформлены.",Порции neutral <sep> блюда positive
33838,id_7,Заказал еще себе рис с угрем и ролл Радужный.,
13912,id_3,"Выбрали зал для некурящих, который в отличии от Харбина на Приморской, расположен совершенно отдельно от курящих посетителей.",зал для некурящих neutral
33043,id_8,"Но нас это не испугает, ходили и будем ходить в Шатер!!!",Шатер positive
1105,id_0,Один из моих любимых ресторанов.,ресторанов positive
22970,id_1,"места мнооооого, и вид из окна хороший.",места positive <sep> вид из окна positive
34956,id_8,"Коллегам. так же, очень понравились блюда.",блюда positive
32926,id_6,"Шоколадный фонтан просто сказка, очень вкусный и красивый.",Шоколадный фонтан positive
2747,id_15,"Легкое тонкое тесто, сочное мясо - прекрасно.",тесто positive <sep> мясо positive
36166,id_0,Здравствуйте!,
33825,id_5,"Интересный интерьер, все красочное и при этом очень домашняя обстановка.",интерьер positive <sep> обстановка positive
35867,id_3,"Отдельно благодарим ЗАМЕЧАТЕЛЬНОГО менеджера по банкетам Анну, которая профессионально помогла: все подробно рассказала о кухне и самом ресторане, помогла с выбором блюд, напитков, выпечки и украшением зала, качественно донесла до нас всю необходимую информацию и суперски организовала наш праздник!!!",менеджера positive
18372,id_3,"Особенно хорошая официантка Алёна,милая,добрая,приветливая и всегда поможет с выбором!",официантка positive
14568,id_8,"Общий вывод: уютное местечко в центре, с разумными ценами и весьма комфортной обстановкой)",местечко positive <sep> центре positive <sep> обстановкой positive
16568,id_1,"Дело в том, что являюсь постоянным посетителем Токио уже несколько лет, и считаю. что в нашем районе это одно из лучших мест, куда можно пойти.",Токио positive <sep> мест positive
28083,id_0,мы посетили ресторан 10 марта.,
28710,id_10,"Официанты тоже очень внимательные и вежливые, не могу вспомнить момента, когда бы нам что-то не понравилось!",Официанты positive
15159,id_3,"Зал симпатичный, обслуживание не выдающееся, но и не навязчивое.",Зал positive <sep> обслуживание neutral
11532,id_12,Минусов не заметила.,
13623,id_2,"Были с мужем в понедельник около восьми вечера, встретила девушка, проводила до столика и принесла меню.",девушка neutral
10663,id_6,"Девушки официантки все здороваются и улыбаются, интерьер потрясающий.",Девушки официантки positive <sep> интерьер positive
32771,id_20,"Но нам очень хотелось танцевать, т.к. певец исполнял очень хорошие песни!",песни positive
29350,id_0,"Вчера были в ресторане ""Небо"", что могу сказать, разложу по пунктам. 1.",
13835,id_4,"Кухня хорошая: вкусные мясные блюда, закуска с нежнейшим салом покорила мужчин, изумительные салаты.",Кухня positive <sep> мясные блюда positive <sep> закуска с нежнейшим салом positive <sep> салаты positive
36126,id_9,Непременно посетим вас ещё и будем советовать ваш ресторан нашим друзьям.,ресторан positive
31004,id_4,"Доброжелательные такие, праздник всё-таки...",
33538,id_0,"Огромное спасибо ресторану ""Империя"" за чудесный ужин!","ресторану ""Империя"" positive"
33621,id_2,"Все по порядку, банкетное меню 2000 на человека, дело было не в цене, хотелось просто видеть богатый стол, администратор уверила, что этого вполне достаточно, хотя у нас было меню на 18 человек, а двое не смогли прийти и сумма заказа была больше чем 2000 на человека и все равно еды было мало!",еды negative
36926,id_4,Особенно порадовал ценник...качественная еда за небольшие деньги.,еда positive
19817,id_1,"Очень нравится спокойная атмосфера, тихая фоновая музыка не мешает беседе, всегда есть свободный столик.",атмосфера positive <sep> музыка positive <sep> столик positive
36407,id_2,"Но не ошиблись, чудесная детская комната, замечательная няня, все дети при деле, что-то лепят, что-то мастерят, их не видно-не слышно!",детская комната positive <sep> няня positive
13623,id_9,"Обслуживание хорошее, пепельницу меняли быстро, официант парень тактично помог с выбором десерта.",Обслуживание positive <sep> официант positive
13835,id_0,"Отмечали в ресторане ""Драго"" свадьбу на 30 человек 1го июля 2010 года.",
20021,id_4,Меню.,
33591,id_3,Небольшое уютное кафе.,кафе positive
26152,id_0,"Честно говоря, не раз проезжая в последнее время по Гороховой обращала внимание на новый ресторан, судя по названию грузинской кухни.",
33897,id_2,Я и семья остались очень довольны проведенным временем в ресторане.,ресторане positive
3705,id_11,Теперь мы ваши постоянные клиенты!,
32859,id_16,С уважением Виктория и FITNESS Land))))))),
19439,id_13,"Медальоны из телятины потрясающи, мясо тает во рту, соус очень вкусный.",Медальоны из телятины positive <sep> мясо positive <sep> соус positive
2345,id_6,"Уже довольно давно отношусь к своему дню рождения более чем спокойно, ограничиваясь тихим семейным ужином.",
32584,id_9,"Еду принесли очень быстро, на любой вопрос по меню, официант отвечает не задумываясь, очень профессионально отработал.",официант positive
1749,id_0,"Хорошее место, где можно посидеть большой компанией и отлично отдохнуть.",место positive
33043,id_5,"Сели, принес официант меню, ушел, ждали минут 20 пока подойдет к нам еще, заказали, заказ принесли буквально через 15 минут, это порадовало, при полной загрузке ресторана, приготовили все быстро, есть хотелось сильно))",официант neutral
2965,id_2,"при заказе нам показали ресторан,предложили несколько вариантов для размещения наших гостей,",
19746,id_1,"Сначала планировали праздник в другом месте, но там не оказалось свободных столиков, и поэтому волею судеб оказались в этом ресторане.",
36126,id_8,Спасибо коллективу!,коллективу positive
3236,id_3,Рядом с нами все столики были заказаны и везде что-то праздновали.,
36589,id_3,"Еда была вкусная, все свежее и оформление блюд особенно порадовало!",Еда positive <sep> оформление блюд positive
19503,id_0,"Сегодня с подругой посетил данное заведение! очень всё понравилось,обслуживание порадовало еще при входе,доброжелательная и улыбчивая администратор Екатерина встретила нас и посадила за очень хороший столик,откуда открывался отличный вид.",обслуживание positive <sep> администратор positive <sep> столик positive <sep> вид positive
33252,id_2,"Выбрали именно этот ресторан , прежде всего, из-за его пивоварни, ну и, как оказалось, у друга была дисконтная карта этого заведения :)",пивоварни positive
10847,id_13,В целом кафе оставляет очень приятные воспоминания.,кафе positive
6668,id_1,"Несмотря на плохую погоду, мы пытались показать приехавшим в гости родственникам (молодоженам) все красоты нашего города, включая белые ночи.",
28612,id_0,Ресторан замечательный!,Ресторан positive
1105,id_11,По десертам ничего сказать не могу-не пробовала.,
10985,id_5,"Ну так как ехать в другое место уже не было сил, решили заказать все-такие еду.",
29321,id_0,Привет.,
15567,id_0,Здравствуйте.,
25709,id_16,"В зале постоянно находилось на обслуживании человека два, так что на зов являлись в течение минуты.",обслуживании positive
34761,id_1,Данный ресторан мы выбрали для празднования свадебного праздничного ужина в кругу друзей и близких.,
30368,id_12,"В целом хорошая, душевная обстановка.",обстановка positive
33693,id_5,Хорошее место для вкусной трапезы итальянской кухни по умеренной цене.,место positive <sep> итальянской кухни positive <sep> итальянской кухни neutral
35085,id_2,Но...,
2468,id_12,"Вот посидел, подумал....",
18518,id_5,"Единственный минус - в праздники и выходные у них очень много посетителей, хотя это говорит о том, что ресторан хороший...",ресторан positive
25507,id_12,Чеснок как надо.,Чеснок neutral
30148,id_6,"Не понравилось долгое ожидание и какая то отчужденность официанта,который просто ушел на улицу посидеть на скамеечке...в то время как мы хотели расплатиться.",официанта negative
13748,id_1,"Несколько раз ходили с друзями, но все неудачные.",
18983,id_3,"Из десертов мне очень понравилось мороженое с сыром гарганзолла (но это, естественно, не их приготовления) 2)",мороженое с сыром гарганзолла positive
16955,id_11,"S. только один отзыв соответствовал правде, но ей повезло больше чем мне)))))",
3452,id_10,В помещении летом жарко.,помещении negative
36512,id_11,Отдельную огромную благодарность мы хотим выразить управляющей рестораном Ольге за ее большую проделанную работу!!!,управляющей рестораном positive
36725,id_2,"Очень понравился официант Шахид, отвечал на все вопросы относительно блюд, заказ не пришлось долго ждать.",официант positive
17009,id_6,"По поводу еды, паста была ну ничего, средненько, чуток пересоленная, цезарь был не очень, заветренные и холодные кусочки куриного филе меня не особо вдохновили.",паста neutral <sep> цезарь negative <sep> куриного филе negative
36,id_7,Овощной салат также пришёлся по вкусу.,Овощной салат positive
19111,id_0,Был с друзьями в четвером в этом ресторане.,
2965,id_1,"заказали столик на 8 человек за день до торжества,",
29383,id_0,"Были в субботу 24 ноября,зная что народу будет много, заранее заказали столик на 10 человек(встреча однокурсников.",
1052,id_7,"Навсегда останется в памяти официант, который обращался к нам исключительно на ""ты"", дерзил, а когда ему было сделано замечание, он нам сообщил, что он поругался со своей девушкой и у него отвратительное настроение!",официант negative
1368,id_8,Из недочетов можно отметить забывчивость официантки - друг дождался своих сигарет только после третьей просьбы.,официантки negative
30368,id_0,С коллегами искали место где можно посидеть шумной компанией.,
28710,id_6,"Интерьер,конечно, поражает сразу, уже на улице все очень мило хорошенькая елочка и туи,фонарики новогоднее настроение, внутри уютно и шикарно,мягкие диваны,свечи, белый рояль.",Интерьер positive <sep> елочка positive <sep> туи positive <sep> фонарики positive <sep> диваны positive <sep> свечи positive <sep> белый рояль positive
2168,id_0,Вчера заходили с подругой перекусить вечером.,
32771,id_19,"По-моему мнению, мы были самые активные и самые шумные в этом плане))))",
20861,id_5,Обслуживание- плохо.,Обслуживание negative
32859,id_0,20 октября отмечали день рождения нашей фирмы в ресторане Аллегро.,
11388,id_0,Несколько раз посещали с друзьями данный ресторан!,
27816,id_6,"Атмосфера позитивная домашняя, потому что уютная обстановка и приветливый персонал.",Атмосфера positive <sep> обстановка positive <sep> персонал positive
18220,id_6,Про кухню много говорить не буду - все достойно.,кухню neutral
18253,id_1,"Кухня радует, а вот обслуживание не очень хорошее.",Кухня positive <sep> обслуживание negative
29298,id_5,"Но все равно, рекомендую посетить этот ресторан, не пожалеете!",ресторан positive
29395,id_9,"Мы были там днем, а вечером там я это точно знаю, что намечалась какая-то программа.",
1749,id_4,Большой выбор десертов!,десертов positive
1289,id_8,Спасибо администрации!,администрации positive
34761,id_5,В меню мы выбирали разнообразные блюда и все они были очень вкусными.,блюда positive
1105,id_9,Шеф-повар тоже с самого открытия.,Шеф-повар positive
14177,id_3,"Домашний интерьер - да, атмосфера...",интерьер positive
280,id_1,"Дело было вечером, народу не очень много.",
27569,id_5,"Несмотря на будний день, все столики были заняты, поэтому бронь оказалась очень уместна.",
33952,id_2,"Очень красивый интерьер, все гости это отметили.",интерьер positive
1511,id_8,"Официант подошел довольно быстро, принял заказ.",Официант positive
14539,id_13,"Думаю- не заостри я на этом внимания, в счете была бы сумма за два по 500 млт, а не за два по 200 млт.",
22015,id_9,"Интерьер милый,есть диванчики,правда не очень мягкие!!",Интерьер neutral <sep> диванчики negative
2073,id_4,Во-первых такого отвратительного обслуживания я не видела нигде.,обслуживания negative
1052,id_3,Неплохой выбор вин.,вин neutral
354,id_10,"Все блюда очень вкусные,приготовлены по-домашнему.",блюда positive
24132,id_5,"Салат Пампелон понравился очень - шпинат с голубым сыром под фантастической заправкой оказался ""что-то с чем-то""!",Салат Пампелон positive <sep> шпинат с голубым сыром positive <sep> заправкой positive
13252,id_7,"Все шашлыки, а мы заказывали их и из телятины и из говядины и из свинины, были превосходны.",шашлыки positive <sep> телятины positive <sep> говядины positive <sep> свинины positive
16714,id_1,"Взяли шашлык по азейрбаджански (из баранины), хачипури Имеритенское, салат Байрам и овощи на гриле.",
33976,id_10,Я бы не рекомендовала идти в данный ресторан.,ресторан negative
14031,id_8,"Очень советую посетить ресторан, атмосфера домашняя.",ресторан positive <sep> атмосфера positive
11102,id_0,Недавно посетила ресторан по рекомендации друзей.,ресторан positive
21399,id_7,Отдельно хочется отметить обслуживание - на высшем уровне.,обслуживание positive
18430,id_8,Так что будет лишний повод зайти и воспользоваться скидкой),
10231,id_0,"Я несколько раз была в этом заведении,о кухне могу сказать только самое хорошее.",кухне positive
3231,id_3,"Нигде раньше такого не встречала...официанты очень внимательные, всегда было на столе чисто и даже не приходилось себе ничего наливать и накладывать!",официанты positive
24916,id_2,"А вот обслуживание.... то ли обслуга стремилась начать отмечать 8-е марта побыстрее (мы приехали туда около 21.30,девушка при входе сказала, что ресторан работает до 23.00, хотя ЗАРАНЕЕ, когда делалась бронь столика, НАС НИКТО НЕ ПРЕДУПРЕДИЛ, ЧТО РЕСТОРАН БУДЕТ РАБОТАТЬ ДО 23.00)",обслуживание negative <sep> обслуга negative <sep> девушка negative
6668,id_15,"Хочу сказать большое спасибо ""ночному персоналу"" ресторана, который сделал наш поздний ужин таким приятным!",ночному персоналу positive
14177,id_6,"Маленькое, уютное, сухарики из собственного вкусного хлеба скрашивают ожидание блюд.",сухарики из собственного вкусного хлеба positive
21856,id_1,"Позвонила заказать столик,ответил приятный молодой человек Евгений,забронировал нам столик учитывая все наши пожелания,за что ему отдельное огромное СПАСИБО!!!!!!",молодой человек positive
26887,id_2,А сегодня заказали кулеш.,
27569,id_4,На всякий случай заранее заказали столик.,
32513,id_5,"Уже была 2 раза в Манго, поэтому его выбрала.",Манго positive
36205,id_12,"Для себя отметили, что зал прекрасно подойдет и для празднования каких-то масштабных событий.",зал positive
11355,id_2,"Официант (кажется Евгений) был просто замечательный: встретил, посадил, сразу же подал меню, поиинтересовался принести ли напитки, потом понравилась ли еда и вообще весь вечер появлялся как только это было нужно!!",Официант positive
19467,id_1,Соскучилась!),
18220,id_8,"Рекомендую, особенно тем кто был там днем, зайдите вечером, поверьте, вы попадете в абсолютно другое заведение.",заведение positive
25709,id_8,Мягкие диваны с россыпью подушек.,диваны positive <sep> подушек positive
32721,id_9,- Очень порадовала кухня.,кухня positive
10231,id_2,"Последний раз была с друзьями,все остались довольны и обслуживанием и едой.",обслуживанием positive <sep> едой positive
33897,id_0,Добрый день!,
32771,id_26,"Кухня - 10, Интерьер - 10, Сервис - 10.",Кухня positive <sep> Интерьер positive <sep> Сервис positive
2616,id_0,Меня не обманули мои друзья!,
32721,id_4,"Плюсы: - Довольно приятный интерьер, приглушенный, мягкий свет, тихая музыка (не мешает общаться).",интерьер positive <sep> свет positive <sep> музыка positive
10625,id_4,"Народу было много, полный зал.",
36381,id_2,"Обслуживание ""на уровне"".",Обслуживание neutral
36926,id_3,"Невозможно уйти оттуда с плохим настроением и голодным, порции очень большие!))",порции positive
2616,id_14,Для романтических свиданий не уверен.,
34196,id_6,"Честно говоря, приготовленные блюда по вкусу чень похожи на блюда в ресторанах Тайланда, хотя мясной стейк немного не удался.",блюда neutral <sep> мясной стейк negative
18518,id_1,"Обслуживанием очень довольны, скатерти меняют после каждого посетителя, все очень чисто.",Обслуживанием positive
3452,id_25,Авось.,
