review_id,sentences_ids,sentences_texts,sentences_opinions
875139,id_3,We were 4 and got the family size penne a la vodka which was tremendously gigantic portion...a bucket of food literally.,penne a la vodka positive
929329,id_3,"Interesting selection, good wines, service fine, fun decor.",wines positive <sep> service positive <sep> decor positive <sep> selection positive
1395421,id_4,Check this place out!,place positive
1353599,id_3,The sangria was pretty tasty and good on a hot muggy day.,sangria positive
1486041,id_4,Taxan delicious!,Taxan positive
1289424,id_5,I highly recommend visiting this restaurant and having dinner and drinks!,restaurant positive
1335656,id_3,Salads were fantastic.,Salads positive
1572027,id_3,I ate here a week ago and found most dishes average at best and too expensive.,dishes negative
493013,id_3,noodles with shrimp and chicken and coconut juice is the MUST!,noodles with shrimp and chicken and coconut juice positive
1064477,id_3,The rice to fish ration was also good--they didn't try to overpack the rice.,rice to fish ration positive
958809,id_2,We could have made a meal of the yummy dumplings from the dumpling menu.,dumplings positive
958809,id_1,I have to say I have never had a disapointing meal here.,meal positive
957145,id_4,I lOVE THIS PLACE!,PLACE positive
1615322,id_3,This restaurant is VEGETARIAN; there are NO MEAT dishes whatsoever.,MEAT dishes negative
1730127,id_1,"The food is outstanding and the service is quick, friendly and very professional.",food positive <sep> service positive
553097,id_4,But that wasn't the icing on the cake: a tiramisu that resembled nothing I have ever had.,tiramisu negative
1286916,id_1,"The first time I went, and was completely taken by the live jazz band and atmosphere, I ordered the Lobster Cobb Salad.",live jazz band positive <sep> atmosphere positive
1451109,id_2,The food was pretty tradional but it was hot and good with large portions.,food positive <sep> portions positive
1609375,id_2,"The svc can be a bit rude at times, esp if you have big group, but overall the restaurant is a must!",svc negative <sep> restaurant positive
535086,id_1,(Always ask the bartender for the SEASONAL beer!!!,SEASONAL beer positive
584025,id_0,"Great spot, whether looking for a couple of drinks or quiet dinner.",spot positive
1404042,id_2,Fish was overdone.,Fish negative
1341354,id_1,Enjoyed a very nice Caesar Salad while my wife had arugula and goat cheese....both very tasty.,Caesar Salad positive <sep> arugula and goat cheese positive
1126814,id_3,Decent wine at reasonable prices.,wine neutral <sep> wine positive
872763,id_4,There is a downside if you're ordering in -- the delivery guys have MAJOR attitude.,delivery guys negative
1470286,id_1,Delivery is fast too.,Delivery positive
1561259,id_0,"The food is good, I can't lie.",food positive
1028246,id_0,"Went on a 3 day oyster binge, with Fish bringing up the closing, and I am so glad this was the place it O trip ended, because it was so great!",Fish positive
1289424,id_0,We had a great time at the Jekyll and hyde Pub last night.,Jekyll and hyde Pub positive
1430994,id_6,My boyfriend had Prime Rib it was good .,Prime Rib positive
454704,id_2,This place is not worth the prices.,place negative
536919,id_1,The only thing the waiters don't do for you is wipe your chin when you leave.,waiters positive
535171,id_2,"A cool bar with great food, and tons of excellent beer.",bar positive <sep> food positive <sep> beer positive
455623,id_0,Love Pizza 33..,Pizza 33 positive
1660047,id_4,"We did tip, I guess the model/waitress just wanted more and complained to the manager.",waitress negative
470488,id_1,The soup for the udon was soy sauce and water.,soup for the udon negative
397331,id_0,Mizu is the Japenese find in Grammercy.,Mizu positive
1394712,id_1,We ordered some beef and noodle soup dishes from the Thai section of the menu but nothing we got was Thai.,beef and noodle soup dishes negative
464342,id_1,I asked for an open faced cheese sandwich and the manager basically told me to take my business elsewhere!,manager negative
1432551,id_1,The portions are large and the servers always surprise us with a different starter.,portions positive
1728733,id_5,We ended our great experience by having Gulab Jamun (dessert) recommended by the waiter.,Gulab Jamun (dessert) positive
709294,id_2,Indoor was very cozy and cute.,Indoor positive
680345,id_2,"Delicate spices, onions, eggs and a kick-ass roti.",spices positive <sep> onions positive <sep> eggs positive <sep> roti positive
958809,id_3,"Luckily we saved room for the BBQ Salmon, Sea Bass and Crispy Duck.",BBQ Salmon positive <sep> Sea Bass positive <sep> Crispy Duck positive
1041457,id_3,The only thing I moderately enjoyed was their Grilled Chicken special with Edamame Puree.,Grilled Chicken special with Edamame Puree positive
1404042,id_4,Someone else recommended the dessert - we also left that.,dessert negative
1642666,id_1,We thought that this place is using too much of MSG cooking in the foods.,foods negative
1014458,id_2,The duck confit is always amazing and the foie gras terrine with figs was out of this world.,foie gras terrine with figs positive <sep> duck confit positive
430342,id_0,delicious simple food in nice outdoor atmosphere.,food positive <sep> outdoor atmosphere positive
1573534,id_3,I am happy i did the food was awsome.,food positive
1189674,id_4,"Great wine selection, Gigondas is worth the price, and the house champagne is a great value.",wine selection positive <sep> Gigondas positive <sep> house champagne positive
1723402,id_1,it's the only place you can get yummy authentic japanese comfort food.,japanese comfort food positive
740923,id_1,"If you don't mind pre-sliced low quality fish, unfriendly staff and a sushi chef that looks like he is miserable then this is your place.",fish negative <sep> staff negative <sep> sushi chef negative
1707741,id_3,Service was also very good.,Service positive
1154550,id_0,This is the best sushi in new york city - hands down.,sushi positive
1718513,id_1,"The pesto pizza was excellent, thin-crust pizza with a nice amount of spicy Italian cheese that I'd never heard of before.",pesto pizza positive <sep> spicy Italian cheese positive
1660047,id_2,"The waitress, seems to be more concerned of looking good than actually waitressing.",waitress negative
1586174,id_4,"limited menu, no-so-fresh ingredients, thinly-sliced fish, fall-apart rice.",menu negative <sep> ingredients negative <sep> fish negative <sep> rice negative
1367358,id_3,"Ambience is delightful, service impeccable.",Ambience positive <sep> service positive
493013,id_2,I LOVE their Thai,Thai positive
1476493,id_0,I thought this place was totally overrated.,place negative
1349391,id_0,sometimes i get good food and ok service.,food positive <sep> service neutral
1655504,id_0,Have frequented 'ino for several years and the food remains excellent.,food positive
1335656,id_5,Ingredients are organic which is a real plus for me.,Ingredients positive
620892,id_5,"Service, however, was excellent...and I liked the setting/atmosphere a lot.",Service positive <sep> setting/atmosphere positive
1632445,id_4,The only fallback on this restaurant is the prices.,restaurant negative
1338124,id_4,"I have reservations about the all you can eat deal, however -- the choices are fairly limited and you can probably order more food than you can eat for less than $18 by just going off the menu.",all you can eat deal negative
496132,id_1,The setting is casual and romantic.,setting positive
1253117,id_2,"Two complaints- their appetizer selection stinks, it would be nice to get some mozzarella sticks on the menu.",appetizer selection negative
1395421,id_1,THe Pizza and wine were excellent-the service too--but what really MADE this place was the backyard dining area.,Pizza positive <sep> wine positive <sep> service positive <sep> backyard dining area positive
1300636,id_0,This was my frist time at Cafe St. Bart's and I must say how delicous the food and the service was.,food positive <sep> service positive
1303984,id_0,This restaurant was way overhyped.,restaurant negative
759781,id_2,"Most of the servers are very attentive, friendly and quite attractive.",servers positive
498657,id_5,"A few tips: skip the turnip cake, roast pork buns and egg custards.",turnip cake negative <sep> roast pork buns negative <sep> egg custards negative
1349391,id_1,"sometimes i get bad food and bad service, sometimes i get good good and bad service.",food negative <sep> service negative <sep> service negative <sep> good positive
682250,id_0,"Went here last night - nice decor, good service, but the food was surprisingly excellent.",decor positive <sep> service positive <sep> food positive
1167434,id_1,first it took us a long time to find the place.,place negative
610611,id_1,"stick with the chicken, beef, and lamb dishes.",chicken positive <sep> beef positive <sep> lamb dishes positive
496132,id_3,The food is excellent!,food positive
1710746,id_2,My son and his girlfriend both wanted cheeseburgers and they were huge!,cheeseburgers neutral
1153034,id_1,"There was a small wait, but shorter than I expected.",wait positive
535086,id_3,Excellent spot for holiday get togethers with co-workers or friends that you haven't seen in a while.,spot positive
1303984,id_1,My chow fun and chow see was really bland and oily.,chow fun and chow see negative
1004293,id_0,"Judging from previous posts this used to be a good place, but not any longer.",place negative
1090587,id_2,Add to that great service and great food at a reasonable price and you have yourself the beginning of a great evening.,service positive <sep> food positive
1297844,id_2,The bagel was huge.,bagel positive
521916,id_1,"Small servings for main entree, i had salmon (wasnt impressed) girlfriend had chicken, it was good.",salmon negative <sep> chicken positive <sep> servings for main entree negative
717570,id_3,The portions are small but being that the food was so good makes up for that.,portions negative <sep> food positive
1199292,id_3,I take all my NYC guests to VT's.,VT's positive
1253117,id_5,Wait staff is blantently unappreciative of your business but its the best pie on the UWS!,Wait staff negative <sep> pie positive
1719567,id_0,We had the lobster sandwich and it was FANTASTIC.,lobster sandwich positive
1387314,id_1,This is my first time writing a review for a restaurant because the food and service was excellent.,food positive <sep> service positive
503807,id_2,The food was exceptional.,food positive
1189674,id_2,"The Steak Tartare is a great bet, they fix it for you at the table.",Steak Tartare positive
1199480,id_0,"Not sure where the previous reviewer, lonk, dined, but Saul is in a great neighborhood and has great food!",neighborhood positive <sep> food positive
1357554,id_0,I started out with a Bombay beer which was big enough for two.,Bombay beer positive
397331,id_3,"Not only is the cuisine the best around, the service has always been attentive and charming.",cuisine positive <sep> service positive
1543345,id_1,Who has room for Cheesesticks with the best pizza in NYC!,pizza positive
1404042,id_5,One of us actually liked the expresso - that's it.,expresso positive
1746113,id_5,We all agreed that mare is one of the best seafood restaurants in New York.,mare positive
1713185,id_1,"The last two times I ordered from here my food was soo spicy that  I could barely eat it, and the spice took away from the flavor of the dish.",food negative <sep> spice negative
1230993,id_2,Our server was very helpful and friendly.,server positive
1723658,id_0,I've lived in NY for 5 years and this place has it all.,place positive
485767,id_0,Everything about this restaurant was special.,restaurant positive
1662726,id_0,I was here a few weeks back and we had the worst customer service experience at a restaurant ever.,customer service negative
535086,id_0,"This is the perfect spot for meeting friends, having lunch, dinner, pre-theatre or after-theatre drinks!",spot positive
1387314,id_2,The filet mignon dish was superb!,filet mignon dish positive
1058221,id_2,the food is decent.,food neutral
1611489,id_1,"Also, the sandwiches (nearing $7) didn't come with anything like chips or a side.",sandwiches negative
1726473,id_0,"Average to good Thai food, but terrible delivery.",Thai food positive <sep> delivery negative
493013,id_6,In summer-eat outside on a terrace (another great feature of Suan)!!!,terrace positive
507755,id_2,Finally a reliable Chinese restaurant!,Chinese restaurant positive
1004293,id_5,Avoid this place!,place negative
1256373,id_0,By far the best salad I have had in a fast food restaurant.,salad positive
1538149,id_3,The service was excellent - friendly and attentive.,service positive
1615322,id_1,Chennai Garden is my favorite Indian restaurant in the city.,Chennai Garden positive
1335154,id_1,"Great vibe, lots of people.",vibe positive
404464,id_1,I ordered the smoked salmon and roe appetizer and it was off flavor.,smoked salmon and roe appetizer negative
1470286,id_2,"Great friendly service, Fast seating, Fast Delivery, Excellent sushi.",service positive <sep> seating positive <sep> Delivery positive <sep> sushi positive
558423,id_4,"However, if you want great food at a great price and don't mind the decor, you can't beat this place.",food positive <sep> decor neutral
758263,id_3,$20 for all you can eat sushi cannot be beaten.,all you can eat sushi positive
513521,id_2,Drawbacks: service is slow and they don't toast!,service negative
680390,id_2,"In an area sadly lacking in decent Thai food, this is one of the best spots.",Thai food positive
1387314,id_4,It's a small cute restaurant.,restaurant positive
535248,id_3,"If you venture off the island of Manhattan and can't seem to find a great Italian restaurant, drive to Corona.",Corona positive
1543345,id_4,Always great service!,service positive
1700205,id_3,I highly recommend Caviar Russe to anyone who wants delicious top grade caviar and fantastic service.,caviar positive <sep> service positive
1561259,id_1,But the staff was so horrible to us.,staff negative
737999,id_2,Always good drinks and service is pretty good;,drinks positive <sep> service positive
507844,id_0,This place would be so much better served by being run by a group that actually understands customer service.,customer service negative
447697,id_0,Great sushi experience.,sushi positive
746254,id_2,"One would think we'd get an apology or complimentary drinks - instead, we got a snobby waiter wouldn't even take our order for 15 minutes and gave us lip when we asked him to do so.",waiter negative
426930,id_0,Authentic Taiwanese food that's cheap... what more could you ask for?,Taiwanese food positive
444818,id_2,"Best Italian food I ever had (and being Italian, that means alot).",Italian food positive
378848,id_3,"The blond wood decor is very soothing, the premium sake is excellent and the service is great.",blond wood decor positive <sep> premium sake positive <sep> service positive
1655504,id_3,"(The asparagus, truffle oil, parmesan bruschetta is a winner!)","asparagus, truffle oil, parmesan bruschetta positive"
496132,id_4,"if you're daring, try the balsamic vinegar over icecream, it's wonderful!",balsamic vinegar over icecream positive
1212346,id_1,"Took my mom for Mother's Day, and the maitre d' was pretty rude.",maitre d' negative
1726427,id_1,"We are very particular about sushi and were both please with every choice which included: ceviche mix (special), crab dumplings, assorted sashimi, sushi and rolls, two types of sake, and the banana tempura.",sushi positive <sep> ceviche mix (special) positive <sep> crab dumplings positive <sep> assorted sashimi positive <sep> sushi positive <sep> rolls positive <sep> two types of sake positive <sep> banana tempura positive
773720,id_1,I would highly recommand requesting a table by the window.,table by the window positive
1055910,id_0,we love th pink pony.,pink pony positive
1126814,id_1,"My wife and I always enjoy the young, not always well trained but nevertheless friendly, staff, all of whom have a story.",staff positive
1470334,id_3,They have a huge selection of different cream cheeses and all of their salads are great.,salads positive <sep> cream cheeses positive
1230993,id_4,The food was good too.,food positive
1430994,id_0,The view is breathtaking the service is top notch... the ambiance is wonderfull.,view positive <sep> service positive <sep> ambiance positive
493514,id_0,I cannot imagine a friendlier staff working in a restaurant.,staff positive
1655521,id_1,I almost hesititate to write a review because the atmosphere was so great and I would hate for it too become to crowded.,atmosphere positive
1572033,id_1,Decor is nice though service can be spotty.,Decor positive <sep> service negative
558423,id_5,Quick and friendly service.,service positive
1264954,id_2,"The chicken pot pie is excpetiona, the cheeseburger huge and delictable, and the service professional wan warm.",chicken pot pie positive <sep> cheeseburger positive <sep> service positive
430342,id_2,I really like both the scallops and the mahi mahi (on saffron risotto-yum!).,scallops positive <sep> mahi mahi (on saffron risotto positive
1014458,id_3,The wine list is interesting and has many good values.,wine list positive
1572033,id_5,Try the sea bass.,sea bass positive
709294,id_5,Staff is very accomodating.,Staff positive
1486041,id_1,The owner and staff are all Japanese as well and that adds to the entire ambiance.,owner positive <sep> staff positive <sep> ambiance positive
555734,id_0,I really liked this place.,place positive
464215,id_2,The cream cheeses are out of this world and I love that coffee!!,cream cheeses positive <sep> coffee positive
1328078,id_4,We had Pam's special fried fish and it was amazing.,Pam's special fried fish positive
447697,id_3,Try sushimi cucumber roll.,sushimi cucumber roll positive
1586174,id_5,"the only things u could really taste are the very salty soy sauce (even its low sodium), the vinegar-soaked rice, and the scallion on top of the fish.",soy sauce negative <sep> rice negative
519425,id_3,The waiter was attentive.,waiter positive
1280179,id_5,"The decor is vibrant and eye-pleasing with several semi-private boths on the right side of the dining hall, which are great for a date.",decor positive <sep> semi-private boths positive
1119578,id_2,"Yes, they use fancy ingredients, but even fancy ingredients don't make for good pizza unless someone knows how to get the crust right.",ingredients positive <sep> pizza negative <sep> crust negative
1062641,id_2,Food is great.,Food positive
935633,id_4,I recieved prompt service with a smile.,service positive
657129,id_4,"Ask for Usha, the nicest bartender in manhattan.",Usha positive
1189674,id_0,First went here to enjoy their garden terrace.,garden terrace positive
632121,id_2,"The food is amazing, rich pastas and fresh doughy pizza.",food positive <sep> pastas positive <sep> pizza positive
541532,id_0,Cozy romantic atomosphere with only around 15 tables at most.,atomosphere positive
737999,id_4,A great place to meet up for some food and drinks...,place positive
1398844,id_2,"The tables are crammed way too close, the menu is typical of any Italian restaurant, and the wine list is simply overpriced.",tables negative <sep> menu neutral <sep> wine list negative
620892,id_4,Not enough wines by the glass either.,wines by the glass negative
1123262,id_1,"The seafood is amazing, there's a good wine list, and the ever-changing menu always offers some great surprises.",seafood positive <sep> wine list positive <sep> menu positive
1125284,id_0,"As a Japanese native, I've lived in the Tristate area for over 8 years, but I was just so amazed at this place.",place positive
430342,id_3,My friend devoured her chicken and mashed potatos.,chicken and mashed potatos positive
1430994,id_3,My boyfriend had the New England Chowder it was good but I think the award should go to the Lobster Bisque.,New England Chowder positive <sep> Lobster Bisque positive
507937,id_3,Service is fast and friendly.,Service positive
1430994,id_7,We didn't want a bottle of bubbly on a weekday so we each got little bottles of Korbett it was just enough.,bottles of Korbett positive
720620,id_1,The food here does a great service to the name (Cantonese that is...).,food positive
1726427,id_0,The service was excellent and the food was delicious.,service positive <sep> food positive
1352948,id_3,And evaluated on those terms Pastis is simply wonderful.,Pastis positive
1649025,id_2,The food is so cheap and the waiters are nice.,food positive <sep> waiters positive
1730447,id_3,"The crust is thin, the ingredients are fresh and the staff is friendly.",crust positive <sep> staff positive <sep> ingredients positive
1718513,id_3,"THe back garden sitting area is very pleasant, where you can see their personal herb garden.",back garden sitting area positive
1293334,id_1,"My husband and I thougt it would be great to go to the Jekyll and Hyde Pub for our anniversary, and to our surprise it was fantastic.",Jekyll and Hyde Pub positive
1084394,id_3,The Prix Fixe menu is worth every penny and you get more than enough (both in quantity AND quality).,Prix Fixe menu positive
1727363,id_1,This is a wonderful place on all stand points especially value ofr money.,place positive
611117,id_2,Don't miss Bloom's on your next trip to Manhatten.,Bloom's positive
535248,id_1,The shrimp scampi was excellent and the antipasti were plentiful.,shrimp scampi positive <sep> antipasti positive
1471273,id_2,Not impressed with the food.,food negative
433878,id_6,NO PIZZA 33 for me!,PIZZA 33 negative
426805,id_0,"The view is spectacular, and the food is great.",view positive <sep> food positive
571962,id_2,Good drink.,drink positive
1289424,id_3,The server was really cool and served us our food and drinks with a smile.,server positive
1230993,id_0,I had a grat time at Jekyll and Hyde!,Jekyll and Hyde positive
1286916,id_0,I have NEVER been disappointed in the Red Eye.,Red Eye positive
1572027,id_1,Amma is nothing special.,Amma neutral
1125006,id_3,My wife had the fried shrimp which are huge and loved it.,fried shrimp positive
404464,id_2,"The entree was bland and small, dessert was not inspired.",entree negative <sep> dessert negative
1476493,id_2,"The ambience was nice, but service wasn't so great.",ambience positive <sep> service negative
720620,id_5,Simply some good tasting Chinese food at incredible prices...,Chinese food positive
512925,id_2,"also it's great to have dinner in a very romantic and confortable place, the service it's just perfect...they're so frendly that we never want to live the place!",place positive <sep> service positive
1573534,id_0,First of all Dal Bukhara Rocks.,Dal Bukhara positive
1707201,id_1,The food was good.,food positive
1496205,id_1,The location and ambience is Ok but the food is what makes up for it.,location neutral <sep> ambience neutral <sep> food positive
1700205,id_2,"Considering we were the last patrons there and it was after the closing time, the waitstaff did not rush us at all and made us feel comfortable and relaxed.",waitstaff positive
1730447,id_2,"By far, the best pizza in Manhattan.",pizza positive
1287538,id_0,"If we were to move from the upper east side, we would genuinely miss this restaurant.",restaurant positive
1102681,id_3,"However, go for the ambience, and consider the food just a companion for a trip across the world!",ambience positive <sep> food neutral
558423,id_0,This place has the best Chinese style BBQ ribs in the city.,BBQ ribs positive
680345,id_0,This is an amazing place to try some roti rolls.,roti rolls positive
445960,id_0,"This is such a lovely, peaceful place to eat outside.",place positive
1609375,id_1,"We love the food, drinks, and atmosphere!",food positive <sep> drinks positive <sep> atmosphere positive
527109,id_1,"The restaurant has a Family feel, not least with regard to the portions which are enormous; the veal alone could have single-handedly solved third world famine.",restaurant positive <sep> portions positive <sep> veal positive
397331,id_2,Mizu is home to creative and unique rolls not to found anywhere else.,rolls positive
1380450,id_0,I'm still mad that i had to pay for lousy food.,food negative
444818,id_0,"Seriously, this place kicks ass.",place positive
1486041,id_0,"The atmosphere is nothing special, but it feels like a Sushi establishment in Tokyo.",atmosphere positive
1138996,id_1,"We have been to this place many times, and always have great food, wine, and service.",food positive <sep> wine positive <sep> service positive
1451109,id_0,If you want something really different than try Jekyll and Hyde.,Jekyll and Hyde positive
707917,id_0,I have been to Rao's probably 15 times the past 3 years and it keeps getting better.,Rao's positive
1577714,id_3,"Quite frankly, this is some of the worst sushi I have ever tried.",sushi negative
445960,id_3,"The food is good, especially their more basic dishes, and the drinks are delicious.",food positive <sep> basic dishes positive <sep> drinks positive
1014458,id_0,"I have eaten at Saul, many times, the food is always consistently, outrageously good.",food positive
527109,id_3,The wine list is extensive and can easily hike up an otherwise reasonably priced meal.,wine list positive <sep> meal positive
1707201,id_2,The place was nice and calm.,place positive
519425,id_0,The food was absolutely amazing!!,food positive
535086,id_4,I have been doing all of the above at the Heartland Brewery for over 5 years now and I HAVE NEVER BEEN DISAPPOINTED!,Heartland Brewery positive
626269,id_3,bottles of wine are cheap and good.,bottles of wine positive
1014458,id_1,Saul is the best restaurant on Smith Street and in Brooklyn.,Saul positive
1269216,id_4,Worth visiting the 1st Ave spot because it is the original store.,1st Ave spot positive
