review_id,sentences_ids,sentences_texts,sentences_opinions
584025,id_2,The food is great and they have a good selecion of wines at reasonable prices.,food positive <sep> wines positive
1723402,id_0,love the food.,food positive
1256373,id_1,fine dining restaurant quality.,dining positive
444818,id_1,"The atmosphere is unheralded, the service impecible, and the food magnificant.",atmosphere positive <sep> service positive <sep> food positive
1632445,id_0,Mermaid Inn is an overall good restaurant with really good seafood.,seafood positive <sep> Mermaid Inn positive
680345,id_1,I really recommend the very simple Unda (Egg) rolls.,Unda (Egg) rolls positive
1055910,id_2,Food-awesome.,Food positive
682391,id_0,Best drumsticks over rice and sour spicy soup in town!,drumsticks over rice positive <sep> sour spicy soup positive
1448587,id_4,Problem is nothing at Prune is particularly memorable.,Prune negative
1457607,id_0,The place is a lot of fun.,place positive
1439875,id_0,The food is amazing... especially if you get the Chef's tasting menu and your favourite bottle (or two!) of wine from an extensive selection of wines.,food positive <sep> selection of wines positive <sep> Chef's tasting menu positive
1700205,id_1,"From the spectacular caviar to the hospitable waitstaff, I felt like royalty and enjoyed every second of it.",caviar positive <sep> waitstaff positive
746254,id_4,"With so many good restaurants on the UWS, I don't need overpriced food, absurdly arrogant wait-staff who don't recognize they work at a glorified diner, clumsy service, and management that doesn't care.",food negative <sep> wait-staff negative <sep> service negative <sep> management negative
1451107,id_6,The staff was the friendliest that have seen in New York.,staff positive
1664346,id_2,I would highly recommend this place!,place positive
1380450,id_1,The hanger steak was like rubber and the tuna was flavorless not to mention it tasted like it had just been thawed.,hanger steak negative <sep> tuna negative
746254,id_0,We were seated outside and the waiter spilled red wine and hot tea on myself and my date.,waiter negative
1500453,id_4,"Although the tables may be closely situated, the candle-light, food-quality and service overcompensate.",candle-light positive <sep> food positive <sep> service positive <sep> tables negative
1707741,id_1,The buffet had a nice selection.,buffet positive
1623276,id_3,Not a great place for family or general dining.,place negative
1225162,id_3,The staff is incredibly helpful and attentive.,staff positive
1145510,id_1,The pizza is yummy and I like the atmoshpere.,pizza positive <sep> atmoshpere positive
875139,id_1,The pizza was pretty good and huge.,pizza positive
1032695,id_0,Every time in New York I make it a point to visit Restaurant Saul on Smith Street.,Restaurant Saul positive
1748839,id_0,The food was mediocre at best but it was the horrible service that made me vow never to go back.,food negative <sep> service negative
1719567,id_4,We waited at the bar and had martinis that were just right.,martinis positive
759781,id_4,"The vibe is very relaxed and cozy, service was great and the food was excellent!",vibe positive <sep> service positive <sep> food positive
757762,id_0,Baluchi's has solid food and a nice decor at reasonable prices.,food positive <sep> decor positive <sep> Baluchi's positive
1287538,id_3,The food is a diamond in rough -- the food is delicious and homemade with the perfect balance of herbs and tomatoes.,food positive <sep> balance of herbs and tomatoes positive
872763,id_2,Personal pans are the perfect size for those hungry nights.,Personal pans positive
1398844,id_3,Slightly above average wines start at $70+ with only one selection listed at $30+.,wines negative
1632445,id_1,The menu is limited but almost all of the dishes are excellent.,menu negative <sep> dishes positive
436868,id_3,"Calling the place Hampton Chutney Co. does warn you that these folks offer more style than substance, but in this unattractive room with unhelpful clerks there was a dearth of the former too.",place negative <sep> room negative <sep> clerks negative
470488,id_5,"The fish was adequate, but inexpertly sliced.",fish negative
1707741,id_2,The food was average or above including some surprising tasty dishes.,food positive <sep> dishes positive
476473,id_0,Awsome Pizza especially the Margheritta slice.,Pizza positive <sep> Margheritta slice positive
494850,id_1,"During the course of the past 3 months, the chef and staff changed and it was not for the better.",chef negative <sep> staff negative
1338124,id_5,"In any event, this is a place I'll be sure to stop by again when I'm in this part of town.",place positive
1338124,id_0,"This is some really good, inexpensive sushi.",sushi positive
1221938,id_2,"Service is not exactly five star, but thats not really a big deal.",Service neutral
505535,id_0,this little place has a cute interior decor and affordable city prices.,interior decor positive <sep> place positive
682391,id_3,Best Taiwanese food in NY!,Taiwanese food positive
1289424,id_4,The place's decor and hidden bathrooms made for a good laugh.,decor positive <sep> hidden bathrooms positive
1199292,id_0,"Pizza - the only pizza in NYC that should not have additional toppings - the crust tastes like the best, freshly baked bread!",crust positive <sep> pizza positive
1041457,id_4,I had never had Edamame pureed before but I thought it was innovative and tasty (could've used a bit more salt).,Edamame pureed positive
1125284,id_3,This place is worth an one-hour drive.,place positive
1728733,id_4,The food looked very appetizing and delicious since it came on a variety of fancy plates.,food positive
1632929,id_3,"The food was delicious (I had a halibut special, my husband had steak), and the service was top-notch.",food positive <sep> halibut special positive <sep> steak positive <sep> service positive
717570,id_4,You must have the crabmeat lasagna which is out of this world and the chocolate bread pudding for dessert.,crabmeat lasagna positive <sep> chocolate bread pudding positive
1189674,id_6,"Have recommended the place to friends, always gets good response.",place positive
475298,id_3,The location is perfect.,location positive
397331,id_1,"While their kitchen food is delicious, their Sushi is out of this world.",kitchen food positive <sep> Sushi positive
957145,id_3,"I've also been amazed at all the new additions in the past few years: A new Jazz Bar, the most fantastic Dining Garden, the Best Thin Crust Pizzas, and now a Lasagna Menu which is to die for (these are not your average lasagnas)!",Dining Garden positive <sep> Jazz Bar positive <sep> Thin Crust Pizzas positive <sep> Lasagna Menu positive
1543345,id_3,Great staff.,staff positive
1730127,id_0,You cannot go wrong with this place.,place positive
1746113,id_1,The menu has so many fish items and oysters.,menu positive
404464,id_3,I expected quite a bit more from such an expensive menu.,menu negative
624715,id_1,Authentic Pakistani food.,Pakistani food positive
1660047,id_3,"After dinner the manager grabbed my boyfriend, asked him: Where are you from...maybe you dont know how things work in America...and in the end stormed away almost teareyed yelling that tips are the only thing they survive on.",manager negative
610611,id_6,skip dessert.,dessert negative
1162037,id_0,"Planet Thailand has always been a hit with me , I go there usually for the sushi, which is great , the thai food is excellent too .",sushi positive <sep> thai food positive <sep> Planet Thailand positive
1706644,id_3,"My friends settled for rice dishes, but we came back the following day to try the dim sum, which was good...not outstanding, but good.",dim sum neutral
1147082,id_0,I went there for lunch and it was not as good as I expected from the reviews I read.,lunch negative
565344,id_1,This little place definitely exceeded my expectations and you sure get a lot of food for your money.,food positive <sep> place positive
527109,id_2,"The anti-pasta was excellent, especially the calamari, as were the filling pasta mains.",anti-pasta positive <sep> calamari positive <sep> pasta mains positive
1661757,id_4,I would definitely recommend SEA if you like thai cuisine!,thai cuisine positive
490565,id_3,"But the best part about LS is the late night atmosphere, delightfully free of the BTs.",late night atmosphere positive
490565,id_1,"The wait staff is pleasant, fun, and for the most part gorgeous (in the wonderful aesthetic beautification way, not in that she's-way-cuter-than-me-that-b@#$* way).",wait staff positive
709294,id_1,"We recently decided to try this location, and to our delight, they have outdoor seating, perfect since I had my yorkie with me.",outdoor seating positive
1506491,id_2,Check out the secret back room.,back room positive
1603698,id_5,"The dinner was ok, nothing I would have again.",dinner negative
1126886,id_2,"The service is excellent, the decor is great, and the food is delicious and comes in large portions.",service positive <sep> decor positive <sep> food positive <sep> portions positive
436868,id_1,"The dosas are skimpy, unattractive and drip with grease, and personally I'd drink popcorn topping before I'd eat another one of these.",dosas negative
430342,id_6,Great neighborhood joint.,joint positive
1572033,id_2,This place is always packed.,place neutral
1380450,id_2,Service was also horrible and the ambience is not that great.,Service negative <sep> ambience negative
720620,id_2,I fell in love with the egg noodles in the beef broth with shrimp dumplings and slices of BBQ roast pork.,egg noodles in the beef broth with shrimp dumplings and slices of BBQ roast pork positive
1280166,id_2,"Food was very good as well, considering that we tried the budget selection (though I wish the pork belly that I ordered was roasted a bit longer, so that fat was more of a melt-in-your-mouth experience).",Food positive <sep> pork belly negative
1459569,id_2,Drinks way over priced.,Drinks negative
1062641,id_0,This place has got to be the best japanese restaurant in the new york area.,place positive
1221938,id_0,The drinks are always welll made and wine selection is fairly priced.,drinks positive <sep> wine selection positive
430342,id_5,"Even if the food wasn't this good, the garden is a great place to sit outside and relax.",garden positive <sep> food positive
530517,id_0,Lucky Strike is a great casual place to just grab a bite to eat.,Lucky Strike positive
773720,id_0,Food was good and the view of the new york city skiline was terrific even on a foggy rainy day like that of when I went.,Food positive <sep> view of the new york city skiline positive
1300636,id_4,"I highly recommend Cafe St. Bart's for their food, the ambience and wonderful service.",food positive <sep> ambience positive <sep> service positive
1293334,id_2,"The have over 100 different beers to offer thier guest so that made my husband very happy and the food was delicious, if I must recommend a dish it must be the pumkin tortelini.",beers positive <sep> food positive <sep> pumkin tortelini positive
1577714,id_2,The fish was not fresh and the rice tasted old and stale.,fish negative <sep> rice negative
1626564,id_3,Waitstaff are very friendly.,Waitstaff positive
503807,id_4,"I choose to go with one of the special, the braised lamb shank in red wine, which was excellent.",braised lamb shank in red wine positive
624715,id_2,People are always friendly.,People positive
608500,id_2,"While the ambiance and atmosphere were great, the food and service could have been a lot better.",ambiance positive <sep> atmosphere positive <sep> food negative <sep> service negative
773720,id_2,Although they do the typical what kind of water would you like questions the service was good and overall very relaxing to place to eat.,service positive <sep> place positive
1335656,id_4,Although we were looking for regular lettuce and some walnuts the salads we got were great.,salads positive
1264954,id_0,"On a recent Sunday afternoon, a friend and I accidently found this great restaurant on our way to see the pulitzer prize winning play DOUBT.",restaurant positive
1713185,id_0,"This place is really trendi but they have forgotten about the most important part of a  restaurant, the food.",food negative <sep> place positive
561054,id_2,"The food is wonderful, tasty and filling, and the service is professional and friendly.",food positive <sep> service positive
1417496,id_0,A restaurant that doesn't try to do anything except serve great food with great service in a pleasant atmosphere.,food positive <sep> service positive <sep> atmosphere positive
630914,id_3,"Nice atmosphere, the service was very pleasant and the desert was good.",atmosphere positive <sep> service positive <sep> desert positive
1460715,id_0,Great pizza for lunch place.,pizza positive
737999,id_0,Consistently good Japanese Tapas.,Japanese Tapas positive
571962,id_1,Good food.,food positive
1395421,id_0,My Girlfriend and I stumbled onto this hopping place the other night and had a great time!,place positive
1064477,id_2,The sushi seemed pretty fresh and was adequately proportioned.,sushi positive
1153034,id_0,Great pizza and fantastic service.,pizza positive <sep> service positive
1086478,id_4,"Also, specify if you like your food spicy- its rather bland if you don't.",food negative
1572033,id_4,"Most importantly, food is excellent.",food positive
1125284,id_1,This place is the most Japanese it can ever get.,place positive
751493,id_0,I am relatively new to the area and tried Pick a bgel on 2nd and was disappointed with the service and I thought the food was overated and on the pricey side.,service negative <sep> food negative
1340075,id_6,This place is always very crowded and popular.,place positive
1702257,id_0,Nice Family owned traditional restaurant.,restaurant positive
496132,id_0,This is the kind of place you'd like to take all your friends to and still keep a secret.,place positive
1655504,id_2,"The large selection of bruschettas, paninis, tramezzinis keep the palate from stagnating.",bruschettas positive <sep> paninis positive <sep> tramezzinis positive
1470334,id_2,"The bagels always warm, soft on the inside, crispy on the outside and enormous in size.",bagels positive
1131595,id_3,The food was bland oily.,food negative
1655504,id_1,Cheese plate is a varied delight and great bargain at $10.,Cheese plate positive
475512,id_2,"Well, this place is so Ghetto its not even funny.",place negative
470488,id_4,"Furthermore, the rice had no seasoning, so the sushi was bland and disgusting.",rice negative <sep> sushi negative
757762,id_1,The only problem is that the manager is a complete incompetent.,manager negative
558423,id_1,I also recommend the rice dishes or the different varieties of congee (rice porridge).,rice dishes positive <sep> congee (rice porridge) positive
561054,id_3,"I can't wait for summer, when they serve outside on their gigantic patio.",patio positive
1367358,id_2,"Pizza is terrific, as is homemade pasta.",Pizza positive <sep> homemade pasta positive
470488,id_2,The sushi was awful!,sushi negative
553097,id_1,Too bad the food wasn't of the same heritage.,food negative
1671113,id_0,I have been to Casimir over 5 times and I have always had a great time there.,Casimir positive
1269216,id_1,The staff is no nonsense.,staff positive
1353599,id_4,Kind of a small place but I guess if they are not too busy might be able to fit a group or kids.,place neutral
565344,id_0,I recently tried Suan and I thought that it was great.,Suan positive
561054,id_1,"When you're sitting in their main dining room (which has a spectacular, hand-painted high ceiling) you'd never know there was a world outside.",main dining room positive <sep> ceiling positive
620892,id_2,Pizza was a little soggy.,Pizza negative
957145,id_2,"Over the years the host, Vittorio, and his crew, have always treated me as family--although with all the business this not-so-little gem does, it amazing he's even able to remember a consistent but not-so-frequent visitor.",host positive <sep> crew positive
1395421,id_2,It is one the nicest outdoor restaurants I have ever seen in NY--I am from Italy and this place rivals the ones in my country.,outdoor restaurants positive
1126886,id_0,"Everytime I decide to try another place on the UES, I get angry that I didn't just go to Zucchero Pomodori.",Zucchero Pomodori positive
1055910,id_4,Ambiance- relaxed and stylish.,Ambiance positive
1632445,id_3,The service is good and ambience is good for a date or group outing.,service positive <sep> ambience positive
1367358,id_1,The food is authentic Italian - delicious!,food positive
1232468,id_3,Service was prompt and courteous.,Service positive
1586174,id_0,honestly the worst sushi my husband and i had in our entire lives.,sushi negative
1212346,id_0,"Moules were excellent, lobster ravioli was VERY salty!",Moules positive <sep> lobster ravioli negative
1293334,id_0,"If you are the type of person who likes being scared and entertained, this is a great place to go and eat.",place positive
1352948,id_1,And where does Patis go wrong; no where.,Patis positive
1707201,id_3,but the service was a bit slow.,service negative
485026,id_2,"Try the Pad Thai, or sample anything on the appetizer menu...they're all delicious.",Pad Thai positive <sep> appetizer menu positive
1448587,id_2,"We ordered the special, grilled branzino, that was so infused with bone, it was difficult to eat.",grilled branzino negative
578016,id_0,I have never had cheescake like this.,cheescake positive
507755,id_1,The fried dumplings are GREAT!,fried dumplings positive
521916,id_2,Dessert is a joke...dont bother,Dessert negative
447697,id_2,Unique apppetizers.,apppetizers positive
1457607,id_5,"However, I think Jeckll and Hydes t is one of those places that is fun to do once.",Jeckll and Hydes positive
1728733,id_1,We were greeted promptly by the waiter who was very nice and cordial.,waiter positive
1538149,id_5,Very good wine choices.,wine choices positive
1225162,id_4,The bar is very well stocked with interesting beers and well priced wines.,bar positive <sep> beers positive <sep> wines positive
430342,id_4,Delicious crab cakes too.,crab cakes positive
1390357,id_4,The sushi is amazing!!!,sushi positive
507937,id_2,Spreads and toppings are great - though a bit pricey.,Spreads positive <sep> toppings positive <sep> Spreads negative <sep> toppings negative
1710746,id_6,I had a huge pastrami sandwich on a roll.,pastrami sandwich on a roll neutral
1221938,id_3,Downstairs lounge is always a good attraction,Downstairs lounge positive
1726427,id_3,Definitely a great spot for a nice occasion or date.,spot positive
1055910,id_5,"Don't judge this place prima facie, you have to try it to believe it, a home away from home for the literate heart.",place positive
1205520,id_2,Make sure you have the Spicy Scallop roll.. .,Spicy Scallop roll positive
1280179,id_0,"I've been to at Cafe Spice probably 5-8 times, it is probably still the best Indian restaurant around Union Square.",Cafe Spice positive
1280179,id_3,"Food is usually very good, though ocasionally I wondered about freshmess of raw vegatables in side orders.",Food positive <sep> raw vegatables in side orders negative
449802,id_5,But who says Murray's is anything about service.,service negative
1723658,id_3,I'm glad I was introduced to this place and this is a rare gem in NY.,place positive
509227,id_3,"Rao is a good restaurant, but it's nothing special.",Rao neutral
1269216,id_2,The food options rule.,food positive
1430994,id_1,The staff offers impeccable service.,staff positive
1506491,id_5,Thank You Emilio.,Emilio positive
680390,id_1,The food's as good as ever.,food positive
1410878,id_0,Myagi is one of my favorite restaurants in the City; the place the negative reviews describe sound like they were somewhere else.,Myagi positive
1718513,id_0,"We went here for lunch a couple of weeks ago on a Saturday, and I was thoroughly impressed with the food.",food positive
1661043,id_2,You should pass on the calamari.,calamari negative
513521,id_0,Great bagels made the old-fashioned way.,bagels positive
1053543,id_4,We went around 9:30 on a Friday and it had died down a bit by then so the service was great!,service positive
1543345,id_2,Get the pepperoni - YUM - and a family style salad.,pepperoni positive <sep> family style salad positive
1470334,id_1,Ess-A-Bagel (either by Sty-town or midtown) is by far the best bagel in NY.,bagel positive
1432551,id_2,The wine list is excellent.,wine list positive
1390357,id_0,I absolutely love this place!!!,place positive
1162037,id_1,"With the great variety on the menu , I eat here often and never get bored .",menu positive
436868,id_2,"The sandwiches are dry, tasteless and way overpriced.",sandwiches negative
1451107,id_5,And really large portions.,portions positive
1457607,id_3,"The food however, is what one might expect.",food negative
505535,id_1,"the pad se ew chicken was delicious, however the pad thai was far too oily.",pad se ew chicken positive <sep> pad thai negative
720620,id_3,This dish is my favorite and I always get it when I go there and never get tired of it.,dish positive
1710746,id_4,"Consequently, their burgers fell apart in their hands and made such a mess that they did'nt feel like finishing them.",burgers negative
1328078,id_3,"the salads are delicious, both refreshing and very spicy.",salads positive
1623276,id_2,This is a nice restaurant if you are looking for a good place to host an intimate dinner meeting with business associates.,restaurant positive
624715,id_4,"Just straight up cheap, good food.",food positive
872763,id_1,The food is great.,food positive
1448587,id_3,"The decor in this place is very diner-ish and the kind of place you expect in the East Village - not romantic, just simple, small and sparse.",decor neutral
720620,id_6,Service is not what you are coming here for...,Service negative
1318537,id_0,fresh restaurant was amazing........ food was delicious and of course fresh.,fresh restaurant positive <sep> food positive
1064477,id_0,"I tend to judge a sushi restaurant by its sea urchin, which was heavenly at sushi rose.",sea urchin positive
1145510,id_0,This is a fun restaurant to go to.,restaurant positive
1477631,id_2,Thius is a must for anyone who loves Shabu-Shabu.,Shabu-Shabu positive
1016296,id_5,I/we will never go back to this place again.,place negative
1086478,id_3,"The kitchen however, is almost always slow.",kitchen negative
1147211,id_2,The waitress was very patient with us and the food is phenomenal!,waitress positive <sep> food positive
1074868,id_3,"In the evening, this place attracted a well dressed, with it, NY crowd.",crowd positive
1125006,id_1,Best Pastrami I ever had and great portion without being ridiculous.,Pastrami positive <sep> portion positive
1086478,id_1,"I like the somosas, chai, and the chole, but the dhosas and dhal were kinda dissapointing.",somosas positive <sep> chai positive <sep> chole positive <sep> dhosas negative <sep> dhal negative
1661043,id_4,Decor is charming.,Decor positive
490565,id_2,"The food is yummy, especially their cooked-to-perfection mussels in spicy tomato sauce and their shoestring crispy fries.",food positive <sep> mussels in spicy tomato sauce positive <sep> fries positive
1353599,id_0,Right off the L in Brooklyn this is a nice cozy place with good pizza.,pizza positive <sep> place positive
1280166,id_4,Traditional French decour was pleasant though the hall was rather noisy - the restaurant was full and we had to raise our voices to be able to maintain a conversation.,Traditional French decour positive <sep> hall negative
507937,id_1,"delicious bagels, especially when right out of the oven.",bagels positive
1227999,id_1,"The waitress moved our table practically into the bathroom and when we asked to cancel our dinner orders because we did not want to eat sitting on the toilet, we were told no...",waitress negative
493514,id_1,I cannot imagine better Indian food in all of the city.,Indian food positive
1167434,id_5,"those rolls were big, but not good and sashimi wasn't fresh.",rolls neutral <sep> rolls negative <sep> sashimi negative
1626564,id_4,Love YUKA.,YUKA positive
1241906,id_0,"Great service, great food.",service positive <sep> food positive
1055910,id_3,Service- friendly and attentive.,Service positive
624715,id_0,This place is a great bargain.,place positive
485767,id_3,The brioche and lollies as party favors is a cute and sweet touch to a most memorable meal.,brioche and lollies positive
1623276,id_1,The food is tasty and portion sizes are appropriate.,food positive <sep> portion sizes positive
433878,id_3,The counter service is bad.,counter service negative
1632445,id_6,The lobster sandwich is $24 and although it was good it was not nearly enough to warrant that price.,lobster sandwich positive <sep> lobster sandwich negative
1341354,id_3,"We concluded with tiramisu chocolate cake, both were delicious.",tiramisu chocolate cake positive
1615322,id_5,It's a rather cramped and busy restaurant and it closes early.,restaurant negative
485767,id_1,"The service was attentive, yet discreet.",service positive
519425,id_1,The baked clams octopus we shared as appetizers were the best we've ever had!!,baked clams octopus positive
1632929,id_6,I highly recommend the restaurant based on our experience last night.,restaurant positive
1460715,id_2,The pizza was great.,pizza positive
1417496,id_2,The dining room is quietly elegant with no music to shout over -- how refreshing!,dining room positive
513395,id_1,"Their bagels are fine, but they are a little overcooked, and not really a 'special' bagel experience.",bagels negative
1340075,id_2,The atmosphere is noisy and the waiters are literally walking around doing things as fast as they can.,atmosphere negative <sep> waiters positive
1162037,id_3,It's all about the food !!,food positive
