review_id,sentences_ids,sentences_texts,sentences_opinions
32859,id_1,Хочу выразить огромную благодарность этому ресторану за самый лучший и не мало важный день в жизни нашей фирмы.,ресторану positive
12270,id_4,"После, подошла милая девушка, поздоровалась,улыбнулась и извинилась за ожидание)",девушка positive
33952,id_1,"Отмечала свой день рождения в красивейшем зале ""Царский"".","зале ""Царский"" positive"
26152,id_5,"Кирпичные стены, добротная мебель, современный интерьер...",мебель positive <sep> интерьер positive
13623,id_8,"Вся еда на вид была аппетитная, размер порций достойный.",еда positive <sep> порций positive
28258,id_16,Будем приезжать еще в этот ресторан.,ресторан positive
16761,id_7,Народу было много.,
12118,id_6,"На горячее многие заказали шашлык из свинины и телятину с шалфеем, но увы, и то и другое было суховато и прямо скажем не вкусно(((",шашлык из свинины negative <sep> телятину с шалфеем negative
34232,id_9,"Хорошие приборы, новая посуда, позитивный интерьер.",приборы positive <sep> посуда positive <sep> интерьер positive
29350,id_1,"В ресторане очень вкусная еда, в частности- суши, роллы, свинной шашлык,теплый мексиканский салат(рекомендую)!!! 2.",еда positive <sep> суши positive <sep> роллы positive <sep> свинной шашлык positive <sep> теплый мексиканский салат positive
27169,id_14,"Отмечу также как человек, увлекающийся фотографией,что фотографии на фоне этого замечательного средневекового интерьера получаются просто фантастические!",интерьера positive
3152,id_10,"Директор - душевный человек, все пожелания учитывает и советует, что и как лучше сделать.",Директор positive
19439,id_11,"Кухня на высоте: салаты необычны, вкусны, порции весьма приличные по размеру.",Кухня positive <sep> салаты positive <sep> порции positive
1105,id_5,"Поели рибай, после чего сделали вывод, что он был лучше, чем в некоторых стейк-хаусах.",рибай positive
33838,id_15,"Официанты в массе своем мужчины, как рассказывают это фишка суши, позволяющая увеличить быстроту обслуживания.",Официанты positive
27841,id_9,"Интерьер неплохой, жалко только, что диванчики и плазменная панель только в зале для некурящих.",Интерьер neutral
22527,id_3,"Обслуживание прекрасное: тарелки убирали сразу, новые блюда приносили быстро, так что ничего не надо было ждать.",Обслуживание positive
32513,id_9,Столики у стенок с диванами заняты все.,Столики negative
36512,id_9,"Хотим сказать огромное спасибо персоналу за внимательное отношение к нам и нашим гостям, а так же за красиво декорированные и украшенные свадебный зал и столы!!!",персоналу positive <sep> свадебный зал positive <sep> столы positive
16378,id_3,"Обслуживание - Приятные, вежливые молодые люди, не слишком часто, но и не редко подходят, работают не бездушно, с улыбкой и вообще органично смотрятся, никаких нареканий.",Обслуживание positive <sep> молодые люди positive
14539,id_8,За счет того что стены из стеклопакетов ощущение что находишься в теплице.,стены из стеклопакетов negative
32513,id_23,"Но если управляющий уходит куда-то, на мой взгляд, он непременно должен оставить информацию о заказанных столах кому-то!",управляющий negative
16955,id_1,Интерьер не то что оставляет желает лучшего......!!!!! такого я не видела давно.,Интерьер negative
2006,id_2,"В ресторане спокойная, уютная атмосфера.",атмосфера positive
21574,id_8,Уже порекомендовала это заведение всем друзьям.,заведение positive
11027,id_8,"Меню хорошо смотреться и легко читается, а также присутствует специальное предложение.",Меню positive
20086,id_9,"По качеству салатов претензий не было, а вот десерты не впечатлили, нам показалось, что готовятся они не в ресторане.",салатов neutral <sep> десерты negative
12863,id_5,"Из всех заведений японской кухни - это самое лучшее, придем туда еще раз до 20 ноября...по акции!!!!",заведений японской кухни positive
12591,id_13,Спасибо за такое чудесное место в Пушкине!,место positive
33798,id_5,Паста и суши всегда на отлично!,Паста positive <sep> суши positive
22015,id_7,С таким обслуживанием у заведения вряд ли появятся постоянные гости!!,обслуживанием negative
27539,id_4,"А в остальном все прекрасно: и девушка администратор (помогла нам сделать выбор блюд), уютная атмосфера, в зале не накуренно, обслуживание очень даже быстрое, официатки внимательные, еда вкусная.",девушка администратор positive <sep> атмосфера positive <sep> зале neutral <sep> обслуживание positive <sep> официатки positive <sep> еда positive
10847,id_5,"В кафе чувствуется от персонала, что люди хотят работать и это им нравится, а это самое главное!)",персонала positive
36781,id_1,"Пришли вовремя, сели за столик и ....",
36205,id_10,Светлая мебель.,
23878,id_1,"Пришли вечером, чтобы послушать живую музыку, отдохнуть и пообщаться.",
20397,id_8,"Салаты вкусные, свинина с сыром Фета, фисташками и грибным соусом - это просто восторг!!!","Салаты positive <sep> свинина с сыром Фета, фисташками и грибным соусом positive"
3202,id_7,Всем советую посетить Нельсон паб и получить там только хорошие эмоции!!!,Нельсон паб positive
34710,id_10,Но где берут таких официантов???,официантов negative
1052,id_8,"В В другой раз нам ""повезло"" не меньше.",
10778,id_7,"Жаль,что многие не знают этот замечательный ресторан.",ресторан positive
36017,id_6,"Можно сказать, что оно даже скромное.",
8996,id_2,"Интерьер на очень достойном уровне, чувствуется что заведение держит свою марку.",Интерьер positive <sep> заведение positive
29350,id_2,"Слегка не уютно, от большого пространства и не много прохладно(зимой), но летом - это супер виды из окна!!! 3.",большого пространства negative <sep> виды из окна positive
35486,id_12,Вообщем такие дела.,
19439,id_16,Итог таков: 2 бокала коньяка по 50 гр. 3 бокала красного сухого вина 100 гр.,
28258,id_9,Я ела крем суп из белых грибов (примерно 350 р.) и пенне с уткой ( 450 р.).,
27539,id_5,"В целом приличный китайский ресторан, еда конечно чуть дороже, чем скажем в ""Харбине"", но ресторан того стоит.",китайский ресторан neutral <sep> китайский ресторан positive
36,id_20,"Жаль, что не урвал телефончик.",
35863,id_8,Кухня..,
35486,id_6,Я заказал сырные палочки.,
36274,id_3,"В последний раз была с другом, он заказывал кальян.",
28112,id_9,Интерьер??,
12467,id_11,"Подруга заказывала рыбные рулетики, а принесли рулетики и +гору салата!!!",рулетики positive <sep> салата positive
10778,id_13,С уважением Ирина,
16676,id_5,"Меню довольно интересное, больше имеет восточную направленность, но главное по ценам очень демократичное.",Меню positive
10099,id_1,"Зашли случайно, обе в китайских ресторанах не бывали, решили попробовать, что это такое.",
24501,id_0,"Хотела бы выразить благодарность за, неожиданно приятное впечатление, которое произвел на меня персонал и атмосфера Вашего ресторана!",персонал positive <sep> атмосфера positive <sep> ресторана positive
16274,id_3,"Нас встретила очень милая девушка проводила в зал для не курящих,народу было скажем не мало,после прочтенных отзывов ожидала ,что буду сидеть в пустом зале ,но нет, свободных было только два столика у прохода,там мы и сели.",девушка positive
3385,id_15,"заказанный заранее (наполеон) не оправдал моих ожиданий, ну что ж на вкус и цвет товарища нет.",наполеон negative
13100,id_1,"За пару дней заказал столик,что оказалось весьма кстати-несмотря на будний день,веранда была занята полностью.",
29350,id_3,"Сервис, на мой взгляд очень хороший, начиная от встречи гостя до проводов.",Сервис positive <sep> встречи гостя positive <sep> проводов positive
33405,id_3,Обслуживание на достойном уровне!,Обслуживание positive
25861,id_5,"Если бы не это, то могла бы назвать Моджо приятным местом чтобы посидеть вечером с друзьями.",Моджо positive
33912,id_3,"Пришли мы туда в пятницу вечером и как ни странно, народу было совсем немного, что в принципе нас порадовала, так как без проблем смогли выбрать любой понравившийся нам столик.",
23858,id_5,"Однако, в пятницу, когда пришел уже непосредственно отмечать и решил заказать их пива, мне сказали что в наличии остался только один сорт, причем не местного пива.",пива negative
9870,id_6,Все наши пожелания и замечания были учтены Сергеем вплоть до мелочей.,
29395,id_2,"Кухня замечательная, обслуживание на 10.",Кухня positive <sep> обслуживание positive
36321,id_3,"Обстановка располагает к душевному застолью с тостами, речами и беседам (помещение маленькое, уютное и не шумное).",Обстановка positive <sep> помещение positive
15335,id_0,"Отдыхали с друзями, гуляли, отмечали День рождение друга, решили зайти в ресторан Трес Амигос нас очень порадовала сразу обстановка и интерьер, очень уютно и веет домашней обстановкой!",обстановка positive <sep> интерьер positive
26284,id_1,"Мы из Москвы,посетили на выходные Питер и Ваш замечательный ресторан!",ресторан positive
23369,id_14,"Вино оказалось очень дорогим,поэтому пришлось обойтись пивом и довольно вкусным домашним морсом.",Вино negative <sep> домашним морсом positive
32513,id_8,Управляющего на месте нет.,Управляющего negative
29395,id_8,"Правда не помню живая ли она была, вроде, нет.",
20417,id_16,"Пока не лопну, наверно хватит одной порции.",
11532,id_10,Такого вкусного мороженого давно не ела!!,мороженого positive
34196,id_0,"Бронировали столик в прошлые выходные (30.08.14), небольшой компанией.",
37036,id_6,"Хочется снова окунуться в незабываемую атмосферу, которая присуща данному заведению.",атмосферу positive
17999,id_8,"Большой ресторан, хорошее и главное довольно выгодное место и кухня очень приличная, но вот обслуживание оставляет желать лучшего....",ресторан positive <sep> место positive <sep> кухня positive <sep> обслуживание negative
34334,id_8,"Официанты очень внимательные и доброжелательные!!подходили,спрашивали,все ли хорошо, что лучше принести, на столе не было пустых бутылок и грязных салфеток!",Официанты positive
31071,id_5,"Кухня неплохая, никаких претензий, попробовала равиоли с трюфелями и рикоттой (380 р.) и крем-суп из тыквы с пармезаном (380 р.) (так получилось, что выбрала самые недорогие блюда из меню:)).",Кухня neutral <sep> равиоли с трюфелями и рикоттой neutral <sep> крем-суп из тыквы с пармезаном neutral
11770,id_18,Я же очень полюбила блюдо тартар с сырой рыбой и сырым яйцом.,блюдо тартар с сырой рыбой и сырым яйцом positive
35085,id_13,"Еда, довольно вкусная, но очень маленькие порции (как вообще у нас в России в ресторанах почему-то).",Еда positive <sep> Еда negative
36359,id_5,"Заказала себе салат,так мне даже было жалко его съесть,настолько было красиво украшен))я уже не говорю,что было очень вкусно).",салат positive
13186,id_2,"Я решила выпить вина и поинтересовалась у официантки какое вином мне посоветуйте, явно меню в этом ресторане официанты не учат, ничего про вино она мне не смогла обьяснить!",официанты negative
34761,id_10,"Если бы мне пришлось второй раз выбирать ресторан, я не усомнившись сделала выбор в пользу Duplex!",Duplex positive
32206,id_1,"Два этажа, очень спокойный, но стильный интерьер, само место неожиданно располагает к тому, чтобы провести там время за разговором, а ""заодно"" и поесть.",интерьер positive <sep> место positive
29321,id_7,"Цены на вино просто бешенные..хотя, может для такого ресторана это и нормально, но вот в соотношении с едой мне показалось дорого!",вино negative
33665,id_4,"Мы отмечали в большом зале,он был украшен просто шикарно фонтаны из шариков,с потолка свисали сердца,все было в красных тонах,а про наше место я уже молчу,подсветка,шикарные цветы на столе,вообще все украшение было шикарным,каждый стульчик был украшен.",большом зале positive <sep> фонтаны из шариков positive <sep> потолка positive <sep> в красных тонах positive <sep> подсветка positive <sep> цветы на столе positive <sep> украшение positive <sep> стульчик positive
32692,id_3,"Заказывали по салату Цезарю, пасту и пиццу - все понравилось!",салату Цезарю positive <sep> пасту positive <sep> пиццу positive
36407,id_12,"Хорошо,что есть теперь такое место у нас в районе.",место positive
32771,id_0,"Добрый день, Праздновали День Рождение в середине ноября (15 ноября, пятница).",
12467,id_18,"Понравилось все-обстановка, сервис и кухня на высоте!",обстановка positive <sep> сервис positive <sep> кухня positive
2345,id_1,Очень уютная атмосфера.,атмосфера positive
34045,id_4,"Рекомендую это кафе как для тех, кто просто хочет попить кофе в спокойной обстановке, так и для тех, кто хочет отметить день рождения или какой-то другой праздник.",кафе positive <sep> обстановке positive
3480,id_1,"В тихом месте,есть,где припарковать машину,интерьер очень уютный!)",месте positive <sep> интерьер positive
2747,id_16,"Морс - из натуральной клюквы, как домашний.",Морс - из натуральной клюквы positive
24275,id_2,"Чувствовалось, что здесь персоналу не безразлично настроение и впечатление посетителей.",персоналу positive
34575,id_1,Место просто потрясающее!,Место positive
19467,id_11,В этот раз повезло.,
24217,id_4,"Отделка везде использована недорогая, но само пространство выглядит уютно и празднично.",Отделка neutral <sep> пространство positive
18780,id_5,Посещаю это место уже в течении двух лет качество еды и обслуживания не меняется а постоянство признак професссионализма.,место positive <sep> еды positive <sep> обслуживания positive
16151,id_9,А вот второй этаж очень уютный.,второй этаж positive
225,id_24,Вернусь ли я туда?,
30201,id_1,"Кухня хорошая, ничего сказать не могу, но вот сервис и обслуживание последнее время (с начала лета) оставляют желать лучшего.",Кухня positive <sep> сервис negative <sep> обслуживание negative
24713,id_10,До заказа банкета я кое-что заказала в кафе на первом этаже.,
11267,id_1,"Обслуживание просто ни в какие рамки не лезет, офицантки просто не обращают на тебя никакого внимания, а если уж все-таки удастся кого-нибудь поймать, то на тебя смотрят с таким выражением лица.. ""ах, вам еще и принести что-то надо..."".",Обслуживание negative <sep> офицантки negative
12591,id_4,"Подошла к первому человеку,идущему на встречу и поинтересовалась ,где есть хорошее место,чтобы выпить кофе.",
16714,id_2,"Хачипури немного подкачало, показалось что маловато сыра, хотя наверное на любителя.",Хачипури neutral <sep> сыра neutral
21856,id_11,S.,
32856,id_4,"Обстановка в ресторане вообще очень приятная и домашняя, грязные тарелки исчезали со стола незаметно, весь персонал приятные и улыбчивые ребята.",Обстановка positive <sep> персонал positive
10663,id_2,Очень вежливый и приятный мужчина из гардероба.,мужчина из гардероба positive
32584,id_15,Цены вполне приемлемые: за большую пиццу и 6 коктейлей мы заплатили 2200,пиццу neutral <sep> коктейлей neutral
35635,id_13,"На вопрос : ""почему?"", официант, заявил, что их некому делать!",
26152,id_13,"Персонал старается, надеюсь так будет продолжаться и дальше.",Персонал positive
20784,id_8,"Шашлык свежий, тает, никакого жира и костей.",Шашлык positive
21574,id_5,"Очень понравился салат с креветками и листьями, рулетики из баклажанов (начинка включала в себя грецкие орехи, остальное не поняла))), холодный рыбный рулет и, корюшка, фаршированная рисом и овощами-поистине красивое и вкусное блюдо.","салат с креветками и листьями positive <sep> рулетики из баклажанов positive <sep> начинка positive <sep> грецкие орехи positive <sep> холодный рыбный рулет positive <sep> корюшка, фаршированная рисом и овощами positive <sep> блюдо positive"
19817,id_11,Тоже не плохое.,
354,id_6,"Когда зашли в ресторан в зале никого не было, позже подошли ещё 2 посетителя.",
35635,id_12,"Оказывается, что их больше нет в меню!",меню negative
23858,id_3,Порадовало и наличие своего пива по приемлемой цене и неплохого вкуса.,пива neutral
12118,id_7,А вот рыба в беконе - порадовала))),рыба в беконе positive
12270,id_11,Кухня..,
28112,id_3,"Что меня удивляет в этом,так это то,что кухня (качество)не меняется уже 8!!!лет.",кухня positive
1032,id_0,"Посетили этот ресторан 25,08,12.",
11770,id_20,"В общем, ресторан высокого уровня.",ресторан positive
