review_id,sentences_ids,sentences_texts,sentences_opinions
16955,id_2,"Ладно, первый зал проходной, но там есть столики,надеюсь они всегда пустые... похож на магазин , где стоят холодильники с мороженным!",зал negative
36,id_16,Но и группа друзей не пропадёт.,
19467,id_13,Меню интересное и разнообразное.,Меню positive
20862,id_6,"Позвали, подошла, заказали пасту, свежевыжатый сок, напитки.",
20021,id_3,"интерьер мне понравился. в светлых тонах, висят картины, занавесочки из то ли бисера, то ли ещё чего)",интерьер positive <sep> картины positive <sep> занавесочки positive
25709,id_1,"Я второй раз, подруга - первый.",
27841,id_11,"Отлично, что появилось такое приятное местечко в нашем районе.",местечко positive
3647,id_3,Попробовали местное пиво – понравилось.,местное пиво positive
27629,id_10,Но очень не удобная мебель.,мебель negative
29350,id_4,"Персонал очень вежливый (особенно официантка Анастасия),приветливый и хорошо знает состав блюд, что не мало важно.",Персонал positive <sep> официантка positive
35635,id_11,И опять сюрприз!,
2747,id_17,"На десерт - брали вишневый штрудель (много вишни с шариком мороженого), горячий яблочный пирог (тоже понравился), клубнчный десерт - по-моему панакота с клубничным пюре, (нежный и вкусный)",вишневый штрудель positive <sep> вишни positive <sep> мороженого positive <sep> яблочный пирог positive <sep> клубнчный десерт positive <sep> панакота с клубничным пюре positive
1368,id_9,Но это можно компенсировать весьма вежливым обслуживанием.,обслуживанием positive
2616,id_4,"Кухня: прекрасные суши, свежая рыба, правильно сваренный рис, как запеченные, таки и классичесикие суши и роллы чудо как хороши.",Кухня positive <sep> суши positive <sep> рыба positive <sep> рис positive <sep> классичесикие суши positive <sep> роллы positive
36381,id_7,"Поднялись на второй этаж, встретила нас девушка, предложила пару маленьких столиков.",
14190,id_5,Сидели прямо напротив кухни (где пиццу готовят) около окна.,
24217,id_6,"Кухня особого впечатления не вызвала, порции маловаты, но для бара сойдет, хотя цены показались несколько завышенными.",Кухня negative <sep> Кухн neutral <sep> порции neutral
11770,id_1,"Вкусное пиво, сырные палочки.",пиво positive <sep> сырные палочки positive
36079,id_4,"Ну и для кого-то минус, а для меня плюс, хозяин заведения против алкоголя и в его заведениях он не продается принципиально.",алкоголя neutral
33082,id_0,У нас была свадьба в этом ресторане.,
28083,id_10,Очень приветливая девушка!,девушка positive
33252,id_8,"Молодцы, ребята, за такое обслуживание не жалко и чаевые оставлять.",обслуживание positive
21716,id_3,Обслуживанием вполне довольны.,Обслуживанием positive
24713,id_8,Когда попробовала салаты- пришла в ужас.,салаты negative
33520,id_7,А вечером в пятницу и в субботу танцевальное шоу и живая музыка.,
27629,id_6,"Время было позднее много есть мы не могли , но сказав 3 блюда китайской кухни и 2 японской мы не нашли не одного действительно вкусного.",блюда китайской кухни negative
33252,id_5,кухня нас тоже очень порадовала!,кухня positive
33405,id_0,"Ходили в пятницу с друзьями в ""Москву"", они там частые гости, я была второй раз.",
1289,id_7,Рекомендую всем!,
26152,id_16,"Салат от шеф-повара с курицей - ничего лишнего, необычного, но вкусно.",Салат от шеф-повара с курицей positive
25709,id_6,Предварительно очень подробно рассказав обо всех прелестях данного заведения.,
11027,id_19,Теперь буду частенько посещать ваше заведение!!!!,заведение positive
354,id_14,"Друг заказал пиво,харчо и лагман, в итоге часть лагмана он не доел, хотя покушать он очень любит:).",лагман positive
225,id_10,"Меню показалось немного скучным, но мы быстро определились с выбором.",Меню neutral
31778,id_2,"Были на концерте группы ""Сегодня ночью"".",
2747,id_12,Захотелось попробовать чебуреки.,
30808,id_3,Конечно же впечатляет интерьер: уютно и красиво.,интерьер positive
35501,id_0,Заходили недавно в «Прагу» со своим молодым человеком.,
2089,id_5,"Причем на вопрос почему так, девушка сказала: ну я же вам принесла гарнир, а вы его съели... вот вам мясо))))))))))",девушка negative
3480,id_3,"Бизнес-ланч по сравнению с другими ресторанами не самый дешевый,но качество цене соответствует полностью!!!",Бизнес-ланч neutral <sep> Бизнес-ланч positive
354,id_13,"Муж тоже заказывал хинкали(после Чихиртмы) и сказал, что можно было взять одну порцию на двоих.",хинкали positive
27040,id_6,"Заказывали закуски-крылья, сырные шарики, фрукты-все очень понравилось!!!",закуски-крылья positive <sep> сырные шарики positive <sep> фрукты positive
32859,id_5,Мы заказывали 2 судака фаршированных и индейку.,
32856,id_10,"S.: не могу не отметить трепетного отношения к детям в этом ресторане, моим малышам там настолько понравилось, еле увели домой))))",отношения к детям positive
33798,id_9,"Официанты внимательные, но ненавящивые.",Официанты positive
35501,id_5,Официантки вежливые и приветливые.,Официантки positive
28258,id_0,Заехали с мужем поужинать в пятницу ( 17.01.14.) в 23:00.,
16151,id_14,Говядина по-дижонски.,
33622,id_6,"Очень весело, музыка хорошая, конкурсы и для молодых и для взрослых!",музыка positive <sep> конкурсы positive
27169,id_8,"Сразу было видно, что все продукты свежие!",продукты positive
33598,id_10,"А какое шоу нам показали двое молодых людей, занятых приготовлением заказанного десерта, прямо в зале перед нашим столиком.",шоу positive
11388,id_6,"Очень понравился музыкальный коллектив, хорошая музыка!",музыкальный коллектив positive <sep> музыка positive
36205,id_3,Уже давно хотел посетить.,
26152,id_15,"Салат с лососем - большая порция, необычная заправка, вцелом понравилось.",Салат с лососем positive <sep> порция positive <sep> заправка positive
21399,id_2,"Интерьер мне лично очень понравился, чем-то напомнил ресторан ""Русский Китч"".",Интерьер positive
9230,id_5,"Итак, мы взяли устриц.",
1751,id_4,"Меню достаточно разнообразное, есть отдельное меню японской кухни, ну это на любителя.",Меню neutral
22386,id_2,"По меню: Ценник выше среднего Небольшой выбор салатов Из блюд компаний перепробовали: соленья, кармашки с грибами и рыбой, жареный камамбер, шашлык из свинины, свинину с моцареллой и грибами, угря.",меню negative <sep> салатов negative
24578,id_5,"Еда вкусная, но порции не большие.",Еда positive <sep> порции negative
29383,id_1,"Народу действительно было много, но столики на пару человек можно было найти.",
10942,id_8,Очень понравился кальян.,кальян positive
36321,id_14,Долго искали хорошее место и не прогадали.,место positive
16955,id_3,"Два других зала нормальные, конечно до хороших) им ползти и ползти..., но вот еда!!!!!",зала neutral <sep> еда negative
18518,id_0,Мы были в этом ресторане 2 раза.,
11355,id_1,"Посетили вчера Твинс с подругой, в целом все очень понравилось!!",Твинс positive
33838,id_0,"Давно здесь не был, хотя близко от меня.",
18430,id_1,"Начилось все не с очень приятных моментов, т.к когда мы пришли туда, то оказалось что нет свободных столиков и только спустя наверное минут 20 официант все нашел нам подходящий стол.",официант positive
33405,id_7,"Нереально вкусный рулет, тает во рту, высшее наслаждение!!!",рулет positive
36576,id_4,ОООЧЕНЬ!) спасибо повару!,повару positive
2692,id_0,из всех посещенных мной ресторанов китайской кухни Тан Жен на гороховой - самой любимый.,Тан Жен positive
17572,id_11,Холодные закуска и салат были великолепны!,Холодные закуска positive <sep> салат positive
27841,id_1,"Сразу было очарована обслуживающим персоналом: встречают так, как будто ждали именно тебя и очень рады визиту.",обслуживающим персоналом positive
10778,id_11,"Я думаю, что гость,который посетит этот ресторан станет его постоянным гостем.",ресторан positive
12270,id_7,Выбрала зал для дискотек-музыка негромкая-если что могут сделать потише..очень понравились удобные диванчики и сервировка стола..,музыка positive <sep> диванчики positive <sep> сервировка стола positive
36402,id_1,"Действительно много места, как в самих залах, так и в холлах и гардеробе.",залах positive <sep> холлах positive <sep> гардеробе positive
33838,id_9,Замечательно.,
19746,id_0,отмечали в Караване -сарае день рождение мужа.,
17572,id_2,Честно говоря была немного удивлена...,
25709,id_0,Были 1 февраля.,
24578,id_16,"Да, и в ресторане чаевые от суммы оставляют себе сами.",
9837,id_4,"Интерьер приятный - правда, мне больше понравился первый зал - он более ресторанного типа, а многие любят сидеть во втором, напоминающем по интерьеру греческую таверну.",Интерьер positive <sep> первый зал positive <sep> интерьеру positive
29298,id_2,"Очень радует то, что по вечерам, где-то с 9 часов, играет живая музыка, можно потанцевать и прекрасно провести время.",живая музыка positive
17572,id_4,Ну да ладно идем дальше.,
26330,id_8,бармен стал нам просто другом.,бармен positive
22975,id_3,Кухня действительно похожа на греческую(в Греции бываю почти каждое лето).,
23369,id_10,"Что можно сказать о кухне...горячее очень порадовало,особенно вкусно приготовлено мясо-нежное сочное,вкучно приготовлены овощи.",горячее positive <sep> мясо positive <sep> овощи positive
1427,id_3,"Зашли к вам вечером,уставшие, оказалось что все залы забиты а на веранде все же прохладно сидеть с ребенком, встретил нас молодой человек предложил несколько столов куда можно было присесть,Проводила нас до столика уже девушка(имени к сожалению не запомнила) судя по внешнему виду администратор,она же и подала меню,что больше всего удивило нам налили абсолютно бесплатной воды по бокалам, было очень приятно.",залы negative <sep> веранде negative <sep> молодой человек positive <sep> девушка positive <sep> администратор positive
225,id_6,"Помню только что столовые приборы, бокалы и специи находятся вдоль стены на невысокой ступеньке.",
15423,id_5,"Отдельное спасибо за обслуживание милой Татьяне, очень часто на неё попадаем, и всегда получаем приветливое и качественное обслуживание, всегда посоветует и ответит на шутку, видно что девушка с чувством юмора).",обслуживание positive <sep> обслуживание positive <sep> девушка positive
1200,id_2,"Вино взяли белое сицилийское,понравилось,попросили еще такое же, его оказалось больше нет,взяли другое, и оно тоже было в одном экземпляре,взяли третье....3.",Вино positive <sep> Вино negative
32584,id_11,"Планировка ресторана продумана отлично, музыка очень приятная и приглушенная.",Планировка positive <sep> музыка positive
36274,id_6,"Обстановка кафе вполне располагающая к отдыху-удобная мягкая мебель, зоны столиков разделены шторами, но в помещении прохладно когда открывается и закрывается входная дверь если сидеть около входа.",Обстановка positive <sep> мягкая мебель positive <sep> столиков positive <sep> помещении negative
25507,id_4,"Официантку пришлось долго ждать-при условии того, что позвали ее сами, да и не один раз!!",Официантку negative
354,id_3,"Нас 4 взрослых и 3 детей(4,6 и 9 лет).",
11770,id_4,Отмечали его день рождения.,
6668,id_9,Мы скоротали время за бутылочкой вина.,
26330,id_0,В пятницу 8 числа с друзьями проходили мимо ресторана у видели большую вывеску и решили зайти посмотреть открытие олимпиады.,
20397,id_2,"столики не стоят впритык, думаю, даже при большом количестве народа посетители не чувствуют себя селедками в бочке (мы были во вторник, было совсем просторно).",столики positive
11793,id_11,"Обслуживание хорошее, но иногда приносят все сразу: и суши и суп и десерт.",Обслуживание neutral
16630,id_2,"Еда, стоит ли говорить, что трудно удивить человека, привыкшего и знающего грузинскую кухню.",Еда positive
35501,id_11,"К сожалению, никогда не были в Праге, но захотелось сравнить с настоящей.",
36085,id_4,Теперь это наше любимое место.,место positive
35501,id_1,Приятно были удивлены смене интерьера.,интерьера positive
21716,id_0,"Мы проводили торжество в марте 2014 года в ресторане ""На горке"".",
16137,id_9,Усадили.,
28745,id_1,"Я выбрал ""Мидзуки"" основываясь на отзывах с этого сайта, и не ошибся - очень уютное место, вкусная еда (заказывали роллы и рис с курицей), музыка ненавязчивая и тихая.",Мидзуки positive <sep> место positive <sep> еда positive <sep> роллы positive <sep> рис с курицей positive <sep> музыка neutral
34710,id_2,"Меню на столе нет при этом официантка подходит и спрашивает: ""Что вы выбрали?"" Из чего?",официантка negative
27040,id_1,Отмечали День Рождения!,
32771,id_15,Кухня - изумительная!,Кухня positive
25861,id_1,Красивый интерьер - сидели у окна за столиком с диванчиками.,интерьер positive
3385,id_4,Второе мы заказывали по меню.,
28258,id_2,"Интерьер ресторана мне нравится, я люблю такой дизайн.",Интерьер positive <sep> дизайн positive
2345,id_12,И вкус и оформление блюд достойны самой высокой оценки!!!,блюд positive
23369,id_15,"Выбор блюд достаточно широкий,поэтому думаю,что следующий раз мы попробуем что-нибудь еще.",блюд positive
34889,id_3,"Уже на пороге почувствовав легкую прохладу кондиционера и услышав приятную музыку, поняли, что сделали правильный выбор!",кондиционера positive <sep> музыку positive
13252,id_10,"Обслуживания все те три раза, что мы там были, также было безупречным.",Обслуживания positive
16378,id_2,"Интерьер - В целом достаточно тематично, исключая уже упомянутую кем-то колонку в зале и может быть недостаток света в главном зале, мне, как и многим, кто здесь писал больше нравится светлый зал, он намного уютнее, единственное - стоит обратить внимание на чистоту скатертей, не всегда идеально.",Интерьер neutral <sep> колонку negative <sep> света в главном зале negative <sep> светлый зал positive <sep> чистоту скатертей negative
27629,id_11,"В общем, в это заведение мы больше не пойдем.",заведение negative
14568,id_7,Больше в к этому месту нареканий в принципе не возникло),
36205,id_1,Пригласил девушку в АМАРЕНА на романтический ужин!,
9870,id_7,"Очень дружелюбный и внимательный коллектив официантов, все было во время и, кстати, от подачи блюд до элементарной чистоты на столах.",коллектив официантов positive <sep> подачи блюд positive
3452,id_9,Пересели ),
31778,id_5,"Публика от мала до велмка отрывалась весь вечер Но за эо уже большое спасибо лично им, хотя и администрацию бара тоже есть за что поблагодарить-концерт был совершенно бесплатный!",Публика positive <sep> администрацию бара positive
18003,id_5,"И встретили нас и проводили к столику, а официантка какая была, просто чудо, приветливая, внимательная, но самое главное все в меру, ее не было слишком много, но работу она выполняла на все 100, а то и 200 %.",официантка positive
12118,id_9,Холодные закуски- вполне съедобны.,Холодные закуски neutral
16714,id_9,"Очень хотелось, чтобы родителям понравилось, и сервис оказался выше всяких похвал.",сервис positive
34282,id_5,"При заказе спросили, как долго будут готовиться те или иные блюда, и в конечном счете, т.к. время было мало, заказали цезарь и морс мне, и пасту, блины и морс мужу.",
20086,id_3,"Интерьер в нашем зале нам понравился - уютно, красивая мебель.",Интерьер positive <sep> мебель positive
28585,id_7,"Заказали: смузи овощной, смузи злаковый, чайник чая (вроде мультифит), салат с домашним сыром, руккола с креветками,рулет из лосося с зелёной спаржей и тунец с овощами гриль.",
28585,id_2,Увидели рекламу данного ресторана в ресторанном дворике и решили попробовать ...и не пожалели!!!(,ресторана positive
2345,id_9,Отдельно хочется отметить качество живой музыки!,живой музыки positive
34307,id_8,"В зале стоит галдеж, музыку вобще не слышно.",зале negative <sep> музыку negative
1878,id_2,"Сразу подошла официантка, с темными волосами, к сожалению имя не запомнил, обслуживание в ресторане отличное, тут ничего не скажешь!",официантка positive <sep> обслуживание positive
15567,id_2,Так вот.,
33598,id_6,"Вечер в ресторане Палкин прошел в изысканной обстановке, созданной вежливым и внимательным персоналом.",обстановке positive <sep> персоналом positive
32771,id_13,"Нас обслуживал молодой человек (к сожалению, имени не помню).",
32513,id_22,"Не знаю кто виноват, в том что сотрудники зала не знаю ничего о брони..",сотрудники negative
