review_id,sentences_ids,sentences_texts,sentences_opinions
0,0,"My friend's entree wasn't presented as described in the menu, but we didn't want to add to the drama.",entree negative <sep> menu neutral
0,0,The host came by and told us that they made a mistake and would have to seat us at a two-person table.,host negative <sep> seat neutral
0,0,"They had a definite buzz at the bar, but the place is so big that we felt like we had our own private room in the back.",bar neutral <sep> place positive
0,0,We arrived at 5:30 and had leave at 7:30 without dessert or coffee because the kitchen took insanely long between courses.,kitchen negative <sep> courses neutral
0,0,The food was abundant and good but wasn't worth the unpleasant wait.,food positive <sep> wait negative
0,0,Our waitress kept forgetting our drinks.,waitress negative <sep> drinks neutral
0,0,"Although my waiter had about as much personality as a dead fish, I loved the great solid food and would definately go back.",waiter negative <sep> fish negative <sep> food positive
0,0,The busboy kept our glasses full; the waiter warmed up to our table at the end of the night by cracking jokes.,glasses neutral <sep> waiter positive
0,0,"I love the creative rolls that they have on their menus, and none of them were a disappointment.",rolls negative <sep> menus neutral
0,0,"had dinner there last night, max the waiter was great.",dinner neutral <sep> waiter positive
0,0,Hoegardden on tap is an added bonus if you're not drinking from the well versed wine menu.,tap neutral <sep> wine menu positive
0,0,"We started at the bar with a nice bottle of wine, which was priced fairly and sampled several different cheeses.",bar neutral <sep> bottle of wine positive <sep> cheeses positive
0,0,The best out of the three entree's we had was the goat cheese ravioli.,entree neutral <sep> goat cheese ravioli positive
0,0,While waiting there was no room for standing and the bar staff and their drinks were horrendous.,waiting neutral <sep> bar staff negative <sep> drinks negative
0,0,We walked out the door with only a drink in each of us and the bill was still over $100.,drink neutral <sep> bill negative
0,0,"The owners are incredibly nice too, comping pitchers of margaritas if you sit there and eat for a couple of hours.",owners positive <sep> margaritas neutral
0,0,This is of course after waiting forever for menus and eventually having to ask for them.,waiting negative <sep> menus neutral
0,0,Salads are a delicious way to begin the meal.,Salads positive <sep> meal neutral
0,0,My only complaint is waiting a bit between the appetizer and the main course but it was well worth it.,waiting negative <sep> main course neutral
0,0,"Additionally, one of the waiters found it necessary to walk around the restaurant, telling people how to eat their food.",waiters positive <sep> food neutral
0,0,They deliver and I've used their food for quick executive type lunches in my office.,food neutral <sep> lunches positive
0,0,"The high light was the fondue, that we never got because again the server said the kitchen was too busy.",fondue positive <sep> server neutral <sep> kitchen negative
0,0,Waitress took FOREVER to take our drink order (it was not crowded) and she forgot our chips guac.,drink neutral <sep> chips guac negative
0,0,"Don't miss the creamed spinach, skip the frieeees.",creamed spinach positive <sep> frieeees negative
0,0,The rice was warm and didn't have a hint of vinegar.,rice positive <sep> hint neutral
0,0,"With one drink each, apps, entrees, and three desserts (nothing great) the bill came to $200 for four.",drink negative <sep> entrees negative <sep> bill neutral
0,0,"Sure, the burgers are good, but not good enough to make up for the abominable service and disgusting, filthy atmosphere.",burgers positive <sep> atmosphere negative
0,0,The food is not five star but the prices reflect that.,food negative <sep> prices positive
0,0,This has to be the HUGEST steak I've ever seen and the value here is OUTRAGEOUS.,steak positive <sep> value neutral
0,0,"My advice: go the bathroom at home, and then go to Ginza for EXCELLENT sushi and service.",bathroom neutral <sep> sushi positive <sep> service positive
0,0,About a half hour wait with reservations.,wait negative <sep> reservations neutral
0,0,We stumbled onto this diamond in the rough after our dinner plans at Schiller's were thwarted by a 90 minute wait.,dinner neutral <sep> wait negative
0,0,"I went to Sushiden on a Friday night around 8:00, the place was pretty empty, we had reservations, but we didnt need them.",place negative <sep> reservations neutral
0,0,"The characters were very entertaining, and while the prices are a little steep, it is well worth the cost.",characters positive <sep> prices negative <sep> cost positive
0,0,The shrimps looked old and had a sheen to them that you see at an all you can eat buffet at Sizzler.,shrimps negative <sep> buffet neutral
0,0,Chino's has become my new regular Lunch spot after trying their awesome pork sandwhich and calamari salad.,Lunch neutral <sep> pork sandwhich positive <sep> calamari salad positive
0,0,Don't let the all-Italian menu intimidate; the waitstaff patiently translates each item.,menu neutral <sep> waitstaff positive
0,0,"Good food, but they could expand their desert menu.",food positive <sep> menu negative
0,0,Mushroom appetizer was doused in a gross mayonnaise like sauce and had not been described that way on the menu.,Mushroom appetizer negative <sep> gross mayonnaise like sauce neutral <sep> menu neutral
0,0,"A bright spot: the server was immeadiately apologetic and whisked problem plates away, and replacements were prompt.",server positive <sep> plates negative
0,0,We waited FOREVER for a table and when the appetizers arrived they were cold or frozen in the middle!,table neutral <sep> appetizers negative
0,0,"The ambience is diner-like and the wait staff is rushed, but at these prices, I can't complain.",ambience positive <sep> wait staff negative <sep> prices positive
0,0,A sushi chef creating entrees of art that will have you talking as much as eating.,sushi chef positive <sep> entrees neutral <sep> art neutral
0,0,"In Short The weathered bar, well-worn tables, and chipped black paint on the walls give this corner tavern a lived-in feel.",bar neutral <sep> tables negative
0,0,"The bartender was skilled, the owners were very friendly, but the wait for my burrito was longer than I would have liked.",owners positive <sep> wait negative <sep> burrito neutral
0,0,"The Food In a less-than-booming economy, it's a joy to find an East Village bistro with entrees that rarely top 15 bucks.",Food positive <sep> entrees neutral
0,0,"The desserts were both essentially the same, and the service was on the slow side.",desserts neutral <sep> service negative
0,0,Lastly the waiters and bartender should learn to have argurments in private and not in front of customers.,waiters negative <sep> bartender negative <sep> private neutral
0,0,We had a sit down dinner and cannot tell you how satisfied I was with the quality of service and food.,dinner neutral <sep> service positive <sep> food positive
0,0,"The bar downstairs is a lot of fun, so if you get stuck waiting, just have drink.",waiting negative <sep> drink neutral
0,0,My snack was fava bean hummus chips which was the perfect amount to hold me til dinner.,fava bean hummus chips positive <sep> dinner neutral
0,0,The ONLY negative was when we asked the waiter to secretly bring birthday cake and some other desserts for the table.,waiter negative <sep> table neutral
0,0,"Charging full price for half pie toppings, and refusing delivery (1 block) for orders under $20.",price negative <sep> half pie toppings neutral
0,0,"I also do not think waiters there are rude- yes there are not friendly and chatty, but do provide great service.",waiters negative <sep> service positive
0,0,if you do though just wait at the bar (yummy drinks!,bar neutral <sep> drinks positive
0,0,I was really excited when our waiter read off the list of specials.,waiter neutral <sep> specials positive
0,0,At least you have the ambiance and lovely live piano musice being played for you while you wait.,ambiance neutral <sep> live positive
0,0,We did not have reservations so we sat at the small bar with the friendly bartender for 10 minutes.,reservations neutral <sep> bartender positive
0,0,"After waiting 40 minutes for a table and 30+ for our entrees, our waiter was distracted.",waiting neutral <sep> table neutral <sep> entrees neutral <sep> waiter negative
0,0,My only complaints are the less spectacular sides and menu items other than steak.,sides negative <sep> menu negative <sep> steak positive
0,0,"The waiters are sometimes grouchy and the decor doesn't change, but the food is always delicious and satisfying.",waiters negative <sep> decor negative <sep> food positive
0,0,"Be warned though, this plaice gets packed at lunch - and the service can be rottenly slow-going.",lunch neutral <sep> service negative
0,0,We were never offered dessert because our waiter spent about 20 minutes at the bar calculating the checks instead.,dessert neutral <sep> waiter negative <sep> bar neutral
0,0,The actors try to draw your attention away from the better stuff that is happening below.,actors neutral <sep> stuff positive
0,0,"The rest of the meal was good, but a little over priced for Chinese take out style food.",priced negative <sep> food neutral
0,0,Went to Spice Restaurant for dinner and loved my meal.,dinner neutral <sep> meal positive
0,0,I am not one to waste dessert but we threw away the box after taking a few bites of it.,dessert neutral <sep> box negative
0,0,"He hooted and hollered -- and told every staff person at the bar, not to serve us.",staff negative <sep> bar neutral
0,0,I went for lunch yesterday and had a lovely time.,lunch neutral <sep> time positive
0,0,When we got up to leave and the waiter tried to charge us 18% for the two mediocre apetizers and one drink they did serve us.,waiter negative <sep> apetizers negative <sep> drink neutral
0,0,They later told us that our waiter had to fix the 'computer' - that was the reason he couldn't bring us our drinks.,waiter negative <sep> drinks neutral
0,0,Basically the comfort is lacking but the food is the focus.,comfort negative <sep> food positive
0,0,"After the wine experience, I actually expected worse than what was served.",wine neutral <sep> served negative
0,0,The manager came over to our table at the end of our entree course to get our review.,manager positive <sep> entree neutral
0,0,I let the waiter know and he offered me a free dessert.,waiter positive <sep> dessert neutral
0,0,"I'd say the menu is generally below-average for the neighborhood, but if you want a burger, this is the place to go.",menu negative <sep> burger positive
0,0,The porterhouse is as good a steak you are going to find in NYC or the surrounding area.,steak positive <sep> area neutral
0,0,I didn't realize how good the food was until I went for dinner the other night.,food positive <sep> dinner neutral
0,0,The place was bustling at 8:30pm on a Wednesday night- we arrived earlier than our reservation and got situated at the bar.,place negative <sep> reservation neutral
0,0,Later two waiters decided to bodyguard our table; when my fork hits the plate it's snatched away.,waiters negative <sep> table neutral
0,0,Drinks were well priced and the buyback rate was fantastic.,Drinks neutral <sep> priced positive
0,0,However when I returned to my table the waiter immediately came over and said So I guess we are celebrating a birthday here.,table neutral <sep> waiter negative
0,0,I spent more time looking for a waiter than I did enjoying my meal.,waiter negative <sep> meal positive
0,0,The food was simple but exploded with flavor and the presentation was as if it was out of a cook book.,food neutral <sep> flavor positive <sep> presentation positive
0,0,Brunch at Cafe des Artistes was hands down the most terrible dining experience I have had in New York.,Brunch neutral <sep> dining negative
0,0,Got the check tossed on table 10 minutes after being served and hostess came by to rush us some more.,served neutral <sep> hostess negative
0,0,"i always get the apple pie, but the past two times i visited, the waiter burnt the pie while he was supposed to warm it up.",apple pie neutral <sep> waiter negative
0,0,"Sometimes, the take-out and seating lines can be long, but the staff help move things along.",take-out neutral <sep> seating lines neutral <sep> staff positive
0,0,"My favorite was the apple dessert, which came with little squares of pear and apple jelly.",apple dessert positive <sep> apple jelly neutral
0,0,Order ended up being double the price of a normal lunch.,price negative <sep> lunch neutral
0,0,"But, as I said, it's a dive bar, so it's not someplace you'd take a high-maintenance individual.",bar neutral <sep> individual negative
0,0,"For appetizers try the tuna carpaccio with wasabi creme fraiche, lobster tempura with tarter sauce.",appetizers neutral <sep> tuna carpaccio with wasabi creme fraiche positive <sep> lobster tempura with tarter sauce positive
0,0,For $19 in a place that specializes in breakfast I did expect perfect eggs benedict.,breakfast neutral <sep> eggs benedict positive
0,0,I have lived in Japan for 7 years and the taste of the food and the feel of the restaurant is like being back in Japan.,taste positive <sep> food neutral <sep> feel positive
0,0,"Desserts are showstoppers, namely the caramelized banana tower with toasted marshmallows in a tall hazelnut shell.",Desserts positive <sep> shell neutral
0,0,"the place looks cool, but the food is not really that good.",place positive <sep> food negative
0,0,Its a sicilian slice made with freshly grilled veggies which lie on top of a sumptous tomato sauce.,sicilian slice neutral <sep> grilled veggies positive
0,0,"Overall, the food makes up for what is missing in the ambience and service.",food positive <sep> ambience negative <sep> service negative
0,0,I really like the decor and it made it feel like I was having drinks at a mansion.,decor positive <sep> drinks neutral
0,0,The portions are miniscule and the size of an entree could be half-and appetizer if even that large.,portions negative <sep> entree neutral <sep> appetizer neutral
0,0,There is actually space to breathe and the decor sets the tone for an intimate dinner.,space neutral <sep> decor positive <sep> dinner positive
0,0,"I've been accustomed by the restaurant group's great service, so I was disappointed by the long wait for my lunch.",service positive <sep> wait negative
0,0,The owner and staff are all Japanese as well and that adds to the entire ambiance.,owner neutral <sep> staff neutral <sep> ambiance positive
0,0,you may have to wait a bit for service but you will not be disappointed with the food.,service negative <sep> food positive
0,0,"I had dinner with a few of my friends, and it was the best we've had in a long time.",dinner positive <sep> time neutral
0,0,"Free edamame (nice perk) and we ordered four rolls between the two of us, and each of us had a drink.",edamame positive <sep> rolls neutral <sep> drink neutral
0,0,but the wait for seating can be exasperating.,wait negative <sep> seating neutral
0,0,Sometimes when I come home from work I stop at the bar to have a plate of oysters and something delicious for dinner.,bar neutral <sep> plate of oysters neutral <sep> dinner positive
0,0,"While the space is exceptionally small and the seating can be uncomfortable, the food is well worth the few inconveniences.",seating negative <sep> food positive
0,0,The service is excellent and always informative without an air.,service positive <sep> air neutral
0,0,"I had afternoon tea which featured a pot of tea and several pastries and tea sandwiches, all of which were delicious.",afternoon tea positive <sep> pot of tea neutral <sep> pastries positive <sep> tea sandwiches positive
0,0,"After the bar, they sat us on the side with the wine room with a nice view of everything.",bar neutral <sep> view positive
0,0,Yet the maitre d still sat us next to the bar.,maitre negative <sep> bar neutral
0,0,Lobster bisque is a 10+ and Steaks ; fish and cajun shrimp app are standouts!,Lobster bisque positive <sep> Steaks neutral <sep> fish and cajun shrimp app positive
0,0,A few of us went the other night for cocktails (half price!),cocktails neutral <sep> price positive
0,0,I went on a saturday and the atmosphere was no more exciting than eating dinner at home.,atmosphere negative <sep> dinner neutral
0,0,The staff treated them like true royalty.,staff neutral <sep> royalty positive
0,0,"The salad I received was Iceberg lettuce with nothing else in it (no tomatoes, carrots).",salad neutral <sep> Iceberg lettuce neutral <sep> carrots negative
0,0,"And the owner didnt seem to care, she was more interested in talking at the bar than hearing from me.",owner negative <sep> bar neutral
0,0,"Food was good, but not worth the wait.",Food positive <sep> wait negative
0,0,I went there for Easter Dinner and the pork chops were quite tasty.,Dinner neutral <sep> pork chops positive
0,0,"The ribs are a second runner up, poo poo platters are never out of style.",ribs neutral <sep> poo platters positive
0,0,"If you want peace quiet, ambience and patient service, go elsewhere.",ambience neutral <sep> service positive
0,0,"Their appetizer portions are not huge, just right since the entrees are much larger.",appetizer portions negative <sep> entrees positive
0,0,i took another 45 minutes so i called back the waiter and said that if the food was ready now ill just pay for it.,waiter negative <sep> food neutral
0,0,The bar is also a must after dinner: have a raspberry martini!,bar positive <sep> dinner neutral <sep> raspberry martini positive
0,0,the food tastes like home cooking.,food neutral <sep> cooking positive
0,0,There is no way the food and service here are worth the prices they charge.,food neutral <sep> prices positive
0,0,Super friendly neighboorhood atmosphere where even a lady can go alone and have a drink and feel comfortable.,atmosphere positive <sep> drink neutral
0,0,The sandwiches from the take out window are delicious too.,sandwiches positive <sep> take out window neutral
0,0,"For far better fish at the same price (but less interesting roll combinations), try Yama, just around the corner.",fish positive <sep> price neutral <sep> roll negative
0,0,The duck burrito with mole sauce is out of this world and the prices are definitely affordable $12-16 for most entrees.,duck burrito with mole sauce positive <sep> prices positive <sep> entrees neutral
0,0,The Scene Inconspicuous Bottino is an ideal stop for a light lunch or full dinner while gallery-hopping through Chelsea.,Scene neutral <sep> lunch positive <sep> dinner positive
0,0,The waiter disappeared after dropping off the food so I had no choice but to eat it as is.,waiter negative <sep> food neutral
0,0,"When the food arrived, the portions were really small, and didn't really reflect the awesome descriptions on the menu.",food neutral <sep> portions negative
0,0,"Then the manager said, hey we'll give you shrimp instead, which would have taken another hour.",manager negative <sep> shrimp neutral
0,0,Drinks are a bit pricey ($10-12) but delicious - no wine is less than $10/glass either.,Drinks positive <sep> wine negative
0,0,ambience and decoration was nice but for a check of $330 for 5 for brunch and with just average food.,ambience positive <sep> decoration positive <sep> brunch neutral <sep> food neutral
0,0,"And I'm saying that dinner has actually taken about an hour more than it should, just because of the slow service.",dinner neutral <sep> service negative
0,0,We actually enjoy eating there earlier for lunch definatly a more relaxed atmosphere.,lunch neutral <sep> atmosphere positive
0,0,If you like a cleaner (more generic) flavor then other places may provide the norm.,flavor positive <sep> norm neutral
0,0,"The waiter took my boyfriend's order, snatched away the menus and stormed away from the table without even looking at me.",waiter negative <sep> menus neutral
0,0,"this guy should work in a dinner ,didn't even know the menu ,he couldn't explain me anythings ,a real nightmare.",guy negative <sep> dinner neutral <sep> menu neutral
0,0,"The lamb was wonderful, although I could do without all the beans.",lamb positive <sep> beans neutral
0,0,Go there for dinner this time and find it unusually bad in taste and not pleasent service at all.,dinner neutral <sep> service negative
0,0,"Good Italian spot, but should raise the bar on the food before some newcomers challenge its standings.",spot positive <sep> bar neutral <sep> food neutral
0,0,I dined in the Main Dining Room which is surrounded by authentic Spanish decorations.,Main Dining Room neutral <sep> decorations positive
0,0,"The place was jumping on a Mon nite, as was the bar, but with a nice mixed crowd.",bar neutral <sep> mixed crowd positive
0,0,My only suggestion would be to avoid long waits for food by adding extra servers when there are large groups.,food neutral <sep> servers positive
0,0,The Scene The windowed bar and front waiting area seems bright and airy compared to the somewhat stuffy main room.,Scene neutral <sep> windowed bar positive <sep> front waiting area positive
0,0,I ordered the Prix Fixe Pasta while my husband and children ordered from the menu - we were all happy with our choices.,Prix Fixe Pasta positive <sep> menu neutral
0,0,Beers on tap were pretty good and we had a great waiter but the food left much to be desired.,tap neutral <sep> waiter positive <sep> food negative
0,0,"Trendy decor doesn't make up for the avg food, adequate service and relatively high prices.",avg food negative <sep> service positive <sep> prices negative
0,0,"In summer, the small outdoor garden is an ideal place to sip coffee while reading under a canopy of trees and sky.",outdoor garden positive <sep> coffee neutral
0,0,"I went there for lunch with my mom, it was just excellent, the sole and cremed spinach dish I had was divine.",lunch neutral <sep> sole positive <sep> spinach dish positive
0,0,Before our food arrived I asked our waitress if we could be moved and she just stared blankly at me.,food neutral <sep> waitress negative
0,0,The waiter just slapped my food down and then never returned until he slapped my check down.,waiter negative <sep> food neutral
0,0,One gentleman ignored us most of the time and would plunk the coffee down and spill it on the table without saying a word.,gentleman negative <sep> coffee neutral
0,0,The Waterview is one of the best diners I've evr been to interms of the quality and taste of the food.,diners positive <sep> quality neutral <sep> food neutral
0,0,The scene is reasonably cool but unworth more than a drink.,scene positive <sep> drink negative
0,0,The atmosphere was really nice and inviting but our waiter was awful!,atmosphere positive <sep> waiter negative
0,0,"Warning, you are supposed to order multiple dishes, so if you order just an entree per person you probably won't have enough.",dishes positive <sep> entree neutral
0,0,I have seen the crowd go from ultra hip to BT and I still love it becuause of the food.,crowd neutral <sep> food positive
0,0,"No extra pickles, no AC, no ice water, slow service, the whole thing was just dissapointing.",water neutral <sep> service negative
0,0,"No bread basket for the table, the server came around with a basket and we each got 1 piece of bread.",table neutral <sep> server positive
0,0,"the soups were superb and only $2 a bowl, and the entire dinner, with beers, cost less than $30 for two people.",soups positive <sep> bowl neutral <sep> dinner neutral <sep> beers neutral <sep> cost neutral
0,0,However the manager came over and aplogized and all drinks were on him.,manager positive <sep> drinks neutral
0,0,The service always ruins your food if it's poor.,service negative <sep> food neutral
0,0,The Pink Pony's brunch is among the very best in the city!,Pony neutral <sep> brunch positive
0,0,"The bar is available while you waiting for the table, the DJ is nice.",bar neutral <sep> DJ positive
0,0,"BBQ is ordinal, and cole slaw is not even worth trying.",BBQ neutral <sep> cole slaw negative
0,0,"Warning Service is decent, but it takes forever to get the check.",Service positive <sep> check negative
0,0,"I went to Joy hoping to find some great Indian, but unfotunately found curry that was no better than average.",Indian positive <sep> curry negative
0,0,i recently had brunch at the new hill diner let me tell you it was great.,brunch positive <sep> diner neutral
0,0,"Although the mediterreanian plate was delicious, it was NOT what I'd expect from a tea salon.",mediterreanian plate positive <sep> tea salon negative
0,0,The miso soup lacked flavor and the fish was unfortunately not as well prepared as in the past.,miso soup neutral <sep> flavor negative <sep> fish negative
0,0,the food sucked straight up looks like a nice place to go out with date and have a couple of drinks.,food negative <sep> drinks neutral
0,0,"The baked penne came out in a small bowl, burnt with barley any sauce for $18.",baked neutral <sep> sauce negative
0,0,"Helpings are HUGE and most come with choice of rice and beans, or salad and plantains.",Helpings positive <sep> rice neutral <sep> beans neutral <sep> salad neutral <sep> plantains neutral
0,0,fresh home-made tomato sauce with chunks of awesome tomatoes fire it all up in a brick oven.,home-made tomato sauce positive <sep> chunks of awesome tomatoes neutral
0,0,"Main dishes - Vindaloo chicken OK, massive hunk of lamb decent.",Main dishes neutral <sep> Vindaloo chicken neutral <sep> lamb positive
0,0,"Prices are not cheap, but not expensive but the meal is worth every penny.",Prices negative <sep> meal positive
