review_id,sentences_ids,sentences_texts,sentences_opinions
0,0,"The ribs are a second runner up, poo poo platters are never out of style.",ribs neutral <sep> poo platters positive
0,0,The DJ at the bar kept the place alive.,DJ positive <sep> bar neutral
0,0,I can't imagine how small the fish portion on the $10 lunch menu must be if I got the large one.,fish portion negative <sep> lunch menu neutral <sep> one positive
0,0,The sushi was delicious and fresh and they didn't short you on the pieces of fish either.,sushi positive <sep> fish neutral
0,0,"For appetizers, I'd recommend the crab napolean or the monkfish mousse.",appetizers neutral <sep> monkfish mousse positive
0,0,Then another pleasant surprise - the menu said we had to share the entree for each couple.,menu neutral <sep> entree neutral <sep> surprise positive
0,0,"Man, that chicken (in some kind of spicy soup) was yummy!",chicken positive <sep> spicy soup neutral
0,0,People waiting for tables stand at a drink rail next to large windows which open out over a leafy garden in the summertime.,waiting neutral <sep> drink neutral <sep> windows positive
0,0,"We orderes and our food took about 1 hour to get it, after the long wait.",food neutral <sep> wait negative
0,0,Chino's has become my new regular Lunch spot after trying their awesome pork sandwhich and calamari salad.,Lunch neutral <sep> pork sandwhich positive <sep> calamari salad positive
0,0,The $9 glass of wine which the waitress called good was like grape juice with alcohol and no sugar.,glass of wine neutral <sep> waitress negative <sep> grape juice neutral <sep> alcohol neutral <sep> sugar negative
0,0,The waitress came to our table and told us about their tempting specials.,waitress positive <sep> table neutral <sep> specials positive
0,0,"It is not a very stylish place, but we had some of the best Chinese food we ever had.",place negative <sep> Chinese food positive
0,0,"Whole roasted branzino, a well-charred rib eye steak and roast suckling pig are typical dinner entrees.",roasted branzino neutral <sep> well-charred rib neutral <sep> roast suckling pig neutral <sep> dinner entrees positive
0,0,The dessert was as good as the waiter said it would be.,dessert positive <sep> waiter neutral
0,0,not having a menu was rather strange at first but the food was superb.,menu neutral <sep> food positive
0,0,"Generally, the food was fine, but the table is too small to eat comfortably.",food positive <sep> table negative
0,0,"The pooris were miniscule, about 2 bites each; they serve 4 of those as a dinner for $25!",pooris negative <sep> dinner neutral
0,0,"Two Tom's food is excellent, it more than makes up for the lack of decor.",Tom's food positive <sep> decor negative
0,0,"On the other hand, I never felt rushed to vacate the place at the end of my meal.",place negative <sep> meal neutral
0,0,My only complaint is waiting a bit between the appetizer and the main course but it was well worth it.,waiting negative <sep> main course neutral
0,0,Good value for breakfast.,value positive <sep> breakfast neutral
0,0,Went to Spice Restaurant for dinner and loved my meal.,dinner neutral <sep> meal positive
0,0,My favorite part of dinner was the Oyster Quail Egg Shooters.,dinner neutral <sep> Oyster Quail Egg Shooters positive
0,0,"There was interesting summer dessert, a rubarb-crisp with basil ice cream.",dessert positive <sep> rubarb-crisp with basil ice cream neutral
0,0,The manager was very thoughtful to have the chef make me a dish not on the menu to my liking.,manager positive <sep> chef neutral
0,0,The cultured wait staff were accommodating and helped explain and pronounce the items off the menu.,cultured wait staff positive <sep> menu neutral
0,0,We told the waitress a few more were coming and ordered drinks.,waitress negative <sep> drinks neutral
0,0,Out waitress never came back to our table after taking our food orders.,waitress negative <sep> food neutral
0,0,Drinks are a bit pricey ($10-12) but delicious - no wine is less than $10/glass either.,Drinks positive <sep> wine negative
0,0,The place was not crowded for dinner on a Sunday night at 8:30pm.,place positive <sep> dinner neutral
0,0,i took another 45 minutes so i called back the waiter and said that if the food was ready now ill just pay for it.,waiter negative <sep> food neutral
0,0,Between the 6 of us we tried almost everything on the menu and we were all very pleased with our meals.,menu neutral <sep> meals positive
0,0,I was expecting an average meal and was really pleased to get an awesome dinner - and it was pretty cheap too.,meal neutral <sep> dinner positive
0,0,The only problem we had was with an incompetent waitress and floor manager which slowed down our food and seating.,waitress negative <sep> floor manager negative <sep> food neutral
0,0,"With 5 items on the menu and prices this low, you'd think turnover would be a priority -- think again!!!",menu neutral <sep> prices positive
0,0,"My dinner at Diner 24 is highlighted by rude waiters, overpriced food and unprepared dishes.",dinner neutral <sep> waiters negative <sep> food negative
0,0,"I stopped in here for a pre-theater dinner, and I must say I was very happy with my meal.",pre-theater dinner neutral <sep> meal positive
0,0,The Food The restaurant boasts an impressive raw bar and samplings from the bait menu a big draw.,Food neutral <sep> bar positive <sep> menu neutral
0,0,Needless to say I will rather go spend $400 on dinner somewhere else wirh better service.,dinner neutral <sep> service positive
0,0,Super friendly neighboorhood atmosphere where even a lady can go alone and have a drink and feel comfortable.,atmosphere positive <sep> drink neutral
0,0,"They were out of cherry, so we got a few slices of apple and one key lime.",slices negative <sep> apple neutral
0,0,bartenders management and at first were a bit disappointed with food.,bartenders management neutral <sep> food negative
0,0,We fully relied on our very capable waiter for choices of the menu and we were not disappointed.,waiter positive <sep> menu neutral
0,0,"Chicken with Mixed vegetables is an explosion of flavor, many great spicy dishes too.",Mixed vegetables neutral <sep> flavor positive <sep> dishes positive
0,0,For dessert the waiter reccomended his favorite which was a Torreja.,dessert neutral <sep> waiter positive
0,0,"Its definitely recommended to make a reservation on the weekends, since its difficult to walk-in and get a table.",reservation neutral <sep> table negative
0,0,"When the manager came over, he accused my friend of offending the chef and continued to argue with her about the dish.",manager negative <sep> chef negative <sep> dish neutral
0,0,"In addition to Pizza, Dani has great homemade Ravioli and Maniccoti.",Pizza neutral <sep> homemade Ravioli positive <sep> Maniccoti positive
0,0,Theme and actors are kinda cool but you are charged some entertainment fee on top of the expensive food and drinks.,actors positive <sep> food negative <sep> drinks negative
0,0,"However, everything we ate was salted to an extreme, and the steak, so regrettably, was saturated with butter.",steak negative <sep> butter neutral
0,0,"I KEPT WAITING FOR THE FLAVORS IN THIS RICH LOOKING SAUCE TO TAKE OVER, BUT THEY DID NOT, THE SCALLOP WAS A LITTLE RUBBERY.",FLAVORS neutral <sep> SAUCE positive
0,0,The waitress lost some points for not refilling our champagne glasses.,waitress negative <sep> champagne glasses neutral
0,0,The front desk person gave us quite a struggle to find a good seat.,person negative <sep> seat positive
0,0,"our waiter noticed it was my bday w/o me saying, and brought me cake w/ candles.",waiter positive <sep> candles neutral
0,0,Did not get to dessert as it took a while to get the server's attention and we had a show to get to.,dessert neutral <sep> server negative
0,0,"The ombiance may be a bit more like your own loft, but how cool to eat food like home.",ombiance neutral <sep> food positive
0,0,"I had the salmon dish and while it was fine, for the price paid, I expected it to have some type of flavor.",price neutral <sep> flavor negative
0,0,"Their pasta isn't spectacular nor is their marinara sauce, but their appetizers are wonderful.",pasta negative <sep> marinara sauce negative <sep> appetizers positive
0,0,The waitstaff can be hard to track down and uninformed about the menu.,waitstaff negative <sep> menu neutral
0,0,") I'm sticking with Cafe Mozart--which has the same desserts, bigger slices, and lower prices!",Cafe neutral <sep> desserts neutral <sep> prices positive
0,0,I always trek to Bar 89 and get one of their huge sandwiches that comes with fries.,Bar neutral <sep> sandwiches positive <sep> fries neutral
0,0,"Waited for a table, got disgusting martinis at the bar, and sat down.",table neutral <sep> martinis negative <sep> bar neutral
0,0,"Fresh fish, tender milk fed veal and outrageous Veal Chops adorn their menu and special list.",fish positive <sep> menu neutral <sep> list positive
0,0,We decided to ask for our check for the wine we had and the waiter became completely annoyed at us!,wine neutral <sep> waiter negative
0,0,"Waiter suggests a beer, and offers to bring a small glass, to taste it and see if I like it, before I even order the beer!",Waiter positive <sep> glass neutral
0,0,The happy hour crowd at the bar was mostly just out of worker blowing off steam.,crowd positive <sep> bar neutral
0,0,The only con is the price ($110 for two people for a full meal).,price neutral <sep> meal positive
0,0,If it's atmosphere you want go to the River Cafe under the bridges and pay an arm and a leg for hospital-type food.,atmosphere neutral <sep> food negative
0,0,They spoon the FAT GREASE over your steak when they bring it to the table.,FAT GREASE negative <sep> steak neutral <sep> table neutral
0,0,I had the first pasta listed on the menu and it left me craving the taste again for days after.,pasta positive <sep> menu neutral
0,0,"Italian cheesecake, Cassata Al Forno and pastries you never saw in other bakeries are great.",cheesecake neutral <sep> pastries positive
0,0,"Prices are not cheap, but not expensive but the meal is worth every penny.",Prices negative <sep> meal positive
0,0,"as written below, the drinks were watered down, and they didn't have the ginger martini available nor all of the wine list.",drinks neutral <sep> wine list negative
0,0,I would love the owner to consider hosting a 'tango bar' once - twice a week.,owner positive <sep> bar neutral
0,0,"One friend had the steak which he didn't care for, but after waiting so long to be seated he was hungry.",steak neutral <sep> waiting negative
0,0,"we had to wait at the bar for a table, but the atmosphere is bustling and is well worth it.",bar neutral <sep> atmosphere positive
0,0,The chef insisted that the meat was cooked properly!?,chef negative <sep> meat positive
0,0,"The service was not great, the wait staff were not clear on the ingredients and or preparation details of the meals.",wait staff negative <sep> ingredients neutral <sep> meals neutral
0,0,"There was a ten minute wait with a reservation, but the bar kept us entertained.",wait neutral <sep> reservation neutral <sep> bar positive
0,0,The menu was in Italian- might as well have been in Esperanto;that put us at the mercy of the waiter for recommendations.,menu neutral <sep> waiter negative
0,0,"They have a lot of beautiful clientele, gay and straight, plus you#146;ll spot random famous actors on occasion.",clientele positive <sep> spot neutral
0,0,The waiter did not take a drink order from us.,waiter negative <sep> drink neutral
0,0,"The menu was nicely sized with five small plates, eight appetizers and seven entrees.",menu positive <sep> plates neutral <sep> appetizers neutral <sep> entrees neutral
0,0,Sometimes when I come home from work I stop at the bar to have a plate of oysters and something delicious for dinner.,bar neutral <sep> plate of oysters neutral <sep> dinner positive
0,0,"Overall, I good place to take a date or have a small group of friends for dinner.",place positive <sep> dinner neutral
0,0,I am hoping the stale service was a one shot deal because it was deplorable for what we paid for dinner!,service negative <sep> dinner neutral
0,0,At least you have the ambiance and lovely live piano musice being played for you while you wait.,ambiance neutral <sep> live positive
0,0,I went with my sister and neither of us had wine so the final bill was a bit shocking.,wine neutral <sep> final bill negative
0,0,Diners at the bar watch busy chefs scoop lobster salad onto warm brioche rolls.,bar neutral <sep> lobster salad neutral <sep> brioche rolls positive
0,0,Great place to go for a lunch date or for coffee after a date.,lunch neutral <sep> coffee neutral <sep> place positive
0,0,"The food is good, and we won't let one bad apple spoil the batch.",food positive <sep> apple negative
0,0,The prices have gone up and some of good old standby entrees have disappeared from the menu.,entrees positive <sep> menu neutral
0,0,"The waiter took my boyfriend's order, snatched away the menus and stormed away from the table without even looking at me.",waiter negative <sep> menus neutral
0,0,"our waitress couldn't explain or describe the specials to us, and a group of five people seemed to overwhelm her.",waitress negative <sep> specials neutral
0,0,I had the lobster ravioli--good size portion with a delicious vodka cream sauce.,lobster ravioli neutral <sep> vodka cream sauce positive
0,0,also you dont mind waiting because theres such a buzz around the bar it makes you feel like you are out for drinks.,waiting positive <sep> bar neutral <sep> drinks neutral
0,0,"Within 10 minutes of being seated at our table, the hostess asked us if we could move.",seated neutral <sep> hostess negative
0,0,"And I pretty much had to tell the waiter that when dinner is late, you usually comp your guests something.",waiter negative <sep> dinner neutral
0,0,The waiter knew his menu and what to recommend.,waiter positive <sep> menu neutral
0,0,"We had to ask the busboy if bread came with our meal, which it did and we received after waiting about 30 minutes.",busboy neutral <sep> meal neutral <sep> waiting negative
0,0,I came to have dinner with two of my girlfriends on saturday and had an awsome time.,dinner neutral <sep> time positive
0,0,The food is good and cheap BUT the attitudes of the bartender and wait staff are almost unbearable.,food positive <sep> bartender negative
0,0,"Took the waiter 10 minutes to get to our table, and another 15 minutes until the coffee I ordered arrived.",waiter negative <sep> table neutral <sep> coffee neutral
0,0,The ceviche had way too much onion which masked the flavor of the fish.,ceviche neutral <sep> onion negative <sep> flavor negative
0,0,"There was a short wait for a table, which we spent at the bar, then we were seated on their patio.",wait positive <sep> table neutral <sep> bar neutral <sep> patio neutral
0,0,"The brunch is $12 and includes unlimited pound cake (homemeade) and mimosas, and complimentary OJ.",brunch neutral <sep> pound cake positive <sep> OJ neutral
0,0,"YYMV, we visited for Restaurant Week so the quality of the food may have been below normal standards because of the crowds.",quality negative <sep> food neutral
0,0,and salads( try mixed green with mozzarella or chicken).,salads neutral <sep> mixed green with mozzarella positive <sep> chicken positive
0,0,"At almost $70/person with a glass of wine, the food is overrated.",glass of wine neutral <sep> food negative
0,0,It's also a good place to unwind after dinner and have some coffee and cake.,dinner neutral <sep> coffee positive <sep> cake positive
0,0,"This time, I ordered the tasting menu and the only two dishes I enjoyed were the squab and the sorbet.",menu positive <sep> dishes positive <sep> sorbet neutral
0,0,For the most part I enjoyed my dining experience at Revival (not to be confused with the bar on 15th).,dining experience positive <sep> bar neutral
0,0,Ten minutes later: no burgers and no sign of our waiter.,burgers neutral <sep> waiter negative
0,0,A freind invited me for lunch at Home because he said they have the best hamburgers.,lunch neutral <sep> hamburgers positive
0,0,Best plan is to order more appetizers and get one sushi platter.,appetizers positive <sep> sushi platter neutral
0,0,"Got a seat quick, and had some weird fill-out order form for a hard to understand menu.",seat positive <sep> menu negative
0,0,"From chicken wings and smoked beef brisket to pulled pork and Texas links, the menu features many barbecue favorites.",smoked beef brisket positive <sep> pork positive <sep> menu neutral
0,0,Diver scallops were divine along with chilled beets or high volocety pasta.,scallops neutral <sep> chilled beets neutral <sep> volocety pasta positive
0,0,"For entrees, we all had the steak frites and it was to die for.",entrees neutral <sep> steak frites positive
0,0,The food is so good that there tends to be a little bit of a wait.,food positive <sep> wait neutral
0,0,"After waiting over a month for weekend reservations, I would of rather gone to IL Baggato.",waiting negative <sep> reservations neutral
0,0,I recommend using your bread and sopping up the sauce.,bread positive <sep> sauce neutral
0,0,the most expensive dish on the menu was $14!!!,dish negative <sep> menu neutral
0,0,The food and drinks held up to eatery's rep and the service was just as good if not better.,drinks neutral <sep> service positive
0,0,"Our reservation was for 9, didn't get seated until 9:20 with no acknowledgment by the staff of the delay.",reservation neutral <sep> staff negative
0,0,"We were seated promptly for a Saturday lunch, but service was incredibly slow.",Saturday lunch neutral <sep> service negative
0,0,During the summer the outdoor area is a great place to sit and eat you pizza.,outdoor area positive <sep> pizza neutral
0,0,Top it off with one of many Polish bottled beer and youre in food heaven.,beer neutral <sep> food positive
0,0,"The food is just ok, not at all worth having to put up with the disgusting staff, the manager/owner in particular.",food positive <sep> staff negative
0,0,Its a sicilian slice made with freshly grilled veggies which lie on top of a sumptous tomato sauce.,sicilian slice neutral <sep> grilled veggies positive
0,0,Our waiter didn't know the menu or the ingredients.,waiter negative <sep> menu neutral <sep> ingredients neutral
0,0,"This was after we told the clueless hostess we only wanted to have drinks, and she seated us at a table.",hostess negative <sep> drinks neutral
0,0,"After ordering drinks, we both decided on the Paella Vallenciana, brought out on hot plates.",Paella Vallenciana neutral <sep> plates positive
0,0,"Well, what can I say about a restaurant with a takeaway menu completely devoid of sugar, butter, or deep-fried anything?",sugar negative <sep> butter neutral
0,0,"Stay away from the two specialty rolls on the menu, though- too much avocado and rice will fill you up right quick.",menu neutral <sep> rice positive
0,0,The Food The best surprises on the El Salvadorean menu are the appetizers.,Food neutral <sep> appetizers positive
0,0,MY FATHER ASKED FOR A MARTINI MADE A CERTAIN WAY THE WAITER HAD NO CLUE WHAT HE WAS TALKING ABOUT.,MARTINI neutral <sep> WAITER negative
0,0,i recently had brunch at the new hill diner let me tell you it was great.,brunch positive <sep> diner neutral
0,0,it is a small take-out style restuarant but they have a few tables.,take-out neutral <sep> tables negative
0,0,"The food is fantastic, Gourmet comfort food and has gotten progressively better over the past year, as did the service.",Gourmet comfort food neutral <sep> service positive
0,0,The Scene The windowed bar and front waiting area seems bright and airy compared to the somewhat stuffy main room.,Scene neutral <sep> windowed bar positive <sep> front waiting area positive
0,0,I went there for lunch with co-workers and found the service to be prompt and very friendly.,lunch neutral <sep> service positive
0,0,"After dinner the manager grabbed my boyfriend, asked him: Where are you from.",dinner neutral <sep> manager negative
0,0,"For the price and quality of the food, the service should have been a lot better than it was.",price neutral <sep> food neutral <sep> service negative
0,0,"When questioning our server about a certain dish, she kindly brought over the Union Sq.",server positive <sep> dish neutral
0,0,"Space aside, service is ok but the food is really well done.",Space neutral <sep> food positive
0,0,The ONLY negative was when we asked the waiter to secretly bring birthday cake and some other desserts for the table.,waiter negative <sep> table neutral
0,0,We waited for 1 hour each time the waitress came over to our table.,waitress negative <sep> table neutral
0,0,"He did do the service part well enough -- brought the food, etc.",service positive <sep> food neutral
0,0,"Then the manager said, hey we'll give you shrimp instead, which would have taken another hour.",manager negative <sep> shrimp neutral
0,0,We would have to flag down the bored looking wait staff to refill our tea.,wait staff negative <sep> tea neutral
0,0,The drinks are just as expensive as the chain coffee houses.,drinks negative <sep> coffee houses neutral
0,0,"The food is mediocre, burgers are ok, the pizza tastes like the box it's delivered in.",burgers positive <sep> pizza negative
0,0,"There is always a fun and friendly crowd at the bar, mostly locals, if you just want to come by for happy hour.",crowd positive <sep> bar neutral
0,0,Buffet fare is better than the regular menu and you don't have to deal with the waitstaff.,menu neutral <sep> waitstaff negative
0,0,The pieces were small but the fish was good quality and there wasn't a lot of rice to mess with.,fish neutral <sep> quality positive <sep> rice negative
0,0,"The drinks are quite strong, so I recommend having one of their wines by the glass to accompany dinner instead of a cocktail.",drinks positive <sep> wines by the glass to neutral
0,0,"So I go into the bar, and I ask the (extremely hot) waitress, what's the soup of the day?",bar neutral <sep> waitress positive
0,0,Our waiter was ever so helpful as he stood back and watched my sister and I physically move our table.,waiter positive <sep> table neutral
0,0,My friends and I went to dinner last weekend and had a great time.,dinner neutral <sep> time positive
0,0,"When I questioned the purpose of waiting on this line, I was asked to leave the bar.",waiting neutral <sep> bar negative
0,0,"While the space is exceptionally small and the seating can be uncomfortable, the food is well worth the few inconveniences.",seating negative <sep> food positive
0,0,"The portions are not HUGE, but you are very full by the end of your meal.",portions negative <sep> meal neutral
0,0,Two dogs and an adequately sized drink for two dollars.,dogs neutral <sep> drink positive
0,0,When we asked the waiter for water - he gave us dirty looks and it took at least 15 minutes to get it.,waiter negative <sep> water neutral
0,0,"When our first order came, they forgot the torro (which we later learned it was finished for the night.",torro negative <sep> night neutral
0,0,"Grabbed a lunch here on a weekday and it was reasonably priced, well-portioned and generally well-prepared.",lunch neutral <sep> priced positive
0,0,On the table you will also find individual bottles of fine imported olive oil which we put on the bread-fantastic!,table neutral <sep> olive oil positive
0,0,"We ordered one of the specials our decent waiter mentioned, and one of the chicken dishes off the menu.",specials neutral <sep> waiter positive <sep> chicken dishes neutral <sep> menu neutral
0,0,i went on a thursday evening and the restaurant was pretty empty the server got our drinks wrong 3 times!,server negative <sep> drinks neutral
0,0,"There is a litte bit of a wait on the food, but it is well worth it!",wait negative <sep> food neutral
0,0,"Though there are a handful of Japanese a la carte offerings on the menu, the prix fixe is most popular by far.",menu neutral <sep> prix fixe positive
0,0,"Was there for dinner last night, and the food was great.",dinner neutral <sep> food positive
0,0,"i thought the food was great but kind of expensive for that atmosphere, the tables were too close and it was too noisy.",food positive <sep> atmosphere positive <sep> tables negative
0,0,"The food was unremarkable: generally good, but lacking the spice and flair of more memorable cuban/latin cuisine.",food positive <sep> spice negative <sep> cuisine positive
0,0,"Asked for recommendations, waitress said read everything on the menu which already wasn't to unique.",waitress negative <sep> menu neutral
0,0,"I love the food and as a person that does not drink often or regularly, I am practically addicted to their sangria.",food positive <sep> drink neutral <sep> sangria positive
0,0,Never will you taste sicilian Pizza and Spumoni like LBs.,sicilian Pizza negative <sep> LBs neutral
0,0,07 menu was a deal to try this hip tribeca restaurant but the wrong dessert was sent to the table.,dessert negative <sep> table neutral
0,0,I wasn't impressed by dessert - I ordered truffles w/ bisquits.,dessert negative <sep> w/ bisquits neutral
0,0,"There are a few chefs who aren't very enthusiastic and not very theatrical, but the end product is always great food.",chefs negative <sep> food positive
0,0,"The rest of the meal was good, but a little over priced for Chinese take out style food.",priced negative <sep> food neutral
0,0,"The $5 menu does have smaller portions, and I found the ravioli dish to be not too much better than a can of Chef Boyardee.",menu neutral <sep> portions negative <sep> ravioli dish negative
0,0,"I've had the ribeye, the salmon, and a burger/fries at the bar, and they were all exceptional.",salmon positive <sep> bar neutral
0,0,the manager said that they were just starting with a preview menu.,manager negative <sep> menu neutral
